,indice,page_number,line_number,text,text_type,speaker,time_added
1154,2694,107,20,"Until before that, yeah, because it takes time to put them in the computer and everything.",a,THE WITNESS,start_question
1155,2696,107,22,"I mean, typically you would call around a little before 2:00 is that your practice?",q,MR. INSCHO,start_answer
1156,2698,107,24,"Yeah, around 1:30, 1:45.",a,THE WITNESS,start_question
1157,2700,108,1,Okay. Where is -- is it a written protocol that orders should be waited until the end of the shift to be entered?,q,MR. INSCHO,start_chat
1158,2704,108,5,Object to the form.,side_chat,MR. NINOSKY,start_chat
1159,2705,108,6,No.,side_chat,THE WITNESS,start_question
1160,2707,108,8,So who taught you that you should wait until the end of the shift for intake orders to be entered?,q,MR. INSCHO,start_chat
1161,2709,108,10,Object to the form.,side_chat,MR. NINOSKY,start_chat
1162,2710,108,11,"I don't know that it was necessarily taught as standard practice, that's just what happens and --",side_chat,THE WITNESS,start_question
1163,2714,108,15,"I think you described it as the protocol; is that right, did I use that word correctly?",q,MR. INSCHO,start_answer
1164,2716,108,17,I might have misspoken.  It's not like a written protocol but it's just what we typically do.,a,THE WITNESS,start_question
1165,2718,108,19,Is it something you were taught to do or is it just something that you did as your practice?,q,MR. INSCHO,start_answer
1166,2720,108,21,It's what the nurses generally do.,a,THE WITNESS,start_question
1167,2721,108,22,"Okay. Who is it that -- it has here telephone verbal order, that's the category, second column; do you see that?",q,MR. INSCHO,start_answer
1168,2726,109,2,"Uh-huh, yes.",a,THE WITNESS,start_question
1169,2727,109,3,"And provider called was M. Champlin, NP, nurse practitioner; is that right?",q,MR. INSCHO,start_answer
1170,2729,109,5,Yes.,a,THE WITNESS,start_question
1171,2730,109,6,How do you say her name?,q,MR. INSCHO,start_answer
1172,2731,109,7,"Martha Champlin, NP.",a,THE WITNESS,start_question
1173,2732,109,8,Okay. Was this actually a telephone call?,q,MR. INSCHO,start_answer
1174,2734,109,10,Yes.,a,THE WITNESS,start_question
1175,2735,109,11,"Why would you call the provider -- why would you call the provider at 1:45 in the afternoon, would there have been someone there you could have actually spoken to in person or what's the process there?",q,MR. INSCHO,start_answer
1176,2739,109,15,If I was getting calls or if I was getting orders from a provider on-call it would have been a weekend.  So his intake would have been done on a weekend when there's no providers there so we have to physically or we have to call the provider and get our orders.,a,THE WITNESS,start_question
1177,2745,109,21,So if this is a weekday it shouldn't be a telephone verbal order?,q,MR. INSCHO,start_answer
1178,2747,109,23,It still has to be a telephone verbal order either way.  That's the way of documenting that someone gave you an order.  That's just the technical term no matter -- like that's for nursing in general no matter what facility you're at.,a,THE WITNESS,start_question
1179,2753,110,4,So your understanding is that telephone verbal order doesn't necessarily involve the telephone?,q,MR. INSCHO,start_answer
1180,2755,110,6,"Yes, I understand that's nursing.  I mean, that's everywhere.",a,THE WITNESS,start_question
1181,2757,110,8,Okay.,q,MR. INSCHO,start_answer
1182,2758,110,9,It's not just Prime Care or the jail.,a,THE WITNESS,start_question
1183,2759,110,10,Okay. So was this a telephone call with Martha Champlin or could this have been an in-person conversation?,q,MR. INSCHO,start_answer
1184,2763,110,14,It was a phone call because she does not come to our facility.  She's only on-call.,a,THE WITNESS,start_question
1185,2765,110,16,Okay. And that indicates it must have been a weekend to you because if it were during the week you would have actually spoken to the provider?,q,MR. INSCHO,start_answer
1186,2769,110,20,I would have spoken to not Martha because Martha is only on-cal for us.  She has never set foot in our building.,a,THE WITNESS,start_question
1187,2772,110,23,Okay. But you would have spoken to an actual provider whomever it was who was working that day if it were during the week?,q,MR. INSCHO,start_answer
1188,2777,111,3,Yes.,a,THE WITNESS,start_question
1189,2778,111,4,Okay. The intake orders is that something you would have typed?,q,MR. INSCHO,start_answer
1190,2781,111,7,Yes.,a,THE WITNESS,start_question
1191,2782,111,8,Okay. And it says RWM detox protocol opiate taper.  Is that the order set that would have been ordered?,q,MR. INSCHO,start_answer
1192,2786,111,12,"Yes, well, it's -- yes, it's regular watch medical, the detox protocol and the opiate taper meds.",a,THE WITNESS,start_question
1193,2788,111,14,"And it says follow-up as scheduled, what does that mean?",q,MR. INSCHO,start_answer
1194,2790,111,16,They have -- it's in our protocol they have their detox check the next following detox check and they see the PA when they're scheduled to.,a,THE WITNESS,start_question
1195,2793,111,19,And as scheduled means as scheduled by the computer?,q,MR. INSCHO,start_answer
1196,2795,111,21,Yes.,a,THE WITNESS,start_question
1197,2796,111,22,Would you have essentially run through all of your intakes in the same phone call with Martha Champlin?,q,MR. INSCHO,start_answer
1198,2800,112,1,Yes.,a,THE WITNESS,start_question
1199,2801,112,2,How do you call her if she's on-call?,q,MR. INSCHO,start_answer
1200,2802,112,3,I use a phone.,a,THE WITNESS,start_question
1201,2803,112,4,That's a good idea.,q,MR. INSCHO,start_answer
1202,2804,112,5,Yeah.,a,THE WITNESS,start_question
1203,2805,112,6,What kind of phone?,q,MR. INSCHO,start_answer
1204,2806,112,7,A telephone.,a,THE WITNESS,start_question
1205,2807,112,8,"Yeah, what number?",q,MR. INSCHO,start_answer
1206,2808,112,9,"I don't know, it's her cell phone, yeah.",a,THE WITNESS,start_question
1207,2809,112,10,"Okay, all right. Is she working somewhere for Prime Care?",q,MR. INSCHO,start_answer
1208,2812,112,13,"No, she -- if this was a weekend she could be at home doing whatever she does.",a,THE WITNESS,start_question
1209,2814,112,15,Okay. Where do you call from?,q,MR. INSCHO,start_answer
1210,2816,112,17,The intake room.,a,THE WITNESS,start_question
1211,2817,112,18,You use a landline phone?,q,MR. INSCHO,start_answer
1212,2818,112,19,Yes.,a,THE WITNESS,start_question
1213,2819,112,20,Okay. And does Ms. Champlin still work for the company?,q,MR. INSCHO,start_answer
1214,2822,112,23,No.,a,THE WITNESS,start_question
1215,2823,112,24,Do you remember her cell phone?,q,MR. INSCHO,start_answer
1216,2825,113,1,No.,a,THE WITNESS,start_question
1217,2826,113,2,Okay. Do you know if it was a personal cell phone or a company cell phone?,q,MR. INSCHO,start_answer
1218,2829,113,5,"Personal, none of the providers have company cell phones.",a,THE WITNESS,start_question
1219,2831,113,7,Okay.,q,MR. INSCHO,symbols
1220,2832,113,8,- - -,symbols,,is brackets
1221,2833,113,9,"(Whereupon, P-5 was marked for identification.)",brackets,,symbols
1222,2835,113,11,- - -,symbols,,start_question
1223,2837,113,13,I'm going to show you what's marked as P-5.  I want you to find the orders that would have been entered as a result of this phone call.  I believe they were -- I believe they are 000081 through 000084.,q,MR. INSCHO,start_answer
1224,2841,113,17,"Oh, yeah, I forgot Bentyl is one of them.  We don't really use this taper too much so yeah, it's Bentyl that's on there as well.",a,THE WITNESS,start_question
1225,2844,113,20,"When you say you don't use this taper too much, what do you mean?",q,MR. INSCHO,start_answer
1226,2846,113,22,Since they added the Clonidine one that's just used more often.  So I forgot Bentyl was on there.,a,THE WITNESS,start_question
1227,2848,113,24,Okay. In the verbal order that you entered it just said opiate taper?,q,MR. INSCHO,start_answer
1228,2852,114,3,"Yes, because that was the only one that was an option at the time.",a,THE WITNESS,start_question
1229,2854,114,5,Okay. And since now is there -- there's a Vistaril and a Clonidine one?,q,MR. INSCHO,start_answer
1230,2857,114,8,Yes.,a,THE WITNESS,start_question
1231,2858,114,9,"Okay. Tell me about Bentyl, is Bentyl only on the Vistaril?",q,MR. INSCHO,start_answer
1232,2861,114,12,Yes.,a,THE WITNESS,start_question
1233,2862,114,13,Am I correct with which orders you would have entered?,q,MR. INSCHO,start_answer
1234,2864,114,15,"Yeah, the opiate taper.",a,THE WITNESS,start_question
1235,2865,114,16,Pages 000081 through 000084; is that right?,q,MR. INSCHO,start_answer
1236,2866,114,17,Yes.,a,THE WITNESS,start_question
1237,2867,114,18,"Okay. The prescribers name it's entered under Victoria Gessner, she's the Medical Director; is that right?",q,MR. INSCHO,start_answer
1238,2871,114,22,Yes.,a,THE WITNESS,start_question
1239,2872,114,23,"And she never saw Mr. Adami, correct?",q,MR. INSCHO,start_answer
1240,2873,114,24,"Right, she's just our prescribing doctor for everything.  So when you pick any of the tapers whether it's Benzo, alcohol, whatever, her name is automatically the one that generates.",a,THE WITNESS,start_question
1241,2878,115,4,Okay. So Nurse Champlin's name actually doesn't appear anywhere on here but she's the one that actually signed off on the order; is that right?,q,MR. INSCHO,start_answer
1242,2882,115,8,"Yes, because the only option we're given is for Doctor Gessner.  Or actually we don't even really get the option, it just comes up when you click the opiate taper.",a,THE WITNESS,start_question
1243,2886,115,12,Is every medication ordered at Bucks County Correctional Facility effectively ordered under Doctor Gessner's name?,q,MR. INSCHO,start_answer
1244,2889,115,15,I don't know how it works with the prescribing stuff because she's the Medical Director and she has prescribing authority or something.  So if the PA's order something they're the ones ordering it but it ultimately falls on her so...,a,THE WITNESS,start_question
1245,2894,115,20,I guess my question is for every medication order at the Bucks County Correctional Facility is the prescriber name going to come up as Doctor Gessner?,q,MR. INSCHO,start_answer
1246,2897,115,23,"No, for mental health medications they have the option of selecting a mental health provider.  For the tapers, yes, it's Doctor Gessner.",a,THE WITNESS,start_question
1247,2901,116,2,Is it for any medical non-psychiatric drugs are all going to come up prescribed by Doctor Gessner?,q,MR. INSCHO,start_answer
1248,2903,116,4,Yes.,a,THE WITNESS,start_question
1249,2904,116,5,"The first drug we have here is Bentyl, dosing is TID; what does that mean?",q,MR. INSCHO,start_answer
1250,2906,116,7,Three times a day.,a,THE WITNESS,start_question
1251,2907,116,8,Okay. And it lists 30 days that's because this is automatically set for 10 days?,q,MR. INSCHO,start_chat
1252,2910,116,11,You mean 30 doses?,side_chat,MR. NINOSKY,start_chat
1253,2911,116,12,"30 doses, yeah.",side_chat,MR. INSCHO,start_chat
1254,2912,116,13,"Yes, it's automatically generated.  I just click opiate taper and it makes all of this.",side_chat,THE WITNESS,start_question
1255,2916,116,17,"Okay. You describe it as a taper, are any of the medications actually tapered down?",q,MR. INSCHO,start_answer
1256,2919,116,20,"I think the Vistaril used to be -- yes, they are and it's not shown on here.",a,THE WITNESS,start_question
1257,2921,116,22,Okay. Which ones are tapered?,q,MR. INSCHO,start_answer
1258,2923,116,24,The Vistaril.  It's not printed out on here but that's probably because it ended when he passed.,a,THE WITNESS,start_question
1259,2926,117,2,Uh-huh.,q,MR. INSCHO,start_answer
1260,2927,117,3,"Because the Vistaril is supposed to be given three times a day for one day and then it goes down to two times a day then once a day then it's done.  And I think the Zofran was the same thing, too.  I think it was three times a day, then twice a day and then it's down and the Pepto as well.",a,THE WITNESS,start_question
1261,2933,117,9,Is it your understanding that opiate withdrawal symptoms peak early and then get lessened as time passes?,q,MR. INSCHO,start_chat
1262,2936,117,12,Object to the form.,side_chat,MR. NINOSKY,start_chat
1263,2937,117,13,"Again, it depends on the person.  Some people it depends on the opiate. Methadone is different.  Everyone has their own different way of --",side_chat,THE WITNESS,start_question
1264,2942,117,18,Do you know why they're tapered?,q,MR. INSCHO,start_answer
1265,2943,117,19,That's the orders that I'm given.,a,THE WITNESS,start_question
1266,2944,117,20,I understand that's the orders that you're given.  My question is do you know why they're tapered?,q,MR. INSCHO,start_chat
1267,2946,117,22,Object to the form.,side_chat,MR. NINOSKY,start_chat
1268,2947,117,23,You don't stay on it forever.  I'm not sure -- do I know what do you mean?,side_chat,THE WITNESS,start_question
1269,2951,118,2,"In other words, why do they give those medications less over a period of days?",q,MR. INSCHO,start_answer
1270,2953,118,4,I don't know.,a,THE WITNESS,start_question
1271,2954,118,5,"Okay. Why is Clonidine given as opposed to Vistaril, do you know that?",q,MR. INSCHO,start_answer
1272,2957,118,8,I don't know.,a,THE WITNESS,start_question
1273,2958,118,9,"Why is Tylenol III given to some detox patients and not others, do you know that?",q,MR. INSCHO,start_answer
1274,2960,118,11,I don't know.,a,THE WITNESS,start_question
1275,2961,118,12,All those decisions need to be made by the provider; is that right?,q,MR. INSCHO,start_answer
1276,2963,118,14,Yes.,a,THE WITNESS,start_question
1277,2964,118,15,Bismuth that's Pepto Bismol; is that right?,q,MR. INSCHO,start_answer
1278,2965,118,16,Yes.,a,THE WITNESS,start_question
1279,2966,118,17,How many times is that supposed to be given?,q,MR. INSCHO,start_answer
1280,2967,118,18,That was twice a day as needed.,a,THE WITNESS,start_question
1281,2968,118,19,"Okay. Next page, the medication we see there what is that medication?",q,MR. INSCHO,start_answer
1282,2971,118,22,Zofran.,a,THE WITNESS,start_question
1283,2972,118,23,What's Zofran for by the way?,q,MR. INSCHO,start_answer
1284,2973,118,24,Nausea and vomiting.,a,THE WITNESS,start_question
1285,2975,119,1,And how many times is that supposed to be given?,q,MR. INSCHO,start_answer
1286,2977,119,3,Three times a day as needed.,a,THE WITNESS,start_question
1287,2978,119,4,And then doctors instructions one -- it says one PO or IM would that be intramuscular?,q,MR. INSCHO,start_answer
1288,2980,119,6,"Yes, so either orally or intramuscular three times a day as needed.",a,THE WITNESS,start_question
1289,2982,119,8,"Next page, the Vistaril?",q,MR. INSCHO,start_answer
1290,2983,119,9,That's three times a day.,a,THE WITNESS,start_question
1291,2984,119,10,And it's just recorded as TID?,q,MR. INSCHO,start_answer
1292,2985,119,11,"Yes, that's three times a day.",a,THE WITNESS,start_question
1293,2986,119,12,And that is an oral medication?,q,MR. INSCHO,start_answer
1294,2987,119,13,Yes.,a,THE WITNESS,start_question
1295,2988,119,14,Okay. Is it fair to say unless someone -- unless a provider intervenes and decides that an intramuscular injection should be given all these medications are given at the med cart orally?,q,MR. INSCHO,start_chat
1296,2993,119,19,Object to the form.,side_chat,MR. NINOSKY,start_chat
1297,2994,119,20,"Yeah, there isn't an injection form of Vistaril.  There isn't an injection form of Pepto.  There isn't an injection form of Bentyl.  So the only option is the injection of the Zofran and the inmate can request it or the nurse can assess them and determine if it's indicated.  That's why we're given the option.",side_chat,THE WITNESS,start_question
1298,3003,120,4,When do you tell the inmates that they can request the Zofran intramuscular?,q,MR. INSCHO,start_answer
1299,3005,120,6,"The med cart nurse can tell them or you -- again, you're assessing them for detox or you see them throwing up or they tell you they're throwing up or you know, again, it's an assessment, you can offer it to them.",a,THE WITNESS,start_question
1300,3010,120,11,Do the med cart nurses have the intake?,q,MR. INSCHO,start_answer
1301,3011,120,12,Do you mean the forms they are available to them.,a,THE WITNESS,start_question
1302,3013,120,14,Do the -- is there some notation given to the med cart nurses as to who has complained of vomiting?,q,MR. INSCHO,start_answer
1303,3015,120,16,No.,a,THE WITNESS,start_question
1304,3016,120,17,What -- is there any written protocol for assuring that individuals receive their prescribed medications?,q,MR. INSCHO,start_chat
1305,3019,120,20,Object to the form.,side_chat,MR. NINOSKY,start_chat
1306,3020,120,21,"Can you clarify, I'm sorry?",side_chat,THE WITNESS,start_question
1307,3023,120,24,"Yeah, is there some protocol about making sure that inmates receive the medications that are ordered?",q,MR. INSCHO,start_chat
1308,3026,121,2,Object to the form.,side_chat,MR. NINOSKY,start_chat
1309,3027,121,3,Not that I know of.,side_chat,THE WITNESS,start_question
1310,3029,121,5,How -- strike that. The last involvement you would have had with Frederick Adami before the emergency would have been calling to obtain the orders for his medications; is that right?,q,MR. INSCHO,start_answer
1311,3034,121,10,Yes.,a,THE WITNESS,start_question
1312,3035,121,11,You did not see him on the block at all until after the emergency and he's found nonresponsive; is that right?,q,MR. INSCHO,start_answer
1313,3038,121,14,Correct.,a,THE WITNESS,start_question
1314,3039,121,15,Okay. You had no role in the detox checks; is that right?,q,MR. INSCHO,start_answer
1315,3042,121,18,Correct.,a,THE WITNESS,start_question
1316,3043,121,19,Okay. And you would have had no reason to go and check on what was entered in those detox checks; is that right?,q,MR. INSCHO,start_answer
1317,3047,121,23,Correct.,a,THE WITNESS,start_question
1318,3048,121,24,And you would have had no role in giving him any medications while he's on the block; is that right?,q,MR. INSCHO,start_answer
1319,3051,122,2,Correct.,a,THE WITNESS,start_question
1320,3052,122,3,You didn't give him any medications in intake; is that right?,q,MR. INSCHO,start_answer
1321,3054,122,5,Correct.,a,THE WITNESS,start_question
1322,3055,122,6,Even though he's going to get some of those medications they ordered three times a day --,q,MR. INSCHO,start_answer
1323,3057,122,8,Uh-huh.,a,THE WITNESS,start_question
1324,3058,122,9,-- you didn't give him them in intake?,q,MR. INSCHO,start_answer
1325,3059,122,10,"Correct, he could have been back on the block by the time I got orders.",a,THE WITNESS,start_question
1326,3061,122,12,You could call for orders at the time of intake; is that right?,q,MR. INSCHO,start_answer
1327,3063,122,14,Yes.,a,THE WITNESS,start_question
1328,3064,122,15,But that's not the protocol?,q,MR. INSCHO,start_answer
1329,3065,122,16,"Right, there was nothing emergent.",a,THE WITNESS,symbols
1330,3066,122,17,- - -,symbols,,is brackets
1331,3067,122,18,"(Whereupon, P-6 was marked for identification.)",brackets,,symbols
1332,3069,122,20,- - -,symbols,,start_question
1333,3071,122,22,I'm showing you what's been marked as P-6. These are a series of statements which have been produced to the plaintiff and I believe a similar set were given to me this morning although I'm not entirely sure from Prime Care.,q,MR. INSCHO,start_chat
1334,3077,123,3,I can't guarantee you what we --,side_chat,MR. NINOSKY,start_chat
1335,3079,123,5,I get it.,side_chat,MR. INSCHO,start_chat
1336,3080,123,6,-- had versus the County so...,side_chat,MR. NINOSKY,start_chat
1337,3082,123,8,I get it.,side_chat,MR. INSCHO,start_chat
1338,3083,123,9,"So I'd say similar, correct, can't guarantee the same.",side_chat,MR. NINOSKY,start_question
1339,3086,123,12,"So there's a reference on Page 66 to a Nurse Jen coming to the cell floor.  Who is Jen -- Nurse Jen, if you know?",q,MR. INSCHO,start_answer
1340,3089,123,15,Jen Acker.,a,THE WITNESS,start_question
1341,3090,123,16,A-C --,q,MR. INSCHO,start_answer
1342,3091,123,17,A-C-K-E-R.,a,THE WITNESS,start_question
1343,3092,123,18,Is she still employed at Prime Care?,q,MR. INSCHO,start_answer
1344,3093,123,19,Yes.,a,THE WITNESS,start_question
1345,3094,123,20,Okay. And then last line here at approx...8:12 Nurse Sam informed me that the dispensary was notified by fax that inmate Adami was deceased. Did you take a call or get a fax that indicated Mr. Adami was deceased?,q,MR. INSCHO,start_answer
1346,3101,124,2,"Yes, it says that I got a fax.",a,THE WITNESS,start_question
1347,3102,124,3,"All right. So that is your -- that's you, you're Nurse Sam?",q,MR. INSCHO,start_answer
1348,3105,124,6,Yes.,a,THE WITNESS,start_question
1349,3106,124,7,All right. So what was the fax?,q,MR. INSCHO,start_answer
1350,3108,124,9,"The fax I would have gotten would have been from the emergency room.  They send us over the ER summary of what they did, you know, if the person is being admitted or if they're sending them back or if they were deceased.",a,THE WITNESS,start_question
1351,3113,124,14,Is that standard that anyone who gets sent to the hospital the ER will fax over the summary?,q,MR. INSCHO,start_answer
1352,3115,124,16,Yes.,a,THE WITNESS,start_question
1353,3116,124,17,"Go to Bates number Bucks Adami 000069, is this a statement that you did?",q,MR. INSCHO,start_answer
1354,3118,124,19,Yes.,a,THE WITNESS,start_question
1355,3119,124,20,So the S.D. would refer to your maiden name initials?,q,MR. INSCHO,start_answer
1356,3121,124,22,Yes.,a,THE WITNESS,start_question
1357,3122,124,23,All right. You wrote patient found unresponsive in cell.  CPR initiated until EMS arrived.  AED applied. Sent to ER. When did you write this statement?,q,MR. INSCHO,start_answer
1358,3128,125,4,After he left with the ambulance.,a,THE WITNESS,start_question
1359,3129,125,5,"Okay. Let's go to the next one, this is Bates number 000070.  Is this also a statement you did?",q,MR. INSCHO,start_answer
1360,3132,125,8,Yes.,a,THE WITNESS,start_question
1361,3133,125,9,What did you write here?,q,MR. INSCHO,start_answer
1362,3134,125,10,CO Moran accompanied EMS to ER with patient. I ask CO about what happened during this event and he reported that EMS stated white powder was present in patient's nose.,a,THE WITNESS,start_question
1363,3138,125,14,When did you write this statement?,q,MR. INSCHO,start_answer
1364,3139,125,15,It would have been after he passed because if the Officer is back from the ER then that means they passed.  So it would have been after that.,a,THE WITNESS,start_question
1365,3142,125,18,Okay. And what you're reporting here is something that -- not something you observed; is that fair?,q,MR. INSCHO,start_answer
1366,3146,125,22,Correct.,a,THE WITNESS,start_question
1367,3147,125,23,"Okay. Did you, in fact, perform CPR on Mr. Adami?",q,MR. INSCHO,start_answer
1368,3151,126,2,Yes.,a,THE WITNESS,start_question
1369,3152,126,3,Okay. Did you note any white powder or anything in his nose?,q,MR. INSCHO,start_answer
1370,3155,126,6,No.,a,THE WITNESS,start_question
1371,3156,126,7,Okay. Were you the first person -- first medical provider on the scene?,q,MR. INSCHO,start_answer
1372,3159,126,10,"Me, Jen and Deb showed up at the same time.",a,THE WITNESS,start_question
1373,3160,126,11,Who is Deb?,q,MR. INSCHO,start_answer
1374,3161,126,12,Debra Buckman.,a,THE WITNESS,start_question
1375,3162,126,13,Okay. Did you conduct a primary survey when you arrived?,q,MR. INSCHO,start_answer
1376,3165,126,16,Yes.,a,THE WITNESS,start_question
1377,3166,126,17,Okay. Did you notice any indications of white powder anywhere on Mr. Adami's body during your primary survey?,q,MR. INSCHO,start_answer
1378,3170,126,21,No.,a,THE WITNESS,start_question
1379,3171,126,22,Did you perform both breaths and compressions?,q,MR. INSCHO,start_answer
1380,3172,126,23,I did compressions.,a,THE WITNESS,start_question
1381,3173,126,24,Okay. Compressions only?,q,MR. INSCHO,start_answer
1382,3176,127,2,Yes.,a,THE WITNESS,start_question
1383,3177,127,3,Okay.,q,MR. INSCHO,start_answer
1384,3178,127,4,I believe Jen and Deb alternated with the breathing.,a,THE WITNESS,start_question
1385,3180,127,6,Did you stay until Mr. Adami was transported to the hospital?,q,MR. INSCHO,start_answer
1386,3182,127,8,"No, EMS took over and they did CPR on him for quite some time and they took him to the hospital.",a,THE WITNESS,start_question
1387,3184,127,10,And at some point you left the block during that period of time?,q,MR. INSCHO,start_answer
1388,3186,127,12,"Yes, uh-huh.",a,THE WITNESS,start_question
1389,3187,127,13,All right. Did you give any other statements other than these two?,q,MR. INSCHO,start_answer
1390,3190,127,16,Not that I can recall.,a,THE WITNESS,start_question
1391,3191,127,17,Did you speak to anyone from Bucks County about the events of Mr. Adami's death?,q,MR. INSCHO,start_answer
1392,3193,127,19,No.,a,THE WITNESS,start_question
1393,3194,127,20,Did you ever speak to anyone who actually observed white powder in Mr. Adami's nose?,q,MR. INSCHO,start_answer
1394,3196,127,22,"No, because it was EMS that apparently reported it.  So if they noticed that on their observation it was after they took over CPR and they would have assessed it and seen it.",a,THE WITNESS,start_question
1395,3201,128,2,"I'm sorry, you missed my question, I think.",q,MR. INSCHO,start_answer
1396,3202,128,3,I'm sorry.,a,THE WITNESS,start_question
1397,3203,128,4,Did you ever speak to anyone who saw white powder on Mr. Adami's nose?,q,MR. INSCHO,start_answer
1398,3205,128,6,"Oh, no.",a,THE WITNESS,start_question
1399,3206,128,7,Okay. You document in your statement essentially thirdhand knowledge of something that EMS told Moran who told you and then you wrote the statement; is that right?,q,MR. INSCHO,start_answer
1400,3211,128,12,"Yes, yes.",a,THE WITNESS,start_question
