,indice,page_number,line_number,text,text_type,speaker,time_added
0,0,0,0," A witness herein, acknowledged having been duly sworn and testified upon his oath as follows:",,,start_chat
1,103,4,5,I do. DIRECT EXAMINATION,side_chat,THE WITNESS,start_question
2,106,4,8,"Good morning, Dr. Howard.",q,MS. MCMORRIS,start_answer
3,107,4,9,"Good morning, Leah.",a,THE WITNESS,start_question
4,108,4,10,Can you hear me all right?,q,MS. MCMORRIS,start_answer
5,109,4,11,"Yes, I can.  How about you?",a,THE WITNESS,start_question
6,110,4,12,I can hear you just fine.,q,MS. MCMORRIS,start_answer
7,111,4,13,All right.  Good.,a,THE WITNESS,start_question
8,112,4,14,So can you please state your name for the record?,q,MS. MCMORRIS,start_answer
9,114,4,16,"Yes, Thomas Peter Howard.",a,THE WITNESS,start_question
10,115,4,17,"And my name is Leah McMorris, I represent the plaintiff in this case and I'll be taking your deposition this morning.  Where is it that you are located today?",q,MS. MCMORRIS,start_answer
11,118,4,20,"I'm in a court reporting office, which is in I think the address is Viera, Florida, but it's near my home in Melbourne, Florida.",a,THE WITNESS,start_question
12,121,4,23,And is there anyone there with you?,q,MS. MCMORRIS,start_answer
13,122,4,24,Yes.  Yvette Harrison the court reporter is here.,a,THE WITNESS,start_question
14,125,5,1,And is your attorney there as well?,q,MS. MCMORRIS,start_answer
15,126,5,2,"No, he's on the phone.",a,THE WITNESS,start_chat
16,127,5,3,I'm sitting in New Jersey.,side_chat,MR. SPEZIALI,start_chat
17,128,5,4,All right.,side_chat,MS. MCMORRIS,start_chat
18,129,5,5,"And I thank you for changing it for a phone dep, which is why I didn't have to go down there.",side_chat,MR. SPEZIALI,start_question
19,133,5,9,"And your attorney is -- I'm sorry, strike that. You are designated as a witness in this case at the request of General Electric and Westinghouse; is that correct?",q,MS. MCMORRIS,start_answer
20,137,5,13,"That's my understanding, yes.",a,THE WITNESS,start_question
21,138,5,14,Okay.  No one else?,q,MS. MCMORRIS,start_answer
22,139,5,15,"Not that I'm aware of, no.",a,THE WITNESS,start_question
23,140,5,16,"Okay.  And I don't think -- you've been deposed many times in the past, so I won't go through all of the general rules for a deposition.  But I just ask at any point you can't hear me or you don't understand my question, just let me know and I'll rephrase the question or speak up and make sure that you can hear me.  Is that fair?",q,MS. MCMORRIS,start_answer
24,147,5,23,Yes.,a,THE WITNESS,start_question
25,148,5,24,"All right.  Great.  Are you currently employed, Dr. Howard?",q,MS. MCMORRIS,start_answer
26,151,6,1,"I retired from the VA in 2017.  I certainly continued to do litigation consultation work, but I don't know if that satisfies your definition of employment. I'm retired from the VA.",a,THE WITNESS,start_question
27,155,6,5,How often do you perform litigation consultant work?,q,MS. MCMORRIS,start_answer
28,157,6,7,"I review probably on average about two cases a week.  But if you're asking me about depositions and trial testimony, it's certainly less than that.  I think I'm estimating this is about the fifth deposition this year.  And on average I would think it ranges between five and ten the last few years at least. And then in trial I probably testify on average maybe once every year, maybe a little less than that recently.",a,THE WITNESS,start_question
29,166,6,16,What percentage of those cases are asbestos related cases?,q,MS. MCMORRIS,start_answer
30,168,6,18,"Well, this year I would -- certainly the vast majority are asbestos related.  I'm working on one rather large tobacco litigation case, so that would be the only one right now that is not asbestos related.  I think it would probably be about 75 to 95 on an average basis over the last several years are asbestos related.",a,THE WITNESS,start_question
31,174,6,24,When were you initially contacted regarding the Drummond case?,q,MS. MCMORRIS,start_answer
32,177,7,1,"Well, I have no independent recollection of a specific date, but based on my report I would estimate that it would have certainly been within a few weeks of September 2018.",a,THE WITNESS,start_question
33,181,7,5,And what were you asked to do following your retention on this case?,q,MS. MCMORRIS,start_answer
34,183,7,7,"Well, I'm again referring to my report, but usually as stated in my report I'm asked to be -- review records and deposition testimony as in this case and then to be willing to render either a report or testify in deposition usually about state of the art issues. Although, as a pulmonologist, frequently as in this case I was asked to review medical records and would expect to weigh in on medical issues as well.  So state of the art, medical issues. And then as noted in my report address the probability if you will of warnings changing the direction of Mr. Drummond's case.",a,THE WITNESS,start_question
35,195,7,19,So in addition -- it is my understanding you reviewed Mr. Drummond's deposition testimony in this case?,q,MS. MCMORRIS,start_answer
36,198,7,22,"Yes.  I brought with me today what I reviewed, which I think is 11 volumes of deposition testimony.",a,THE WITNESS,start_question
37,200,7,24,Okay.  Is there anything else that you brought with you to the deposition today?,q,MS. MCMORRIS,start_answer
38,203,8,1,"Yes.  I brought my CV or a copy of my CV and my report, which I authored in September of 2018.  In addition the medical records I brought, which I reviewed and cited I think in my report from 2016 and '17.  And then recently was provided with a death certificate as well.  So I brought all those things with me.",a,THE WITNESS,start_question
39,209,8,7,Did you prepare any notes in preparation for your deposition today?,q,MS. MCMORRIS,start_answer
40,211,8,9,No.,a,THE WITNESS,start_question
41,212,8,10,"So in addition to the deposition volumes, the medical record and Mr. Drummond's death certificate, were you given any other factual information about the substance of the Drummond case from counsel or anyone else that formed the basis of any of your opinions?",q,MS. MCMORRIS,start_answer
42,217,8,15,No.,a,THE WITNESS,start_question
43,218,8,16,"And, Dr. Howard, are you being compensated for your work on the Drummond case?",q,MS. MCMORRIS,start_answer
44,220,8,18,I expect to be.  I've not rendered a bill.  But I would certainly expect to be for the work that I've done in this case as well as today's session.,a,THE WITNESS,start_question
45,223,8,21,What is your hourly rate?,q,MS. MCMORRIS,start_answer
46,224,8,22,$450.,a,THE WITNESS,start_question
47,225,8,23,Do you have an approximation of how many hours you've worked on the Drummond case?,q,MS. MCMORRIS,start_answer
48,227,8,25,"Yes.  Prior to and including my creation of the report in September of '18, I had spent seven hours on the case.  And since then I've spent an hour rereviewing the materials I mentioned to you and then a 15 minute conference with Mr. Speziali.  So I think it's eight hours and a quarter.",a,THE WITNESS,start_question
49,234,9,6,Were you asked to give any medical causation opinions in this case?,q,MS. MCMORRIS,start_answer
50,236,9,8,I haven't actually been asked anything specific other than what I mentioned.  But I would expect that one of the two parties would ask me if I thought this was an asbestos related mesothelioma and I do.,a,THE WITNESS,start_question
51,240,9,12,Do you have any additional medical causation opinions in addition to the opinion you just expressed that this is an asbestos related mesothelioma?,q,MS. MCMORRIS,start_answer
52,243,9,15,"Well, I have nothing prepared to cite and again I haven't been asked any questions.  But, typically, I would expect that there would be questions about -- and I actually referred to this within my report certainly that this case like many I believe in this era at least is typically related to remote asbestos exposure in the workplace. And both historically and currently I think there's a wealth of information supporting a fiber differential in that causation and I would expect to reflect on the Navy's use and knowledge about asbestos throughout the historical period of time of probably the 1940s through at least OSHA in 1972. So I would expect again I don't have any specific script to tell you what my exact opinions are there, but I would welcome any questions concerning that. I would -- I cited as best I could the variables that I and most physicians and medical scientist look to to try to establish causation in terms of the nature of the exposure, specifically the frequency, the intensity, the duration, the product itself in terms of the friability or respirability of the asbestos contained within that product.  And I certainly look to all those in trying to establish a specific causation. As I noted in this case from the deposition testimony, specifically regarding Westinghouse and GE, I thought there were very few of those specifics that were able to be cited.  So I mention that in the report. Certainly, if there's other information regarding that, I would factor all that in.  So I don't know if that answers your question globally at least.  I would expect to have a lot of opinions regarding that general area based on primarily the deposition testimony or more importantly the historical medical literature and how it developed.",a,THE WITNESS,start_question
53,281,11,1,"Okay.  So looking at your report that's dated September 14th, 2018, how did this report come to be prepared?",q,MS. MCMORRIS,start_answer
54,284,11,4,So I need to clarify.  The report that I believe I rendered in this case was authored on September 11th.  Is that -- are we looking at the same report?,a,THE WITNESS,start_question
55,288,11,8,"That's correct.  It was served on September 14th, so that was the date I was representing. But you're correct, the report is dated September 11th.",q,MS. MCMORRIS,start_answer
56,291,11,11,"Oh, I see.  Okay.  So if I understand your question, I put together this information and tried to summarize not only case specific details, which are relatively few as you probably noted, it's probably two or three paragraphs based on the deposition testimony and then at the end I insert information that I gleaned from review of the medical records. And then I have already prepared a summary report of my state of the art opinions, which of course do not change with a given case.  So I insert all of those and then submit it.  Is that what you're asking me? I'm not sure.",a,THE WITNESS,start_question
57,303,11,23,Yes.,q,MS. MCMORRIS,start_answer
58,304,11,24,Okay.,a,THE WITNESS,start_question
59,305,11,25,Do you have any updates to this report since you initially created it in September of 2018?,q,MS. MCMORRIS,start_answer
60,308,12,2,"I think, and I'm sorry, Leah, I don't know the exact date, but it seems to me that I updated my generic report for both Westinghouse and GE, which of course are not focused on Mr. Drummond's specific case, but some of that information would come from those updated reports. Which if I'm correct, I think was at the end of '18 and beginning of '19 I think.  I'd have to check.  I didn't bring those reports with me. So there may have been some updates, but I don't think any of it would conflict with the substance of this report.",a,THE WITNESS,start_question
61,319,12,13,Okay.  I would like to mark your report as Exhibit 1 to the deposition so we know what we're referring to.,q,MS. MCMORRIS,is brackets
62,322,12,16,(Plaintiff's Exhibit No. 1 was Marked for Identification.),brackets,,start_question
63,325,12,19,So am I understanding you correctly that none of your opinions as to GE or Westinghouse has changed since this report was drafted?,q,MS. MCMORRIS,start_answer
64,328,12,22,That's correct.,a,THE WITNESS,start_question
65,329,12,23,Do you estimate giving any state of the art opinions that are not included in this report?,q,MS. MCMORRIS,start_answer
66,331,12,25,"I certainly don't anticipate it.  I try in these summary reports to address most, if not all, of the issues that I would expect to be asked about. Having said that, I know I've been in situations where either plaintiff or defense counsel have asked me specific questions that I might know about historically for example that I didn't include.  So if that came up, I would hope to be able to answer the question.  But I've tried the best I could to summarize all that I would expect to be asked about in this report.",a,THE WITNESS,start_chat
67,342,13,10,"Leah, this is Dave Speziali.  I can send you, if you gave me an e-mail address, I call them generic reports.  There were updates to those.  If you'd like, I can get them to you now or later at some point or through Cathy.",side_chat,MR. SPEZIALI,start_chat
68,347,13,15,"Okay.  If you wouldn't mind e-mailing, that would be great.",side_chat,MS. MCMORRIS,start_chat
69,349,13,17,"I think is your e-mail available on your website?  If it is, I'll just get it from there.",side_chat,MR. SPEZIALI,start_chat
70,352,13,20,It is.,side_chat,MS. MCMORRIS,start_chat
71,353,13,21,Go ahead.,side_chat,MR. SPEZIALI,start_chat
72,354,13,22,Cathy has it as well.,side_chat,MS. MCMORRIS,start_chat
73,355,13,23,All right.  I'll find it.,side_chat,MR. SPEZIALI,start_chat
74,356,13,24,All right.  Thank you.,side_chat,MS. MCMORRIS,start_question
75,360,14,2,"So from reading the materials that you were provided in this case, is it your understanding that Mr. Drummond was suffering from pleural mesothelioma?",q,MS. MCMORRIS,start_answer
76,363,14,5,"Yes.  I think he had a variety of medical conditions, but pertinent most to our discussion today is that he developed a malignant pleural mesothelioma, which I believe was likely related to past occupational exposure to asbestos.",a,THE WITNESS,start_question
77,368,14,10,"And you just touched on, as mentioned in your report, a number of variables that need to be considered when determining the degree to which a given exposure contributes to an asbestos related disease.  Is that correct?",q,MS. MCMORRIS,start_answer
78,373,14,15,Yes.,a,THE WITNESS,start_question
79,374,14,16,"And some of these factors that you mentioned include the proximity of exposure, duration of exposure, frequency, fiber type and there are several others listed in the report that you frequently mention.  Correct?",q,MS. MCMORRIS,start_answer
80,378,14,20,Correct.,a,THE WITNESS,start_question
81,379,14,21,"So after reading Mr. Drummond's deposition and reviewing his medical records, do you have any opinions regarding the variables during his work at the Fore River Shipyard in general?",q,MS. MCMORRIS,start_answer
82,383,14,25,"Well, I believe certainly in his early years of employment from '56 through probably '71 I read about working in a shipyard arena, which certainly I think would provide opportunities for exposure. My earlier comments about GE and Westinghouse just had to do with a lack of very specific recollection of those variables including whether asbestos was involved and things like that. But I think from his description and my knowledge of the shipyard setting, especially in the early years, I think without giving you exact references, I took from it there were certainly opportunities for exposure in the shipyard that would have led and did lead in my opinion to the conclusion that I expressed earlier that it was likely related to asbestos.",a,THE WITNESS,start_question
83,399,15,15,Were there any specific exposures that you were able to identify that contributed to his mesothelioma?,q,MS. MCMORRIS,start_answer
84,401,15,17,"As I pointed out in the report and I'll answer up front no is the answer in that many of those details are lacking. But, again, knowing the extensive use and the period of time that he was there and the description that he gave, I think generally it's fair to conclude that the general exposure through that arena would have been enough to attribute the causation conclusion too that I mentioned.",a,THE WITNESS,start_question
85,411,16,1,Okay.  Do you have any opinions regarding any particular product or manufacturer's responsibility for Mr. Drummond's development of mesothelioma?,q,MS. MCMORRIS,start_answer
86,414,16,4,"Well, certainly not specific manufacturers. But, again, as I rendered in the report, most pleural mesothelioma currently have to do with remote exposure, which often involves thermal insulation. I mentioned other types of exposure in the report, but the vast majority have to do with thermal insulation products. So, generally, again knowing the extensive use of those in the shipyard setting, especially in the 50s, I would say that that as a product is the most likely. But as far as a specific exposure I don't think that you can accurately conclude that.",a,THE WITNESS,start_question
87,426,16,16,"In addition to thermal insulation, are there any other products in this case that you believe may have contributed to Mr. Drummond's mesothelioma?",q,MS. MCMORRIS,start_answer
88,429,16,19,"Well, my focus again was on GE and Westinghouse.  I can't -- and especially I didn't review a year after I rendered the report those other types of exposures.  I mentioned certainly brake and I think drywall in my report, but I can't recall any specific product or type of product. Thermal insulation overwhelmingly is the most likely.  I know he mentioned gaskets and other things in the shipyard, but, as I recall, overwhelmingly it was thermal insulation that I thought was the culprit.",a,THE WITNESS,start_question
89,440,17,4,Did your review of Mr. Drummond's deposition suggest to you one way or the other that he was exposed to asbestos while working around General Electric equipment?,q,MS. MCMORRIS,start_answer
90,444,17,8,"No.  Again, I thought he did not recall specific exposure.  He made it very clear he didn't work -- he never worked directly on turbines.  The turbine manufacturers that he was able to recall I didn't see was specific to General Electric or Westinghouse. The specific recollection on Westinghouse regarding forced draft blowers, I think even when questioned he couldn't specifically say it was asbestos. And in my experience many of those are not insulated. So I thought there were many variables there that would not allow me to specifically conclude that exposure to Westinghouse or GE products were the culprit, no.",a,THE WITNESS,start_question
91,457,17,21,"Did either Westinghouse or General Electric provide you any documents regarding the insulation, thermal insulation products that were used on the Sherman-class destroyers built at the Fore River Shipyard?",q,MS. MCMORRIS,start_answer
92,463,18,1,No.,a,THE WITNESS,start_question
93,464,18,2,Were you provided with any information about the asbestos content of the insulation used on this turbine on the Sherman-class destroyers?,q,MS. MCMORRIS,start_answer
94,467,18,5,"No, certainly not.  I'm aware generally of various manufacturers and generally of the content, but not specifically in this case, no.",a,THE WITNESS,start_question
95,470,18,8,"So same question for the forced draft blowers, were you provided with any information about the asbestos content of insulation used on the forced draft blowers on the Sherman-class destroyers?",q,MS. MCMORRIS,start_answer
96,474,18,12,"No, just the uncertainty mentioned in the deposition.  So other than that, no.",a,THE WITNESS,start_question
97,476,18,14,Okay.  What is your general understanding of the insulation used on those types of equipment on Navy vessels during the 1950s?,q,MS. MCMORRIS,start_answer
98,479,18,17,"Well, I'm certain that's out of my field of expertise, but I've seen descriptions from a variety of sources that primarily focuses on the piping that could be attached to the turbine.  Oftentimes there is a blanket referenced on the top of the turbine.  But we're getting beyond my field of expertise. I would refer to his description of the process and then certainly my knowledge of extensive use on piping within the vessel typically in shipyards historically.",a,THE WITNESS,start_question
99,490,19,2,"If you were provided any information showing that the insulation on General Electric or Westinghouse equipment on the Sherman-class destroyers was asbestos containing, would that in any way change your opinion regarding Mr. Drummond's exposure?",q,MS. MCMORRIS,start_answer
100,495,19,7,"Well, if I understand your question, it would involve that specific exposure that he experienced.  So I did mention in my report that, for example, if you were to provide evidence that his exposure on that vessel and that turbine involved asbestos containing thermal insulation and there was evidence of all those other variables in terms of more than just walking by, he was actually there when exposure was ongoing, I think from his description I'm confident that at most it would have been bystander exposure. But, historically, certainly if that was present and it was asbestos containing thermal insulation, then I would certainly be able to conclude that that might have added to the causative exposures that he experienced.",a,THE WITNESS,start_question
101,510,19,22,In your report you detail a number of general state of the art opinions.  And I don't want to go through all those because I think they're laid out pretty well in your report. But do you have any additional opinions about the general state of the art that are not included in your report?,q,MS. MCMORRIS,start_answer
102,518,20,4,"So I understood your previous question to be similar.  And, again, I don't think so, but certainly if you ask me something that was outside of this -- of what was covered here and I knew about it, I would certainly try to answer that. But I don't anticipate -- I think I've tried to cover from my knowledge and my experience what questions are most pertinent to both sides.",a,THE WITNESS,start_question
103,526,20,12,Do you have any opinions specific to the Navy knowledge regarding the hazards of asbestos in the 1950s?,q,MS. MCMORRIS,start_answer
104,528,20,14,"Well, I don't consider myself a Navy expert. I'm not a Navy veteran, I've never worked for the Navy in a shipyard.  So in that regard, no. But I've tried to include in my report based predominately on published medical literature I believe the sophistication of the Navy in the development of this so called state of the art knowledge base. From the very beginning I cited the Fleischer Drinker report for example and then Captain Brown's publication both in the 40s that detail I think processes that the Navy had in place to try to address asbestos. And so I would -- I think I referenced what I'm thinking of in response to your question in the report and I would expect to reflect on those publications, Fleischer Drinker, the Brown publication, the Marr publication all referenced I think in my report. You know, certainly the Navy was involved with Walsh-Healy requirements, the minimum standards I referenced.  So off the top I'm thinking that those are all in response to what I would expect to render concerning your question about Navy knowledge.",a,THE WITNESS,start_question
105,550,21,10,Do you have any information specific to Bethlehem Steel's knowledge regarding the hazards of asbestos in the 1950s?,q,MS. MCMORRIS,start_answer
106,553,21,13,No.,a,THE WITNESS,start_question
107,554,21,14,"When Mr. Drummond began working at the Fore River Shipyard in 1956, what was the general state of the art at that time?",q,MS. MCMORRIS,start_answer
108,557,21,17,"Well, as I initiated in my report, the knowledge base I believe regarding the potential hazards of asbestos began prior to that in the 1930s, late 20s if you look at case reports. So certainly by the 50s there was a base of medical literature that utilized peer review published epidemiologic studies showing in predominately textile factory arenas that with prolonged and intense and direct exposure some of those individuals would develop scarring within the lung, which was referred to as asbestosis. Certainly, I think your question was in the 50s by.  By the 40s we now have both Captain Brown's publication and maybe more importantly the Fleischer Drinker study published in '46 that indicated a number of processes were in place. And the significance of the Fleischer Drinker study I believe was that it represented the first epidemiologic study outside of the textile factory arena that concluded in part that this field of marine insulation at that time with those processes in place was not a dangerous occupation. Certainly, the state of the art at that time also involved the role of the ACGIH and the utilization of some of those studies from the 30s to initiate a dust control level that was established and promulgated across the country to try to void and prevent any adverse outcome, which as noted at that time was asbestosis. So that gets us I think to the 50s, which is I think where you asked me.  So by 1956 certainly it was acknowledged that in certain circumstances asbestos could result in scarring of the lung and there were efforts to minimize dust production at least to that level that was promulgated as a level that below which adverse outcomes would not occur.  All of that was in place by the 1950s.",a,THE WITNESS,start_question
109,593,23,1,"These efforts to minimize dust production levels, what were some of those efforts that were in place in the 1950s?",q,MS. MCMORRIS,start_answer
