,indice,page_number,line_number,text,text_type,speaker,time_added
191,1091,42,5,"No.  He made it clear that at most we're talking about what most of us would refer to as bystander type exposure.  So he's not the one involved in insulating for example. But if there was thermal insulation involved in these exposures that it contained asbestos and he was exposed in a bystander fashion, then to answer your question through '71 for sure bystanders were not perceived to be likely or at risk of developing disease. Many publications said in that time period that there are others who may experience exposures, but until we know that exposure is a problem or above a level that is considered a problem, it would be inaccurate to assume or conclude that all of those people are at risk of disease.  Certainly there would be some other who are exposed. And this concept is not at all unique to asbestos.  It's a dose response relationship that applies to just about any product or element.  Oxygen is always the one I think about when asked that question.  But dose response means that just because you have some exposure, which by the way all of us have had, that does not mean that you have a higher incidence of disease because of that exposure.",a,THE WITNESS,start_question
192,1116,43,4,"And in at least through '71, what was the prevailing threshold limit value that was -- that was established for asbestos through that timeframe?",q,MR. SPEZIALI,start_answer
193,1119,43,7,"So throughout that time period starting actually in the 1940s, the threshold limit value was five million particles per cubic foot. At the very end of the time period that you're asking me about, there were suggestions by some to alter the TLV and that occurred I believe in the late '71, early '72 time period. Now that was multifactorial in part related to a change in the methodology for measuring dust rather than particles going to fibers.  But it was also based on developing literature that showed that the threshold limit value may need to be reduced, which of course it was.",a,THE WITNESS,start_question
194,1132,43,20,"Right.  And without revisiting and spending a lot more time here, did both Dr. Selikoff and Doctors Balzer and Cooper address the idea regarding hands on insulator exposures versus bystanders that you described in publications in the 60s and 70s?",q,MR. SPEZIALI,start_answer
195,1137,43,25,"Yes.  Absolutely focused on the insulator population.  With of course some comments made by one of those authors about maybe we'll need to investigate other people, which it subsequently in his career and historically later on they did to try to determine if in fact there was a risk of disease.",a,THE WITNESS,start_question
196,1144,44,6,And I understand from your report that you have actually met and discussed with Dr. Balzer his research in the 60s and 70s; is that correct?,q,MR. SPEZIALI,start_answer
197,1147,44,9,That is correct.,a,THE WITNESS,start_question
198,1148,44,10,"All right.  I want to ask you one other thing. You were asked a lot of questions about the Navy's knowledge and the shipyard's knowledge. Let me ask you this.  Again, let's just assume for purposes of my questions and I understand it's -- let's just assume it, that Mr. Drummond is working with asbestos insulation materials during the period that he testified to in the shipyards for '56 through '71. That he -- again just assume that his testimony was that he's working at Fore River and that he's working on Navy ships, okay, just as he testified to.",q,MR. SPEZIALI,start_answer
199,1159,44,21,Okay.,a,THE WITNESS,start_question
200,1160,44,22,And let's assume that those are asbestos containing materials being used by insulators in and around him.  Okay.  Just assume all that.,q,MR. SPEZIALI,start_answer
201,1163,44,25,Okay.,a,THE WITNESS,start_question
202,1165,45,1,"Would there have been reason -- if all that were occurring, would there have been reason for Westinghouse and General Electric to believe that Mr. Drummond would have been advised of any dangers in association with asbestos in his work and would have been advised of any precautions to take regarding exposures to asbestos in association with his exposures in work as he described?",q,MR. SPEZIALI,start_chat
203,1173,45,9,"Objection, form.",side_chat,MS. MCMORRIS,start_question
204,1175,45,11,Do you follow that?,q,MR. SPEZIALI,start_answer
205,1176,45,12,"I think so.  I'm reflecting back on one of Leah's earlier questions.  The wealth of publicly available peer reviewed medical literature comes to mind, which certainly supports throughout this period of time that the Navy had in place as mentioned with variable degrees of compliance a variety of measures which they cited from the very beginning with the published Fleischer Drinker study.  I mentioned Captain Brown's publication as well in the 40s and then Marr's publication in '64. Those all come to mind immediately when you ask that question in that we have a variety of processes allegedly utilized by the Navy and reported in the medical literature that would suggest that communication, if you will, that there is a potential in addressing this fiber or these products and that has to be communicated in order for -- for this to be taking place, which is published. So in addition to the published medical literature, you know, the involvement of the National Safety Council, the ACGIH, the minimum standards that we talked about, all of these to me would support the idea that processes are utilized, which would require that communication. Not that I would expect the individual sailor to know specifics about the diseases in question or anything like that, but that would communicate some of the potential for hazard, which I think you can assume has to take place.",a,THE WITNESS,start_question
206,1206,46,16,"All right.  So you mentioned three publications, you mentioned the Brown publication 1941, the Fleischer Drinker report of 1946, the Marr study of 1964.  There was also discussions of the Walsh-Healey Act.  So let's just focus on those four publications. If in fact Mr. Drummond was working either with or around asbestos insulation materials in the manner in which he described in association with Westinghouse or General Electric products or equipment, if he was doing that during the timeframe in question, would there -- would he have been advised or received information regarding respiratory protection as to asbestos if he was in danger from those exposures based on what was published?  I'm not saying it happened, based on what the Navy was telling the world.",q,MR. SPEZIALI,start_answer
207,1222,47,6,"Well, and I may need some help in understanding this.  Certainly, if there was a perceived risk, that without the respiratory protection there was risk of disease that would be reduced or eliminated with respiratory protection, then certainly that communication would have taken place. But from a state of an art perspective, especially from '56 to '71, if I'm understanding your question correctly, we have to put ourself back in that time period and without question mesothelioma was not considered a risk of bystanders in my opinion at that point. The risk was focused especially in the 60s as we've mentioned on insulators.  So insulators and when you read the Fleischer Drinker study it has to do with marine insulators, are encouraged to utilize a variety of measures including respiratory protection. Now from my reading of these deposition volumes, I saw no evidence that Mr. Drummond was an insulator.  So I think we've agreed that at best or at the worst he was a bystander.  And, therefore, the advice at that time would not be that if you're a bystander, A, you're at risk of getting a disease, especially something like mesothelioma and, B, that you as a bystander would be asked to wear respirators. Certainly, if you're an insulator after the Selikoff studies in the mid to late 60s, then of course that would be wise.  And of course with OSHA that's addressed specifically.  So I don't -- does that answer your question?",a,THE WITNESS,start_question
208,1253,48,11,"Yeah.  In fact, let me make it easier so we have a cleaner record following what you threw in.  It was really a bad question by me. If there was a perceived risk of danger to Mr. Drummond from exposure to asbestos from the activities that he described, if, and I understand your opinion is that there was not, but let's assume that there was, okay. Based upon what the Navy -- well, not only the Navy but even the shipyards, based upon what was in the published scientific and medical literature, would Mr. Drummond have been advised of those dangers and the need to use respiratory protection doing the activities that he described if there was a perceived risk?",q,MR. SPEZIALI,start_answer
209,1267,48,25,"Certainly, yes, if the risk was of adverse outcomes, yes.",a,THE WITNESS,start_question
210,1270,49,2,"Okay.  Would he again based upon what was in the public medical and scientific literature, would he have been advised or would he have been -- or would have there been utilized ventilation and exhaust for dust control purposes in the areas that he talked about in the manner in which he describes?",q,MR. SPEZIALI,start_answer
211,1276,49,8,Yes.,a,THE WITNESS,start_question
212,1277,49,9,"Okay.  Would the Navy in the shipyard have put in place as part of dust control measures moistening of the materials and, again, I'm referring to the Brown article?",q,MR. SPEZIALI,start_answer
213,1281,49,13,"Certainly the wet methods were an engineering device that was recommended by many.  So, again, if there was a perceived risk, that would have been wise.",a,THE WITNESS,start_question
214,1284,49,16,"Okay.  In simple -- in simple language, if there was a perceived risk based upon what is described in the literature during the relevant timeframe we're about, would Mr. Drummond have been made aware of those risks and dangers?",q,MR. SPEZIALI,start_answer
215,1289,49,21,Yes.,a,THE WITNESS,start_chat
216,1290,49,22,"Okay.  I don't have any other questions.  Thank you, Doctor.",side_chat,MR. SPEZIALI,start_chat
217,1292,49,24,I have nothing further.,side_chat,MS. MCMORRIS,is brackets
218,1293,49,25,(The reading and signing of the deposition were waived.),brackets,,is brackets
219,1296,50,2,"(The deposition was concluded at 11:35 a.m.) I, YVETTE S. HARRISON, RPR, FPR, the undersigned authority, hereby certify that the witness THOMAS P. HOWARD, M.D. was duly sworn by me. WITNESS MY HAND AND OFFICIAL SEAL this 21st day of August of 2019 at Melbourne, Florida.",brackets,,symbols
220,1340,50,17,"________________________________ YVETTE S. HARRISON, RPR Certificate No. CC717086 CERTIFICATE OF REPORTER STATE OF FLORIDA  ) COUNTY OF BREVARD ) Reporter, Florida Professional Reporter, do hereby stenographically report the deposition of THOMAS P. not requested; and that the foregoing transcript, correct record of my stenographic notes. I FURTHER CERTIFY that I am not a relative, parties, nor am I a relative or employee of any of the action, nor am I financially interested in",symbols,,symbols
221,1374,51,15,"_________________________________ Yvette S. Harrison, Florida Professional Reporter",symbols,,end
