,indice,page_number,line_number,text,text_type,speaker,time_added
110,596,23,4,"Well, when you read the publications, both the Brown publication that I mentioned in 1941, as well as the Fleischer Drinker study in 1946, they especially specific to this case they talk about processes that the Navy had in various locations and with various levels of compliance that involved ventilation, dust suppression techniques and even the use of respirator type devices. In some they mentioned wet methods, which would be occasionally utilized.  I think those are predominately the engineering categories that are cited at that time.",a,THE WITNESS,start_question
111,606,23,14,Do you have any knowledge whether or not any of those dust minimization efforts that you just described were being used at the Fore River Shipyard?,q,MS. MCMORRIS,start_answer
112,609,23,17,"I certainly don't have any personal knowledge. I would reflect -- and I haven't done this in preparation for this so I can't cite it directly, but as I mentioned in my report the Fore River Shipyard was one of those surveyed by the Fleischer Drinker study. So to specifically answer I would have to look at the language there, but I don't know off the top I'm sorry.  And I'm not suggesting that those measures were preventative to the subsequent development of a mesothelioma, the knowledge of that of course comes in the future well beyond 1956 in my opinion.",a,THE WITNESS,start_question
113,621,24,3,"In your reading of Mr. Drummond's deposition testimony, did you see any indication that any of those dust suppression techniques were being used at Fore River during Mr. Drummond's time there?",q,MS. MCMORRIS,start_answer
114,625,24,7,"No.  But I don't recall anybody specifically asking him about ventilation and things like that.  But to answer your question, no.",a,THE WITNESS,start_question
115,628,24,10,"Do you have any information regarding General Electric or Westinghouse's contemporaneous knowledge of awareness, knowledge or awareness, excuse me, of what Bethlehem Steel knew about the hazards of asbestos during Mr. Drummond's time there?",q,MS. MCMORRIS,start_answer
116,633,24,15,"Specifically regarding Bethlehem Steel, absolutely not.  I do have some knowledge and certainly expectations regarding the published medical literature and what I would expect and in some cases know that the corporation would know about that information certainly being part of organizations which promulgate those conclusions from the published literature I think is evident in this case. And maybe this is getting too far afield, but certainly my knowledge about Alice Hamilton and her role with GE historically would I think partially address that.  But I have no knowledge about what the corporate knowledge about Bethlehem Steel's knowledge would be, it would be more aimed at the published medical literature.",a,THE WITNESS,start_question
117,648,25,4,"In your report you express an opinion that, trying to find the correct paragraph here:  ""The absence of caution labels associated with General Electric or Westinghouse cannot be deemed a proximate cause of Mr. Drummond's exposure to asbestos."" Do you see that reference?  I think it's on the third page.",q,MS. MCMORRIS,start_answer
118,655,25,11,"I don't -- let me see if I can find it.  I recall the reference, let's see if I can find it.  I may not need to find it.  Go ahead and ask.  I recall the reference.",a,THE WITNESS,start_question
119,659,25,15,The question is what is the basis for your opinion?,q,MS. MCMORRIS,start_answer
120,661,25,17,"Well, so specifically regarding whether warning labels on a GE or a Westinghouse product in this case would have probably changed anybody's behavior. In most cases I don't have a specific quote from the plaintiff.  In this case Mr. Drummond was specifically asked whether or not that information would have changed him and I think I included that in my report.  He clearly stated that it would not. In most cases my conclusion, and in this one as well, is in part based on a number of variables including their described work. So the fact that he didn't work directly on those products, along with the fact that the products in question here are predominately thermal insulation as noted throughout a period of time that he worked in that arena did have warnings on them.  As well as certainly the sophistication and the knowledge of the Navy, which I referenced earlier. It wouldn't have been that that kind of information would have educated the Navy or likely based on his own response have any impact on what Mr. Drummond's activity was.",a,THE WITNESS,start_question
121,684,26,14,"Is that your opinion the same opinion regarding what you just testified for the Navy, is it also your opinion that these warning labels would not have impacted the shipyard in any manner?",q,MS. MCMORRIS,start_answer
122,688,26,18,"Correct, yes.",a,THE WITNESS,start_question
123,689,26,19,So is it your opinion that neither GE or Westinghouse made an affirmative decision not to warn because they were aware of the shipyard or the Navy's investigation regarding the hazards of asbestos?,q,MS. MCMORRIS,start_answer
124,693,26,23,"Well, I can't really speak specifically to what was underneath that decision, but certainly they were aware and in many instances it would be based again on published medical literature, as well as experience, that number one as I think was pointed out in a deposition the forced draft blowers and in this case the turbines would typically be delivered without asbestos. The asbestos that the Navy decided to subsequently apply would have in many cases had warnings already on it. So in part that knowledge of the processes that are in place and probably that many products that were available and in use at that time, which were I don't believe mandated to use, did have warning labels already on them. So I think speculating a little bit that all of those factors would certainly play into that decision, as well as the fact that your product does not contain asbestos.",a,THE WITNESS,start_question
125,713,27,17,And you mentioned some of the controls that were in place affecting shipyards during this time period.  And I believe you cited to the minimum requirements for safety of industrial health for shipyards in the Walsh-Healey Act. Are there any other that apply specifically to the Fore River Shipyard during that time period?,q,MS. MCMORRIS,start_answer
126,720,27,24,"Well, certainly the ACGIH.  And I guess not a requirement, but my understanding is that the vast majority of states embraced the recommended threshold limit value.  So what the legal requirement of specific shipyard was regarding that I can't really address, but I think that also would at least speak to the processes in place. Other than that, I think the two things that you mentioned certainly are pertinent to that.  Along with certainly the published literature that I spoke to earlier.  That's somewhat of a unique variable in this case.  So I think that's all I'm thinking of in answering that.",a,THE WITNESS,start_question
127,734,28,12,"And specific to the Walsh-Healey Act, was that applicable to product manufacturers such as General Electric and Westinghouse as well as shipyards?",q,MS. MCMORRIS,start_answer
128,737,28,15,"We're getting outside of my field here.  My understanding is a federal employee was Walsh-Healy Act involved federal contracts beyond a certain economic level and then it required a variety of actions be taken, which included adherence to the five million particle per cubic foot level in the 50s I recall. But as far as specific requirements and legal requirements of a corporation versus a shipyard, I don't know.  My understanding as a physician was that it applied to all federal contracts over a certain dollar amount.",a,THE WITNESS,start_question
129,749,29,1,"And so the federal contract, is it your understanding that was just between the Navy and a shipyard and not necessarily including product manufacturers?  I'm just trying to understand your opinion.",q,MS. MCMORRIS,start_answer
130,754,29,6,"Okay.  Again, I'm not an expert on the contractual situation.  My understanding was if you signed a federal contract, whoever you are, General Electric, Westinghouse or a shipyard that involved more than I thought it was $10,000, but I'm not sure of that, then you would be obligated to follow this -- these rules of engagement.  That's the extent of my knowledge. I just know from reading it that it embraced the five million particle which becomes very pertinent to what I testify about speaking again to the widespread adoption both in federal and in state jurisdictions to that level as being a credible effort to do the best that we could with the knowledge that we had at a specific time to prevent adverse outcomes.  That's the extent of my knowledge of that.",a,THE WITNESS,start_question
131,769,29,21,In what way do the requirements imposed upon the Fore River Shipyard through the Walsh-Healey Act or the minimum standards contribute to your opinion that the Fore River Shipyard was highly sophisticated regarding asbestos safety?,q,MS. MCMORRIS,start_answer
132,775,30,1,"Well, my understanding of your previous question that led to that label of highly sophisticated had to do with the Navy. The shipyard in terms of the Walsh-Healey Act in my opinion it speaks to the question that frequently comes up about the legitimacy of the five million particle per cubic foot level. Clearly people were not embracing that in an effort to cause harm to people.  And when that position is taken, I think citing federal endorsement of it through the Walsh-Healey Act and then state endorsement of it tends to minimize the legitimacy of that argument. So beyond that, the legal sophistication of the shipyard I'm not personally aware of.  I was speaking primarily of where the Navy's involvement from the very beginning of this period of time, specifically the 40s, in investigating and knowing about the potential hazards of asbestos.",a,THE WITNESS,start_question
133,793,30,19,"In the third page of your report there is a statement stating:  ""The Fore River Shipyard was highly sophisticated regarding asbestos safety starting with the requirements imposed upon it by the government regulations including the minimum standards and the Walsh-Healey Act.""  That's what I was referencing.  Do you see that in your report?",q,MS. MCMORRIS,start_answer
134,801,31,1,Yes.  What I think I'm addressing is thinking that the Fore River Shipyard is affiliated with the Navy and the Navy is certainly knowledgeable and obligated and endorsing those ideas and the base of the knowledge for it. So maybe I shouldn't separate the Fore River Shipyard as an entity from the Navy.  I'm just thinking the Navy is there and predominately he's working on naval vessels.  So I'm assuming there's going to be some cross pollination of that knowledge base.  I'm just not specifically knowledgeable about the non Navy functioning of the Fore River Shipyard.,a,THE WITNESS,start_question
135,813,31,13,Do you have an understanding of whether or not the Fore River Shipyard was a Navy shipyard versus a contract shipyard?,q,MS. MCMORRIS,start_answer
136,816,31,16,"No, I don't know the makeup there.  I just thought from the description in this case that it was heavily involved with the Navy, especially during the period of time that Mr. Drummond was there.  So I don't know the legal makeup or the specific corporate entity makeup of the shipyard.",a,THE WITNESS,start_question
137,822,31,22,Would it change your opinion at all if the Fore River Shipyard was a privately owned shipyard as opposed to a Navy shipyard?,q,MS. MCMORRIS,start_answer
138,825,31,25,"I don't think so.  In those cases that I've been involved with, if it was a totally non Navy operation, then typically the shipyard has been involved with organizations like the National Safety Council and Industrial Hygiene Foundation, things like that where information is passed.  And as mentioned earlier, the ACGIH with state adoption of various dust control limits. Usually, if the Navy is not involved, I've done the work to try to figure out what the corporate entity was guided by in a given state.  I'm just assuming in this case there was heavy Navy involvement.  He made that clear from his testimony as well.  So that's kind of where my thought process is regarding the sophistication.",a,THE WITNESS,start_question
139,839,32,13,And would that sophistication for a private shipyard such as the Fore River Shipyard be the same as what a corporation such as General Electric or Westinghouse would have had available to them?,q,MS. MCMORRIS,start_answer
140,843,32,17,"Well, most of what I refer to and the publications that I've referred to here, including all the ACGIH information and state regulations and federal regulations, are all publicly available. So if your workplace is addressed, it's pertinent to know and I would expect an operation to be aware of what was in those sources of information from peer reviewed published literature, to state regulations, to federal law that addressed your operation.  I would certainly expect them to know about that.",a,THE WITNESS,start_question
141,854,33,2,So changing gears here a little bit.  You did review medical records of Mr. Drummond from this 2016 to 2018 time period; is that correct?  Let me see if I can find it here.,q,MS. MCMORRIS,start_answer
142,858,33,6,"Leah, I'm sorry, I was still thinking about your last question and I looked through my report.  In citations four and five I think I addressed some of what you asked me about, including of course the previously noted reference that the Fore River Shipyard was one of the original yards surveyed in that Fleischer Drinker report. So I guess specific to this case I would look at citation four and five to address some of those sophistication questions.  I'm sorry, I got distracted by that and I forgot or missed your most recent question.",a,THE WITNESS,start_question
143,869,33,17,That's okay.  I was going to change gears on you here and talk about Mr. Drummond's medical records that you reviewed. Is it correct that the records that you reviewed were from 2016 to 2017?,q,MS. MCMORRIS,start_answer
144,874,33,22,Yes.,a,THE WITNESS,start_question
145,875,33,23,Okay.  And what did your review of his medical record suggest to you regarding his diagnosis of mesothelioma?,q,MS. MCMORRIS,start_answer
146,879,34,1,"Well, I believe it confirmed it.  I usually am asked to review the records to weigh in on the legitimacy of the diagnosis and in this case I think it was totally and completely legitimate to do what they did and I'm certainly supportive of the diagnosis.",a,THE WITNESS,start_question
147,884,34,6,"I'm just going to review my notes briefly here, but I think I'm just about finished.  When you're reviewing a case like this and the medical records that you were provided, is there -- do you have a method to differentiate between an exposure that you believe is causative and contributes to disease or one that does not?",q,MS. MCMORRIS,start_answer
148,891,34,13,"I usually don't get that from the medical records.  But there are some variables that I look to and in this case there was evidence of pleural plaques formation, which also attests to the deposition claim of occupational exposure to asbestos. So specific to this case that was an indicator in my opinion supportive of Mr. Drummond's testimony and what I knew about the workplace that supported that this was an asbestos related mesothelioma. But most of the time and in most situations regarding your question, it's gleaned more from the deposition testimony of the workplace and the exposure than it is the medical record.  I, you know, with mesothelioma many are non occupational -- non occupationally related, but you can't determine that in most cases from the medical records.",a,THE WITNESS,start_question
149,908,35,4,"Did you see anything in your review of Mr. Drummond's medical records that you disagreed with treatment wise, diagnosis wise or anything just in general that you disagreed with?",q,MS. MCMORRIS,start_answer
150,912,35,8,"Not in his medical records if that's the focus of your question.  The only thing I can think of, and I don't think it was a conclusion, but one of the entries listed a history of asbestosis and that certainly was not supported throughout his clinical record that I reviewed. That was not a diagnosis that his treating physicians had reached. But that was just one entry, it was in a list of historical diagnosis so I wouldn't know what they had based that on.  And it certainly was not supported by his clinical records.",a,THE WITNESS,start_question
151,923,35,19,But is it your opinion that his clinical records did support a diagnosis of asbestosis at some point?,q,MS. MCMORRIS,start_answer
152,926,35,22,"No, not the ones that I reviewed.  No, they did not.  That is noted on a death certificate, but there are other significant inaccuracies in the death certificate. So I think the clinical records did not conclude that he had asbestosis.  They did include that he had mesothelioma of course.",a,THE WITNESS,start_question
153,933,36,3,"In your review of the death certificate, what are the inaccuracies in your opinion?",q,MS. MCMORRIS,start_answer
154,935,36,5,"Well, the most glaring ones are the list of metastatic lung cancer followed by asbestosis.  I don't believe the clinical records that I reviewed supported either conclusion.",a,THE WITNESS,start_question
155,939,36,9,And why is that?,q,MS. MCMORRIS,start_answer
156,940,36,10,"Well, hopefully we can agree here today that lung cancer is not mesothelioma.  They are totally distinct entities that really have little, if anything, to do with each other.  So I saw nothing in his record that this gentleman had had lung cancer. And, again, asbestosis is a diagnosis based on a variety of things, predominately the radiographic findings and the radiographic reports that I saw along with the clinical conclusions by his treating doctors did not diagnose him with that.  So those are the two most glaring ones. I guess from your perspective I would conclude that the absence of mesothelioma on his death certificate is an obvious error as well in my opinion.",a,THE WITNESS,start_question
157,954,36,24,Any other errors that you see on the death certificate?,q,MS. MCMORRIS,start_answer
158,957,37,1,I don't think so.,a,THE WITNESS,start_question
159,958,37,2,All right.  Are there any additional opinions in your report or outside of your report that we have not discussed today that you anticipate having opinions about if you were to testify in trial in this case?,q,MS. MCMORRIS,start_answer
160,962,37,6,"Without a specific question, I can't add to what we already talked about in anticipation of those questions.  So, no, I don't.",a,THE WITNESS,start_question
161,965,37,9,"I think that's all I have for you, Dr. Howard.",q,MS. MCMORRIS,start_answer
162,966,37,10,"All right.  Thank you, Leah.",a,THE WITNESS,start_question
163,967,37,11,Thank you.,q,MS. MCMORRIS,start_chat
164,968,37,12,"Leah, this is Dave.  Well, first off, let me mention this.  I sent you the e-mail just now.",side_chat,MR. SPEZIALI,start_chat
165,971,37,15,Okay.,side_chat,MS. MCMORRIS,start_chat
166,972,37,16,"If you wanted to take a minute and look at those, that's totally your call.  We can certainly take whatever amount kind of break you need.  Those are generic reports.  I don't think you're going to find a lot there different, but you certainly might. Is there anybody else on the phone that wants to ask questions?  I don't even know if anybody else is on the phone.",side_chat,MR. SPEZIALI,start_chat
167,981,37,25,I don't think there is.,side_chat,MS. MCMORRIS,start_chat
168,983,38,1,Did you want to take a few minutes and take a look at those?  It's totally your call.,side_chat,MR. SPEZIALI,start_chat
169,986,38,4,Sure.  It will probably take me two minutes to scroll through it and compare to what I have and see if there's anything that's different and worth mentioning.,side_chat,MS. MCMORRIS,start_chat
170,990,38,8,Did the e-mail come through?,side_chat,MR. SPEZIALI,start_chat
171,991,38,9,"It did, I just got it.",side_chat,MS. MCMORRIS,start_chat
172,992,38,10,"Okay.  Wait a few minutes.  And then I may or may not have a couple questions, but let's see where it goes.  We'll give it let's say ten minutes, quarter after.",side_chat,MR. SPEZIALI,start_chat
173,996,38,14,Okay.,side_chat,MS. MCMORRIS,is brackets
174,997,38,15,(A break was taken.),brackets,,start_chat
175,998,38,16,Did you have any more questions?,side_chat,MR. SPEZIALI,start_chat
176,999,38,17,I just have one follow-up.,side_chat,MS. MCMORRIS,start_question
177,1001,38,19,Is it your opinion that neither the Navy or Bethlehem Steel appreciated the risk of exposure to bystanders during the time period that Mr. Drummond worked at the Fore River Shipyard?,q,MS. MCMORRIS,start_chat
178,1005,38,23,"Objection to form.  Go ahead, Doc.",side_chat,MR. SPEZIALI,start_answer
179,1007,38,25,"So, again, I don't know the specific basis for Bethlehem Steel.  I would expect everybody to look to the medical literature to try to answer that. Certainly, in terms of exposure, I think there would be general understanding, which is not unique to asbestos, that certainly there is likely to be exposure. The question certainly has to do with the expected development of adverse outcomes and that throughout this period of time was felt not to occur if the level of exposure was be below a certain range. And certainly at this point, '56 to '62 in particular, I don't know of any epidemiologic based knowledge that would in any way suggest bystanders were at risk of disease.  I think there would be just a general understanding that there might be minimal exposure the further you get from a focal point. But, again, the point of dust production, the target was five million particles and below that adverse effects would not occur. So clearly it was not perceived nor reported that bystanders were at risk of getting any disease, especially mesothelioma.",a,THE WITNESS,start_question
180,1030,39,22,"And so that risk, therefore, would not have been appreciated by either the Navy or Bethlehem Steel?",q,MS. MCMORRIS,start_answer
181,1032,39,24,"Oh, maybe I misunderstood.  I mean the risk of exposure to me is different than the risk of adverse outcome from that exposure.  So, again, I don't know the specific answer for Bethlehem Steel. I would expect and certainly from all the processes in place with the Navy they were aware that there was a risk of exposure, but not a risk of disease to bystanders at that period of time.",a,THE WITNESS,start_chat
182,1041,40,7,Okay.  Thank you.  I think that's all I have.,side_chat,MS. MCMORRIS,start_chat
183,1043,40,9,This is Dave.  I just have a couple quick questions. CROSS EXAMINATION,side_chat,MR. SPEZIALI,start_question
184,1047,40,13,"Dr. Howard, for purposes of my questions, although you've made it clear it's not reflected in the testimony, let's just assume that insulation materials used in conjunction with the products at issue for General Electric and/or Westinghouse were asbestos containing.  Okay.  Just assume that for the purposes of my question.",q,MR. SPEZIALI,start_answer
185,1054,40,20,Okay.,a,THE WITNESS,start_question
186,1055,40,21,"Okay.  For the time period for the activities described by Mr. Drummond and as you reflected in your report and your testimony today, would there have been reason for General Electric or Westinghouse to know or have reason or belief that exposure to asbestos insulation materials in conjunction with those products would have been dangerous for Mr. Drummond during the timeframes we're talking about?",q,MR. SPEZIALI,start_answer
187,1064,41,4,"No.  And I was trying to answer that with Leah's last question I think.  Certainly the state of the art at that period of time '56 through '62 was clearly not that a bystander, if in fact that occurred, the type of exposure to thermal insulation was likely to cause any adverse outcome.  So no.",a,THE WITNESS,start_question
188,1070,41,10,"All right.  And let's again just for purposes of this question -- and I understand your opinions, and I understand why your -- when you say through '62, you're focusing on Mr. Drummond's apprenticeship years; is that right?",q,MR. SPEZIALI,start_answer
189,1075,41,15,Yes.  There was a little bit of confusion beyond that because it was active military career.  But that's why I chose that period of time.,a,THE WITNESS,start_question
190,1078,41,18,"Okay.  And that's fine.  But let's just assume for purposes of our discussion so that there is no question as to where your opinions stand, we know that his career went through '71 and I recognize that his testimony differs substantially from his apprentice years to his later years. But if we expanded the question to include the period up through '71, in that timeframe again is there any reason to believe or know that the types of exposures that he describes would have created dangers for him in terms of insulation materials on the General Electric or Westinghouse products discussed in this case?",q,MR. SPEZIALI,start_answer
