,indice,page_number,line_number,text,text_type,speaker,time_added
886,2585,100,11,"Well, in context with Abacus 06-10 CDO.",a,THE WITNESS,start_question
887,2587,100,13,"Sorry.  When you say you're now aware of it, do you mean that this is something that you were not aware of at the time, but you subsequently learned?",q,MR. CROKE,start_answer
888,2591,100,17,Subsequently after the event happened?,a,THE WITNESS,start_question
889,2593,100,19,Yes.,q,MR. CROKE,start_answer
890,2594,100,20,Yes.,a,THE WITNESS,start_question
891,2595,100,21,"Okay. During your time at Deutsche Bank, were you ever aware of any circumstance in which you or the people who worked with you at Deutsche Bank submitted",q,MR. CROKE,start_answer
892,2601,101,1,Mathur - Attorneys' Eyes Only a request to replace a collateral security in a synthetic CDO?,a,THE WITNESS,start_answer
893,2604,101,4,Was I aware of it at that time? I don't recall frankly.,a,THE WITNESS,start_question
894,2606,101,6,"So to be clear, you have a recollection of a circumstance in which you, or people who worked with you at Deutsche Bank, submitted a request to replace a collateral security in the Abacus 06-10 CDO, but --",q,MR. CROKE,start_answer
895,2612,101,12,I'm saying that I -- sorry to cut you off.,a,THE WITNESS,start_chat
896,2614,101,14,"Let him finish the question, please.",side_chat,MR. ITKIN,start_question
897,2617,101,17,"I just want to make sure I understand.  I think I understand what you're saying and I just want to make sure it's clear. Is your answer that you have a recollection of a circumstance in which -- or rather, sorry, I'm going to strike that.",q,MR. CROKE,start_answer
898,2624,101,24,Uh-huh.,a,THE WITNESS,start_question
899,2625,101,25,Are you aware -- is it that,q,MR. CROKE,start_answer
900,2627,102,1,"Mathur - Attorneys' Eyes Only you're aware of a circumstance in which you or your colleagues at Deutsche Bank submitted a request to replace a collateral security in the Abacus 2006-10 CDO, but you don't have a specific recollection as to whether you were aware of it during your time at Deutsche Bank or whether you learned of it after the fact?",a,THE WITNESS,start_answer
901,2636,102,10,That is correct.  I think the former is correct.,a,THE WITNESS,start_question
902,2638,102,12,Okay.,q,MR. CROKE,start_answer
903,2639,102,13,"It was only recent that I sort of refreshed my memory about it.  If you had asked me the same question, let's say, three years ago, I may not recall in the same fashion, for instance.",a,THE WITNESS,start_question
904,2644,102,18,"Sitting here today, do you know whether you were involved in any discussions about that replacement security at the time it happened at Deutsche Bank?",q,MR. CROKE,start_answer
905,2648,102,22,"You know, there were thousands of things that I was doing at DB at that time. Could have been sort of a minor involvement possibly, but I have zero recollection.",a,THE WITNESS,start_answer
906,2653,103,1,Mathur - Attorneys' Eyes Only,a,THE WITNESS,start_question
907,2654,103,2,"And I think we're all on the same page here, but just so the record is clear, when you say Abacus 06-10 CDO, you're referring to the Abacus CDO that is the subject of this proceeding, right?",q,MR. CROKE,start_answer
908,2659,103,7,Yes.,a,THE WITNESS,start_question
909,2660,103,8,Okay. What do you recall about Deutsche's request to substitute a collateral security in the Abacus 2006-10 CDO?,q,MR. CROKE,start_answer
910,2665,103,13,What I do recall now?,a,THE WITNESS,start_question
911,2666,103,14,"Sitting here today, what is it that you recall about that?",q,MR. CROKE,start_answer
912,2668,103,16,My memory was recently refreshed by the fact that there was subprime collateral that was about to default and Deutsche Bank at that time had put in a request to replace that collateral.,a,THE WITNESS,start_question
913,2673,103,21,"And do you know whether the collateral security that Deutsche Bank proposed to replace was, in fact, replaced?",q,MR. CROKE,start_answer
914,2676,103,24,"Now I'm aware of it that yes, it was replaced.",a,THE WITNESS,start_answer
915,2679,104,1,Mathur - Attorneys' Eyes Only,a,THE WITNESS,start_question
916,2680,104,2,Do you know whether the replacement collateral security that your team at Deutsche Bank selected for the Abacus 06-10 CDO was required to comply with any eligibility criteria?,q,MR. CROKE,start_chat
917,2685,104,7,Objection.  That mischaracterizes the testimony.  I'm not sure the witness ever testified that his team at Deutsche Bank --,side_chat,MR. ITKIN,start_answer
918,2689,104,11,"Yes, I was going to say that.  It wasn't my team at that time.",a,THE WITNESS,start_question
919,2691,104,13,Okay. Do you recall who it was who was involved in selecting the collateral security for the Abacus 06-10 CDO?,q,MR. CROKE,start_answer
920,2695,104,17,"Do I recall?  No.  Can I guess? Probably, yeah.",a,THE WITNESS,start_question
921,2697,104,19,Was it people that worked with you on your trading desk?,q,MR. CROKE,start_answer
922,2699,104,21,"At that time, yes, that would have been the natural guess.",a,THE WITNESS,start_question
923,2701,104,23,Was it people that reported to you?,q,MR. CROKE,start_answer
924,2703,104,25,"No.  As I said, that wasn't my",a,THE WITNESS,start_answer
925,2705,105,1,Mathur - Attorneys' Eyes Only team at that time.,a,THE WITNESS,start_question
926,2707,105,3,"So I just want to make sure I understand. The trading desk at that time, and for your own reference, I'll represent to you this is 2008, at that time you were working on a trading desk with how many people was it roughly?",q,MR. CROKE,start_answer
927,2714,105,10,"2008 was probably the biggest flux of the year, frankly speaking.  At some point it could range from 15, 20, 25 people on the same sort of trading desk to same part of, depending on the year, month of the year.  Could be as little as seven, for instance.",a,THE WITNESS,start_question
928,2721,105,17,Okay.,q,MR. CROKE,start_answer
929,2722,105,18,So a lot of people.,a,THE WITNESS,start_question
930,2723,105,19,And what was your role on the trading desk at that time?,q,MR. CROKE,start_answer
931,2725,105,21,"I was on the structuring side of that, primarily.",a,THE WITNESS,start_question
932,2727,105,23,And did other people on the trading desk report to you at that time?,q,MR. CROKE,start_answer
933,2729,105,25,"2008, yes, they may have, yeah.",a,THE WITNESS,start_answer
934,2731,106,1,Mathur - Attorneys' Eyes Only,a,THE WITNESS,start_question
935,2732,106,2,"So my question is, do you know whether any of the people who were involved in submitting this request to replace a collateral security reported to you at that time?",q,MR. CROKE,start_answer
936,2737,106,7,"I would say I don't have a specific recollection about the whole procedure back then, but I don't recall anyone reporting in to me would have done it.  That would be my best guess at the moment.",a,THE WITNESS,start_question
937,2743,106,13,"Okay. So it would be people who worked on the desk with you, but you don't recall, one way or the other, whether it was people who --",q,MR. CROKE,start_answer
938,2748,106,18,"No, no, I do recall that they're unlikely to be reporting to me.  Just because I know the subject matter.  It isn't likely that those people would be the ones reporting in to me would have participated in this matter.",a,THE WITNESS,start_question
939,2754,106,24,Okay. Do you know whether the,q,MR. CROKE,start_answer
940,2757,107,1,Mathur - Attorneys' Eyes Only replacement on a collateral security that those people at Deutsche Bank selected for the Abacus 2006-10 CDO was required to comply with my eligibility criteria?,a,THE WITNESS,start_answer
941,2762,107,6,Did I know then?,a,THE WITNESS,start_question
942,2763,107,7,Do you know now whether the collateral security that the team at Deutsche Bank selected was required to comply with any eligibility criteria?,q,MR. CROKE,start_chat
943,2767,107,11,Objection.,side_chat,MR. ITKIN,start_answer
944,2768,107,12,"So do I know now whether it was then required, is that the question?",a,THE WITNESS,start_question
945,2770,107,14,"Sitting here right now, do you know whether the collateral security that the team at Deutsche Bank selected for the Abacus 2006-10 CDO was required at the time to comply with eligibility criteria?",q,MR. CROKE,start_chat
946,2775,107,19,Just one second.  I just want to object and make the record clear.  I'm not sure that we established that there was a team that selected anything at Deutsche Bank.  I am just going to clarify that and do with that whatever you want.,side_chat,MR. ITKIN,start_answer
947,2783,108,1,Mathur - Attorneys' Eyes Only,a,THE WITNESS,start_question
948,2785,108,3,"Sitting here right now, do you know whether the collateral security that these individuals at Deutsche Bank selected for inclusion in the Abacus 2006-10 CDO was required at the time to comply with any eligibility criteria?",q,MR. CROKE,start_answer
949,2791,108,9,I do not know whether it was required.  I don't recall whether I had a recollection at that time if it was required to do a satisfaction of an eligibility criteria.  I don't recall that.,a,THE WITNESS,start_question
950,2796,108,14,"I'm not asking about your recollection then.  I'm asking you, sitting here today, do you know whether the collateral security that these individuals at Deutsche Bank selected for inclusion in the Abacus 06-10 CDO was required at the time to comply with any eligibility criteria?",q,MR. CROKE,start_answer
951,2804,108,22,"Yeah, I think protection buyer -- not now, with the hindsight knowledge, I do believe that protection buyer is supposed to qualify every single eligibility",a,THE WITNESS,start_answer
952,2809,109,1,"Mathur - Attorneys' Eyes Only criteria of any replacement security, whether it's replaced by noteholders or not.",a,THE WITNESS,start_question
953,2813,109,5,"Okay. And do you know whether the replacement collateral security that these individuals at Deutsche Bank selected for inclusion in the Abacus 2006-10 CDO, in fact, satisfied those eligibility criteria?",q,MR. CROKE,start_answer
954,2819,109,11,"I'm not a lawyer.  So I'm not going to opine on that as a technical matter.  All I can say is that if I would assume that if protection buyer went through the eligibility criteria and said it satisfied it, then it should satisfy it. Do I know now technically -- look, I may be wrong about inference of an eligibility criteria in a legal context.  So I wouldn't want to opine on something that I won't be qualified to opine on.",a,THE WITNESS,start_question
955,2830,109,22,"During your time at Deutsche Bank, do you recall anyone ever proposing to substitute a collateral security for a synthetic CDO that did not comply with some",q,MR. CROKE,start_answer
956,2835,110,1,Mathur - Attorneys' Eyes Only eligibility criteria for that synthetic CDO?,a,THE WITNESS,start_answer
957,2838,110,4,"Again, to clarify the question, are you asking me whether I recall back then?",a,THE WITNESS,start_question
958,2841,110,7,"I'm asking -- I'm asking your recollection right now of whether, during your time at Deutsche Bank, anyone ever proposed to substitute a collateral security for a synthetic CDO that did not comply with the eligibility criteria?",q,MR. CROKE,start_answer
959,2847,110,13,"I do not have a recollection -- I've stated twice, and maybe I get confused right now.  I don't have recollection of it. Now my memory has been refreshed that, yes, some securities, or one of the securities was replaced by Deutsche.  It now, hence, I do have a refreshing of memory that yes, it was replaced.  I have very little recollection of what happened at that time.  I wasn't involved in it.",a,THE WITNESS,start_question
960,2858,110,24,I understand that you have a recollection now that it was replaced.,q,MR. CROKE,start_answer
961,2861,111,1,Mathur - Attorneys' Eyes Only,a,THE WITNESS,start_answer
962,2862,111,2,Yes.,a,THE WITNESS,start_question
963,2863,111,3,"But my question is a little different. I'm asking you whether you recall anyone at Deutsche Bank, during your time at Deutsche Bank, ever proposing to substitute a collateral security for a synthetic CDO that did not comply with the eligibility criteria for that synthetic CDO?",q,MR. CROKE,start_answer
964,2872,111,12,"You're asking me whether I recall now.  I don't recall now.  I don't recall most of it.  So no, I don't recall now or later it's the memory has been refreshed of something that happened back then, and I do recall that something happened.  But very vague memory of it.  Recollection about a past event is the same as I have now as it is later.",a,THE WITNESS,start_question
965,2881,111,21,When did you leave Deutsche Bank?,q,MR. CROKE,start_answer
966,2882,111,22,2012.,a,THE WITNESS,start_question
967,2883,111,23,About when in 2012?,q,MR. CROKE,start_answer
968,2884,111,24,"End of quarter 3, I think.",a,THE WITNESS,start_question
969,2885,111,25,So roughly September?,q,MR. CROKE,start_answer
970,2887,112,1,Mathur - Attorneys' Eyes Only,a,THE WITNESS,start_answer
971,2888,112,2,"Yeah, that would probably be right, but technically it could be October.",a,THE WITNESS,start_question
972,2890,112,4,Okay.,q,MR. CROKE,start_answer
973,2891,112,5,"Okay, so...",a,THE WITNESS,start_question
974,2892,112,6,Sure. And why did you leave Deutsche Bank?,q,MR. CROKE,start_answer
975,2895,112,9,Because I wanted to.,a,THE WITNESS,start_question
976,2896,112,10,Okay. Were there any other reasons?,q,MR. CROKE,start_answer
977,2898,112,12,"I wanted to do something on my own, for instance.",a,THE WITNESS,start_question
978,2900,112,14,"After leaving Deutsche Bank, did you become employed somewhere else?",q,MR. CROKE,start_answer
979,2902,112,16,Yes.,a,THE WITNESS,start_question
980,2903,112,17,And where was that?,q,MR. CROKE,start_answer
981,2904,112,18,"I wouldn't strictly call it employment.  So I want to retract it back. I became a partner at Octave, I think.",a,THE WITNESS,start_question
982,2907,112,21,"That's Octave, is that Octave Investment Management?",q,MR. CROKE,start_answer
983,2909,112,23,Correct.,a,THE WITNESS,start_question
984,2910,112,24,And when was that?,q,MR. CROKE,start_answer
985,2911,112,25,"I don't recollect actually, but",a,THE WITNESS,start_answer
986,2913,113,1,Mathur - Attorneys' Eyes Only sometime in end of 2012.,a,THE WITNESS,start_question
987,2915,113,3,Okay.,q,MR. CROKE,start_answer
988,2916,113,4,So it wasn't immediately after.,a,THE WITNESS,start_question
989,2917,113,5,And did there come a time that you left Octave?,q,MR. CROKE,start_answer
990,2919,113,7,Did I resign as a partner?,a,THE WITNESS,start_question
991,2920,113,8,Yes.,q,MR. CROKE,start_answer
992,2921,113,9,Yes.,a,THE WITNESS,start_question
993,2922,113,10,And when was that?,q,MR. CROKE,start_answer
994,2923,113,11,"I don't recall actually.  It's '14, '15 maybe, something, a couple of years later.",a,THE WITNESS,start_question
995,2926,113,14,"Okay. And now, just to avoid any confusion here.  I know that there are several Astra-affiliated entities.  If I refer to Astra, do you have an understanding of, you know -- is that a term that you use to refer to the collective group of Astra entities or is there some other term that's easier for you?",q,MR. CROKE,start_answer
996,2936,113,24,"So the thing is that we're going to be pedantic here, so please refer to the",a,THE WITNESS,start_answer
997,2939,114,1,"Mathur - Attorneys' Eyes Only full sentence if you can, because when we refer to Astra, it could mean Astra Fund, Astra Advisors, Astra Asset Management, LLP and so on.  There are multiple Astra entities.  We call them all one.",a,THE WITNESS,start_question
998,2945,114,7,Okay.,q,MR. CROKE,start_answer
999,2946,114,8,So I would prefer if you use the full legal name so that we're on the same page.,a,THE WITNESS,start_question
1000,2949,114,11,Sure. And what is the full legal name of the entity that is the -- that you understand to be the objector in this case?,q,MR. CROKE,start_answer
1001,2953,114,15,It's the Astra Asset Management UK Limited.,a,THE WITNESS,start_question
1002,2955,114,17,"Okay.  All right. So is it all right if I use the term ""Astra"" to refer to Astra Asset Management UK Limited?",q,MR. CROKE,start_answer
1003,2959,114,21,"It is absolutely fine, Jake.  I'm just simply saying that I might get confused because, you know, you're just having one conversation with me. For the last several years, I've",a,THE WITNESS,start_answer
1004,2965,115,1,"Mathur - Attorneys' Eyes Only been using ""Astra"" as a term for kind of everything, Astra this, Astra that, Astra Fund.  So I might get confused.  So just for my own sanity, if you can help it, great.  If you can't, I'll try to be careful about it, okay.",a,THE WITNESS,start_question
1005,2972,115,8,Fair deal.  Fair deal. Were you involved in founding some of the Astra-affiliated entities?,q,MR. CROKE,start_answer
1006,2975,115,11,"Involved?  The answer is no, actually.",a,THE WITNESS,start_question
1007,2977,115,13,Who was involved in founding the various Astra-affiliated entities?,q,MR. CROKE,start_answer
1008,2979,115,15,I assume for one it would probably be Paul Phillips.,a,THE WITNESS,start_question
1009,2981,115,17,And who is Paul Phillips?,q,MR. CROKE,start_answer
1010,2982,115,18,He's an ex-director of Astra Asset Management UK Limited.,a,THE WITNESS,start_question
1011,2984,115,20,Are you currently an officer of any Astra-affiliated entities?,q,MR. CROKE,start_answer
1012,2986,115,22,I am.,a,THE WITNESS,start_question
1013,2987,115,23,Okay. And what entities are you an officer of?,q,MR. CROKE,start_answer
1014,2991,116,1,Mathur - Attorneys' Eyes Only,a,THE WITNESS,start_answer
1015,2992,116,2,"A director of Astra Asset Management UK Limited, for instance.",a,THE WITNESS,start_question
1016,2994,116,4,Okay. Are there others?,q,MR. CROKE,start_answer
1017,2996,116,6,"Yes, there are.",a,THE WITNESS,start_question
1018,2997,116,7,And what are those?,q,MR. CROKE,start_answer
1019,2998,116,8,"I'm struggling with the word ""affiliate,"" actually.  So I do not know if a fund is an affiliate, for instance.  But Astra came in international, Astra entity.",a,THE WITNESS,start_question
1020,3002,116,12,Okay?,q,MR. CROKE,start_answer
1021,3003,116,13,"I would call it just to make things simple between us, right.",a,THE WITNESS,start_question
1022,3005,116,15,Uh-huh.,q,MR. CROKE,start_answer
1023,3006,116,16,"And I do not know whether the affiliate would be a regular term and also under U.S. Law, it could be different from what it is under the UK law.",a,THE WITNESS,start_question
1024,3010,116,20,Uh-huh.,q,MR. CROKE,start_answer
1025,3011,116,21,But Astra Cayman International is a Cayman limited company for which I'm also a director of.,a,THE WITNESS,start_question
1026,3014,116,24,Do you have a title at any of these entities?,q,MR. CROKE,start_answer
1027,3017,117,1,Mathur - Attorneys' Eyes Only,a,THE WITNESS,start_answer
1028,3018,117,2,Director.,a,THE WITNESS,start_question
1029,3019,117,3,Are you the chief investment officer at any Astra entities?,q,MR. CROKE,start_answer
1030,3021,117,5,"It's not a granted title, but often I presume a function of the chief investment officer of Astra Asset Management UK Limited.",a,THE WITNESS,start_question
1031,3025,117,9,Okay.,q,MR. CROKE,start_answer
1032,3026,117,10,And this is how the investors may perceive me as well.,a,THE WITNESS,start_question
1033,3028,117,12,Are you the chief executive officer of any Astra entities?,q,MR. CROKE,start_answer
1034,3030,117,14,We don't have a function like that at Astra entities.,a,THE WITNESS,start_question
1035,3032,117,16,Okay. Do you report to anyone at any of the Astra entities?,q,MR. CROKE,start_answer
1036,3035,117,19,What does reporting mean actually?,a,THE WITNESS,start_question
1037,3037,117,21,Do you report to anyone in your day-to-day job?  Do you have someone who oversees your performance?,q,MR. CROKE,start_answer
1038,3040,117,24,My performance?  What performance?,a,THE WITNESS,start_answer
1039,3043,118,1,Mathur - Attorneys' Eyes Only,a,THE WITNESS,start_question
1040,3044,118,2,"You conduct business on a day-to-day business in your role at Astra, is that correct?  Is there anyone who oversees your performance?",q,MR. CROKE,start_answer
1041,3048,118,6,"For example, we have a cumulative set of directors who discuss matters together.  We don't have a concept of performance review, per se.",a,THE WITNESS,start_question
1042,3052,118,10,Do you report to anyone in connection with your role at Astra?,q,MR. CROKE,start_answer
1043,3054,118,12,"As I said, it's not a structure like that.  I would happily answer this question if there was one, but --",a,THE WITNESS,start_question
1044,3057,118,15,Does anyone report to you at any of these Astra entities?,q,MR. CROKE,start_answer
1045,3059,118,17,"As I said, we don't have a structure like that, a reporting line structure.",a,THE WITNESS,start_question
1046,3062,118,20,Okay. So there is no reporting line structure at any of these Astra entities?,q,MR. CROKE,start_chat
1047,3065,118,23,Objection.  Asked and answered.,side_chat,MR. ITKIN,start_answer
1048,3067,118,25,"We have functions, and within",a,THE WITNESS,start_answer
1049,3069,119,1,"Mathur - Attorneys' Eyes Only certain functions people refer to an organization chart, for instance.  But it isn't a formal reporting line on personnel.",a,THE WITNESS,start_question
1050,3073,119,5,Okay. Do you work with Mr. Adler at Astra?,q,MR. CROKE,start_answer
1051,3076,119,8,I do.,a,THE WITNESS,start_question
1052,3077,119,9,Okay. What is Mr. Adler's role at Astra?,q,MR. CROKE,start_answer
1053,3080,119,12,He's also one of the directors Astra Asset Management UK Limited.,a,THE WITNESS,start_question
1054,3082,119,14,Does he have any other roles?,q,MR. CROKE,start_answer
1055,3083,119,15,"Yes, he just, like I have multiple roles, he does, too.",a,THE WITNESS,start_question
1056,3085,119,17,What are his roles?,q,MR. CROKE,start_answer
1057,3086,119,18,"Amongst other things, he looks at, for instance, risk on the portfolio.",a,THE WITNESS,start_question
1058,3088,119,20,Okay. Is Mr. Adler involved in trading securities at Astra?,q,MR. CROKE,start_answer
1059,3091,119,23,"Involved, yes.",a,THE WITNESS,start_question
1060,3092,119,24,Okay. Are you involved in trading,q,MR. CROKE,start_answer
1061,3095,120,1,Mathur - Attorneys' Eyes Only securities at Astra?,a,THE WITNESS,start_answer
1062,3097,120,3,Involved as in a day-to-day function?,a,THE WITNESS,start_question
1063,3099,120,5,Whatever you understand that to mean.  Are you involved in trading securities at Astra?,q,MR. CROKE,start_chat
1064,3102,120,8,Objection.,side_chat,MR. ITKIN,start_answer
1065,3103,120,9,"I don't understand it, so I can try and answer that from what it means, but involvement is a broader term, and from that extremely broad term, since I'm the CIO equivalent of an Astra Asset Management UK Limited manager, investment manager of various Astra funds, I'm involved in everything that Astra does, including trading of securities.",a,THE WITNESS,start_question
1066,3112,120,18,"Okay. And other than you and Mr. Adler, are there others at Astra that are involved in trading securities?",q,MR. CROKE,start_answer
1067,3116,120,22,Yes.,a,THE WITNESS,start_question
1068,3117,120,23,And who is that?,q,MR. CROKE,start_answer
1069,3118,120,24,Today?,a,THE WITNESS,start_question
1070,3119,120,25,Yeah.,q,MR. CROKE,start_answer
1071,3121,121,1,Mathur - Attorneys' Eyes Only,a,THE WITNESS,start_answer
1072,3122,121,2,"It would be, for instance, Kyle.",a,THE WITNESS,start_question
1073,3123,121,3,Kyle who?,q,MR. CROKE,start_answer
1074,3124,121,4,Kyle Muscrup.,a,THE WITNESS,start_question
1075,3125,121,5,Okay.  Are there others?,q,MR. CROKE,start_answer
1076,3126,121,6,"Yes, could be Shikha Gupta.",a,THE WITNESS,start_question
1077,3127,121,7,Are there others?,q,MR. CROKE,start_answer
1078,3128,121,8,"Yes.  It depends on what security we're talking about, but yes, there are others as well.",a,THE WITNESS,start_question
1079,3131,121,11,"For asset-backed securities, sitting here today --",q,MR. CROKE,start_answer
1080,3133,121,13,These are the people.,a,THE WITNESS,start_question
1081,3134,121,14,Okay. So that group is the group that is typically involved in trading asset-backed securities.,q,MR. CROKE,start_answer
1082,3138,121,18,Uh-huh.,a,THE WITNESS,start_question
1083,3139,121,19,When was Astra founded?,q,MR. CROKE,start_answer
1084,3140,121,20,2012.,a,THE WITNESS,start_question
1085,3141,121,21,And who are Astra's founders?,q,MR. CROKE,start_answer
1086,3142,121,22,"That's, again, a technical question.  I don't recall exactly, but I would have thought one of the founders would be Tarun Joshi.",a,THE WITNESS,start_answer
1087,3147,122,1,Mathur - Attorneys' Eyes Only,a,THE WITNESS,start_question
1088,3148,122,2,Are you one of the founders of Astra?,q,MR. CROKE,start_answer
1089,3150,122,4,"Again, this is a technical question.  So when you say founder, I mean am I the founder, the concept, is that the question?",a,THE WITNESS,start_question
1090,3154,122,8,Do you consider yourself a founder of Astra?,q,MR. CROKE,start_answer
1091,3156,122,10,"Well, a layman term, a founder, yes.  But technical term founder, no.",a,THE WITNESS,start_question
1092,3158,122,12,Okay. Have you ever described yourself as a founder of Astra?,q,MR. CROKE,start_answer
1093,3161,122,15,I may have.,a,THE WITNESS,start_question
1094,3162,122,16,Okay. Were you still employed at Deutsche Bank when Astra was founded?,q,MR. CROKE,start_answer
1095,3165,122,19,"Probably, but I don't recall actually exactly when it was founded, to be honest.",a,THE WITNESS,start_question
1096,3168,122,22,And when did you become affiliated with Astra?,q,MR. CROKE,start_answer
1097,3170,122,24,"Between September and November sometime in the time, 2012.",a,THE WITNESS,start_answer
