,indice,page_number,line_number,text,text_type,speaker,time_added
1543,4343,168,1,"Mathur - Attorneys' Eyes Only occasion, I don't have a specific recollection about any conversations regarding this.",a,THE WITNESS,start_question
1544,4347,168,5,Okay.,q,MR. CROKE,start_answer
1545,4348,168,6,Okay?,a,THE WITNESS,start_question
1546,4349,168,7,Uh-huh.,q,MR. CROKE,start_answer
1547,4350,168,8,"But I hope I have given you the answer that you are seeking.  If it is not, then let me know right now.",a,THE WITNESS,start_question
1548,4353,168,11,"No, that's very helpful.",q,MR. CROKE,start_answer
1549,4354,168,12,Okay.,a,THE WITNESS,start_question
1550,4355,168,13,Do you recall when the last time that Astra purchased or sold Abacus 2006-10 securities was?,q,MR. CROKE,start_answer
1551,4358,168,16,It would have been in 2016.,a,THE WITNESS,start_question
1552,4359,168,17,2016. And do you recall when in 2016?,q,MR. CROKE,start_answer
1553,4361,168,19,No.  It could have been May actually.,a,THE WITNESS,start_question
1554,4363,168,21,May?,q,MR. CROKE,start_answer
1555,4364,168,22,I sort of recall now.,a,THE WITNESS,start_question
1556,4365,168,23,Okay. Was the Abacus 2006-10 CDO the first CDO that Astra purchased?,q,MR. CROKE,start_answer
1557,4369,169,1,Mathur - Attorneys' Eyes Only,a,THE WITNESS,start_chat
1558,4370,169,2,Objection.,side_chat,MR. ITKIN,start_answer
1559,4371,169,3,Do you have the record date at hand as to when was the first master purchase?,a,THE WITNESS,start_question
1560,4374,169,6,"Sir, my question first, specifically, is just whether you recall, now sitting here, whether the Abacus 06-10 CDO was the first CDO that Astra purchased.",q,MR. CROKE,start_chat
1561,4378,169,10,"Objection. Just to be clear, would it help you to look at the dates?",side_chat,MR. ITKIN,start_answer
1562,4381,169,13,The thing is that I don't want to answer a question that won't be helpful.  I want to be helpful to answer that question. But I don't know the exact date when the first purchase was.,a,THE WITNESS,start_question
1563,4386,169,18,Okay.  That's fine.,q,MR. CROKE,start_answer
1564,4387,169,19,"So I'm just calculating -- the reason I'm trying to help out is if the answer is do I first recall right now, the answer is very easy no.",a,THE WITNESS,start_question
1565,4391,169,23,Okay.,q,MR. CROKE,start_answer
1566,4392,169,24,"But I'm trying to calculate it in my mind right now, trying to refresh my",a,THE WITNESS,start_answer
1567,4395,170,1,"Mathur - Attorneys' Eyes Only memory.  If you like me to do that, it would be helpful if I see the data that you may have available.",a,THE WITNESS,start_question
1568,4399,170,5,"Since the last time that Astra purchased or sold Abacus 2006-10 securities, has Astra submitted any bids to purchase additional Abacus 2006-10 securities?",q,MR. CROKE,start_answer
1569,4404,170,10,Since the last purchase?,a,THE WITNESS,start_question
1570,4405,170,11,Since the last purchase in 2016.,q,MR. CROKE,start_answer
1571,4406,170,12,"Yes, there may have been, yeah.",a,THE WITNESS,start_question
1572,4407,170,13,When is the first one you recall?,q,MR. CROKE,start_answer
1573,4408,170,14,After the last actual purchase?,a,THE WITNESS,start_question
1574,4409,170,15,After the last actual purchase.,q,MR. CROKE,start_answer
1575,4410,170,16,The first one that I recall?,a,THE WITNESS,start_question
1576,4411,170,17,The first instance you recall after the last actual purchase in which Astra submitted a bid to purchase additional Abacus 2006-10 securities.,q,MR. CROKE,start_answer
1577,4415,170,21,"There was a CDO auction recently. I don't know the exact date, but this quarter.",a,THE WITNESS,start_question
1578,4418,170,24,"Oh, so within the last few months?",q,MR. CROKE,start_answer
1579,4421,171,1,Mathur - Attorneys' Eyes Only,a,THE WITNESS,start_answer
1580,4422,171,2,Yeah.,a,THE WITNESS,start_question
1581,4423,171,3,Okay. And Astra submitted bids?,q,MR. CROKE,start_answer
1582,4425,171,5,"Yes, yes.",a,THE WITNESS,start_question
1583,4426,171,6,Did Astra win those bids?,q,MR. CROKE,start_answer
1584,4427,171,7,"I'll answer this question, but I'd prefer if you don't ask specific questions about Astra's trading strategies, but the answer is no, we did not win.",a,THE WITNESS,start_question
1585,4431,171,11,"Okay. Other than that auction that you recalled in the last quarter, are there other instances since 2016 in which you recall that Astra submitted bids to purchase Abacus 2006-10 securities?",q,MR. CROKE,start_answer
1586,4437,171,17,"I don't recall a specific instance, but there would have been -- there were more transactions -- what I recall is there were more transactions that happened.",a,THE WITNESS,start_question
1587,4442,171,22,"Sorry, when you say there were more transactions that happened, you mean offers to bid or sell that were not completed?",q,MR. CROKE,start_answer
1588,4447,172,1,Mathur - Attorneys' Eyes Only,a,THE WITNESS,start_answer
1589,4448,172,2,"Yes, yes, like a D&T, for instance.",a,THE WITNESS,start_question
1590,4450,172,4,"Okay. During your time at Astra, have you ever been involved in any trading of Abacus 2006-10 notes other than the Class A notes?",q,MR. CROKE,start_answer
1591,4455,172,9,So would I have been involved?,a,THE WITNESS,start_question
1592,4456,172,10,Uh-huh.,q,MR. CROKE,start_answer
1593,4457,172,11,"The answer is -- I'm struggling because what does that mean, trading instances in the sense, a completed sale or --",a,THE WITNESS,start_question
1594,4461,172,15,A completed purchase or sale of Abacus 2006-10 notes of any class other than the Class A notes.,q,MR. CROKE,start_answer
1595,4464,172,18,Was I personally involved?  No.,a,THE WITNESS,start_question
1596,4465,172,19,Do you know whether Astra has engaged in any trading of Abacus 2006-10 notes other than the Class A notes?,q,MR. CROKE,start_answer
1597,4468,172,22,No.,a,THE WITNESS,start_question
1598,4469,172,23,"And just so I'm clear, do you know that Astra has not engaged in any trading?",q,MR. CROKE,start_answer
1599,4473,173,1,Mathur - Attorneys' Eyes Only,a,THE WITNESS,start_answer
1600,4474,173,2,"Sorry, can you go back to the previous question?  I may not have answered it accurately.",a,THE WITNESS,start_question
1601,4477,173,5,"Sure. During your time at Astra, have you ever been involved in any trading of Abacus 2006-10 notes other than the Class A notes?",q,MR. CROKE,start_answer
1602,4482,173,10,No.  Sorry.  I just want to make sure.,a,THE WITNESS,start_question
1603,4484,173,12,I appreciate it.,q,MR. CROKE,start_answer
1604,4485,173,13,Okay.,a,THE WITNESS,start_question
1605,4486,173,14,And are you aware of any instances in which Astra has traded Abacus 2006-10 notes other than the Class A notes?,q,MR. CROKE,start_answer
1606,4489,173,17,No.,a,THE WITNESS,start_question
1607,4490,173,18,Okay.,q,MR. CROKE,start_answer
1608,4491,173,19,"Sorry, just want to make sure --",a,THE WITNESS,start_question
1609,4492,173,20,"No, I appreciate that.",q,MR. CROKE,start_answer
1610,4493,173,21,I thought you were asking about DB.,a,THE WITNESS,start_question
1611,4495,173,23,"No, no.  We'll get to that. What is the original face value of the Abacus 2006-10 securities that Astra",q,MR. CROKE,start_answer
1612,4499,174,1,Mathur - Attorneys' Eyes Only currently owns?,a,THE WITNESS,start_answer
1613,4501,174,3,"When you say Astra currently owns, do you mean manage?",a,THE WITNESS,start_question
1614,4503,174,5,Yeah.  The original face value of the Abacus 2006-10 securities in the funds that Astra manages and is pursuing this action on behalf of.,q,MR. CROKE,start_answer
1615,4507,174,9,"You're characterizing it pursuing this action, but excluding that for a moment, but you're asking me --",a,THE WITNESS,start_question
1616,4510,174,12,I'm just trying to understand what is the original face value of the Abacus 2006-10 securities held in the funds that Astra manages.,q,MR. CROKE,start_answer
1617,4514,174,16,I don't know the split between funds and managed account actually.,a,THE WITNESS,start_question
1618,4516,174,18,"I'm not trying to draw a distinction between the two of them.  My question is just what is the original face value of the Abacus 2006-10 securities that are either held in funds that Astra manages, or in managed accounts that Astra manages, what is the total original face value of those securities?",q,MR. CROKE,start_answer
1619,4525,175,1,Mathur - Attorneys' Eyes Only,a,THE WITNESS,start_answer
1620,4526,175,2,"Okay, yes.  That is 47 and a half million to my recollection.",a,THE WITNESS,start_question
1621,4528,175,4,Okay.  Thank you. And is the current outstanding face value of those securities some number less than that?,q,MR. CROKE,start_answer
1622,4532,175,8,"Well, that depends.  It is my belief that it isn't, but there has been some collections on them.",a,THE WITNESS,start_question
1623,4535,175,11,What do you mean by that?,q,MR. CROKE,start_answer
1624,4536,175,12,The pool factor is less than 1.,a,THE WITNESS,start_question
1625,4537,175,13,"And if the factor is less than 1, that means that the current outstanding face value is less than the original face value, correct?",q,MR. CROKE,start_chat
1626,4541,175,17,Objection.,side_chat,MR. ITKIN,start_answer
1627,4542,175,18,"Not -- generally speaking, that would be the case.  In this instance, it shouldn't be the case.",a,THE WITNESS,start_question
1628,4545,175,21,And why shouldn't it be the case?,q,MR. CROKE,start_answer
1629,4546,175,22,Because the factor should be 1.,a,THE WITNESS,start_question
1630,4547,175,23,And why should the factor be 1?,q,MR. CROKE,start_answer
1631,4548,175,24,Because the outstanding notional should be the same as the real face,a,THE WITNESS,start_answer
1632,4551,176,1,Mathur - Attorneys' Eyes Only notional on this.,a,THE WITNESS,start_question
1633,4553,176,3,And why should the outstanding notional be the same as the original face value?,q,MR. CROKE,start_answer
1634,4556,176,6,Because there should be no write-downs of this one.,a,THE WITNESS,start_question
1635,4558,176,8,And why should there be no write-downs?,q,MR. CROKE,start_answer
1636,4560,176,10,"We can go into a very long discussion about this one, but I think you -- or the answer to the proceedings are perhaps a testament of why there shouldn't be one.",a,THE WITNESS,start_question
1637,4565,176,15,"But setting aside for the moment your views as to what should or shouldn't be the case, is it correct that the current outstanding face value of the Abacus 06-10 notes that Astra holds or manages is something less than $47.5 million?",q,MR. CROKE,start_chat
1638,4571,176,21,Objection.,side_chat,MR. ITKIN,start_answer
1639,4572,176,22,I would limit my answer to the fact that the trustee report states that the current notional of the notes is less than 47 and a half million.,a,THE WITNESS,start_answer
1640,4577,177,1,Mathur - Attorneys' Eyes Only,a,THE WITNESS,start_question
1641,4578,177,2,"Okay. And the way that the trustee report reflects that is that the trustee report includes a factor for the notes, is that correct?",q,MR. CROKE,start_answer
1642,4583,177,7,It does.,a,THE WITNESS,start_question
1643,4584,177,8,"Okay. And again, setting aside for the moment the question of what any beliefs as to what should or should not be the case here, the way in which you would calculate the outstanding face value of the notes would be to multiply the original face value by the current factor, is that correct?",q,MR. CROKE,start_chat
1644,4593,177,17,Objection.,side_chat,MR. ITKIN,start_answer
1645,4594,177,18,Talking in case of Abacus?,a,THE WITNESS,start_question
1646,4595,177,19,Yes.,q,MR. CROKE,start_answer
1647,4596,177,20,Yes.,a,THE WITNESS,start_question
1648,4597,177,21,Okay. And do you know what the current factor for the Class A notes is for the Abacus 06-10 CD?,q,MR. CROKE,start_answer
1649,4601,177,25,06-10 CDO?,a,THE WITNESS,start_answer
1650,4603,178,1,Mathur - Attorneys' Eyes Only,a,THE WITNESS,start_question
1651,4604,178,2,The Abacus 2006-10 CDO.  Do you know what the current factor is for the Class A notes?,q,MR. CROKE,start_answer
1652,4607,178,5,"Oh, Class A notes.  Yes, I do know what the current factor is.",a,THE WITNESS,start_question
1653,4609,178,7,And what is it?,q,MR. CROKE,start_answer
1654,4610,178,8,It's about .69.,a,THE WITNESS,start_question
1655,4611,178,9,"So if you multiply .69 times the 47.5 million original face value of notes that Astra owns or manages, that yields roughly $33 million outstanding face value, correct?",q,MR. CROKE,start_answer
1656,4616,178,14,"On the basis of the previous conversation in that context, yes.",a,THE WITNESS,start_question
1657,4618,178,16,Were the Abacus 2006-10 collateral securities a factor in any of Astra's decisions to purchase Abacus 2006-10 securities?,q,MR. CROKE,start_chat
1658,4622,178,20,Objection.,side_chat,MR. ITKIN,start_answer
1659,4623,178,21,The factor of Abacus 06-10?,a,THE WITNESS,start_question
1660,4624,178,22,I'm not using the term factor to refer to the factor of the notes. I'm saying in considering whether or not to purchase the Abacus 2006-10,q,MR. CROKE,start_answer
1661,4629,179,1,"Mathur - Attorneys' Eyes Only securities, were the Abacus 2006-10 collateral securities a factor that was considered?",a,THE WITNESS,start_chat
1662,4633,179,5,Objection.,side_chat,MR. ITKIN,start_answer
1663,4634,179,6,Considered when?,a,THE WITNESS,start_question
1664,4635,179,7,In the decision to purchase Abacus 2006-10 securities.,q,MR. CROKE,start_answer
1665,4637,179,9,When?,a,THE WITNESS,start_question
1666,4638,179,10,At any point.,q,MR. CROKE,start_answer
1667,4639,179,11,"Look, like any purchase of any security, there are a multitude of factors that are considered, with collateral security becoming part of those factors, I would have thought so.  But do I have a specific recollection about that?  No.",a,THE WITNESS,start_question
1668,4645,179,17,So you don't have a specific recollection as to whether the Abacus 2006-10 collateral securities were a factor considered in any of Astra's decisions to Abacus 2006-10 securities?,q,MR. CROKE,start_chat
1669,4650,179,22,Objection.,side_chat,MR. ITKIN,start_answer
1670,4651,179,23,"When you say -- I'm trying to understand the question here.  When I make a decision about purchasing securities,",a,THE WITNESS,start_answer
1671,4655,180,1,Mathur - Attorneys' Eyes Only does collateral security form a part of the decision-making process?  Is that your question?,a,THE WITNESS,start_question
1672,4659,180,5,No. My question is whether you have a specific recollection as to whether the Abacus 2006-10 collateral securities were a factor in any of Astra's decisions to purchase Abacus 2006-10 securities?,q,MR. CROKE,start_chat
1673,4665,180,11,Objection.,side_chat,MR. ITKIN,start_answer
1674,4666,180,12,"Of course, as I answered before, when I'm buying these securities, collateral securities become part of a decision-making factor.",a,THE WITNESS,start_question
1675,4670,180,16,I'm not speaking generally.  I'm asking do you have a specific recollection that the Abacus 2006-10 --,q,MR. CROKE,start_answer
1676,4673,180,19,"No, no specific recollection, no.",a,THE WITNESS,start_question
1677,4674,180,20,So no specific recollection --,q,MR. CROKE,start_answer
1678,4675,180,21,No.,a,THE WITNESS,start_question
1679,4676,180,22,-- as to whether the Abacus 2006-10 collateral securities were a factor in any of Astra's decisions to purchase Abacus 2006-10 securities?,q,MR. CROKE,start_answer
1680,4681,181,1,Mathur - Attorneys' Eyes Only,a,THE WITNESS,start_chat
1681,4682,181,2,Objection.,side_chat,MR. ITKIN,start_answer
1682,4683,181,3,That is correct.,a,THE WITNESS,start_question
1683,4684,181,4,"After Astra's initial purchase of the Abacus 2006-10 securities, were you involved in monitoring the risk associated with that investment?",q,MR. CROKE,start_answer
1684,4688,181,8,"Involved with, again, is a broad term.  Yes, I'm involved in pretty much a lot of things that happen in Astra.  So involved, yes.",a,THE WITNESS,start_question
1685,4692,181,12,And do you recall anything in particular that you did in connection with managing that risk?,q,MR. CROKE,start_chat
1686,4695,181,15,Objection.,side_chat,MR. ITKIN,start_answer
1687,4696,181,16,"I don't know how to answer that question.  When you say what do I recall specifically.  There is no specific recollection about how to manage a portfolio.  A portfolio is being managed by a multitude of factors and -- but the reason I hesitate to answer this question is because you can't be seriously asking me that right now in this conversation, can you?  If you be more specific about these",a,THE WITNESS,start_answer
1688,4707,182,1,"Mathur - Attorneys' Eyes Only questions, I'll be very happy to give you very accurate answers.",a,THE WITNESS,start_question
1689,4710,182,4,Sure.,q,MR. CROKE,start_answer
1690,4711,182,5,But it's such broad questions.,a,THE WITNESS,start_question
1691,4712,182,6,"Sir, I don't think it's intended to be a broad question. I asked whether you were involved in monitoring the risk associated with the Abacus 2006-10 securities at Astra, and you said you were involved.  And I asked whether you recalled anything in particular that you did in connection with managing that risk.",q,MR. CROKE,start_chat
1692,4721,182,15,Objection.,side_chat,MR. ITKIN,start_answer
1693,4722,182,16,"When you say particularly you did, do you mean did I take some actions specific to Abacus 06-10 securities?",a,THE WITNESS,start_question
1694,4725,182,19,You said that you were involved in monitoring the risk associated with the Abacus 2006-10 investments during your time at Astra.,q,MR. CROKE,start_answer
1695,4729,182,23,Uh-huh.,a,THE WITNESS,start_question
1696,4730,182,24,What do you recall about managing the risk associated with the Abacus 2006-10,q,MR. CROKE,start_answer
1697,4733,183,1,Mathur - Attorneys' Eyes Only investments during your time at Astra?,a,THE WITNESS,start_chat
1698,4735,183,3,"Objection.  Maybe I can help out.  You keep switching the terms ""monitoring"" and ""managing"" and maybe that is adding to the confusion. If you want to clarify that question, maybe that could help.  But I want the record to be clear that you are switching those terms.",side_chat,MR. ITKIN,start_answer
1699,4743,183,11,"But I don't even understand either of the terms.  What is -- see, monitoring is a very specific task, which simply means I look at it, but I don't do anything.  Managing is a different task, I look at it and do something, for instance.",a,THE WITNESS,start_question
1700,4749,183,17,Uh-huh.,q,MR. CROKE,start_answer
1701,4750,183,18,"Okay.  My job as a portfolio manager or a CIO, whichever you look at it, is to manage a whole portfolio.  Unless you're asking me something specific about did I do something specific about Abacus in monitoring that -- that is not my role in the firm.  My role in the firm is to manage the borrowed risk of the fund, not about",a,THE WITNESS,start_answer
1702,4759,184,1,"Mathur - Attorneys' Eyes Only monitoring specific assets. The reason I'm struggling to answer that question is do I specifically monitor or manage a certain asset, the answer is no.",a,THE WITNESS,start_question
1703,4765,184,7,Okay.,q,MR. CROKE,start_answer
1704,4766,184,8,Okay.,a,THE WITNESS,start_question
1705,4767,184,9,So you don't recall having any specific involvement in managing or monitoring the risk associated with Abacus 2006-10?,q,MR. CROKE,start_chat
1706,4771,184,13,Objection.,side_chat,MR. ITKIN,start_answer
1707,4772,184,14,"I just gave you the answer.  I'm not going to change that answer.  You've got the answer, right?",a,THE WITNESS,start_question
1708,4775,184,17,I'm not asking you to change your answer.  I'm just trying to make sure it's clear. Do you recall having any specific -- strike that. Do you have a specific recollection of anything that you did in connection with managing or monitoring the risk associated with the Abacus 2006-10,q,MR. CROKE,start_answer
1709,4785,185,1,Mathur - Attorneys' Eyes Only securities during your time at Astra?,a,THE WITNESS,start_chat
1710,4787,185,3,Objection.  Asked and answered.,side_chat,MR. ITKIN,start_answer
1711,4789,185,5,"Anything specific that I did in monitoring or managing Astra, I'm still not clear what you're trying to ask me.",a,THE WITNESS,start_question
1712,4792,185,8,"I understand your point that you were involved in managing the risk associated with a large portfolio. My question to you is very specific, it's do you recall anything specific that you did in connection with monitoring or managing the risk associated with the Abacus 2006-10 securities.",q,MR. CROKE,start_chat
1713,4800,185,16,Objection.,side_chat,MR. ITKIN,start_answer
1714,4801,185,17,"I didn't do anything -- when you use the word ""specific,"" I understand something particular that I wouldn't do otherwise for anything else.  Is that what you mean by ""specific""?",a,THE WITNESS,start_question
1715,4806,185,22,I'm asking you whether you have any specific recollection of doing anything specific with respect to monitoring or managing the risk associated with the,q,MR. CROKE,start_answer
1716,4811,186,1,Mathur - Attorneys' Eyes Only Abacus 2006-10 securities?,a,THE WITNESS,start_chat
1717,4813,186,3,Objection.,side_chat,MR. ITKIN,start_answer
1718,4814,186,4,"You're putting two specific words in your sentence, specific recollection on a specific thing that I do.",a,THE WITNESS,start_question
1719,4817,186,7,Uh-huh.,q,MR. CROKE,start_answer
1720,4818,186,8,Right?,a,THE WITNESS,start_question
1721,4819,186,9,Uh-huh.,q,MR. CROKE,start_answer
1722,4820,186,10,What do you mean by the two specifics?  That's what I'm struggling to understand here.  Did I do anything particular that I wouldn't do for something else that I did for Abacus?  Is that your question?,a,THE WITNESS,start_question
1723,4826,186,16,"My question is whether you recall doing anything specific with respect to Abacus?  If your answer is that you had a process that you followed with respect to the portfolio and that there was nothing different with respect to Abacus than something else, then that's fine.  I'm just trying to understand whether that's the case.",q,MR. CROKE,start_chat
1724,4835,186,25,Objection.,side_chat,MR. ITKIN,start_answer
1725,4837,187,1,Mathur - Attorneys' Eyes Only,a,THE WITNESS,start_answer
1726,4838,187,2,"So you want to use one specific thing right now, do I have a specific recollection?  That's the only specific you used in the second question?",a,THE WITNESS,start_question
1727,4842,187,6,Do you have a process that you followed at Astra with respect to the portfolio as a whole?,q,MR. CROKE,start_chat
1728,4845,187,9,Objection.,side_chat,MR. ITKIN,start_chat
1729,4846,187,10,"Sorry, let me rephrase.",side_chat,MR. CROKE,start_question
1730,4849,187,13,Do you have a process at Astra with respect to managing the risk of the portfolio of the securities that Astra manages?,q,MR. CROKE,start_answer
1731,4853,187,17,"Generally, there is a process, yeah.",a,THE WITNESS,start_question
1732,4855,187,19,Is there anything that you did at Astra with respect to managing the risk associated with the Abacus 2006-10 CDO that was different from what you did with respect to managing the risk associated with other securities in that portfolio?,q,MR. CROKE,start_answer
1733,4861,187,25,That's a much better question.,a,THE WITNESS,start_answer
1734,4863,188,1,"Mathur - Attorneys' Eyes Only It depends on what time you're looking at and it depends on different assets.  For example, if I want an RMBS asset, I'll look to manage the risk of an RMBS asset differently to managing a AB CDO asset.  So there are differences in the two aspects.",a,THE WITNESS,start_question
1735,4870,188,8,"I understand that different securities have different asset classes, can be managed differently. My question is do you recall anything specific about the Abacus 2006-10 CDO that you did that was different from what you did in managing the risk associated with the other securities?",q,MR. CROKE,start_answer
1736,4878,188,16,"For example, if you're asking me have you done any of the proceedings such as this, this is something different that we're doing for Abacus, is sitting here and having a deposition, for instance.  This is something different that I've had to do for Abacus CDO that I wouldn't have had to do or had to have to do for something else. Does that qualify?",a,THE WITNESS,start_question
1737,4887,188,25,Other than this proceeding and,q,MR. CROKE,start_answer
1738,4889,189,1,"Mathur - Attorneys' Eyes Only the, you know, correspondence between attorneys leading up to it, in the course of your day-to-day role as a trader and as a manager of a portfolio of risk, was there anything that you did with respect to the Abacus 2006-10 CDO that was different from what you did with respect to the other assets that you managed?",a,THE WITNESS,start_chat
1739,4898,189,10,Objection.,side_chat,MR. ITKIN,start_answer
1740,4899,189,11,"My role is much broader in the firm than a role of an analyst or a trader. I hope you understand that.  And my role doesn't become specific in a specific instance related to an asset. If somebody comes and asks me a specific question about Abacus 06-10 Class A notes, that would be a specific task or a specific decision that I would have had to make on that matter and that will be very specific to Abacus 06-10. Will there be specific instances about every other asset that could relate to this?  The answer is yes.  If you ask me another, say, European ABS that we own",a,THE WITNESS,start_answer
