,indice,page_number,line_number,text,text_type,speaker,time_added
2177,6059,234,1,Mathur - Attorneys' Eyes Only suspect that there might have been collateral securities in the Abacus 2006-10 CDO that did not comply with the eligibility criteria?,a,THE WITNESS,start_answer
2178,6064,234,6,"Personally, I think it will be 2015, in my opinion.",a,THE WITNESS,start_question
2179,6066,234,8,2015?,q,MR. CROKE,start_answer
2180,6067,234,9,I would have thought so.,a,THE WITNESS,start_question
2181,6068,234,10,Do you recall ever having any discussions with anyone else at Astra prior to 2015 about whether the collateral securities in Abacus 2006-10 did not comply with the eligibility criteria?,q,MR. CROKE,start_answer
2182,6073,234,15,"I don't specifically recall -- oh, but I don't think so.",a,THE WITNESS,start_question
2183,6075,234,17,"So just so the record is clear, you don't recall ever having any discussions with anyone else at Astra prior to 2015 about whether the collateral securities in Abacus 2006-10 did not comply with the eligibility criteria?",q,MR. CROKE,start_chat
2184,6081,234,23,Objection.  Asked and answered.,side_chat,MR. ITKIN,start_answer
2185,6083,234,25,"I do not recall it, no.",a,THE WITNESS,start_answer
2186,6085,235,1,Mathur - Attorneys' Eyes Only,a,THE WITNESS,start_question
2187,6086,235,2,Okay. How did you first come to believe that there were collateral securities in Abacus 2006-10 that did not comply with the eligibility criteria?,q,MR. CROKE,start_answer
2188,6091,235,7,It was a gradual process when we started looking at it.  I think somebody brought it to my attention that something is going on here.,a,THE WITNESS,start_question
2189,6095,235,11,And who was it that brought it to your attention?,q,MR. CROKE,start_answer
2190,6097,235,13,"I don't specifically recall, but I can guess probably would have been Mark.",a,THE WITNESS,start_question
2191,6099,235,15,And that's Mark Thomas?,q,MR. CROKE,start_answer
2192,6100,235,16,Yes.,a,THE WITNESS,start_question
2193,6101,235,17,Okay. And how did Mark Thomas come to learn that?,q,MR. CROKE,start_chat
2194,6104,235,20,Objection.,side_chat,MR. ITKIN,start_answer
2195,6105,235,21,I guess --,a,THE WITNESS,start_chat
2196,6106,235,22,Are you asking him --,side_chat,MR. ITKIN,start_answer
2197,6107,235,23,You're asking me to estimate?,a,THE WITNESS,start_question
2198,6108,235,24,I'm asking do you have an understanding as to how it is that Mark,q,MR. CROKE,start_answer
2199,6111,236,1,Mathur - Attorneys' Eyes Only Thomas came to the view that there might have been collateral securities in Abacus 2006-10 that did not comply with the eligibility criteria?,a,THE WITNESS,start_answer
2200,6116,236,6,There wasn't a -- I do not remember.  It was a lengthy period of time around which this whole thing happened.,a,THE WITNESS,start_question
2201,6119,236,9,Uh-huh.,q,MR. CROKE,start_answer
2202,6120,236,10,"There wasn't an event that, say, oh, look what I found.  There was never a eureka moment, if that's what you're asking.",a,THE WITNESS,start_question
2203,6124,236,14,Had you asked Mr. Thomas to look into issues like this?,q,MR. CROKE,start_answer
2204,6126,236,16,Issues like what?,a,THE WITNESS,start_question
2205,6127,236,17,Had you asked Mr. Thomas to investigate whether there might be collateral securities that did not comply with eligibility criteria in the Abacus 2006-10 CDO?,q,MR. CROKE,start_answer
2206,6132,236,22,"Do I recall?  No.  Mr. Thomas' task is to generally look at securities and make sure that all securities have -- follow the docs, securities that follow the",a,THE WITNESS,start_answer
2207,6137,237,1,"Mathur - Attorneys' Eyes Only criteria that they're meant to follow. Such a product, just a matter of adhering to a set of legal contracts and want to make sure that the Bloomberg is supporting the right thing. There are many instances where the -- I would have asked Mark to make sure that the index report is reflected accurately, Bloomberg is reflected accurately.  So, generally speaking, the instruction for the analysts or the trader is to make sure that everything is complied with.",a,THE WITNESS,start_question
2208,6151,237,15,And was it you who gave that instruction to Mr. Thomas?,q,MR. CROKE,start_answer
2209,6153,237,17,"I don't recall specifically, but it is not a specific instruction about a specific security that I would have given to anyone, is what my guess would be.",a,THE WITNESS,start_question
2210,6157,237,21,Uh-huh.,q,MR. CROKE,start_answer
2211,6158,237,22,"Would I have spoken about it? Yeah, probably.",a,THE WITNESS,start_question
2212,6160,237,24,Who was the first person outside of Astra that you contacted regarding your,q,MR. CROKE,start_answer
2213,6163,238,1,Mathur - Attorneys' Eyes Only belief that there were collateral securities in Abacus 2006-10 that did not comply with the eligibility criteria?,a,THE WITNESS,start_chat
2214,6167,238,5,Objection.,side_chat,MR. ITKIN,start_answer
2215,6168,238,6,I don't remember.,a,THE WITNESS,start_question
2216,6169,238,7,Have you ever had any conversations with Rajesh Pai as to whether the Abacus 2006-10 securities complied with the eligibility criteria?,q,MR. CROKE,start_answer
2217,6173,238,11,"You know, I was thinking about it.  I was thinking about it, you might ask that question.  I can't recall, at least at that time when he was working at Astra, did I ever speak to him again about his memory later on.  I tried to think about it pretty hard.  I don't remember if I did.",a,THE WITNESS,start_question
2218,6180,238,18,Uh-huh.,q,MR. CROKE,start_answer
2219,6181,238,19,Later on.,a,THE WITNESS,start_question
2220,6182,238,20,Uh-huh.,q,MR. CROKE,start_answer
2221,6183,238,21,But I was thinking that you might ask that question.  So I tried -- but no.,a,THE WITNESS,start_question
2222,6185,238,23,And you referenced a memo.  What memo are you talking about there?,q,MR. CROKE,start_answer
2223,6187,238,25,"The memo that Rajesh wrote, and",a,THE WITNESS,start_answer
2224,6189,239,1,Mathur - Attorneys' Eyes Only we discussed that memo sometime in '15.,a,THE WITNESS,start_question
2225,6191,239,3,Okay. And do you know why he wrote that memo?,q,MR. CROKE,start_answer
2226,6194,239,6,No.,a,THE WITNESS,start_question
2227,6195,239,7,Do you know when he wrote that memo?,q,MR. CROKE,start_answer
2228,6197,239,9,I know now.,a,THE WITNESS,start_question
2229,6198,239,10,And when did he write that memo?,q,MR. CROKE,start_answer
2230,6199,239,11,I think it was '14.,a,THE WITNESS,start_question
2231,6200,239,12,But you didn't discuss it with him until 2015?,q,MR. CROKE,start_answer
2232,6202,239,14,"I don't remember discussing it at all, actually.",a,THE WITNESS,start_question
2233,6204,239,16,Okay.,q,MR. CROKE,start_answer
2234,6205,239,17,But what I'm saying is that I can't even recall whether I did discuss with him or not.,a,THE WITNESS,start_question
2235,6208,239,20,"I think a few moments ago, when I asked you what memo are you talking about here, you said the memo that Rajesh wrote and we discussed that memo sometime in '15.",q,MR. CROKE,start_answer
2236,6212,239,24,"We, as in not me and Rajesh.  We, as in me and Astra people.",a,THE WITNESS,start_answer
2237,6215,240,1,Mathur - Attorneys' Eyes Only,a,THE WITNESS,start_question
2238,6216,240,2,Do you know whether Rajesh discussed that memo with anyone else at Astra in 2014?,q,MR. CROKE,start_answer
2239,6219,240,5,"Yeah, he may have.",a,THE WITNESS,start_question
2240,6220,240,6,Do you know whether he did?,q,MR. CROKE,start_answer
2241,6221,240,7,I do not know.,a,THE WITNESS,start_question
2242,6222,240,8,Have you had any discussions with Rajesh regarding that memo?,q,MR. CROKE,start_answer
2243,6224,240,10,"As I said before, I tried to think about it, expecting that you might ask that question, but I couldn't recall, actually.",a,THE WITNESS,start_question
2244,6228,240,14,Okay. Do you know why he wrote that memo?,q,MR. CROKE,start_chat
2245,6231,240,17,Objection.,side_chat,MR. ITKIN,start_answer
2246,6232,240,18,I can guess.,a,THE WITNESS,start_question
2247,6233,240,19,And why is that?,q,MR. CROKE,start_answer
2248,6234,240,20,Why is what?,a,THE WITNESS,start_question
2249,6235,240,21,What is your belief as to why he wrote that memo?,q,MR. CROKE,start_answer
2250,6237,240,23,"So you're asking me to guess, right?",a,THE WITNESS,start_question
2251,6239,240,25,If that's what you have as an,q,MR. CROKE,start_answer
2252,6241,241,1,Mathur - Attorneys' Eyes Only understanding as to why he may have written it.,a,THE WITNESS,start_chat
2253,6244,241,4,Objection.,side_chat,MR. ITKIN,start_answer
2254,6245,241,5,I didn't quite understand the last phrase you used.,a,THE WITNESS,start_question
2255,6247,241,7,Do you have any understanding as to why he did write the memo?,q,MR. CROKE,start_answer
2256,6249,241,9,"Yeah, I do have understanding why he may have wrote it.  But do I recall it? No.",a,THE WITNESS,start_question
2257,6252,241,12,What is your --,q,MR. CROKE,start_answer
2258,6253,241,13,I can guess it.  He's working on a project which I believe now are more collateral securities.,a,THE WITNESS,start_question
2259,6256,241,16,Okay. Did you ask him to work on that project?,q,MR. CROKE,start_answer
2260,6259,241,19,I don't specifically recall that.,a,THE WITNESS,start_question
2261,6260,241,20,"Okay. Over the course of your career, not limited to your time at Astra or Deutsche Bank, have you identified any other synthetic CDOs in which you believe that certain collateral securities did not",q,MR. CROKE,start_answer
2262,6267,242,1,Mathur - Attorneys' Eyes Only comply with the eligibility criteria other than the Abacus 2006-10 CDO?,a,THE WITNESS,start_answer
2263,6270,242,4,"Nothing specific comes to my mind at the moment.  People usually comply, uh-huh.",a,THE WITNESS,start_chat
2264,6273,242,7,I'm going to show you an exhibit here.  This will be Mathur Exhibit 2.,side_chat,MR. CROKE,is brackets
2265,6276,242,10,"(Mathur Exhibit 2, Trading data, Bates stamped ASTRA-00035203, marked for identification, as of this date.)",brackets,,start_question
2266,6280,242,14,Do you recognize this document?,q,MR. CROKE,start_answer
2267,6281,242,15,As in have I seen this document before?  No.  Do I recognize it?  Yes.,a,THE WITNESS,start_question
2268,6283,242,17,And what is it?,q,MR. CROKE,start_answer
2269,6284,242,18,It's -- looks like a trading history.,a,THE WITNESS,start_question
2270,6286,242,20,So I'll represent to you this is a printout of a tab from a spreadsheet that Astra produced in this matter with the production number ASTRA-00035203.,q,MR. CROKE,start_answer
2271,6290,242,24,Uh-huh.,a,THE WITNESS,start_question
2272,6291,242,25,"And the tab was labeled ""Trading",q,MR. CROKE,start_answer
2273,6293,243,1,"Mathur - Attorneys' Eyes Only Data.""",a,THE WITNESS,start_answer
2274,6295,243,3,Okay.,a,THE WITNESS,start_question
2275,6296,243,4,Does this document reflect Astra's trading of Abacus 2006-10 securities?,q,MR. CROKE,start_answer
2276,6299,243,7,It probably does.,a,THE WITNESS,start_question
2277,6300,243,8,"Okay. And each row in this chart represents a different trade, right?",q,MR. CROKE,start_answer
2278,6303,243,11,I assume so.,a,THE WITNESS,start_question
2279,6304,243,12,"Okay. Do you see the column labeled ""ORIG size""?",q,MR. CROKE,start_answer
2280,6307,243,15,Yep.,a,THE WITNESS,start_question
2281,6308,243,16,Does that column represent the original face value of the securities that are being bought or sold in each trade?,q,MR. CROKE,start_answer
2282,6311,243,19,Uh-huh.,a,THE WITNESS,start_question
2283,6312,243,20,"Okay. Do you see the column labeled ""Price""?",q,MR. CROKE,start_answer
2284,6315,243,23,Yeah.,a,THE WITNESS,start_question
2285,6316,243,24,Does that column represent the price for the securities being bought or,q,MR. CROKE,start_answer
2286,6319,244,1,Mathur - Attorneys' Eyes Only sold in each trade?,a,THE WITNESS,start_answer
2287,6321,244,3,"If that's what it does, yeah.",a,THE WITNESS,start_question
2288,6322,244,4,And is that price measured as a percentage of the original face value of the securities being bought or sold in each trade?,q,MR. CROKE,start_answer
2289,6326,244,8,"That would be my guess, yeah.",a,THE WITNESS,start_question
2290,6327,244,9,"And the first purchase listed here is a purchase on March 13, 2013.",q,MR. CROKE,start_answer
2291,6329,244,11,Uh-huh.,a,THE WITNESS,start_question
2292,6330,244,12,Correct?,q,MR. CROKE,start_answer
2293,6331,244,13,Yeah.,a,THE WITNESS,start_question
2294,6332,244,14,"Is this the purchase that you were discussing earlier that you recall being involved at when you were at Astra -- sorry, at Octave?",q,MR. CROKE,start_answer
2295,6336,244,18,"Yes, yeah.",a,THE WITNESS,start_question
2296,6337,244,19,And do you see the original size for that first purchase is listed as $30 million?,q,MR. CROKE,start_answer
2297,6340,244,22,Correct.,a,THE WITNESS,start_question
2298,6341,244,23,And the price is listed as 22?,q,MR. CROKE,start_answer
2299,6342,244,24,Uh-huh.,a,THE WITNESS,start_question
2300,6343,244,25,So just to make sure I'm on the,q,MR. CROKE,start_answer
2301,6345,245,1,"Mathur - Attorneys' Eyes Only same page with you here, so to get the amount that was paid to get these securities, you multiplied 30 million times 22 percent, correct?",a,THE WITNESS,start_answer
2302,6350,245,6,Approximately.,a,THE WITNESS,start_question
2303,6351,245,7,"Okay. And so that equals $6.6 million, roughly?",q,MR. CROKE,start_answer
2304,6354,245,10,Roughly.,a,THE WITNESS,start_question
2305,6355,245,11,"Do you see that the next row in this chart indicates that on November 5, 2014, there is a sale of 17.5 million original face value of the Abacus 2006-10 notes at a price of 52.5. Do you see that?",q,MR. CROKE,start_answer
2306,6361,245,17,Uh-huh.,a,THE WITNESS,start_question
2307,6362,245,18,Were these the sales that we were discussing earlier that you recall being involved in during your time at Astra?,q,MR. CROKE,start_answer
2308,6365,245,21,Yes.,a,THE WITNESS,start_question
2309,6366,245,22,"And looking at this now, do you have any recollection as to why Astra decided to sell those securities?",q,MR. CROKE,start_answer
2310,6369,245,25,The first thing I want to notify,a,THE WITNESS,start_answer
2311,6371,246,1,Mathur - Attorneys' Eyes Only is that it looks like my recollection was wrong with respect to the 2016 sale and purchase.  I assume it was in May.  Looks like it's in September.  So I apologize for that.,a,THE WITNESS,start_question
2312,6377,246,7,Not a problem.,q,MR. CROKE,start_answer
2313,6378,246,8,"I just didn't refresh by looking at it.  That was my recollection at the time. The second question is -- also, could you repeat the first question?  I was too involved with that thing.",a,THE WITNESS,start_question
2314,6384,246,14,"Sure. So looking at this now, seeing the sale on November 5, 2014, do you have any recollection as to why Astra decided to sell those securities?",q,MR. CROKE,start_chat
2315,6389,246,19,Objection.,side_chat,MR. ITKIN,start_answer
2316,6390,246,20,"It's not a specific recollection, but I can guess.",a,THE WITNESS,start_question
2317,6392,246,22,And what is that guess?,q,MR. CROKE,start_answer
2318,6393,246,23,"Looks -- at that time, looked like a very good price.",a,THE WITNESS,start_question
2319,6395,246,25,Do you have any recollection as,q,MR. CROKE,start_answer
2320,6397,247,1,Mathur - Attorneys' Eyes Only to the process that you went through in deciding to sell those securities?,a,THE WITNESS,start_chat
2321,6400,247,4,Objection.,side_chat,MR. ITKIN,start_answer
2322,6401,247,5,No.,a,THE WITNESS,start_question
2323,6402,247,6,And do you have any recollection as to whether Astra sold these securities through an auction or bilateral sale?,q,MR. CROKE,start_answer
2324,6405,247,9,"That I now know, as I said through this process, my memory is refreshed, yeah.",a,THE WITNESS,start_question
2325,6408,247,12,Do you know why Astra sold only 17.5 million of the Abacus 2006-10 securities?,q,MR. CROKE,start_answer
2326,6411,247,15,Do I know why?,a,THE WITNESS,start_question
2327,6412,247,16,Yes.,q,MR. CROKE,start_answer
2328,6413,247,17,"That's what had been the trading decision at that time as to how much to sell, yeah.",a,THE WITNESS,start_question
2329,6416,247,20,Do you recall any consideration of whether to sell the entire $30 million that Astra held at that point?,q,MR. CROKE,start_answer
2330,6419,247,23,"It probably would have been considered, given the price.",a,THE WITNESS,start_question
2331,6421,247,25,But you don't have a specific,q,MR. CROKE,start_answer
2332,6423,248,1,Mathur - Attorneys' Eyes Only recollection as to why it was or wasn't?,a,THE WITNESS,start_answer
2333,6425,248,3,No.,a,THE WITNESS,start_question
2334,6426,248,4,And does looking at this now refresh your recollection as to whether Goldman Sachs was the party on the other side of the broker that Astra sold these securities to?,q,MR. CROKE,start_chat
2335,6431,248,9,Objection.  Asked and answered.,side_chat,MR. ITKIN,start_answer
2336,6433,248,11,"No, it doesn't give me a recollection --",a,THE WITNESS,start_chat
2337,6435,248,13,"Sorry to interrupt, but I have to do that.",side_chat,MR. ITKIN,start_chat
2338,6437,248,15,You have to do that.  I'm trying to be helpful to the young man here.,side_chat,THE WITNESS,start_chat
2339,6440,248,18,There is no need to be.  Just answer his questions.,side_chat,MR. ITKIN,start_chat
2340,6442,248,20,Okay.,side_chat,THE WITNESS,start_answer
2341,6443,248,21,"No, I don't have any specific recollection, no.",a,THE WITNESS,start_question
2342,6445,248,23,Do you have any recollection as to why Astra decided to sell those securities through a broker as opposed to,q,MR. CROKE,start_answer
2343,6449,249,1,Mathur - Attorneys' Eyes Only through some other method of selling the security?,a,THE WITNESS,start_answer
2344,6452,249,4,"No recollection.  Again, this is a long time.  But I can guess.",a,THE WITNESS,start_question
2345,6454,249,6,Okay.  What's that guess?,q,MR. CROKE,start_answer
2346,6455,249,7,"Typically for CDOs, usually working out is always a good idea.",a,THE WITNESS,start_question
2347,6457,249,9,"When you say ""working out""?",q,MR. CROKE,start_answer
2348,6458,249,10,Through a dealer or broker who looks at the asset and works it out with multiple parts as opposed to offer in an auction process.,a,THE WITNESS,start_question
2349,6462,249,14,Do you recall any concerns about approaching a potential purchaser directly?,q,MR. CROKE,start_chat
2350,6464,249,16,Objection.,side_chat,MR. ITKIN,start_answer
2351,6465,249,17,"I can guess what you're asking. But if you're more specific, I'll probably be able to answer the question.",a,THE WITNESS,start_question
2352,6468,249,20,What is your guess as to what I'm asking?,q,MR. CROKE,start_answer
2353,6470,249,22,I'm not going to guess.,a,THE WITNESS,start_question
2354,6471,249,23,"Do you recall, do you recall any discussions about whether or not Astra should try to sell its securities directly",q,MR. CROKE,start_answer
2355,6475,250,1,Mathur - Attorneys' Eyes Only to another party as opposed to through a broker?,a,THE WITNESS,start_chat
2356,6478,250,4,Objection.,side_chat,MR. ITKIN,start_answer
2357,6479,250,5,"There was no discussion of whether we should go directly to a specific party at that time, no.",a,THE WITNESS,start_question
2358,6482,250,8,Do you recall whether it was Astra that approached the broker about a sale or whether the broker had approached Astra?,q,MR. CROKE,start_answer
2359,6486,250,12,"I'm not directly trading these securities, neither Abacus nor any other security.  There's probably -- I don't even recall trading a specific security or engaging -- that is not my role at Astra. Do I recall anything about a specific trade or transaction?  There is no clear specific memory that I have about any of these things.",a,THE WITNESS,start_question
2360,6495,250,21,"Did you have an understanding, at the time that Astra was selling these securities to a broker, that there was somebody else on the other side of that transaction?",q,MR. CROKE,start_answer
2361,6501,251,1,Mathur - Attorneys' Eyes Only,a,THE WITNESS,start_chat
2362,6502,251,2,Objection.  Asked and answered.,side_chat,MR. ITKIN,start_answer
2363,6504,251,4,"If you're selling to a broker, there is obviously somebody else on the other side.",a,THE WITNESS,start_question
2364,6507,251,7,Okay. Do you recall any conversations about why you would prefer to sell it through a broker to someone on the other side as opposed to contacting a potential purchaser directly?,q,MR. CROKE,start_chat
2365,6513,251,13,Objection.,side_chat,MR. ITKIN,start_answer
2366,6514,251,14,How would you know who the broker is going to go to?,a,THE WITNESS,start_question
2367,6516,251,16,So you don't have any recollection about any conversations about whether you should approach a purchaser directly as opposed to selling through a broker?,q,MR. CROKE,start_chat
2368,6521,251,21,Objection.,side_chat,MR. ITKIN,start_answer
2369,6522,251,22,"Wait a second.  To who?  When you're selling a security to a broker, you're selling to a broker who sells it to the market and whoever is the highest",a,THE WITNESS,start_answer
2370,6527,252,1,"Mathur - Attorneys' Eyes Only bidder, and he makes a bid offer between the two.",a,THE WITNESS,start_question
2371,6530,252,4,Uh-huh.,q,MR. CROKE,start_answer
2372,6531,252,5,So everybody sells a security through a broker.  What's unusual about this one?,a,THE WITNESS,start_question
2373,6534,252,8,"In connection with this sale, do you recall whether there were any concerns at Astra about trying to conceal Astra's identity from Goldman Sachs?",q,MR. CROKE,start_answer
2374,6538,252,12,"No.  At that time, no.",a,THE WITNESS,start_question
2375,6539,252,13,Okay.,q,MR. CROKE,start_chat
2376,6540,252,14,"I'm going to object to the question.  I didn't get a chance to say it before the answer, but I just want to make sure it's there.",side_chat,MR. ITKIN,start_chat
2377,6545,252,19,Sorry.,side_chat,THE WITNESS,start_chat
2378,6546,252,20,"No, it's okay.",side_chat,MR. ITKIN,start_question
2379,6548,252,22,"So doing the math here, if Astra sold 17 and a half million in notes at a price of 52.5, that means that Astra received roughly 9.2 million in sale",q,MR. CROKE,start_answer
2380,6553,253,1,"Mathur - Attorneys' Eyes Only proceeds, correct?",a,THE WITNESS,start_answer
2381,6555,253,3,Roughly.,a,THE WITNESS,start_question
2382,6556,253,4,"So Astra paid roughly 6.6 million for 30 million of Abacus 2006-10 notes, and then in the flex transaction here sold just over half of those notes for roughly 9.2 million, is that correct?",q,MR. CROKE,start_answer
2383,6561,253,9,"Yes, looks like it.",a,THE WITNESS,start_question
2384,6562,253,10,"Okay. So at that point, Astra had already made back the entire amount it paid for the Abacus 2006-10 notes plus millions more, correct?",q,MR. CROKE,start_chat
2385,6567,253,15,Objection.,side_chat,MR. ITKIN,start_answer
2386,6568,253,16,Yeah.,a,THE WITNESS,start_question
2387,6569,253,17,Okay. Yes?,q,MR. CROKE,start_answer
2388,6571,253,19,Yeah.,a,THE WITNESS,start_question
2389,6572,253,20,"Okay. And Astra still had another 12.5 million in Abacus 2006-10 notes, correct?",q,MR. CROKE,start_answer
2390,6575,253,23,Uh-huh.,a,THE WITNESS,start_question
2391,6576,253,24,"Looking at the next row in this chart, do you see that on November 26, 2014",q,MR. CROKE,start_answer
2392,6579,254,1,Mathur - Attorneys' Eyes Only Astra purchased 20 million original face value of the Abacus 2006-10 notes at a price of 30.5?,a,THE WITNESS,start_answer
2393,6583,254,5,Yeah.,a,THE WITNESS,start_question
2394,6584,254,6,Does looking at this refresh your recollection about any of factors that were considered in deciding to purchase those notes?,q,MR. CROKE,start_answer
2395,6588,254,10,"Just by looking at this, no.",a,THE WITNESS,start_question
2396,6589,254,11,Okay. Do you recall why Astra decided to purchase more Abacus 2006-10 securities just a few weeks after it had sold 17.5 million of Abacus 2006-10 securities?,q,MR. CROKE,start_chat
2397,6594,254,16,Objection.,side_chat,MR. ITKIN,start_answer
2398,6595,254,17,Do I recall why?,a,THE WITNESS,start_question
2399,6596,254,18,Uh-huh.,q,MR. CROKE,start_answer
2400,6597,254,19,My guess is it must be available for sale.,a,THE WITNESS,start_question
2401,6599,254,21,Say what?,q,MR. CROKE,start_answer
2402,6600,254,22,It must be available for sale.,a,THE WITNESS,start_question
2403,6601,254,23,Okay. Do you recall whether the fact that Astra had been able to sell 17.5,q,MR. CROKE,start_answer
2404,6605,255,1,Mathur - Attorneys' Eyes Only million in Abacus 2006-10 securities at a price of 52.5 was a factor that Astra considered in deciding to purchase another 20 million of Abacus 2006-10 securities at a price of 30.5?,a,THE WITNESS,start_chat
2405,6611,255,7,Objection.,side_chat,MR. ITKIN,start_answer
2406,6612,255,8,"Whenever Astra makes any purchase or sales, or sells a security, it is purely based on what our analysis of that security is and whether or not we're willing to hold an asset at a certain price.",a,THE WITNESS,start_question
2407,6617,255,13,And was the fact that three weeks prior to that purchase Astra had sold these securities at a price of 52.5 a factor that Astra considered in deciding to purchase another 20 million of those securities?,q,MR. CROKE,start_chat
2408,6622,255,18,Objection.,side_chat,MR. ITKIN,start_answer
2409,6623,255,19,"It may have considered that as one of the factors possible, but I think I gave you the answer.",a,THE WITNESS,start_question
2410,6626,255,22,"Do you recall any conversations about the fact that Astra had recently sold 17 million, 17.5 million of the securities at a price of 52.5 in connection with the",q,MR. CROKE,start_answer
