,indice,page_number,line_number,text,text_type,speaker,time_added
281,680,27,6,He always complained to me that he had pain.,a,THE WITNESS,start_question
282,682,27,8,But did you ever see anything about him?,q,MS. SCHWEIKERT,start_answer
283,684,27,10,"Because I was busy working, I didn't pay attention.  I didn't see it.",a,THE WITNESS,start_question
284,686,27,12,"What about Mr. Vu, did you ever notice anything different about Mr. Vu after the accident?",q,MS. SCHWEIKERT,start_answer
285,689,27,15,"Yes, I saw him get weaker.",a,THE WITNESS,start_question
286,690,27,16,In what way?,q,MS. SCHWEIKERT,start_answer
287,691,27,17,I see him have difficult time eating. That's why he got weaker.,a,THE WITNESS,start_question
288,693,27,19,When did you move out with Mr. Pham? When did you stop living together?,q,MS. SCHWEIKERT,start_answer
289,695,27,21,I don't understand the question.,a,THE WITNESS,start_question
290,696,27,22,"Did you live with Mr. Pham, or did Mr. Pham live with you?",q,MS. SCHWEIKERT,start_answer
291,698,27,24,I lived with Mr. Pham.,a,THE WITNESS,start_question
292,700,28,1,When did you move out of Mr. Pham's house?,q,MS. SCHWEIKERT,start_answer
293,702,28,3,I can't recall.,a,THE WITNESS,start_question
294,703,28,4,"When you moved out of Mr. Pham's house, where did you go?",q,MS. SCHWEIKERT,start_answer
295,705,28,6,I moved to Texas.,a,THE WITNESS,start_question
296,706,28,7,When did you move to Texas?,q,MS. SCHWEIKERT,start_answer
297,707,28,8,I can't recall.,a,THE WITNESS,start_question
298,708,28,9,"Were you still in treatment for this accident?  Was it after you stopped going to treatment?  Was it 2017, 2018? Can you give me any idea of when you moved to Texas?",q,MS. SCHWEIKERT,start_chat
299,713,28,14,Objection. You can answer.,side_chat,MS. KATHOPOULIS,start_chat
300,715,28,16,I can't recall.,side_chat,THE WITNESS,start_chat
301,716,28,17,That's all the questions I have for you.,side_chat,MS. SCHWEIKERT,symbols
302,718,28,19,- - -,symbols,,is brackets
303,719,28,20,"(Whereupon, the deposition concluded at 1:32 p.m.)",brackets,,symbols
304,721,28,22,"- - - C E R T I F I C A T E I hereby certify that the proceedings, evidence and objections noted are contained fully and accurately in the notes taken by me on this hearing of the above-captioned case on August 26, 2019, and that this is a correct transcription of same.",symbols,,end
