,indice,page_number,line_number,text,text_type,speaker,time_added
209,764,29,23,"I should have said, you know, the way that these e-mail chains work is you have to start at the back --",q,MR. ELLERBE,start_answer
210,768,30,1,Which is what I did exactly.,a,THE WITNESS,start_question
211,769,30,2,Okay.,q,MR. ELLERBE,start_answer
212,770,30,3,-- so I can reacquaint myself.,a,THE WITNESS,is brackets
213,771,30,4,(Reviews document.),brackets,,start_question
214,772,30,5,"I'll just let you know, you take as much time as you need, but my questions are going to deal with your e-mail on the second page --",q,MR. ELLERBE,start_answer
215,775,30,8,Okay.,a,THE WITNESS,start_question
216,776,30,9,-- that ends in 12.,q,MR. ELLERBE,start_answer
217,777,30,10,"Okay.  (Reviews document.) Okay.  I'm sure I'll want to read it again when you ask, but at least I've acquainted myself with it.",a,THE WITNESS,start_question
218,781,30,14,Sure.  So can you just describe generally what this document is?,q,MR. ELLERBE,start_answer
219,783,30,16,It's an e-mail chain among a number of people within the quality and clinical space discussing feedback received through FDA on MDR reporting and reporting under clinical studies.,a,THE WITNESS,start_question
220,788,30,21,Okay.  So do you see the e-mail that you wrote on June 15th and sent at 5:13 p.m. that appears on the page that ends in 12?,q,MR. ELLERBE,start_answer
221,791,30,24,I do.,a,THE WITNESS,start_question
222,792,30,25,Okay.  And who were the people you were sending this to?,q,MR. ELLERBE,start_answer
223,795,31,2,"Chris Harrold at the time would have been our vice-president of regulatory for the CRM division.  Bill Young would have been our vice-president of quality for the CRM division.  Steve McQuillan was in clinicals. I don't remember his title. Greg Voss was in clinicals, and Erika Huffman was a manager in the post market team.",a,THE WITNESS,start_question
224,803,31,10,Okay.  So did she work under you at this point in time?,q,MR. ELLERBE,start_answer
225,805,31,12,Yes.,a,THE WITNESS,start_question
226,806,31,13,"Okay.  Now do you see the fifth bullet point down in your list of bullet points that begins with, ""Based on our QSAT deep dive""?",q,MR. ELLERBE,start_answer
227,809,31,16,I do.,a,THE WITNESS,start_question
228,810,31,17,And does that refer to the meeting whose minutes we just looked at?,q,MR. ELLERBE,start_answer
229,812,31,19,"It refers to a QSAT.  I can't tell you if it's the exact QSAT meeting, because they were held periodically.",a,THE WITNESS,start_question
230,815,31,22,Okay.,q,MR. ELLERBE,start_answer
231,816,31,23,But it does refer to that same forum.,a,THE WITNESS,start_question
232,817,31,24,Okay.  Can you explain what you're saying in this bullet point?,q,MR. ELLERBE,start_answer
233,820,32,1,Let me read it one more time --,a,THE WITNESS,start_question
234,821,32,2,Sure.,q,MR. ELLERBE,start_answer
235,822,32,3,-- and then I will answer.,a,THE WITNESS,is brackets
236,823,32,4,"(Reviews document.) Okay.  So at one point in time the -- our interpretation of the FDA regulations related to similar was not as broad as we ultimately made it, meaning it had to be more specific. The regulations don't tell you the definition of similar, so our interpretation at the time was more limited such that when that COGENT 4 study was taking place, it did not meet the definition of similar at that time, so we were not filing MDRs. What this is saying is based on learning from that deep dive, which I believe came through some feedback that we got from FDA on another site within the Boston Scientific family, but not within the CRM or the management division, we took and listened to that feedback and figured out we -- we should be looking at how do we apply it within CRM. It's important to note we were under different quality systems at the time, so what's referred to here as legacy BSC would have been different from cardiac rhythm management.  So what it's saying here is we took the feedback that we received, that we just talked about at a QSAT meeting, and we ultimately updated our procedures to define the definition of similar device.",brackets,,start_question
237,854,33,9,"Okay.  And is this meaning that if a -- if Boston Scientific has a defibrillator device and it's -- it might still be under an IDE, but there's an adverse event that happens, does this mean that an MDR should be filed for that event?",q,MR. ELLERBE,start_chat
238,860,33,15,Objection to form. You can answer.,side_chat,MR. ROBINSON,start_chat
239,862,33,17,It doesn't necessarily mean an MDR would be filed.  It would be evaluated --,side_chat,THE WITNESS,start_chat
240,865,33,20,Okay.,side_chat,MR. ELLERBE,start_chat
241,866,33,21,-- against the criteria.,side_chat,THE WITNESS,start_chat
242,868,33,23,Okay.,side_chat,MR. ELLERBE,start_question
243,870,33,25,"So -- and if the criteria were met for MDR filing, then an MDR would be filed in that case?",q,MR. ELLERBE,start_answer
244,874,34,3,"I would go back -- yes, but let me go back one step earlier.  It -- the definition of -- it's not as broad as saying a defibrillator. It had to be of the same product code. There's an FDA pro code that's assigned by the FDA, and that is how we like -- put like categories together and that's how we met the definition of similar. So if you -- if your question is if it met the definition of similar, meaning it had the same pro code, and we walked an MDR decision tree and we got to a decision that yes, it should be reported, yes, it would be reported as an MDR.",a,THE WITNESS,start_question
245,888,34,17,"Okay.  And when we talk about similar, we're comparing a device that's under the IDE to a device that's already being marketed; is that right?",q,MR. ELLERBE,start_answer
246,892,34,21,"Yeah, it's comparing -- yes, a device that is marketed to one that may not be marketed, correct.",a,THE WITNESS,start_question
247,895,34,24,"Okay.  And if they have the same pro code then you would evaluate whether that -- excuse me.  Strike that. The event happens with the device that was not being marketed, right, but then you evaluate whether that device is similar to one that is being marketed; is that right?",q,MR. ELLERBE,start_answer
248,903,35,6,Correct.,a,THE WITNESS,start_question
249,904,35,7,"And then if they have the same pro code, then you evaluate whether or not that event needs to be reported under the normal MDR reporting criteria; is that right?",q,MR. ELLERBE,start_answer
250,908,35,11,Correct.,a,THE WITNESS,start_question
251,909,35,12,Do you know whether Cognis and Teligen had the same pro codes as their predecessor devices?,q,MR. ELLERBE,start_chat
252,912,35,15,Objection to form.,side_chat,MR. ROBINSON,start_chat
253,913,35,16,"I would -- so if I'm not supposed to guess, then I'm going to say I don't know for certain.",side_chat,THE WITNESS,start_chat
254,916,35,19,Okay.,side_chat,MR. ELLERBE,start_question
255,918,35,21,Do you know where the information regarding what the pro code for a device would be resides?,q,MR. ELLERBE,start_answer
256,921,35,24,"So a pro code -- once it's approved, a pro code is assigned by the FDA and there is a database within the FDA that, I believe when you submit your registration, the pro code is part of that process, so we then as a manufacturer know what pro code to use when we do submit MDRs.",a,THE WITNESS,start_question
257,929,36,6,"And if you submit a supplemental PMA for a new device as opposed to an original PMA, would the new device have the same pro code as the old device which it was supplementing?",q,MR. ELLERBE,start_answer
258,933,36,10,I don't know.,a,THE WITNESS,start_question
259,934,36,11,"Okay.  Now, can you explain what your parenthetical note in this bullet point means?",q,MR. ELLERBE,start_answer
260,937,36,14,"Where it says italic starting with, ""Note""?",a,THE WITNESS,start_question
261,938,36,15,Correct.,q,MR. ELLERBE,start_answer
262,939,36,16,"Okay.  Let me read it.  (Reviews document.) Okay.  So it's saying that we did this deep dive, again, as I mentioned learning from feedback -- from FDA from different parts of Boston Scientific, we looked internally within our CRM process and we identified we were not filing MDRs on Cognis/Teligen that were part of COGENT 4. And as I stated earlier, at the time we did not have the definition of similar in place, so it was therefore not applied.  And the rationale I'm stating here is we viewed Cognis/Teligen as a different platform and, therefore, not similar, meaning we weren't using pro code as our basis for similar.  The quality system assurance team agreed with that. We aligned to make the interpretation change on a go-forward basis, so we decided not to go back and file MDRs, but we update our procedures on a go-forward to align with that pro code classification. And that's very consistent with any change in interpretation that we have with regulations, we will make them, very typically, on a go-forward basis.",a,THE WITNESS,start_question
263,966,37,17,Can you explain why?,q,MR. ELLERBE,start_answer
264,967,37,18,"Well, as I stated earlier, regulations are not black and white, so interpretation of those regulations is always evolving as we learn more.  So unless we viewed it as a -- a nonconformance where we clearly identified we -- we did not follow the regulation, but rather we evolved our understanding of the regulation, that's on a go-forward basis. There's -- it's very difficult to -- there's -- there's not a line in the sand black and white.  There is a continual evolution of interpretation.  And so when we make those changes, we make them going forward.",a,THE WITNESS,start_question
265,982,38,7,Okay.  So here's a different hypothetical. If there were an adverse event that happened with a device and Boston Scientific didn't learn about that adverse event until a year later --,q,MR. ELLERBE,start_answer
266,987,38,12,Okay.,a,THE WITNESS,start_question
267,988,38,13,-- would it still do -- evaluate whether or not MDR reporting was appropriate for that event even though it had happened 12 months beforehand?,q,MR. ELLERBE,start_answer
268,992,38,17,"We will take a complaint, no matter when we receive it, and we use the procedures that are in place at the time we get that complaint, and whatever procedure is in place is what we follow. So in your scenario, we learn of a complaint that may have happened sometime in the past, if we learn about it today, we will evaluate it today based on those procedures.",a,THE WITNESS,start_question
269,1002,39,1,And does the FDA use MDR reporting to make decisions about whether any sort of action on its part is needed?,q,MR. ELLERBE,start_chat
270,1005,39,4,Objection to scope.,side_chat,MR. ROBINSON,start_chat
271,1006,39,5,I don't know what FDA -- I can't speak for what FDA does with the information we submit.,side_chat,THE WITNESS,start_question
272,1010,39,9,You don't know why the FDA requires reporting of MDRs?,q,MR. ELLERBE,start_answer
273,1012,39,11,That's a different question than what you asked the first time.,a,THE WITNESS,start_question
274,1014,39,13,"Okay.  Okay.  Well, then, can you tell me, do you know why FDA requires reporting of adverse events?",q,MR. ELLERBE,start_chat
275,1017,39,16,I'm going to object to scope. You may answer.,side_chat,MR. ROBINSON,start_chat
276,1020,39,19,"As part of device regulations, there is an obligation on manufacturers to monitor performance of products to ensure that they remain safe and effective, and the MDR regulation is one of the ways that they collect information for that purpose.",side_chat,THE WITNESS,start_question
277,1029,40,2,"So in this case, wouldn't the FDA want to know about these events that had happened in the COGENT 4 study just as much as they would want to know about events that happened after they approved the devices?",q,MR. ELLERBE,start_chat
278,1034,40,7,Objection to form and scope. You may answer.,side_chat,MR. ROBINSON,start_chat
279,1037,40,10,"I'm sorry, I'm trying to understand your question.  Can you either restate it or state it slightly differently for me?",side_chat,THE WITNESS,start_chat
280,1041,40,14,Sure.,side_chat,MR. ELLERBE,start_question
281,1043,40,16,"So because Boston Scientific had not submitted MDRs for these events that happened in the COGENT 4 study, the FDA did not have MDR reports for those events, right?",q,MR. ELLERBE,start_chat
282,1047,40,20,Objection to form and scope.,side_chat,MR. ROBINSON,start_chat
283,1049,40,22,They would not have received reports from the -- via the MDR system prior to the market approval.,side_chat,THE WITNESS,start_chat
284,1052,40,25,Okay.,side_chat,MR. ELLERBE,start_question
285,1055,41,2,So after the decision was made to change interpretation of the similar --,q,MR. ELLERBE,start_answer
286,1057,41,4,Uh-huh.,a,THE WITNESS,start_question
287,1058,41,5,-- is there any reason to think that the FDA wouldn't also be interested in those events?,q,MR. ELLERBE,start_chat
288,1060,41,7,Objection to form and scope.,side_chat,MR. ROBINSON,start_chat
289,1062,41,9,"I can't speculate for what FDA's interest would or would not be.  All I can tell you is that we interpret the regulations and we follow our procedures which are the result of that interpretation, and when we made the change, we followed the regulation -- the interpretation and the procedures going forward.",side_chat,THE WITNESS,start_question
290,1071,41,18,"But the information is still relevant to these devices that are being marketed at this time, right?",q,MR. ELLERBE,start_chat
291,1074,41,21,Objection to form and scope.,side_chat,MR. ROBINSON,start_chat
292,1076,41,23,"What is your question again, the -- say it again.",side_chat,THE WITNESS,start_question
293,1080,42,1,"The information about those events that happened in the COGENT 4 study is still relevant to the safety and effectiveness of these devices that were being marketed at the time this decision was made, right?",q,MR. ELLERBE,start_answer
294,1085,42,6,Yes.,a,THE WITNESS,start_question
295,1086,42,7,Okay.,q,MR. ELLERBE,start_chat
296,1087,42,8,"I want to make a -- on the last answer, I'm objecting to the scope on that one as well.",side_chat,MR. ROBINSON,start_question
297,1091,42,12,"Okay.  I'm going to show you another document.  This will be Zurn 3, and it's Bates-stamped BSC_Higgins-00275074.",q,MR. ELLERBE,is brackets
298,1094,42,15,(Exhibit 3 marked.),brackets,,start_chat
299,1095,42,16,(Reviews document.) Okay.,side_chat,THE WITNESS,start_question
300,1098,42,19,Okay.  What is this document?,q,MR. ELLERBE,start_answer
301,1099,42,20,This is a Complaint Summary Report from our Lighthouse complaint management system.,a,THE WITNESS,start_question
302,1101,42,22,Okay.  And is it sometimes referred to -- this kind of document sometimes referred to as a CSR?,q,MR. ELLERBE,start_answer
303,1104,42,25,Yes.,a,THE WITNESS,start_question
304,1106,43,1,"Okay.  And do you see there's a number at the top of the first page that says, ""Internal PI number""?",q,MR. ELLERBE,start_answer
305,1109,43,4,Yes.,a,THE WITNESS,start_question
306,1110,43,5,Can you describe what that internal PI number means?,q,MR. ELLERBE,start_answer
307,1112,43,7,It's the -- I believe it's the unique complaint number within Lighthouse.,a,THE WITNESS,start_question
308,1114,43,9,Okay.  And can you just generally describe what information the CSRs contain?,q,MR. ELLERBE,start_answer
309,1116,43,11,"They contain a summary of what was reported to us relative to a complaint.  They may contain any attempts that we make to collect additional or missing information if we need it. It would reflect whether we got the product back, if there was any analysis testing.  It would reflect if we had any -- it would reflect our assessment of whether or not it was reportable either to the FDA via an MDR or outside the United States through various vigilance reporting requirements.",a,THE WITNESS,start_question
310,1128,43,23,And what is vigilance reporting requirements?,q,MR. ELLERBE,start_answer
311,1129,43,24,Vigilance reporting is the generic term we use for a regulatory report outside the U.S. So analogous to an MDR is to the U.S. what a vigilance report would be to various countries throughout the world.,a,THE WITNESS,start_question
312,1135,44,4,Okay.  And how -- or strike that. Would Complaint Summary Reports be used in the process of deciding whether or not to report an event to regulators?,q,MR. ELLERBE,start_answer
313,1139,44,8,"This document itself, no.  The individual analyst doesn't use or print this document. This is a result of their work.",a,THE WITNESS,start_question
314,1142,44,11,Okay.,q,MR. ELLERBE,start_answer
315,1143,44,12,"So they would not use this document, per se, to make a reporting decision.",a,THE WITNESS,start_question
316,1145,44,14,Okay.  Does a Complaint Summary Report reflect all the information that the analyst uses?,q,MR. ELLERBE,start_answer
317,1148,44,17,"It reflects a summary of their investigation of the work that they've performed, yes.",a,THE WITNESS,start_question
318,1150,44,19,Okay.  Okay.  And then can you turn to the second page?,q,MR. ELLERBE,start_answer
319,1152,44,21,Uh-huh.,a,THE WITNESS,start_question
320,1153,44,22,Does this page tell you where the event happened?,q,MR. ELLERBE,start_answer
321,1155,44,24,"I'm looking here.  (Reviews document.) ""Account country,"" if we have it, would be populated.  In this case it's blank, so it's possible we did not -- were not able to obtain all the information.",a,THE WITNESS,start_question
322,1161,45,4,"What about, ""Source Country""?",q,MR. ELLERBE,start_answer
323,1162,45,5,"I'm sorry, I'm looking for that.  Hold on.",a,THE WITNESS,start_question
324,1163,45,6,It's at the top on the right.,q,MR. ELLERBE,start_answer
325,1164,45,7,There you go.,a,THE WITNESS,start_question
326,1165,45,8,Okay.,q,MR. ELLERBE,start_answer
327,1166,45,9,"Actually, I'm going to reclarify my previous question.  The account country would be specific to the contact information.",a,THE WITNESS,start_question
328,1169,45,12,Okay.,q,MR. ELLERBE,start_answer
329,1170,45,13,"But thank you for pointing out the source country is on the top, and it's Germany in this case.",a,THE WITNESS,start_question
330,1173,45,16,So that means this event happened in Germany?,q,MR. ELLERBE,start_answer
331,1174,45,17,Yes.,a,THE WITNESS,start_question
332,1175,45,18,"And does the event date right under that mean that this event happened on March 18th, 2008?",q,MR. ELLERBE,start_answer
333,1177,45,20,Yes.,a,THE WITNESS,start_question
334,1178,45,21,"Okay.  And then at the bottom, do you see where it says, ""Device Info,"" that section?",q,MR. ELLERBE,start_answer
335,1180,45,23,"Device Info, yes.",a,THE WITNESS,start_question
336,1181,45,24,And does this mean that this was a Teligen device model F102 serial number 000128?,q,MR. ELLERBE,start_answer
337,1184,46,1,Yes.,a,THE WITNESS,start_question
338,1185,46,2,Okay.,q,MR. ELLERBE,start_chat
339,1186,46,3,Should we maybe go off the record now.,side_chat,MR. ELLERBE,start_chat
340,1188,46,5,We are going off the record at 9:50 a.m.,side_chat,THE VIDEOGRAPHER,is brackets
341,1190,46,7,(Recess.),brackets,,start_chat
342,1191,46,8,We are back on the record at 10:33 a.m.,side_chat,THE VIDEOGRAPHER,start_question
343,1194,46,11,"Ms. Zurn, do you understand that you're still under oath?",q,MR. ELLERBE,start_answer
344,1196,46,13,Yes.,a,THE WITNESS,start_question
345,1197,46,14,"And before we took a break, we were talking about a CSR for an event that was labeled with an internal PI number 1261088-1; is that right?",q,MR. ELLERBE,start_answer
346,1201,46,18,Correct.,a,THE WITNESS,start_question
347,1202,46,19,Can you explain to me what the dash 1 means in that number?,q,MR. ELLERBE,start_answer
348,1204,46,21,I don't know.,a,THE WITNESS,start_question
349,1205,46,22,Okay.  Okay.  Can you turn to the third page in this document that ends in 076.,q,MR. ELLERBE,start_answer
350,1207,46,24,(Complies.),a,THE WITNESS,start_question
351,1208,46,25,"And can you read the description into the record, please?",q,MR. ELLERBE,start_answer
352,1211,47,2,"""Event description, Boston Scientific CRM received information that this implanted right ventricular defibrillation lead presented with shocking impedances above 125 ohms one day after implant.""",a,THE WITNESS,start_question
353,1216,47,7,Okay.  And then can you please read the manufacturer narrative as well?,q,MR. ELLERBE,start_answer
354,1218,47,9,"""During the revision procedure, it was discovered that the lead's terminal pin was not fully inserted into the header of the implanted implantable cardioverter defibrillator,"" parenthesis, ""ICD.  The lead was reconnected and now the shock impedance measurements are within normal parameters. No adverse patient effects were reported.  No additional information is available.""",a,THE WITNESS,start_question
355,1227,47,18,"So based off of that description, is it correct to say that this patient had a Teligen device implanted and then the next day it was discovered that one of the leads had a shocking impedance measurement above 125 ohms?",q,MR. ELLERBE,start_chat
356,1233,47,24,Objection to form.,side_chat,MR. ROBINSON,start_chat
357,1234,47,25,I think that's how I would summarize it.,side_chat,THE WITNESS,start_question
358,1238,48,3,And then when it -- the manufacturer narrative refers to the revision procedure. Can you describe what a revision procedure is?,q,MR. ELLERBE,start_chat
359,1242,48,7,Objection to form and scope.,side_chat,MR. ROBINSON,start_chat
360,1244,48,9,"Revision procedure would be one where after the device is implanted, something requires the patient to go back into surgery for various reasons to have the implanted device revised.",side_chat,THE WITNESS,start_question
361,1250,48,15,And so that means the pocket is reopened; is that right?,q,MR. ELLERBE,start_chat
362,1252,48,17,Objection to form and scope.,side_chat,MR. ROBINSON,start_chat
363,1254,48,19,It could be.  I don't know that it's always that case.,side_chat,THE WITNESS,start_question
364,1257,48,22,"Reading this narrative, do you believe that the pocket was reopened?",q,MR. ELLERBE,start_chat
365,1259,48,24,Objection to form and scope.,side_chat,MR. ROBINSON,start_chat
366,1262,49,1,"I would say yes, based on the sentence where it says the lead was reconnected.  To me that would imply yes.",side_chat,THE WITNESS,start_question
367,1266,49,5,"Do you see on the next page, at the top it says, ""Regulatory decision information""?",q,MR. ELLERBE,start_answer
368,1268,49,7,Yes.,a,THE WITNESS,start_question
369,1269,49,8,Okay.  And is this what you were referring to earlier when you said that CSRs would record what the regulatory decision-making reporting -- strike that. Does this show what the regulatory reporting decision was for this event?,q,MR. ELLERBE,start_answer
370,1275,49,14,Yes.,a,THE WITNESS,start_question
371,1276,49,15,Okay.  And does this show that no reporting was done for the United States?,q,MR. ELLERBE,start_answer
372,1278,49,17,Yes.,a,THE WITNESS,start_chat
373,1279,49,18,Objection to form.,side_chat,MR. ROBINSON,start_question
374,1281,49,20,Does this show that there was reporting done to an international regulator?,q,MR. ELLERBE,start_answer
375,1283,49,22,Yes.,a,THE WITNESS,start_question
376,1284,49,23,Do you know which regulator that would be?,q,MR. ELLERBE,start_answer
377,1285,49,24,"From this box, I can't tell for certain.",a,THE WITNESS,start_question
378,1286,49,25,"Based off of the fact that this implant occurred in Germany, does that give you information?",q,MR. ELLERBE,start_answer
379,1290,50,3,"More than likely, then, it would have been the German competent authority.",a,THE WITNESS,start_question
380,1292,50,5,Do you know why this event was not reported to the FDA?,q,MR. ELLERBE,start_chat
381,1294,50,7,Objection to form.,side_chat,MR. ROBINSON,start_chat
382,1295,50,8,"Well, the rationale on this, I can't tell exactly from -- because it's -- there's the blank field here.  But based on the date and based on the fact that I believe this device was not approved in the U.S. yet and we had not yet implemented the definition of similar, we would have considered it not eligible for MDR reporting.",side_chat,THE WITNESS,start_question
383,1304,50,17,"Now, putting that policy aside, do you have any sense as to whether or not this event would have been -- strike that. If that policy were not in place, would the MDA -- MDR criteria have been applied to the this event to decide whether or not it needed to be reported to the FDA?",q,MR. ELLERBE,start_chat
384,1311,50,24,Objection to form.,side_chat,MR. ROBINSON,start_chat
385,1312,50,25,"If -- if you're -- if you're asking me if we had had -- if this had happened after the implementation of the similar clause, then we would have assessed it for reportability.",side_chat,THE WITNESS,start_chat
386,1318,51,5,Okay.,side_chat,MR. ELLERBE,start_question
387,1320,51,7,"And based off of your knowledge of MDR reporting, do you believe this event would have been -- should have been reported under that criteria?",q,MR. ELLERBE,start_chat
388,1324,51,11,Objection to form.,side_chat,MR. ROBINSON,start_chat
389,1325,51,12,"So to answer that I would have to look at the procedure that was in place at the time this event came in.  As I stated earlier, our procedures are revised periodically, so I would -- I would want to assess it and make that decision based on the procedure in place at the time the event occurred.",side_chat,THE WITNESS,start_chat
390,1333,51,20,Okay.,side_chat,MR. ELLERBE,start_question
391,1335,51,22,"Even though there was this change in BSC's internal policies regarding similar products, would it have been possible for BSC to have reported on this kind of event to the FDA?",q,MR. ELLERBE,start_chat
392,1340,52,1,Objection to form.,side_chat,MR. ROBINSON,start_chat
