,indice,page_number,line_number,text,text_type,speaker,time_added
393,1341,52,2,"Would it have been possible?  I suppose.  But if the analyst was following the procedure, the answer would be no, they wouldn't have reported it.",side_chat,THE WITNESS,start_question
394,1346,52,7,"If someone at Boston Scientific thought this is an important kind of event, we need to report on this to FDA even if our internal policy says that we don't have to, would it have been possible to submit that kind of report?",q,MR. ELLERBE,start_chat
395,1352,52,13,Objection to form.,side_chat,MR. ROBINSON,start_chat
396,1353,52,14,"Technically, it may have been.  However, I will say our analysts are trained, for very good reason, to follow procedure.  So following procedure, they should not have reported.",side_chat,THE WITNESS,start_question
397,1359,52,20,"Okay.  Turning to the next page -- excuse me, two more pages.  It's the one that ends in 079 at the bottom.  Do you see at the bottom of that field there's a trend number?",q,MR. ELLERBE,start_answer
398,1363,52,24,Yes.,a,THE WITNESS,start_question
399,1364,52,25,Okay.  Is that trend number trend TR8018?,q,MR. ELLERBE,start_answer
400,1366,53,1,Yes.,a,THE WITNESS,start_question
401,1367,53,2,Do you know what that trend is?,q,MR. ELLERBE,start_answer
402,1368,53,3,"I am vaguely familiar with it.  I -- I'm not an expert in the trending process, but I am vaguely familiar with it.",a,THE WITNESS,start_question
403,1371,53,6,So what's the significance of listing the trends in the CSR?,q,MR. ELLERBE,start_answer
404,1373,53,8,"A trend is one of the post market processes to monitor complaints of a similar type, and it helps us monitor to -- to see if there is potentially some -- some action we may need to take.  So putting it on the complaint file is part of the complete part of complaint handling regulations and internal requirements.",a,THE WITNESS,start_question
405,1381,53,16,"So to use Boston Scientific's parlance, would this be a trended event?",q,MR. ELLERBE,start_chat
406,1383,53,18,Objection to scope.,side_chat,MR. ROBINSON,start_chat
407,1384,53,19,Yes.,side_chat,THE WITNESS,start_question
408,1386,53,21,"So outside of the MDR reporting process, were there any other methods by which Boston Scientific reported on incidents and adverse events that occurred in implants of the Cognis and Teligen devices before May 8th, 2008?",q,MR. ELLERBE,start_chat
409,1393,54,2,Objection to form.,side_chat,MR. ROBINSON,start_chat
410,1394,54,3,"So you're using the word ""report.""  Can you clarify what you mean by ""report,"" when you say reported to FDA?",side_chat,THE WITNESS,start_chat
411,1397,54,6,Made FDA aware of.,side_chat,MR. ELLERBE,start_chat
412,1398,54,7,"So the -- the only thing I can think of would be that FDA can come in and inspect Boston Scientific at any point in time, and that's very routine.  So it's possible that they could have become aware or become made aware through coming in and inspecting us.  And when we have inspections, complaint files are routinely looked at.",side_chat,THE WITNESS,start_chat
413,1407,54,16,Okay.,side_chat,MR. ELLERBE,start_chat
414,1408,54,17,So that would be a mechanism for FDA becoming aware of certain events.,side_chat,THE WITNESS,start_chat
415,1411,54,20,Okay.,side_chat,MR. ELLERBE,start_question
416,1413,54,22,Are you familiar with the COGENT field following report?,q,MR. ELLERBE,start_answer
417,1415,54,24,I -- I don't know that I am.,a,THE WITNESS,start_question
418,1416,54,25,Okay.,q,MR. ELLERBE,start_answer
419,1418,55,1,It -- I might need to see --,a,THE WITNESS,start_question
420,1419,55,2,Sure.,q,MR. ELLERBE,start_answer
421,1420,55,3,-- if there's an exhibit or something you can show me.,a,THE WITNESS,start_question
422,1422,55,5,Sure.,q,MR. ELLERBE,start_answer
423,1423,55,6,It's a little bit of a vague question.,a,THE WITNESS,start_question
424,1424,55,7,Okay.  Okay.  So I'm going to first show you an exhibit that will be marked Zurn 4.  It has a Bates number of TEMP-BSC00039698.,q,MR. ELLERBE,is brackets
425,1427,55,10,(Exhibit 4 marked.),brackets,,start_question
426,1429,55,12,Have you ever seen this document before?,q,MR. ELLERBE,start_answer
427,1430,55,13,"I do not know if this is something I saw prior to this deposition or not.  Maybe, but it's -- it's not familiar to me.",a,THE WITNESS,start_question
428,1433,55,16,"Okay.  Does this letter indicate that Ron Thompson was sending an amendment to the PMA supplement for Cognis and Teligen to Doris Terry on April 3rd, 2008?",q,MR. ELLERBE,start_answer
429,1437,55,20,I would agree.  That's what it looks like to me.,a,THE WITNESS,start_question
430,1439,55,22,Okay.  And would this just be a cover letter?,q,MR. ELLERBE,start_answer
431,1440,55,23,That's what it looks like to me.,a,THE WITNESS,start_question
432,1441,55,24,Okay.  So now I'm going to show you another exhibit.  This will be Zurn 5.  And it is Bates-stamped TEMP-BSC00036782.,q,MR. ELLERBE,is brackets
433,1445,56,2,(Exhibit 5 marked.),brackets,,start_question
434,1447,56,4,Have you ever seen this document before?,q,MR. ELLERBE,start_answer
435,1448,56,5,I don't believe so.,a,THE WITNESS,start_question
436,1449,56,6,Okay.,q,MR. ELLERBE,start_answer
437,1450,56,7,No.,a,THE WITNESS,start_question
438,1451,56,8,"I will represent to you that this is a copy of the amendment that Ron Thompson sent to Doris Terry on April 3rd, 2008.",q,MR. ELLERBE,start_answer
439,1454,56,11,Okay.,a,THE WITNESS,start_question
440,1455,56,12,Do you see on the last page that there is a list of exhibits?,q,MR. ELLERBE,start_answer
441,1457,56,14,Yes.,a,THE WITNESS,start_question
442,1458,56,15,Can you tell me what Exhibit 4 is?,q,MR. ELLERBE,start_answer
443,1459,56,16,"It reads, ""OUS COGENT field following clinical report.""",a,THE WITNESS,start_question
444,1461,56,18,Okay.  So now we'll look at one more exhibit. This will be marked Zurn 6.,q,MR. ELLERBE,is brackets
445,1463,56,20,(Exhibit 6 marked.),brackets,,start_question
446,1465,56,22,Have you ever seen this document before?,q,MR. ELLERBE,start_answer
447,1466,56,23,This one I have.,a,THE WITNESS,start_question
448,1467,56,24,Okay.  And is this the COGENT Field Following that was attached as an exhibit to that submission to the FDA?,q,MR. ELLERBE,start_answer
449,1471,57,2,"It's titled the COGENT 4 Field Following, if that's your question.",a,THE WITNESS,start_question
450,1473,57,4,Okay.  I'll represent to you that it is --,q,MR. ELLERBE,start_answer
451,1474,57,5,Okay.,a,THE WITNESS,start_question
452,1475,57,6,-- the exhibit.,q,MR. ELLERBE,start_answer
453,1476,57,7,Okay.,a,THE WITNESS,start_question
454,1477,57,8,"Now, can you tell me the criteria by which events -- strike that. Does this report describe observations and adverse events that happened in connection with the implantation of Cognis and Teligen devices in places outside the United States?",q,MR. ELLERBE,start_answer
455,1484,57,15,I believe that is correct.,a,THE WITNESS,start_question
456,1485,57,16,Okay.  Can you tell me what was the criteria for deciding whether or not to include those observations and/or adverse events in this report?,q,MR. ELLERBE,start_answer
457,1489,57,20,Am I allowed to read this to try and answer that?,a,THE WITNESS,start_question
458,1491,57,22,Sure.,q,MR. ELLERBE,start_answer
459,1492,57,23,Okay.  (Reviews document.) So can you please restate your question one more time for me now?,a,THE WITNESS,start_question
460,1496,58,1,Can you tell me what was the criteria for deciding whether or not to include those observations and/or adverse events in this report?,q,MR. ELLERBE,start_answer
461,1500,58,5,"So my answer would be it would be based on the protocol for the clinical study and how we defined in that protocol adverse events and observations, which I think is defined in here.",a,THE WITNESS,start_question
462,1505,58,10,Okay.,q,MR. ELLERBE,start_answer
463,1506,58,11,I saw it on here somewhere.,a,THE WITNESS,start_question
464,1507,58,12,Is it on page 9?,q,MR. ELLERBE,start_answer
465,1508,58,13,"You're one ahead -- yeah.  So there's a definition on page 9 of an adverse event, and then on page 10 you had asked about observations and complications, and that's defined here.",a,THE WITNESS,start_question
466,1513,58,18,"Okay.  If we can go back to page 9, do you see the section that discusses unanticipated device effects?",q,MR. ELLERBE,start_answer
467,1516,58,21,I do.,a,THE WITNESS,start_question
468,1517,58,22,"Okay.  Can you read that section into the record, please.",q,MR. ELLERBE,start_answer
469,1519,58,24,"""An unanticipated adverse device effect is defined in the IDE regulations,"" parenthesis, ""21 CFR 812.3 S as any serious adverse effect on health or safety or any life-threatening problem or death caused by or associated with a device if that effect problem or death was not previously identified in nature, severity or degree of incidence in the investigation plan or application, including a supplementary plan or application, or any other unanticipated serious problem associated with a device that relates to the rights, safety or welfare of patients.  There have been no unanticipated adverse device effects reported in this field following to date.""",a,THE WITNESS,start_question
470,1536,59,15,"So using this definition of unanticipated device effects, is it possible that if a certain kind of adverse effect happened more frequently than was anticipated, that that would be an unanticipated device effect?",q,MR. ELLERBE,start_chat
471,1541,59,20,Objection to form.,side_chat,MR. ROBINSON,start_chat
472,1542,59,21,"I don't read that in here.  I read severity.  But what you asked to me sounded like occurrence rate.  So I'm reading here if it's something that we did not anticipate, not previously identified or the severity.",side_chat,THE WITNESS,start_question
473,1550,60,3,"Do you see where it says, ""Degree of incidence""?",q,MR. ELLERBE,start_answer
474,1552,60,5,I do see that.,a,THE WITNESS,start_question
475,1553,60,6,Could that mean rate?,q,MR. ELLERBE,start_chat
476,1554,60,7,Objection to form.,side_chat,MR. ROBINSON,start_chat
477,1555,60,8,I don't know.,side_chat,THE WITNESS,start_question
478,1557,60,10,Do you think a person reading this might think that it refers to rate?,q,MR. ELLERBE,start_chat
479,1559,60,12,Objection to form and scope.,side_chat,MR. ROBINSON,start_chat
480,1561,60,14,"When I read it the first time, and how I'm reading it now, severity or degree describes the type more than it does how often, and your question to me was more on the how often.",side_chat,THE WITNESS,start_question
481,1567,60,20,"So is it your testimony that if an adverse effect -- excuse me, strike me -- strike that. If an adverse effect happened more frequently than was anticipated, that that would not be an unanticipated device effect?",q,MR. ELLERBE,start_chat
482,1574,61,1,Objection to form.,side_chat,MR. ROBINSON,start_chat
483,1575,61,2,"I don't know. You're asking me something that's a little outside of my subject area expertise, and I'm trying to answer it the best I can based on reading this.  But I -- I'm not steeped in the clinical space as much as I am in the post market space, so I'm answering the best I can.",side_chat,THE WITNESS,start_chat
484,1583,61,10,Okay.  Okay.,side_chat,MR. ELLERBE,start_question
485,1585,61,12,"Turning to the page that ends in 712, do you see the section heading, ""IS-1 incomplete port insertion""?",q,MR. ELLERBE,start_answer
486,1588,61,15,Yes.,a,THE WITNESS,start_question
487,1589,61,16,"Hold on a second.  Can you read that first paragraph out loud, please.",q,MR. ELLERBE,start_answer
488,1591,61,18,"Sure.  ""The reported event associated with this is impedance of greater than 200 ohms due to the IS-1 terminal pin not being fully inserted into the header.  During the COGENT field following, the field engineers received training that reinforced the instructions-for-use in the system guide. The current system guide gives instruction on how to insert the IS-1 terminal pin, therefore, no changes will be made to address this issue.""",a,THE WITNESS,start_question
489,1603,62,4,Thank you. And do you see under that paragraph that there's a list of seven devices?,q,MR. ELLERBE,start_answer
490,1606,62,7,In the parenthesis with the letters?,a,THE WITNESS,start_question
491,1607,62,8,Yes.,q,MR. ELLERBE,start_answer
492,1608,62,9,Yes.,a,THE WITNESS,start_question
493,1609,62,10,And those would be the devices where this observation was made?,q,MR. ELLERBE,start_chat
494,1611,62,12,Objection to the form.,side_chat,MR. ROBINSON,start_chat
495,1613,62,14,"Well, it says this issue was reported in seven devices, parenthesis, and it lists them, so I would understand this to mean that those were the seven devices that was referred to.",side_chat,THE WITNESS,start_chat
496,1618,62,19,Okay.,side_chat,MR. ELLERBE,start_question
497,1620,62,21,"And then based off of that earlier CSR that we looked at, would you think that that would be one of these events that was listed here?",q,MR. ELLERBE,start_chat
498,1623,62,24,Objection to form.,side_chat,MR. ROBINSON,start_chat
499,1624,62,25,May I look at the --,side_chat,THE WITNESS,start_chat
500,1626,63,1,Sure.,side_chat,MR. ELLERBE,start_chat
501,1627,63,2,This was number 3.,side_chat,THE WITNESS,is brackets
502,1628,63,3,"(Reviews document.) Well, I would not, because this clearly says the event is associated with impedances of greater than 2000 ohms due to the IS terminal 1 not being fully inserted. In the description in the narrative, I don't see anywhere in here that it describes anything related to impedances greater than 2000 ohms.",brackets,,start_question
503,1638,63,13,And are you looking at Zurn 3?,q,MR. ELLERBE,start_answer
504,1639,63,14,"I am looking at Zurn 3, and I'm on -- on the bottom ending at 076.",a,THE WITNESS,start_question
505,1641,63,16,Okay.  And does it say that the measurement was above 125 ohms?,q,MR. ELLERBE,start_answer
506,1643,63,18,"In the description it says, ""The defibrillation lead presented with shocking impedances above 125 ohms,"" yes.",a,THE WITNESS,start_question
507,1646,63,21,So can you rule out that this event didn't meet that definition of greater than 2000 ohms?,q,MR. ELLERBE,start_chat
508,1649,63,24,Objection to form.,side_chat,MR. ROBINSON,start_chat
509,1650,63,25,I will answer again. I don't see anything in here that says greater than 2000 ohms.  And what this says in here is that those events associated in this category had impedances greater than 2000 ohms.,side_chat,THE WITNESS,start_chat
510,1657,64,6,Okay.,side_chat,MR. ELLERBE,start_question
511,1659,64,8,But is there anything that could rule this even out from being included in there --,q,MR. ELLERBE,start_chat
512,1661,64,10,Objection --,side_chat,MR. ROBINSON,start_question
513,1663,64,12,-- or do you just not see enough criteria to include it in that greater than 2000 ohms?,q,MR. ELLERBE,start_chat
514,1665,64,14,Objection to form.,side_chat,MR. ROBINSON,start_chat
515,1666,64,15,"Based on the available information, I don't see it matching this criteria.",side_chat,THE WITNESS,start_question
516,1670,64,19,Does this event also describe an event -- does this CSR also describe an event where there was an incomplete port insertion?,q,MR. ELLERBE,start_answer
517,1673,64,22,It does say the lead's terminal pin was not fully inserted into the header of the ICD.,a,THE WITNESS,start_question
518,1675,64,24,"So is that yes, this is an event where there was an incomplete port insertion?",q,MR. ELLERBE,start_chat
519,1678,65,1,Objection to form.,side_chat,MR. ROBINSON,start_chat
520,1679,65,2,It does meet part of the criteria in terms of the terminal pin not being fully inserted.,side_chat,THE WITNESS,start_chat
521,1682,65,5,Okay.  Okay.,side_chat,MR. ELLERBE,start_question
522,1684,65,7,"So now I'm going to show you a document that's marked BSC_Higgins-00284283, and I believe this will be Zurn 7.",q,MR. ELLERBE,is brackets
523,1687,65,10,(Exhibit 7 marked.),brackets,,start_chat
524,1688,65,11,"Counsel, I apologize, I -- I wrote Zurn 7 at the bottom of this, your copy.",side_chat,MR. ELLERBE,start_chat
525,1691,65,14,Oh.,side_chat,MR. ROBINSON,start_chat
526,1692,65,15,I'm just going to give that to you.,side_chat,MR. ELLERBE,start_chat
527,1694,65,17,I'll forgive you. I would have written it anyway.,side_chat,MR. ROBINSON,start_chat
528,1696,65,19,"I'm sure your handwriting is neater than mine, so I apologize for sullying it.",side_chat,MR. ELLERBE,start_chat
529,1699,65,22,(Reviews document.) Okay.,side_chat,THE WITNESS,start_chat
530,1701,65,24,Okay.,side_chat,MR. ELLERBE,start_question
531,1704,66,1,Can you describe what this document is?,q,MR. ELLERBE,start_answer
532,1705,66,2,This is a Complaint Summary Report.,a,THE WITNESS,start_question
533,1706,66,3,Okay.  And can you describe what kind of device was involved here?,q,MR. ELLERBE,start_answer
534,1708,66,5,"Well, I'm looking under the device information, and it lists ALTRUA as the product family.",a,THE WITNESS,start_question
535,1711,66,8,Okay.  And where did this implant take place?,q,MR. ELLERBE,start_answer
536,1712,66,9,This doesn't list the implant.  Are you asking -- are you asking where the event took place?,a,THE WITNESS,start_question
537,1715,66,12,Yes.,q,MR. ELLERBE,start_answer
538,1716,66,13,Source country says United States.,a,THE WITNESS,start_question
539,1717,66,14,Okay.  And do you see the date as well?,q,MR. ELLERBE,start_answer
540,1718,66,15,"The event date is listed as September 26th, 2008.",a,THE WITNESS,start_question
541,1720,66,17,Okay.  And what is an ALTRUA device?,q,MR. ELLERBE,start_answer
542,1721,66,18,"Boy, I believe it's a pacemaker, but it's been many years since I worked in the division.  So I'm pretty sure -- it's a pacemaker or defibrillator.  I'm pretty sure it's a pacemaker.",a,THE WITNESS,start_question
543,1726,66,23,Okay.  And do you see on the page ending in 289?,q,MR. ELLERBE,start_answer
544,1728,66,25,"289, okay.",a,THE WITNESS,start_question
545,1730,67,1,Is there a trend associated with this CSR?,q,MR. ELLERBE,start_answer
546,1731,67,2,There is.,a,THE WITNESS,start_question
547,1732,67,3,Can you tell me what that trend is?,q,MR. ELLERBE,start_answer
548,1733,67,4,TR08018.,a,THE WITNESS,start_question
549,1734,67,5,Okay.  Now can you tell me why this -- strike that. If we go to the page ending in 286.,q,MR. ELLERBE,start_answer
550,1737,67,8,Okay.,a,THE WITNESS,start_question
551,1738,67,9,Does this page indicate that no MDR was submitted to the FDA?,q,MR. ELLERBE,start_answer
552,1740,67,11,That is correct.,a,THE WITNESS,start_question
553,1741,67,12,Can you explain why?,q,MR. ELLERBE,start_answer
554,1742,67,13,"Well, the rationale that's listed here refers to a decision tree within the procedure at that time.",a,THE WITNESS,start_question
555,1745,67,16,Okay.,q,MR. ELLERBE,start_answer
556,1746,67,17,And I would be happy to explain it if I could at least walk the decision tree and provide that same rationale.,a,THE WITNESS,start_question
557,1749,67,20,Okay.  Okay.  But you would need to see that policy document?,q,MR. ELLERBE,start_answer
558,1751,67,22,"Right.  Because as I said earlier, we follow procedure, procedures change, so I'd want to follow the one that was in place at the time.",a,THE WITNESS,start_question
559,1754,67,25,Sure.  Okay.  We can put that one aside.,q,MR. ELLERBE,start_answer
560,1756,68,1,Okay.,a,THE WITNESS,start_question
561,1757,68,2,"Now I'm going to show you Zurn 8, which is Bates-stamped BSC_Higgins-00280556.",q,MR. ELLERBE,is brackets
562,1759,68,4,(Exhibit 8 marked.),brackets,,start_chat
563,1760,68,5,(Reviews document.) Okay.,side_chat,THE WITNESS,start_chat
564,1762,68,7,Okay.,side_chat,MR. ELLERBE,start_question
565,1764,68,9,So can you tell me what this document is?,q,MR. ELLERBE,start_answer
566,1765,68,10,Complaint Summary Report.,a,THE WITNESS,start_question
567,1766,68,11,Okay.  And what kind of device was involved in this complaint?,q,MR. ELLERBE,start_answer
568,1768,68,13,Under the device info it lists a Teligen.,a,THE WITNESS,start_question
569,1769,68,14,Okay.  And was this also implanted in the United States in January of 2009?,q,MR. ELLERBE,start_answer
570,1771,68,16,The event occurred in the United States.  It doesn't have implant date on here.,a,THE WITNESS,start_question
571,1773,68,18,Okay.  And it was in the United States?,q,MR. ELLERBE,start_answer
572,1774,68,19,"The event occurred in the United States, correct.",a,THE WITNESS,start_question
573,1776,68,21,"Okay.  Now, can you read -- did you read the description of this event?",q,MR. ELLERBE,start_answer
574,1778,68,23,I did.,a,THE WITNESS,start_question
575,1779,68,24,"Okay.  Okay.  Do you see where it says, ""The physician then held the lead and the device together as the nurse tightened the setscrew""?",q,MR. ELLERBE,start_answer
576,1784,69,3,I do see that.,a,THE WITNESS,start_question
577,1785,69,4,Do you know whether that was an off-label implant technique?,q,MR. ELLERBE,start_chat
578,1787,69,6,Objection to form and scope.,side_chat,MR. ROBINSON,start_chat
579,1789,69,8,I don't know.,side_chat,THE WITNESS,start_chat
580,1790,69,9,Okay.,side_chat,MR. ELLERBE,start_question
581,1792,69,11,"If it were on off-label implantation technique, is that something the FDA should have been notified about?",q,MR. ELLERBE,start_chat
582,1795,69,14,Objection to form and scope.,side_chat,MR. ROBINSON,start_chat
583,1797,69,16,Notified how?  Can you clarify your question?,side_chat,THE WITNESS,start_question
584,1800,69,19,Was this -- was this event submitted as an MDR?,q,MR. ELLERBE,start_answer
585,1802,69,21,"On the next page it does say yes, we submitted an MDR.",a,THE WITNESS,start_question
586,1804,69,23,"Okay.  And can you tell me, what does malfunction mean there?",q,MR. ELLERBE,start_answer
587,1806,69,25,There are three types of MDR reports.  This to me says that the type of MDR that was filed was a type malfunction.,a,THE WITNESS,start_question
588,1810,70,3,And what does that mean?,q,MR. ELLERBE,start_answer
589,1811,70,4,"Well, as opposed to a death or a serious injury type, there's -- I'd have to get the regulations out to cite it exactly.  It's the least concerning or least significant type of mal -- or of MDR report.",a,THE WITNESS,start_question
590,1816,70,9,"Okay.  So in the MDR report, should the FDA have been made aware of the fact that this implantation technique was off-label, if indeed it was off-label?",q,MR. ELLERBE,start_chat
591,1820,70,13,Objection to form and scope.,side_chat,MR. ROBINSON,start_chat
592,1822,70,15,"So I don't believe that our MDR reporting requires -- again, I'd have to look at the procedure.  I don't know that this was off-label, first of all.",side_chat,THE WITNESS,start_chat
593,1826,70,19,Okay.,side_chat,MR. ELLERBE,start_chat
594,1827,70,20,So if -- if -- are you asking me if it was off-label -- what is your question exactly?,side_chat,THE WITNESS,start_question
595,1831,70,24,Should the FDA have been told this happened and the doctor used an off-label technique to implant this device?,q,MR. ELLERBE,start_chat
596,1835,71,2,Objection to form and scope.,side_chat,MR. ROBINSON,start_chat
597,1837,71,4,"I don't know about should.  But when we write event descriptions in our MDR reports, we describe the facts as we collect them.  And I believe this event description would have largely been what would have been on the MDR.",side_chat,THE WITNESS,start_chat
598,1843,71,10,Okay.,side_chat,MR. ELLERBE,start_question
599,1845,71,12,"And this event description does not say whether or not this was an off-label technique or not, does it?",q,MR. ELLERBE,start_answer
600,1848,71,15,It does not.,a,THE WITNESS,start_question
601,1849,71,16,"Okay.  So -- okay.  Actually, let's look at the next exhibit.  This will be Zurn 9.",q,MR. ELLERBE,is brackets
602,1851,71,18,(Exhibit 9 marked.),brackets,,start_question
603,1853,71,20,"I'll make some representations to you as I give this to you, which is that this is a printout of a spreadsheet that was produced to us in this case by counsel for Boston Scientific, and it includes the information form from the Form 3500As for certain events --",q,MR. ELLERBE,start_answer
604,1861,72,2,Okay.,a,THE WITNESS,start_question
605,1862,72,3,-- corresponding to certain PI numbers.,q,MR. ELLERBE,start_answer
606,1863,72,4,Okay.,a,THE WITNESS,start_question
607,1864,72,5,"And I believe if you look at the top two rows, you'll see PI numbers for this event that we just were discussing.",q,MR. ELLERBE,start_answer
608,1867,72,8,"Sorry, what -- do you want me to look at the first two rows, you said?",a,THE WITNESS,start_question
609,1869,72,10,It's really -- I believe it's the second row. I'll represent to you that I think that's the form 3500A for this PI.,q,MR. ELLERBE,start_answer
610,1872,72,13,"I'll look at the second row, okay.",a,THE WITNESS,start_question
611,1873,72,14,"And I'll further, just for the record, state that I believe that the first row is the supplemental MDR that was submitted for the same PI number.",q,MR. ELLERBE,start_answer
612,1877,72,18,Okay.  Okay.,a,THE WITNESS,start_question
613,1878,72,19,Okay.  So does this row appear to you to contain all the information that would be submitted in a Form 3500A?,q,MR. ELLERBE,start_answer
614,1881,72,22,"Boy, I --",a,THE WITNESS,start_chat
615,1882,72,23,I'm going to object to the form and the scope of that question.,side_chat,MR. ROBINSON,start_chat
616,1884,72,25,But I answer?,side_chat,THE WITNESS,start_chat
617,1886,73,1,"Yeah, go ahead.",side_chat,MR. ROBINSON,start_chat
618,1887,73,2,"Okay.  I don't know, because I'm used to seeing the 3500A looking like a form and not like a spreadsheet.",side_chat,THE WITNESS,start_chat
619,1890,73,5,Okay.,side_chat,MR. ELLERBE,start_chat
