,indice,page_number,line_number,text,text_type,speaker,time_added
139,716,41,13,"So this report indicated that there were numerous other inconsistencies regarding what she told me and what was documented in many of her other medical records.  And, then, in this medical record, first he reported that she had a history of significant migraines.  She reported to me that there was no significant history of headaches, and she actually indicated that the headaches she was experiencing now were nowhere near as severe as the headaches she had had with her migraines in the past. She also indicated that she had a history of multiple concussions when, with me, she reported that she had only had one concussion.  With me, again, she had said that she was sort of blacked out for a short period of time, and, again, she had told many other doctors that she didn't lose consciousness.  She told this doctor that she had lost consciousness for 45 seconds.  That is a long time to be out cold. And then she reported that she actually drove to the Urgent Care center. She had told me that she required -- she was basically taken to the Urgent Care center.  You know, if an individual has head trauma and loses consciousness for 45 seconds, it would be extremely unusual for that person to drive themselves to the emergency room or an Urgent Care center. Next, he reported sort of this back history of her having been abused as a child, and suffering from post-traumatic stress disorder --",a,THE WITNESS,start_question
140,756,43,3,"I don't want to get into, really, any mental problems.  If you could, just kind of cover the concussion-related symptoms, please.",q,MR. BUCILLA,start_answer
141,760,43,7,"Sure.  He had mentioned the horse injury that I had talked about, and that was sort of the beginning of her chronic pain requiring her to be on chronic pain medications.  This also indicated that she had been involved in a severe car accident in which her vehicle rolled over. Finally, the records indicated that her pain was actually doing much better.  She reported that her pain was well controlled, and she was weaning off a lot of her medications.  She said that she was still getting pain medications from a Dr. Amann who she had only seen once, but was sending multiple pain medications to her home, and she was, basically, stockpiling different boxes of medications like Gabapentin, which is a pain medication, Baclofen, which is a muscle relaxant, different types of patches and creams. The medical records also indicated that she was doing better with her memory and her cognition, and she had recently been on a vacation.  She was reluctant to try certain medications that had been prescribed to her because she was concerned that they would have an impact on her sexual drive. And then she also reported that she was going back and forth to California every few months, and she was hoping that she would move there once she was more financially stable.  And that she was involved in a Workman's Compensation case, and that she wanted that to settle.  She noted that she had already had a job set up in San Diego for once she was able to move to California. And, then, last she said that she had a new relationship with someone in Colorado, and she had traveled to Colorado as well.",a,THE WITNESS,start_question
142,805,45,2,"And I just want to be clear, because you indicated a moment ago that she wanted her Workers' Compensation case to settle, but could you read the actual words from the history portion of the report because I want to make sure the right context is in the record?",q,MR. BUCILLA,start_answer
143,812,45,9,"Sure.  ""She reports she has been traveling to and from California every few months to be with her -- but ultimately hopes to be able to move there once she is able to do so financially and once her Workman's Comp case has settled, noting that she has a job already lined up in an office setting in San Diego.""",a,THE WITNESS,start_question
144,820,45,17,"Doctor, does this cause you to change your full recovery opinion from October 3rd, 2018, approximately five months before this visit to Dr. Watanabe?",q,MR. BUCILLA,start_answer
145,825,45,22,"No.  And, again, like I said, with the other records, it just gives sort of more evidence that she indeed probably has recovered.  She is extremely active.  She's traveling.  She's doing all these things. She has a job already t'd up.  Obviously an individual who is having cognitive complaints and physical complaints that she believes limits her ability to work would not have sought a job and have a job lined up in the coming months. His report also indicated that under, later, his assessment and plan, when it says she has a history of concussion, he reported that he suspected that her residual postconcussive symptoms are probably more related to her mood.  And, again, that would agree with what I'm saying, that I think she's fully recovered from her concussion, and that's no longer an issue.",a,THE WITNESS,start_question
146,847,46,19,"As you're sitting here today now, does it remain your opinion that she is fully recovered from the concussion head injury she sustained from this incident?",q,MR. BUCILLA,start_answer
147,851,46,23,Yes.,a,THE WITNESS,start_question
148,852,46,24,"And you're not offering any opinions today concerning orthopedic injuries, concerning the shoulder, lumbar spine, neck and so forth, Doctor?",q,MR. BUCILLA,start_answer
149,857,47,4,Correct.  I'm not.,a,THE WITNESS,start_question
150,858,47,5,Your opinions today are limited to her head injury?,q,MR. BUCILLA,start_answer
151,860,47,7,Yes.,a,THE WITNESS,start_question
152,861,47,8,Have all the opinions you've expressed today been made to within a reasonable degree of medical certainty?,q,MR. BUCILLA,start_answer
153,864,47,11,Yes.,a,THE WITNESS,start_chat
154,865,47,12,I don't have any further questions.,side_chat,MR. BUCILLA,start_chat
155,867,47,14,Great.,side_chat,MR. KENNY,symbols
156,868,47,15,- - - CROSS-EXAMINATION,symbols,,symbols
157,870,47,17,- - -,symbols,,start_question
158,872,47,19,Good evening.  My name's Patrick Kenny.  I just got a few questions for you.,q,MR. KENNY,start_answer
159,875,47,22,Sure.,a,THE WITNESS,start_question
160,876,47,23,"Can I just take a look at the report you're holding your hand?  I'm not going to look at your whole file, but just...",q,MR. KENNY,start_answer
161,881,48,3,Yes.,a,THE WITNESS,start_question
162,882,48,4,Thanks. And this is what you were referring to in your direct exam as well?,q,MR. KENNY,start_answer
163,885,48,7,Yes.,a,THE WITNESS,start_chat
164,886,48,8,We can go off the record real quick.,side_chat,MR. KENNY,is brackets
165,888,48,10,(A discussion was held off the record at this time.),brackets,,symbols
166,890,48,12,- - -,symbols,,start_chat
167,891,48,13,We can go back on.,side_chat,MR. KENNY,start_question
168,894,48,16,"Good evening, Doctor.  My name is Patrick Kenny.  I've just got a few questions for you. The opinions you rendered today are based on history that you obtained from Ms. Daccardi, all the medical records that you articulated you reviewed and your exam of her; is that correct?",q,MR. KENNY,start_answer
169,902,48,24,Yes.,a,THE WITNESS,start_question
170,904,49,1,"And as Counsel pointed out, you performed a neurological IME of her back on October 3rd, 2018; is that correct?",q,MR. KENNY,start_answer
171,907,49,4,Yes.,a,THE WITNESS,start_question
172,908,49,5,"Okay.  It's coming up on about almost a year ago, correct?",q,MR. KENNY,start_answer
173,910,49,7,That's correct.,a,THE WITNESS,start_question
174,911,49,8,"Okay.  When you were testifying today on direct examination, it's fair to say you were relying on your report, correct?",q,MR. KENNY,start_answer
175,915,49,12,Yes.,a,THE WITNESS,start_question
176,916,49,13,"Okay.  You don't have any firsthand recollection of Ms. Daccardi, correct?",q,MR. KENNY,start_answer
177,919,49,16,"I mean, there are some parts of her story that certainly stand out just because it's somewhat an unusual story, but I can't see her exactly in my mind's eye, if that's what you mean.",a,THE WITNESS,start_question
178,924,49,21,Okay.  How many patients do you see in a given week?,q,MR. KENNY,start_answer
179,926,49,23,Probably close to a hundred if I'm not on call.,a,THE WITNESS,start_question
180,929,50,1,Okay.  And where is your clinical practice located?,q,MR. KENNY,start_answer
181,931,50,3,"I'm at Lankenau Hospital, but I have a satellite office in Broomall, where I'm once a week.",a,THE WITNESS,start_question
182,934,50,6,How many IMEs do you do in a particular week?,q,MR. KENNY,start_answer
183,936,50,8,"So I come here to ExamWorks every other half Wednesday, so two half days a month, I will see a maximum of three IMEs. And sometimes it's zero, and sometimes it's three.",a,THE WITNESS,start_question
184,941,50,13,"Okay.  And since you've seen her almost a year ago, is it fair to say you're not aware of her clinical condition currently, meaning you haven't clinically examined her since almost a year ago, correct?",q,MR. KENNY,start_answer
185,947,50,19,Correct.,a,THE WITNESS,start_question
186,948,50,20,"Okay.  You are aware that she was involved in this accident on July 8th, 2017, correct?",q,MR. KENNY,start_answer
187,951,50,23,Yes.,a,THE WITNESS,start_question
188,952,50,24,And it's your diagnosis she did sustain a concussion as a result of this accident?,q,MR. KENNY,start_answer
189,956,51,3,That's certainly possible.,a,THE WITNESS,start_question
190,957,51,4,"Well, I'm asking you to make an opinion within a reasonable degree of medical certainty if she sustained a concussion.",q,MR. KENNY,start_answer
191,961,51,8,Yes.,a,THE WITNESS,start_question
192,962,51,9,"Okay.  And you would agree that the mechanism of injury that she told you about, falling down and hitting her head on a wall, that would be consistent with someone that could sustain a concussion, correct?",q,MR. KENNY,start_answer
193,968,51,15,"Mild concussion, certainly.  Yes.",a,THE WITNESS,start_question
194,969,51,16,"She reported to you -- I know you want back and forth a lot on direct about whether or not there was loss of consciousness or not, but she told you she ""blacked out for just a brief period,"" quote; that's what she told you, correct?",q,MR. KENNY,start_answer
195,975,51,22,Yes.,a,THE WITNESS,start_question
196,976,51,23,"Okay.  She told you that, initially, when she went to Urgent Care, her symptoms were headaches, dizziness, nausea, vomiting and imbalance, correct?",q,MR. KENNY,start_answer
197,981,52,3,Yes.,a,THE WITNESS,start_question
198,982,52,4,"And you would agree, as a neurologist, those are all symptoms of someone that sustained a concussion, correct?",q,MR. KENNY,start_answer
199,986,52,8,Yes.,a,THE WITNESS,start_question
200,987,52,9,"Okay.  You're not aware of any new injuries or accidents to her head since July 8, 2017, correct?",q,MR. KENNY,start_answer
201,990,52,12,"No, I'm not.",a,THE WITNESS,start_question
202,991,52,13,"Okay.  Did you read her deposition transcript dated March 15th, 2019?",q,MR. KENNY,start_answer
203,994,52,16,I skimmed through portions of it.,a,THE WITNESS,start_question
204,995,52,17,What is your understanding of what she had to do in her preinjury position?,q,MR. KENNY,start_answer
205,998,52,20,"My understanding was that she was a manager, and that she, basically, could have to do anything.  So, obviously, a manager is sort of higher up in the food chain, but if someone were to call in sick, she could have to do anything from loading to cleaning to serving, to doing the cashier, so pretty much anything that is could be required of someone that works the restaurant.",a,THE WITNESS,start_question
206,1009,53,6,"Multitasking a restaurant manager job, would you agree with that?",q,MR. KENNY,start_answer
207,1011,53,8,Yes.,a,THE WITNESS,start_question
208,1012,53,9,Do you know how long she's been doing that for?,q,MR. KENNY,start_answer
209,1014,53,11,I don't remember off the top of my head.,a,THE WITNESS,start_question
210,1016,53,13,"Okay.  You then documented on Page 2 of your report, correct me if I'm wrong, that after the fall, she told you what her symptoms were immediately at the time she went to Urgent Care, and then she also began to develop headaches, correct?",q,MR. KENNY,start_answer
211,1022,53,19,Yes.,a,THE WITNESS,start_question
212,1023,53,20,Okay.  And she told you that those headaches were daily; is that correct?,q,MR. KENNY,start_answer
213,1026,53,23,Yes.,a,THE WITNESS,start_question
214,1027,53,24,Okay.  And now she's telling you that they're three times a week; is that correct?,q,MR. KENNY,start_answer
215,1031,54,3,"No.  She, I think, had a headache every day.",a,THE WITNESS,start_question
216,1033,54,5,Okay.,q,MR. KENNY,start_answer
217,1034,54,6,"Three times a week, it was a mild headache, but four times a week, it was a severe headache.",a,THE WITNESS,start_question
218,1037,54,9,"Okay.  And she described to you how stress, driving, bright lights, loud noises all trigger headaches, correct?",q,MR. KENNY,start_answer
219,1040,54,12,Yes.,a,THE WITNESS,start_question
220,1041,54,13,"Those are all symptoms that represent someone that could have posttraumatic headaches, correct?",q,MR. KENNY,start_answer
221,1044,54,16,"Well, certainly that's possible, but that would then be a sort of a different diagnosis, whether it's a concussive headache or a posttraumatic headache.",a,THE WITNESS,start_question
222,1049,54,21,"Okay.  She also told you that she has trouble or difficulty maintaining attention, and she has some concentration issues, correct?",q,MR. KENNY,start_answer
223,1054,55,1,Yes.,a,THE WITNESS,start_question
224,1055,55,2,"And if I understand your testimony correctly, that kind of developed a little bit later on after her July 8, 2017 work injury, correct?",q,MR. KENNY,start_answer
225,1059,55,6,You're saying that she told me that that started later?,a,THE WITNESS,start_question
226,1061,55,8,Yeah.  Maybe I just misunderstood you.,q,MR. KENNY,start_answer
227,1063,55,10,"Yeah.  I don't think so.  I think she said that just after her fall, she had cognitive problems.",a,THE WITNESS,start_question
228,1066,55,13,Okay.,q,MR. KENNY,start_answer
229,1067,55,14,I don't remember there being a delay in that.,a,THE WITNESS,start_question
230,1069,55,16,"Okay.  Now, you did perform a neurological examination, correct?",q,MR. KENNY,start_answer
231,1071,55,18,Yes.,a,THE WITNESS,start_question
232,1072,55,19,"Okay.  And you talked about on direct that when you do that, you do a cranial nerve examination; is that correct?",q,MR. KENNY,start_answer
233,1076,55,23,Yes.,a,THE WITNESS,start_question
234,1077,55,24,You do a motor exam examination; that's also correct?,q,MR. KENNY,start_answer
235,1080,56,2,Yes.,a,THE WITNESS,start_question
236,1081,56,3,"And a sensory examination, correct?",q,MR. KENNY,start_answer
237,1083,56,5,Yes.,a,THE WITNESS,start_question
238,1084,56,6,Okay.  And you documented all of those tests and the results in that one paragraph on Page 3; is that correct?,q,MR. KENNY,start_answer
239,1087,56,9,Correct.,a,THE WITNESS,start_question
240,1088,56,10,"Okay.  And it was your testimony today, based on that clinical examination, that she had, in essence, a normal -- normal findings, no objective findings for the brain, the spine, or the nerves, correct?",q,MR. KENNY,start_answer
241,1094,56,16,Yes.,a,THE WITNESS,start_question
242,1095,56,17,"Okay.  And you also stated that the MRI of the brain was normal, correct?",q,MR. KENNY,start_answer
243,1097,56,19,That's correct.,a,THE WITNESS,start_question
244,1098,56,20,Did you review the films or just the report of that MRI of the brain?,q,MR. KENNY,start_answer
245,1100,56,22,Just the report.,a,THE WITNESS,start_question
246,1101,56,23,"Okay.  And you would agree, Doctor, as a neurologist, that you can have a normal MRI of the brain, and you can have a normal clinical neurologic examination, and still suffer from postconcussion syndrome and posttraumatic headaches; is that correct?",q,MR. KENNY,start_answer
247,1109,57,6,"That is correct, yes.",a,THE WITNESS,start_question
248,1110,57,7,"Now, you wrote in your report that you felt that -- I don't want to -- it's your opinion that ""almost all people recover from concussions in two to four months of treatment, and beyond that is excessive.""  You document that in your report, correct?",q,MR. KENNY,start_answer
249,1117,57,14,That's correct.,a,THE WITNESS,start_question
250,1118,57,15,Okay.  You actually make the analogy that it's similar to recovering from a right ankle sprain; is that correct?,q,MR. KENNY,start_answer
251,1122,57,19,That's correct.,a,THE WITNESS,start_question
252,1123,57,20,"And that's your opinion, that almost all people recover in two to four months from a concussion?",q,MR. KENNY,start_answer
253,1126,57,23,"Well, I think what I'm referring to is in this case.  There's obviously different types of concussions people have, and there's different histories people have. So if someone were to fall off a building 50 feet from the air and hit their head, that's considered a traumatic brain injury.  And if someone were to be on a motor cycle and be ejected at 70 miles an lower, hit a tree, that could also be a traumatic brain injury and a concussion. So there's different degrees of everything.",a,THE WITNESS,start_question
254,1141,58,13,Okay.,q,MR. KENNY,start_answer
255,1142,58,14,"When someone slips and falls, and hits their head on the ground, that type of concussion is certainly what we would consider self-limited, and, again, recovery would be expected in a few weeks to months. The analogy with the ankle is right if I'm playing basketball, and I twist my ankle, it would get better in a short period of time.  If I jumped off a building and broke my ankle, and fractured it into 20 different pieces, that would obviously be different, and the recovery would be longer.",a,THE WITNESS,start_question
256,1157,59,4,"Okay.  And you've obvious treated patients who had concussions and posttraumatic concussions that last four months, correct, depending on the circumstances?",q,MR. KENNY,start_answer
257,1162,59,9,Yes.,a,THE WITNESS,start_question
258,1163,59,10,"Okay.  And as you stated, it's expected, but it's really patient-specific how they recover; is that a fair statement?",q,MR. KENNY,start_answer
259,1166,59,13,"Yes, again, within a reasonable amount of time.  I mean, I see people all the time who are referred to me because their stories don't make sense to either their primary care doctor or a rehab doctor, or a sports medicine doctor, or an orthopedic doctor; people who have had concussive symptoms for longer than what would be expected and coming to me for a second opinion because the story doesn't make any sense.",a,THE WITNESS,start_question
260,1177,59,24,"Now, you went in detail through the medical records that you reviewed, and I'm just going to briefly go over a few things.  You talked about the Express Narberth records that are listed on Page 5?",q,MR. KENNY,start_answer
261,1184,60,6,Yes.,a,THE WITNESS,start_question
262,1185,60,7,"Okay.  She -- this was shortly after the accident, actually, the first three days.  She reported dizziness, nausea and imbalance at that time, correct?",q,MR. KENNY,start_answer
263,1190,60,12,Yes.,a,THE WITNESS,start_question
264,1191,60,13,"And those physicians actually diagnosed her with a concussion, correct?",q,MR. KENNY,start_answer
265,1193,60,15,That's correct.,a,THE WITNESS,start_question
266,1194,60,16,"Okay.  And then she also went to the facility Mid Atlantic Concussion Alliance, correct?",q,MR. KENNY,start_answer
267,1197,60,19,Yes.,a,THE WITNESS,start_question
268,1198,60,20,"And she had, actually, therapy for her concussion symptoms, is that correct, to your knowledge?",q,MR. KENNY,start_answer
269,1201,60,23,Yes.,a,THE WITNESS,start_question
270,1202,60,24,Do you know what type of therapy she had?,q,MR. KENNY,start_answer
271,1205,61,2,"Well, I believe the majority was -- I thought it was vestibular, sort of dealing with her balance.",a,THE WITNESS,start_question
272,1208,61,5,"Okay.  She went to the Jefferson Concussion Center in September of 2017, correct?",q,MR. KENNY,start_answer
273,1211,61,8,Yes.,a,THE WITNESS,start_question
274,1212,61,9,"Now, we're still two months after the work accident, still reporting headaches, nausea, tinnitus, t-i-n-n-i-t-u-s; is that correct?",q,MR. KENNY,start_answer
275,1216,61,13,Yes.,a,THE WITNESS,start_question
276,1217,61,14,"Okay.  And she was also doing therapy there as well, correct?",q,MR. KENNY,start_answer
277,1219,61,16,Yes.,a,THE WITNESS,start_question
278,1220,61,17,So she's still doing therapy two months or so after the work accident; is that correct?,q,MR. KENNY,start_answer
279,1223,61,20,Yes.,a,THE WITNESS,start_question
280,1224,61,21,"Okay.  And, again, she does go to see the Princeton Brain & Spine, and she's still reporting dizziness, memory problems and photophobia; is that correct?",q,MR. KENNY,start_answer
281,1229,62,1,Yes.,a,THE WITNESS,start_question
282,1230,62,2,"Okay.  And that's also through December of 2017, correct?",q,MR. KENNY,start_answer
283,1232,62,4,Yes.,a,THE WITNESS,start_question
284,1233,62,5,"So that's about four months after the work accident, correct?",q,MR. KENNY,start_answer
285,1235,62,7,Correct.,a,THE WITNESS,start_question
286,1236,62,8,"All these complaints that she was having regarding the dizziness, the headaches, the nausea, those are all consistent with those providers shortly after the work accident, correct?",q,MR. KENNY,start_answer
287,1241,62,13,That's correct.,a,THE WITNESS,start_question
288,1242,62,14,Okay.  You're not aware of any light duty work being offered to her; is that accurate?,q,MR. KENNY,start_answer
289,1245,62,17,"I'm not aware of that, no.",a,THE WITNESS,start_chat
290,1246,62,18,You're referring to the Employer?,side_chat,MR. BUCILLA,start_chat
291,1248,62,20,Yes.  I'm sorry.,side_chat,MR. KENNY,start_question
292,1251,62,23,You're not --,q,MR. KENNY,start_answer
293,1252,62,24,"No, I'm not.",a,THE WITNESS,start_question
294,1254,63,1,All right.,q,MR. KENNY,start_chat
295,1255,63,2,"That's all I have thanks, Doctor.",side_chat,MR. KENNY,symbols
296,1257,63,4,- - - REDIRECT EXAMINATION,symbols,,symbols
297,1259,63,6,- - -,symbols,,start_question
298,1261,63,8,"Just briefly in follow-up, Doctor.",q,MR. BUCILLA,start_answer
299,1263,63,10,Sure.,a,THE WITNESS,start_question
300,1264,63,11,"On cross, you went into this discussion about analogies between head injuries and ankle injuries.  Were your opinion concerning that some sort of consideration of the mechanism of injury that Ms. Daccardi had; is that what you were trying to explain?",q,MR. BUCILLA,start_answer
301,1271,63,18,Yes.  That's correct.,a,THE WITNESS,start_question
302,1272,63,19,"You mentioned a number of diagnoses apart from concussion, so we have to cover those now. Posttraumatic headaches was mentioned on cross, and traumatic brain injury was mentioned on cross.  Did you assign either of those diagnoses to her work incident in this case?",q,MR. BUCILLA,start_answer
303,1281,64,3,"No.  Although, by medical definition, a concussion is often used synonymously with a mild traumatic brain injury, so those are essentially the same thing.  I didn't use it in my report anywhere, but those are the same thing. That's different than someone who had a moderate or severe traumatic brain injury, which we are not talking about here.",a,THE WITNESS,start_question
304,1290,64,12,"And just to make sure I understood you correctly, when you say mild traumatic brain injury, is your diagnosis of a concussion inclusive of mild traumatic brain injury, then?",q,MR. BUCILLA,start_answer
305,1295,64,17,"I didn't put it anywhere in my report, but if you read medical literature, those two things are the same thing.  So, you could say someone has a headache and head pain.  The words in medicine are the same with all types of guidelines. Concussion and mild traumatic brain injury are the same thing.",a,THE WITNESS,start_question
306,1304,65,1,"If we were to assume that the Judge were to find in this case that she did have a mild traumatic brain injury with respect to this date of injury, do you have an opinion based on the information you had available to you in October of 2018 as to whether she had fully recovered at that point in time from any mild traumatic brain injury sustained?",q,MR. BUCILLA,start_answer
307,1313,65,10,"Definitely recovered, yes.  Same exactly thing.",a,THE WITNESS,start_question
308,1315,65,12,Did you assign any posttraumatic headache diagnosis to this incident?,q,MR. BUCILLA,start_answer
309,1317,65,14,"No.  So now we're just getting into language, but if someone hits their head and has headaches, usually you call that a posttraumatic headache.  If they have a concussion with headaches, usually the headaches fall under the concussion umbrella, so usually you don't say it's a posttraumatic headache.  But, again, we're just sort of splitting hairs here. You could also say that, you know, headaches are a part of concussion, so I think she recovered from all of those things.",a,THE WITNESS,start_question
310,1331,66,3,And is that opinion to within a reason a reasonable degree of medical certainty?,q,MR. BUCILLA,start_answer
311,1334,66,6,Absolutely.,a,THE WITNESS,start_chat
312,1335,66,7,No further questions.,side_chat,MR. BUCILLA,start_chat
313,1337,66,9,Okay.  Great. I have nothing further.  Thank you.,side_chat,MR. KENNY,symbols
314,1340,66,12,- - -,symbols,,is brackets
315,1341,66,13,(Witness excused.),brackets,,symbols
316,1342,66,14,- - -,symbols,,is brackets
317,1343,66,15,(Deposition concluded at 6:05 p.m.),brackets,,symbols
