,indice,page_number,line_number,text,text_type,speaker,time_added
0,0,0,0, and testified as follows ....,,,symbols
1,88,16,10,- - - DIRECT EXAMINATION,symbols,,symbols
2,90,16,12,- - -,symbols,,start_question
3,92,16,14,"Doctor, could you start off by stating your full name for the record, please.",q,MR. BUCILLA,start_answer
4,95,16,17,Lucas Margolies.,a,THE WITNESS,is brackets
5,96,16,18,(Document was marked for identification as Defendant's Deposition Exhibit Margolies No. 1.),brackets,,symbols
6,100,16,22,- - -,symbols,,start_question
7,102,16,24,I'm showing you a document that we've had the court reporter mark as D-Margolies-1.  Can you identify that for me?,q,MR. BUCILLA,start_answer
8,107,17,4,That's my C.V.,a,THE WITNESS,start_question
9,108,17,5,And is that a complete and accurate copy of your C.V.?,q,MR. BUCILLA,start_answer
10,110,17,7,"Yes, it is.",a,THE WITNESS,start_question
11,111,17,8,Could you briefly describe for the Judge your education.,q,MR. BUCILLA,start_answer
12,113,17,10,"I went to college at Emory University in Atlanta for four years.  Then I came back to Philadelphia, where I'm from, and I did four years of medical school at Temple University.  I did a one-year medical internship at the University of Pennsylvania, a three-year neurology residency at the University of Pennsylvania, and then a one-year neuromuscular fellowship also at Penn.",a,THE WITNESS,start_question
13,123,17,20,Are you Board Certified?,q,MR. BUCILLA,start_answer
14,124,17,21,"Yes, I am.",a,THE WITNESS,start_question
15,125,17,22,And in what area?,q,MR. BUCILLA,start_answer
16,126,17,23,Neurology.,a,THE WITNESS,start_question
17,127,17,24,And since when have you held that?,q,MR. BUCILLA,start_answer
18,130,18,2,Since 2000.,a,THE WITNESS,start_question
19,131,18,3,Could you briefly describe for the Judge your clinical practice?,q,MR. BUCILLA,start_answer
20,133,18,5,"Sure.  I have an office practice that I'm at Monday through Friday where I see out patients, and then typically once a week and then about once every fourth weekend, I cover the hospital so I, obviously, see the more acute and sicker patients.",a,THE WITNESS,start_question
21,140,18,12,"If I were to ask you additional questions as it pertains to your education, your scholastic efforts, your practice, would your testimony be consistent with what you've set forth in your Curriculum Vitae?",q,MR. BUCILLA,start_answer
22,146,18,18,Yes.,a,THE WITNESS,start_question
23,147,18,19,"Without getting any into specifics yet, did you perform an independent neurological evaluation concerning Christy Daccardi, the Claimant in this case?",q,MR. BUCILLA,start_answer
24,151,18,23,"Yes, I did.",a,THE WITNESS,start_chat
25,152,18,24,"And at this time, I'm going to ask that the C.V. be attached to the transcript, and I move for its admission. And I would offer the Doctor to testify as one of the Employer's experts in this matter subject to any questions that Mr. Kenny has on qualifications at this time.",side_chat,MR. BUCILLA,start_chat
26,164,19,11,"I don't have any questions for the Doctor on qualifications, and I don't have any objection to attaching the C.V. as well.  Thanks.",side_chat,MR. KENNY,start_question
27,170,19,17,"Doctor, your evaluation of Ms. Daccardi, on specifically what date did that occur?",q,MR. BUCILLA,start_answer
28,173,19,20,"October 3rd, 2018.",a,THE WITNESS,start_question
29,174,19,21,"On October 3rd of 2018, did you receive a history from Ms. Daccardi?",q,MR. BUCILLA,start_answer
30,176,19,23,Yes I did.,a,THE WITNESS,start_question
31,177,19,24,"Could you describe that history for the Judge, please?",q,MR. BUCILLA,start_answer
32,180,20,2,"Sure.  She said that about 15 months earlier, so July 8th, 2017, she was involved in an accident.  She said that she was a restaurant manager, and she was walking between rooms when she slipped on a rug and fell onto her right side.  She said that she hit her head and her shoulder, and then landed on her butt. She said that she blacked out for a brief period of time, meaning that she had lost consciousness.  She reported that when she came to, she was sort of helped up by coworkers and was taken to an Urgent Care center.  She thought at that time that she was suffering from headaches, dizziness, nausea, vomiting and imbalance. She said she was diagnosed as having a concussion and was sent to a concussion specialist, who then sent her for different modalities of treatment, and she was given different medications for the symptoms that she had. In addition, she said that she had musculoskeletal injuries on top of her concussion.  She went to the Einstein Neuroscience Center where she was evaluated by a psychiatrist.  She was evaluated by an another concussion specialist and again received more types of therapy.  She said that after her fall, she began to experience headaches. She said that she really didn't have a significant history of headaches, and after her fall, she developed headaches which had not improved at all.  So, in the 15 months between her accident and me seeing her, her headaches had not improved. She said that with the headaches, she can experience symptoms like nausea, and that bright lights and loud noises bother her. She also reported that following her injury, she had imbalance, and her imbalance had only improved about 30 percent. Next she said that she had cognitive problems, so she had difficulty with her memory, maintaining her attention, concentration, and up to ten times a day, she would completely forget what she was doing.  Unusually, she reported that her cognition was actually getting worse.  I asked her if she had received any sort of formal cognitive or neuropsychological evaluation or therapy, and she didn't think that she had had any. I asked her, you know, did she think it was unusual that some of her symptoms were actually getting worse, and she said that she didn't really have an explanation for why that would occur.  She knew concussions typically get better, and she had said usually more on the sooner side than the later side.  But now, here we were 15 months out, and her memory and cognition were getting worse.  And, again, she couldn't explain sort of that inconsistency. She also reported that she developed tinnitus or ringing in her ears, and she said that too had been getting worse.  Again, there was no explanation how that could be getting worse, and she hadn't been evaluated by an ears, nose and throat doctor. I had asked her if she had been involved in any other accidents, and she said that when she was 14, she got thrown off of a horse, hit her head and had a concussion for about three months.  And in 1986, she had a car accident, and while she did hit her face, she didn't think she had a concussion at that time.",a,THE WITNESS,start_question
33,265,23,12,Did she tell you about any other more recent injuries besides this work injury?,q,MR. BUCILLA,start_answer
34,268,23,15,"No, she did not.",a,THE WITNESS,start_question
35,269,23,16,Did you receive any sort of past surgical history?,q,MR. BUCILLA,start_answer
36,271,23,18,"Yes.  So from a medical perspective, she said that she didn't have any long medical problems, but that she had had two surgeries.  One was an appendectomy, and the other was back surgery to her lumbar spine in 1993.",a,THE WITNESS,start_question
37,277,23,24,Did you receive a social history?,q,MR. BUCILLA,start_answer
38,279,24,1,"Yes.  She said that she was single and had one child.  She denied any history of drinking, smoking or drug use, and she had not returned to work in those 15 months.",a,THE WITNESS,start_question
39,284,24,6,"On October 3rd, 2018, did you perform a physical examination?",q,MR. BUCILLA,start_answer
40,286,24,8,"Yes, I did.",a,THE WITNESS,start_question
41,287,24,9,"Could you describe that for the Judge, please?",q,MR. BUCILLA,start_answer
42,289,24,11,"Sure.  So the whole purpose of a neurologic evaluation is to assess the brain, the spine and the nerves, so we evaluate someone's cognition.  While we don't do a formal neuropsychological evaluation, there's obviously not enough time.  We assess someone's thinking, their language. Next we move on to the cranial nerve examination where we evaluate the nerves that control your vision, your eye movements, your facial movements, the movement of your mouth and tongue. Next we go on to a motor examination where we evaluate someone's power, the strength in their arms and legs. We do a sensory examination where we look at the sensation to different modalities like touch and temperature, vibration. Next we check someone's ability to move their arms and legs in a coordinated fashion.  We have someone walk, and we evaluate their gait.  And then we finish up with the reflexes.  We take good old reflex hammer and check the reflexes in the arms and legs, and her evaluation was pretty unremarkable.  There's no evidence on her exam that she had any injury to her brain or spine, or nerves.",a,THE WITNESS,start_question
43,319,25,16,"As part of your evaluation, did you have records available for your review?",q,MR. BUCILLA,start_answer
44,322,25,19,"Yes, I did.",a,THE WITNESS,start_question
45,323,25,20,"And did you have available the Judge's decision from December 12th, 2017, Doctor?",q,MR. BUCILLA,start_answer
46,326,25,23,Yes.,a,THE WITNESS,start_question
47,327,25,24,"You mentioned previously, a moment ago, that her physical neurologic examination was unremarkable.  Were there any objective findings on your examination of ongoing concussion?",q,MR. BUCILLA,start_answer
48,333,26,5,"No, there weren't.",a,THE WITNESS,start_question
49,334,26,6,"As part of the records you had available for your review, did they include preinjury records from December 2016 from Jefferson Urgent Care?",q,MR. BUCILLA,start_answer
50,338,26,10,Yes.,a,THE WITNESS,start_question
51,339,26,11,Did they include records for three dates of service from PA Internal Medicine & Geriatrics?,q,MR. BUCILLA,start_answer
52,342,26,14,Yes.,a,THE WITNESS,start_question
53,343,26,15,"Did they include records from Bryn Mawr Hospital Emergency Room on March 24th, 2017, Doctor?",q,MR. BUCILLA,start_answer
54,346,26,18,Yes.,a,THE WITNESS,start_question
55,347,26,19,From Aria 3B Orthopaedics from May 2017?,q,MR. BUCILLA,start_answer
56,349,26,21,Yes.,a,THE WITNESS,start_question
57,350,26,22,From Doctors Express from the date of injury and from another visit two days later?,q,MR. BUCILLA,start_answer
58,354,27,1,Correct.,a,THE WITNESS,start_question
59,355,27,2,From Bucks County Orthopedic Specialists from July and August of 2017?,q,MR. BUCILLA,start_answer
60,357,27,4,Yes.,a,THE WITNESS,start_question
61,358,27,5,From Mid Atlantic Concussion Alliance from July 2017 through June 2018?,q,MR. BUCILLA,start_answer
62,360,27,7,Yes.,a,THE WITNESS,start_question
63,361,27,8,"From Greater Philadelphia Pain Management, August 2017 through July 2018?",q,MR. BUCILLA,start_answer
64,363,27,10,Yes.,a,THE WITNESS,start_question
65,364,27,11,"From Jefferson Concussion Center, September 11th, 2017?",q,MR. BUCILLA,start_answer
66,366,27,13,Yes.,a,THE WITNESS,start_question
67,367,27,14,"Records from Dr. Schwartz from September and October 2017, and an operative note from April 2018?",q,MR. BUCILLA,start_answer
68,370,27,17,Yes.,a,THE WITNESS,start_question
69,371,27,18,And records from Dr. Shah from September and December 2017?,q,MR. BUCILLA,start_answer
70,373,27,20,Yes.,a,THE WITNESS,start_question
71,374,27,21,Records from Dr. Kamen from November 2017 through July 2018?,q,MR. BUCILLA,start_answer
72,376,27,23,Yes.,a,THE WITNESS,start_question
73,377,27,24,A December 2017 report from Dr. Glaser?,q,MR. BUCILLA,start_answer
74,380,28,2,Yes.,a,THE WITNESS,start_question
75,381,28,3,"A June 2018 report from Dr. Kalra, K-a-l-r-a?",q,MR. BUCILLA,start_answer
76,383,28,5,Yes.,a,THE WITNESS,start_question
77,384,28,6,Physical therapy notes from September 2017 through October 2017?,q,MR. BUCILLA,start_answer
78,386,28,8,Yes.,a,THE WITNESS,start_question
79,387,28,9,And additional physical therapy notes from December 2017 through April 2018?,q,MR. BUCILLA,start_answer
80,390,28,12,Yup.,a,THE WITNESS,start_question
81,391,28,13,"Occupational therapy notes from June 2018 through July 2018, Doctor?",q,MR. BUCILLA,start_answer
82,393,28,15,Yes.,a,THE WITNESS,start_question
83,394,28,16,"Very briefly, did you have any studies available such as MRIs, X-rays, Doctor?",q,MR. BUCILLA,start_answer
84,397,28,19,"Yes, I did.",a,THE WITNESS,start_question
85,398,28,20,Any studies concerning the head or brain?,q,MR. BUCILLA,start_answer
86,400,28,22,Yes.  There was an MRI of the brain from August 8th of 2017.,a,THE WITNESS,start_question
87,402,28,24,"And what did you glean upon your review of the August 8, 2017 MRI of the brain?",q,MR. BUCILLA,start_answer
88,406,29,3,"That was normal.  There was a single white spot, which is normal.  As an individual ages, it's what we would consider an incidental finding of no significance, not related to trauma, and asymptomatic.",a,THE WITNESS,start_question
89,412,29,9,What did you glean upon your review of the records from Jefferson Urgent Care?,q,MR. BUCILLA,start_answer
90,415,29,12,"Those records indicated that prior to this occurrence, she had a history of spine injury and surgery, as well as anxiety and depression.",a,THE WITNESS,start_question
91,419,29,16,"What did you glean upon your review of the records from Doctors Express Narberth from July 8 and July 10, 2017?",q,MR. BUCILLA,start_answer
92,423,29,20,"So she initially presented, you know, after her accident, and at that time, they were the first doctors that evaluated her.  She denied any loss of consciousness. She denied any cognitive problems like trouble with her memory.  She said that she fell and hit her head, and had dizziness, nausea and imbalance. They did a review of systems where they asked her a lot of other question, and it was normal.  And her examination was normal.  Again, those are the first doctors that she sees, and she's denying at that time any loss of consciousness or cognitive issues.",a,THE WITNESS,start_question
93,439,30,11,What did you glean upon your review from the records from her primary care physician at PA Internal Medicine & Geriatrics?,q,MR. BUCILLA,start_answer
94,443,30,15,"Those records indicated that she had a history of not only chronic back -- chronic back pain, she was a chronic pain patient who was taking medications well before this.  She also had a history of headaches which had preceded this accident, and that she had been involved in a slip and fall, which she did not disclose to me.",a,THE WITNESS,start_chat
95,451,30,23,Can you give an offer of proof of when the slip and fall happened?  Do you know? You're talking about a slip and fall that happened before the accident.  I'd just like an offer of proof.  When is that?,side_chat,MR. KENNY,start_chat
96,461,31,8,I think that --,side_chat,THE DOCTOR,start_chat
97,462,31,9,From the Doctor or from me?,side_chat,MR. BUCILLA,start_chat
98,464,31,11,Any of you. You're saying there's a slip and fall before the work accident. Can you give a date?,side_chat,MR. KENNY,start_chat
99,468,31,15,"The slip and fall is from March 24th, 2017, consistent with the Claimant's testimony on Page 14 of her transcript where she said she did --",side_chat,MR. BUCILLA,start_chat
100,474,31,21,Okay.  Thank you.,side_chat,MR. KENNY,start_question
101,477,31,24,"Doctor, what did you glean upon your review of the report from Jefferson Concussion Center from September 11th, 2017?",q,MR. BUCILLA,start_answer
102,482,32,4,"So that was another report in which she documented that there was no loss of consciousness, and that she did have these symptoms of headache, nausea and ringing in her ears.  And that, otherwise, her history and exam were benign.",a,THE WITNESS,start_question
103,488,32,10,What did you glean upon your review of the records available from Princeton Brain and Spine?,q,MR. BUCILLA,start_answer
104,491,32,13,"So they had been treating her for some time for chronic pain dating back to a motor vehicle accident that occurred in what they said was 2003.  They said that she was involved in this accident, and that she, again, initially reported that she did not loss consciousness.  And that she had numerous subjective complaints such as headaches; bright lights and loud noises bothered her; memory loss and dizziness. She was receiving different modalities of therapy, and then later in other records, it reported that she had a history of not only chronic pain, but she had a history of migraine headaches.  She had a history of multiple mood issues including depression.  She had posttraumatic stress disorder. And, then, now her story was changing, and she said she did loss consciousness.  So in realtime, it appeared the medical records documented that initially, she said she did not lose consciousness, did not have any cognitive issues.  Then, with time, it was unclear if she lost consciousness, and now she's saying she did lose consciousness. She also had the history of prior drug abuse, which she had denied to me, and she had a history of numerous psychosocial stressors in her life.",a,THE WITNESS,start_question
105,523,33,20,What did you glean upon your review of the records from Mid Atlantic Concussion Alliance?,q,MR. BUCILLA,start_answer
106,526,33,23,"So they evaluated her for approximately one year, and those medical records were interesting in that many of her symptoms in those records were documented as continually improving as they saw her.  And some of the symptoms that she reported had actually resolved, when she told me that really nothing was improving. I think the only thing that she told me that was a little bit better was her imbalance, but her headaches had not improved.  Her cognitive dysfunction was actually getting worse, and the ringing in her ears were getting worse. Those medical records also indicated that she was receiving different types of medications for treatment and different modalities of therapy, and, you know, they were also using very, sort of, crude tests for cognitive functioning, what's called an ""Impact Test.""  If someone really is worried about someone's cognition, often they'll be sent for a formal neuropsychological evaluation and have formal cognitive therapy.  Impact testing is really just sort of a screen typically used for individuals who play sports.",a,THE WITNESS,start_question
107,556,35,3,"And as part of your review of Dr. Kamen's records, did you have, within those, any records from Dr. Watanabe as of your evaluation?",q,MR. BUCILLA,start_answer
108,560,35,7,Yes.  Those medical records indicated that she was actually sleeping quite well --,a,THE WITNESS,start_chat
109,563,35,10,"Can we just put a date for the record, and who is the doctor, again, Watanabe?",side_chat,MR. KENNY,start_chat
110,567,35,14,"Watanabe, W-a-t-a-n-a-b-e.",side_chat,THE DOCTOR,start_chat
111,569,35,16,So it's not in his report?,side_chat,MR. KENNY,start_chat
112,571,35,18,It was included in the Kamen records.,side_chat,THE DOCTOR,start_chat
113,573,35,20,On Number 16.,side_chat,MR. BUCILLA,start_chat
114,575,35,22,"Oh, Dr. Kamen's records.  Okay.",side_chat,MR. KENNY,start_chat
115,577,35,24,"So that date was June 20th, 2018, I believe.",side_chat,THE DOCTOR,start_question
116,581,36,3,"And what did you glean concerning just the history portion of the records from June 20, 2018?  What was Claimant reporting in terms of her activity level to Dr. Watanabe at that point in time?",q,MR. BUCILLA,start_answer
117,586,36,8,"She reported that she was getting a lot of sleep, between seven and seven-and-a-half hours of sleep, without interruption, and that she was waking up feeling well rested.  She said that she was active, you know, cooking, walking her dogs, doing yard work, and she said that she was cleaning her grandmother's house out.  And she was active again, going to stores, cooking, going to Doctor's appointments. She said that she had recently visited her family in California and was considering moving there long-term in what she considered about six months from that point.  She was, again, fixing up her grandmothers house because she was planning on selling it and, again, moving from Philadelphia to California.",a,THE WITNESS,start_question
118,606,37,3,"Doctor, based upon the history that you received from Ms. Daccardi, your review of records, the MRI of the brain, your examination from October 3rd, 2018, can you tell the Judge what was your diagnosis?",q,MR. BUCILLA,start_answer
119,612,37,9,"My diagnosis was that, you know, if she indeed fell and hit her head, whether she did or didn't lose consciousness, it was certainly possible that she had a concussion.",a,THE WITNESS,start_question
120,617,37,14,"Did you have an opinion as of October 3rd, 2018, to within a reasonable degree of medical certainty, as to whether she had fully recovered from the concussion sustained at work in July of 2017?",q,MR. BUCILLA,start_answer
121,622,37,19,Yes.  I did think she recovered fully.,a,THE WITNESS,start_question
122,624,37,21,Do you have an opinion as to whether she had any ongoing work restrictions relative to her head injury from July of 2017?,q,MR. BUCILLA,start_answer
123,629,38,1,"No.  I don't think she required any testing or treatment, or had any restrictions.",a,THE WITNESS,start_question
124,632,38,4,"Did she require any further medical treatment at all, did you have an opinion, as of October 2018?",q,MR. BUCILLA,start_answer
125,635,38,7,No more treatment.,a,THE WITNESS,start_question
126,636,38,8,"Briefly, for the Judge, just explain why was it your opinion that she had fully recovered from any concussion sustained from this work accident?",q,MR. BUCILLA,start_answer
127,640,38,12,"Well, to begin with, a concussion is like the vast majority of traumatic injuries which gradually improve with time. She's an individual who literally slipped and fell, and hit her head at work.  We know that these types of concussions improve.  Just like an ankle sprain over a short period of time, some people get better within a few days, and some people, it takes a few weeks, maybe a few months. But certainly at 16 months, the natural history of a concussion is that she would be better. In addition, all of the testing that she had was objectively normal, and her physical examination was completely normal. Next, all of the medical records sort of documented that her condition, as we would expect, was not only slowly improving, but her activity level was one that you would expect in an individual who had recovered.  She was performing all of her, what we call, activities of daily living.  She's washing, dressing, cooking, cleaning, managing her finances, driving, going to doctors appointments.  Not only that, she's probably being more active than most people.  She's cleaning her grandmother's home.  She's planning to move to California. So, it was my opinion that, you know, she had fully recovered, and no more testing or treatment was needed.",a,THE WITNESS,start_question
128,675,39,22,"Since your evaluation, have you had the chance to review additional occupational therapy notes from August of 2018?",q,MR. BUCILLA,start_answer
129,680,40,2,Yes.,a,THE WITNESS,start_question
130,681,40,3,And what did you glean upon your review of the occupational therapy records from August of 2018?,q,MR. BUCILLA,start_answer
131,684,40,6,"Well, there's a record from August 21st of 2018 which reported that she had met her cognitive goals, and that she had had strategies to manage her symptoms.  And that she had improved and was able to handle any sort of stress and challenges that would come her way, and she was given resources for her to, essentially, return to work.  And that they didn't think that additional treatment was indicated.",a,THE WITNESS,start_question
132,694,40,16,"Did that report cause you to alter any of the opinions that you came to on October 3rd, 2018?",q,MR. BUCILLA,start_answer
133,697,40,19,"No.  It just further supported the fact that the people who were treating her felt like she was making improvements, and she didn't require additional treatment. And she could go back to sort of being active.",a,THE WITNESS,start_question
134,704,41,1,"Since your evaluation, have you had the chance to review any updated reports for any visits of Dr. Watanabe?",q,MR. BUCILLA,start_answer
135,707,41,4,"Yes, I did.",a,THE WITNESS,start_question
136,708,41,5,And what was the date of service?,q,MR. BUCILLA,start_answer
137,709,41,6,"That was March 6th of this year, 2019.",a,THE WITNESS,start_question
138,711,41,8,"And in terms of the history she provided Dr. Watanabe on March 6th of 2019, what did you glean upon review of the history in terms of her activity level?",q,MR. BUCILLA,start_answer
