,indice,page_number,line_number,text,text_type,speaker,time_added
124,736,28,21,"I felt that based on records reviewed, signs, symptoms, my own exam, as well as imaging, diagnostic studies such as the MRI and EMG which are objective findings, I felt that Ms. Gebeyaw sustained specifically five injuries that continue to bother her and one that I felt was resolved. I felt that the shoulder sprain and strain and the mid and low back sprain and strain, thoracic lumbar sprain and strain, has resolved and certainly did not bother her at the time of my evaluation and did not continue to present any issues. However, more importantly and more seriously, the injuries that continued to bother her was the right sided disc herniation as C3/4 with an EMG confirmed right C4 radiculopathy.  The occipital neurology or the pain in the back of the head.  Cervicalgia, also known as neck pain, cervical whiplash, and aggravation of preexisting cervical degenerative disc disease.",a,THE WITNESS,start_question
125,759,29,18,"Now, what exactly is a herniation?",q,MS. STURGES,start_answer
126,761,29,20,"I really wish I had my model here so I'm going to subject the jury and his or her honor to my drawings.  This is the cross section of the disc.  I guess it's, like, a jelly or a Boston cream donut.  This is the jelly, this is the center of the disc, this is the ring (indicating). When the patient is healthy, the disc is fine.  When we're young, discs are nice and plump.  They are tall.  There is nothing bothering them.  However, when you get -- as you can see when you get in a car accident, such as this, you get hit and the spine suffers.  So disc can herniate out.  As you can see here, the disc herniates out and it's pressing on the nerve.  This is what is called herniation or radiculopathy.  When we typically describe the discs, we can say there is different degrees of bulging, protrusion, or herniation, and it gets progressively worse. Bulging can be signs of normal aging.  Three out of ten people in the room will have some bulges they may not even know about.  So if we have 12 jurors, you know, three, four of them may have disc bulges depending on their age, also depending what type of activity you do.  As you get older, you develop some arthritis and they can develop into protrusion. But herniations are not normal. It's never a sign of normal aging.  It just doesn't sit there where bulges can be there and what I described as asymptomatic.  Meaning, it's there.  You don't know how about it.  It's just there.  If you get an x-ray or MRI, you found the bulge so it doesn't bother you. Herniations are symptomatic.  They are painful. So that's the big difference.",a,THE WITNESS,start_question
127,801,31,8,And one of the other terms that I wanted to ask you about was radiculopathy. Can you explain to the jury what exactly you mean by that.,q,MS. STURGES,start_answer
128,805,31,12,"Radiculopathy is a fancy term for nerve damage.  We diagnosis radiculopathy based on the EMG.  So you really need both. When you do an MRI, MRI is an awesome test, but at the end of the day it's a snapshot in time. It's a picture.  That's all it tells you.  You can look at the MRI, you can try to put a timestamp on it.  You can say, well, there is some arthritis so that was there for a while. There is no arthritis surrounding disc herniation so it's newer.  It's fresher than the other stuff before.  But you can't put a specific timestamp.  You can't say that the herniation occurred on April 2nd.  You just can't do that.  Or whatever the date of the accident is. But you could say, it's acute, subacute, or chronic.  So that's where the EMG comes in.  Because what an MRI shows you, there is some pressure on the nerve root.  It doesn't tell you how much nerve damage is there.  EMG or nerve conduction study gives you a quantitative analysis of how much nerve damage is there without getting specific terms, like, all this fancy stuff.  You can call it mild, moderate, or severe amount of nerve damage. And you can give it, again, more, much closer timeframe, six weeks, three months, six months. So you can try to correlate it together.  You should probably never perform EMG when patient doesn't have pain down the arm or the MRI is negative.",a,THE WITNESS,start_question
129,838,32,19,"Okay.  And, Doctor, out of all the injuries you listed, what are the most serious in your opinion?",q,MS. STURGES,start_answer
130,841,32,22,The C3/4 herniation with the C4 radiculopathy.,a,THE WITNESS,start_question
131,843,32,24,And why is that?,q,MS. STURGES,start_answer
132,844,32,25,"Well, that's permanent in nature.  Radiculopathy means it's permanent because there is permanent nerve damage and a herniation that size just physiologically it's not going to resolve.",a,THE WITNESS,start_question
133,850,33,5,"Now, do you have an opinion to a reasonable degree of medical certainty as to the extent or seriousness of any of the other injuries that you just described for the jury?",q,MS. STURGES,start_answer
134,854,33,9,"They are serious and they are related to this.  Aside from the sprain and strain in the low back and the shoulder, which has resolved, I would say they are a little bit less serious than the herniation.  I'm not sure I understood the question correctly.",a,THE WITNESS,start_question
135,860,33,15,"I think you answered, Doctor.  I know you talked about permanency just a minute ago.  Could you just clarify for the jury what injuries, if any, are permanent as a result of this accident.",q,MS. STURGES,start_answer
136,865,33,20,C3/4 herniation with a C4 radiculopathy is permanent.,a,THE WITNESS,start_question
137,867,33,22,And do you have any opinion as to a reasonable degree of medical certainty as to the cause of the injuries that you have described?,q,MS. STURGES,start_answer
138,872,34,1,"Yes.  Based on timing, based on records reviewed, based on the fact the patient did not have any significant preexisting medical history aside from one car accident a few years -- four or five years ago, she specifically denied any neck pain or any issues predating the car accident in question in 2017. We know that there was nothing else causing this.  So we have this one specific event, the car accident.  Then we have this pain going down the arm.  Get the MRI, which shows some preexisting arthritis, which was no doubt there before.  But the 3/4 herniation, which is large in size and does not have any disc osteophyte complex, meaning it doesn't have any arthritis surrounding that disc making it acute more than chronic, which means it's more likely to be correlated with the accident and then it correlates with the EMG, which again doesn't show that the nerve damage hasn't been there for years and years.",a,THE WITNESS,start_question
139,893,34,22,"Now, Doctor, I know you've already touched upon this a little bit, but could you explain for the jury just a review of the records that you reviewed pertaining to Ms. Gebeyaw.",q,MS. STURGES,start_answer
140,899,35,2,"Aside from my own discussion of the car accident with the patient, how she was sideswiped, I reviewed the records from PennDel Rehab, from the therapy as well as a short summary from Dr. Whalen.  I reviewed the EMG nerve conduction study, both the raw data and the report from Dr. Rosin.  I do agree with his findings.  As well as the MRI where I reviewed the actual images of the study in addition to the radiology report.",a,THE WITNESS,start_question
141,909,35,12,"And in terms of reviewing -- for the EMG, I know you mentioned you reviewed the actual raw data, if you will.  Why is it important to review that?",q,MS. STURGES,start_answer
142,913,35,16,"Well, from me being a physiatrist because I do EMGs in my office, I am able to review the data and see if I agree with the other doctor or not, see if anything was missed.  If any other doctor reviewed it who doesn't know how to do EMGs, they probably just look at the report.",a,THE WITNESS,start_question
143,920,35,23,"And in terms of an EMG, I know you were talking about radiculopathy earlier, can you explain a little bit more in terms of radicular complaints.  Are they constant a occurrence or can they come and go?",q,MS. STURGES,start_answer
144,926,36,3,"Radicular complaints wax and wane depending on the amount of nerve irritation, depending on position.  For example, this patient had a positive Spurling's test.  Spurling's test is when you put a patient's head back and twist it and tilt it and you press on top of the head.  When you do that you compress spaces where nerves come out. If you do it on a healthy patient, you have enough space for the nerve to flow.  When you compress it, nothing is going to happen.  Maybe some, whatever, neck discomfort, but nothing shooting down.  A positive Spurling's test, when you compress it and the area is already compromised from the herniated disc, now you're really squashing that nerve.  So you will get the shooting pain down the arm.  And in this case, it went into the upper arm and the shoulder, which is the C4 nerve distrubution.",a,THE WITNESS,start_question
145,946,36,23,"And in reference to the diagnostic testing that you've been speaking about, particularly the MRI and the EMG, are they objective tests?",q,MS. STURGES,start_answer
146,951,37,2,"As I testified earlier, objective tests.  Patient cannot fake those tests.  In medicine we have something called Waddell's testing.  Waddell's testing is the constellation of five tests that we use to see if the patient is faking, symptom magnifying, or exaggerating like they are trying to pull a fast one on you. At least in my practice I try to perform the same test twice.  Once when the patient knows it and another time when I'm pretending to examine something else and I'm still performing the same test.  And in this case, I didn't find negative Waddell signs. Meaning, patient's physical exam was consistent with the findings.  I try to objectify physical exam findings. And in contrast, the MRI and EMG, patient cannot fake.  MRI is an MRI. Patient as no effect on the discs.  EMG patients are asked to squeeze the arm or make and do biceps.  But if the patient is going like this and nothing is happening, you can actually see the lack of effort in the study. So you can call the patient out for faking that on there.",a,THE WITNESS,start_question
147,978,38,3,"And, Doctor, when she visited you in April of 2018, was Ms. Gebeyaw still having complaints of pain from this accident?",q,MS. STURGES,start_answer
148,981,38,6,Yes.  In regards to her neck going to the shoulder.,a,THE WITNESS,start_question
149,983,38,8,Okay.  And did you make any recommendations for any future medical treatment?,q,MS. STURGES,start_answer
150,986,38,11,"Yes.  We discussed a need for future care.  Specifically starting with a cervical epidural because that would be the next appropriate step.  You never start with an epidural on day one.  You follow the treatment protocol, you go to the ER, you see a doctor, you get medications, antiinflammatories, muscle relaxers, you do some therapy, you do some studies.  And finally when nothing gets better about four, five, six months, that's when you should go for the injection. In this case, for future care, I described in my report that future care for this diagnosis specifically includes further diagnostic studies.  Meaning, depending on the progression of the disease, patient would be a candidate for an MRI and an EMG of the neck within three to five years.  Patient would be a candidate for repeat course of therapy, as well as a repeat course of epidural injections.",a,THE WITNESS,start_question
151,1007,39,6,And why is it important that in instances like this you would recommend for repeat testing?,q,MS. STURGES,start_answer
152,1010,39,9,"Well, to see how much the condition progressed, how much has it changed. You don't expect it to get better, but you can expect it to get worse with age.  And to see if patient becomes a surgical candidate.  God forbid it starts pressing the spinal canal or disc herniation continues and goes further out, becomes a neurologic emergency or surgical emergency or emergency where you need to get a surgeon or perform an injection.  Maybe not a surgery, but an injection at least and it's not an option.  It's not, well, I'll think about it, but, hey, we need to do this or you're going to risk losing something.",a,THE WITNESS,start_question
153,1024,39,23,"And, Doctor, did you come up with a prognosis for Ms. Gebeyaw?",q,MS. STURGES,start_answer
154,1026,39,25,"I did as I do for all my patients.  As I testified earlier on direct, when patients come to me as a specialist, they come to me for prognosis.",a,THE WITNESS,start_question
155,1031,40,4,And what exactly was your prognosis here?,q,MS. STURGES,start_answer
156,1033,40,6,"I felt my prognosis was guarded to poor as this condition is permanent and I don't expect it to get better.  Given her age, I actually expect it to get worse, impacting her further functional ability.",a,THE WITNESS,start_question
157,1038,40,11,"And, Doctor, do you have an opinion to a reasonable degree of medical certainty, as to the reasonableness and necessity of all the treatment that Ms. Gebeyaw received following this incident?",q,MS. STURGES,start_answer
158,1043,40,16,Yes.  I felt it was reasonable and necessary.  As we didn't jump to injections on day one.  We followed the treatment protocol from the least invasive to most invasive.,a,THE WITNESS,start_question
159,1047,40,20,"Okay.  And one last question here, Doctor.  Have you given all of your opinions today to a reasonable degree of medical certainty?",q,MS. STURGES,start_answer
160,1051,40,24,"Yes, ma'am.",a,THE WITNESS,start_question
161,1052,40,25,"Thank you, Doctor.",q,MS. STURGES,start_chat
162,1054,41,1,Your witness.,side_chat,MS. STURGES,symbols
163,1055,41,2,- - - CROSS EXAMINATION,symbols,,symbols
164,1057,41,4,- - -,symbols,,start_question
165,1059,41,6,"Doctor, how many times did you see the plaintiff?",q,MR. SHUEY,start_answer
166,1061,41,8,"Once, sir.",a,THE WITNESS,start_question
167,1062,41,9,"And that was on April 2, 2018?",q,MR. SHUEY,start_answer
168,1063,41,10,Correct.,a,THE WITNESS,start_question
169,1064,41,11,And you haven't seen the plaintiff since then?,q,MR. SHUEY,start_answer
170,1066,41,13,I have not seen Ms. Gebeyaw since then.,a,THE WITNESS,start_question
171,1068,41,15,Have you spoken with the plaintiff since then?,q,MR. SHUEY,start_answer
172,1070,41,17,No.,a,THE WITNESS,start_question
173,1071,41,18,"Okay.  So that was a year and five months ago, the only time that you saw the plaintiff.  Is that about right?",q,MR. SHUEY,start_answer
174,1074,41,21,Yes.,a,THE WITNESS,start_question
175,1075,41,22,"And at the time we previously discussed you wrote your report -- I'm sorry. July 25, 2019, so that would be about a year and four months between the time you saw the plaintiff and wrote your report?",q,MR. SHUEY,start_answer
176,1081,42,2,Correct.  I was trying to do the math on my fingers.,a,THE WITNESS,start_question
177,1083,42,4,"Now, when you saw the plaintiff, how did you communicate with her?",q,MR. SHUEY,start_answer
178,1085,42,6,"I don't recall.  I'm sure if patients don't speak English, we have a translator.  At this point, I honestly don't recall.",a,THE WITNESS,start_question
179,1089,42,10,"Okay.  Do you know, is that translator normally a family member or somebody else or in this case you just simply can't recall?",q,MR. SHUEY,start_answer
180,1093,42,14,"I don't recall, but we have an office translator 99 percent of the time.",a,THE WITNESS,start_question
181,1095,42,16,"In this case, Ms. Gebeyaw speaks a language from Ethiopia or Eritrea.  Would you have a language translator in your office for that?",q,MR. SHUEY,start_answer
182,1099,42,20,"No, we don't.  It's funny you say -- actually, in Allentown I do.  But here, someone from the hospital -- we also utilize translation machines or hospital translators, but those are notoriously difficult in a situation like this.  Frankly, I don't recall which translator was utilized.  I guarantee it was family member.  Sometimes we even utilize a phone.  Like I said, I don't recall what we did in this instance.",a,THE WITNESS,start_question
183,1110,43,5,"Okay.  Now, from your review of the records in this case, would you agree with me that her last physical therapy was in March of 2018?",q,MR. SHUEY,start_answer
184,1114,43,9,Correct.  March 27th.,a,THE WITNESS,start_question
185,1115,43,10,"And then she had her EMG test, which you discussed, in March of 2018?",q,MR. SHUEY,start_answer
186,1117,43,12,Correct.,a,THE WITNESS,start_question
187,1118,43,13,"And the treatment she got from you, the injection the one time you saw her, was in early April of 2018?",q,MR. SHUEY,start_answer
188,1121,43,16,Correct.,a,THE WITNESS,start_question
189,1122,43,17,And since then she's had no treatment related to this accident?,q,MR. SHUEY,start_answer
190,1124,43,19,I am not personally aware of any treatment that she had or she did not have.  I had no personal direction with this patient beyond my report and no additional records were provided to me regarding any additional care when I authored this report this summer.,a,THE WITNESS,start_question
191,1130,43,25,"So to your knowledge, all of her treatment ended with your treatment in April of 2018?",q,MR. SHUEY,start_answer
192,1134,44,3,To the best of my knowledge.,a,THE WITNESS,start_question
193,1135,44,4,"Now, the injection that you gave her, you gave her the injection the first and only time you saw Ms. Gebeyaw, right?",q,MR. SHUEY,start_answer
194,1138,44,7,Yes.,a,THE WITNESS,start_question
195,1139,44,8,And that was done under local anesthesia?,q,MR. SHUEY,start_answer
196,1141,44,10,Correct.,a,THE WITNESS,start_question
197,1142,44,11,Can you just explain for the jury the difference between local and general anesthesia.,q,MR. SHUEY,start_answer
198,1145,44,14,"Absolutely.  Actually, the Medicaid, Medicare guidelines recently strongly suggest that based on evidence that we don't utilize sedation such as anesthesia sedation, MAC, monitored anesthesia care, for this type of procedure.  As when you put a patient to sleep you have to intubate them or least put an airway because you're significantly increasing risk of aspiration.  So risks outweigh the benefits despite significant fear of needles, pain with the procedure.  At the end of the day, it's still an injection.  It's still a needle.  So you can try to numb the patient up. So the difference between both, when we do local sedation, we can either give a patient a Valium to make them feel more relaxed and we use a smaller gauged needle to numb up the skin and then put the needle deeper to numb up as much as possible before you put a thick spinal needle in there.  So you at least numb up the track. So when you say, numb the patient up, it's not painless by any means. You still feel the needle going in because you have to go in with a needle to put the local anesthetic deep in.  You feel the burn of the local anesthetic, but you decrease the discomfort versus sedation or anesthesia.  You can either knock the patient out fully flaccid. That's when you have to intubate them.  They can't breathe on their own or can you do something I do in the hospital when I do my own sedition, conscious sedation.  Where we put in the IV and we put the patient in twilight state.",a,THE WITNESS,start_question
199,1181,45,24,"Doctor, I think my question -- I'm sorry.  That was a very thorough explanation.  I appreciate that.",q,MR. SHUEY,start_answer
200,1185,46,2,At least it was educational.,a,THE WITNESS,start_question
201,1186,46,3,"Yeah.  And I appreciate that. My questions was simpler.  So local anesthesia would be numbing the area, general anesthesia would be putting the patient to some sort of sleep; is that fair?",q,MR. SHUEY,start_answer
202,1191,46,8,Yes.,a,THE WITNESS,start_question
203,1192,46,9,Here you numbed the area?,q,MR. SHUEY,start_answer
204,1193,46,10,Correct.,a,THE WITNESS,start_question
205,1194,46,11,And you mentioned something about Valium.  In your operative report you don't mention using any Valium on this particular patient.,q,MR. SHUEY,start_answer
206,1198,46,15,Correct.,a,THE WITNESS,start_question
207,1199,46,16,"And that injection was done in your office, correct?",q,MR. SHUEY,start_answer
208,1201,46,18,Correct.,a,THE WITNESS,start_question
209,1202,46,19,"Now, you mentioned that you reviewed the MRI film from Advanced Diagnostics, correct?",q,MR. SHUEY,start_answer
210,1205,46,22,Correct.,a,THE WITNESS,start_question
211,1206,46,23,And did you also look at the report of the MRI film?,q,MR. SHUEY,start_answer
212,1208,46,25,Yes.,a,THE WITNESS,start_question
213,1210,47,1,Do you disagree with the report?,q,MR. SHUEY,start_answer
214,1211,47,2,"No.  I agree with the report that there was a herniation at C3/4, that there were preexisting degenerative changes and some osteophytes around the boney spurs.  I certainly don't disagree with the radiologist.",a,THE WITNESS,start_question
215,1216,47,7,"Okay.  In your report, you list your diagnoses and one of those diagnoses is DDD, which I believe is degenerative disc disease.  Am I right about that?",q,MR. SHUEY,start_answer
216,1220,47,11,That's correct.,a,THE WITNESS,start_question
217,1221,47,12,Can you tell the jury what degenerative disc disease is.,q,MR. SHUEY,start_answer
218,1223,47,14,"Degenerative disc diease means when the disc loses their height and discs lose their water content and get some arthritis surrounding the discs means they become weak. A situation such as this, such as the car accident, when you get hit makes them unstable or makes them hurt where they were, like, teeter tattering on the edge before and something pushed them over that edge.",a,THE WITNESS,start_question
219,1232,47,23,Is degenerative disc disease a normal part of aging?,q,MR. SHUEY,start_answer
220,1234,47,25,Yes.  100 percent.,a,THE WITNESS,start_question
221,1236,48,1,You also mentioned spondylosis. Can you tell the jury what that is.,q,MR. SHUEY,start_answer
222,1238,48,3,"Spondylosis is also part of degeneration, part of aging.  It refers traditionally to other parts of the spine, the facet joints or the little joints in the back of the spine where you develop some osteophilic spurs or boney spurs and some overgrowth.  It's another part of arthritis.",a,THE WITNESS,start_question
223,1245,48,10,Can you explain for the jury what osteophytes are.,q,MR. SHUEY,start_answer
224,1247,48,12,"Osteophytes are boney spurs which grow as a result of just age, friction, friction where there is not supposed to be, and traditionally known as arthritic changes.  Just boney spurs, boney hooks, boney projections.",a,THE WITNESS,start_question
225,1252,48,17,Is it fair to say those boney spurs aren't as a result of any car accident?,q,MR. SHUEY,start_answer
226,1254,48,19,"No, no, no.  Not at all.  And that's why I specifically diagnosed this patient as number five under my diagnosis, aggravation of cervical degenerative disc disease and spondylosis.  I separated disc herniation and C3/4 and C4 radiculopathy because that did not have any osteophytes with degenerative changes associated with that specific disc herniation.",a,THE WITNESS,start_question
227,1264,49,3,"Okay.  I have a few more questions about degeneration in the spine, but I just want to be clear or if you could help me be clear about this.  Degeneration is different from trauma, correct?",q,MR. SHUEY,start_answer
228,1269,49,8,100 percent.,a,THE WITNESS,start_question
229,1270,49,9,"So trauma would be from a car accident or something like that, degeneration would be just from the aging process?",q,MR. SHUEY,start_answer
230,1273,49,12,"Correct.  And to have aggravation of degenerative changes, you don't have to have any structural abnormality. Aggravation just means something that wasn't symptomatic before becomes symptomatic now. Wasn't hurting before, hurting now.",a,THE WITNESS,start_question
231,1279,49,18,I would like to refer to that MRI report.  If you need a copy of it I can give a copy.,q,MR. SHUEY,start_answer
232,1282,49,21,Got it.,a,THE WITNESS,start_question
233,1283,49,22,"It looks like you have a copy there.  On this report it says, all of the intervertebral discs demonstrate loss of signal in the T2 wave series indicating some disc desiccation.  Did I read that right?",q,MR. SHUEY,start_answer
234,1289,50,2,That is correct.,a,THE WITNESS,start_question
235,1290,50,3,"Desiccation, is that a degenerative condition?",q,MR. SHUEY,start_answer
236,1292,50,5,"Yes and no.  Disc desiccation corresponds only to the loss of disc normal water content.  Means, as we age, discs start losing their water and will look less bright. In a 61 -- I think she was at the time of the accident -- old female, you would expect a loss of disc water content.  It only becomes degenerative changes when you start losing disc height or you start developing osteophytes or boney spurs at the end plates of the bones.",a,THE WITNESS,start_question
237,1302,50,15,"Let's talk specifically about the C3/4 disc.  That's the one that you said was impacted in this accident, correct?",q,MR. SHUEY,start_answer
238,1305,50,18,Correct.,a,THE WITNESS,start_question
239,1306,50,19,"First of all, the report says that there is loss of height at C3/4 indicating further degeneration.  Did I read that correctly?",q,MR. SHUEY,start_answer
240,1310,50,23,I don't see that.,a,THE WITNESS,start_question
241,1311,50,24,It's right above where it starts listing the individual levels.  The sentence right above that.  So right above C2/3 it says -- it starts with additionally.  Do you see that on this page?,q,MR. SHUEY,start_answer
242,1317,51,4,Correct.,a,THE WITNESS,start_question
243,1318,51,5,Did I read that correctly?,q,MR. SHUEY,start_answer
244,1319,51,6,100 percent correct.,a,THE WITNESS,start_question
