,indice,page_number,line_number,text,text_type,speaker,time_added
245,1320,51,7,"And when specifically discussing C3/4, which is the disc at issue here, the first words here are degenerative end plate changes.  Can you explain what that means.",q,MR. SHUEY,start_answer
246,1324,51,11,"Yes.  Degenerative end pate changes refers not to the disc itself, but to the bones that it sits on.  I'm going to try to draw this.  Just bear with me for one second. And, again, in advance, I'm going to apologize for the quality of my drawing.  All right. On this side, I guess it's the jury's -- I can't figure out the reverse with the camera.  On this one over here you have a normal disc height.  The disc sits nice in the center.  Here you have the degenerated disc. So the disc, as you can see, the height is significantly less for the degenerated disc over here.  So bones are becoming a little too close to each other. So what happens, you may develop these little guys.  They are osteophytes because bone doesn't like to be too close to bone.  So that's what that means.",a,THE WITNESS,start_question
247,1344,52,5,"Now, Doctor, I believe you testified earlier that the plaintiff had no prior injuries before this accident; is that right?",q,MR. SHUEY,start_answer
248,1348,52,9,"I testified that she had a prior accident before, five years before this one. But she denied any neck pain prior to the accident.",a,THE WITNESS,start_question
249,1352,52,13,Would it surprise you then that at her deposition she testified she had had neck pain in the past?,q,MR. SHUEY,start_answer
250,1355,52,16,Yes.  In the past it wouldn't surprise me because she did have a prior accident about four or five years ago.  But what I testified is that she did not have any issues ongoing immediately prior to this accident.,a,THE WITNESS,start_question
251,1361,52,22,"Okay.  So when you were writing your report, however, you were not aware that she had ever had neck pain before; is that correct?",q,MR. SHUEY,start_answer
252,1366,53,1,"If I remember correctly, yeah, I did not remember she had any significant issues that required or necessitated such evasive treatment.",a,THE WITNESS,start_question
253,1370,53,5,"Well, I just asked about any neck pain, Doctor.",q,MR. SHUEY,start_answer
254,1372,53,7,Understood.,a,THE WITNESS,start_question
255,1373,53,8,Is your answer still the same?,q,MR. SHUEY,start_answer
256,1374,53,9,Yes.,a,THE WITNESS,start_question
257,1375,53,10,"Okay.  Now that you're aware today sitting here that she had had neck pain in the past, that's not changing your opinion, correct?",q,MR. SHUEY,start_answer
258,1379,53,14,"No, sir.  Because we have preexisting degenerative changes.  You have a car accident, what, five years ago.  I would understand why she would have some occasional neck pain.  Doesn't change the opinion.",a,THE WITNESS,start_question
259,1384,53,19,"Doctor, earlier you testified, did I understand you correctly that you testified that herniations cannot resolve?",q,MR. SHUEY,start_answer
260,1387,53,22,"Majority of the herniations do not resolve completely.  If you have an extrusion, some of it can shrink or herniations can change in size, but herniations do not resolve.",a,THE WITNESS,start_question
261,1393,54,2,"Now, I'm a little confused by that answer.  So can a person who is symptomatic because of herniation, can they ever feel better, can they ever be not symptomatic?",q,MR. SHUEY,start_answer
262,1398,54,7,"Yes.  And pain can fluctuate, pain can wax and wane as we were discussing on direct.  Depending on the amount of pressure on the nerve, depending on the type of herniation, the symptoms may change.  Sometimes you have a disc extrusion where there is a sequestered fragment.  There is an outside fragment of the disc not connected to the main disc portion and that can actually resolve.  But herniation such as this where it just protrudes back, that is unlikely to resolve.",a,THE WITNESS,start_question
263,1409,54,18,"Okay.  Was your injection, the injection you gave her, was that meant to help her?",q,MR. SHUEY,start_answer
264,1412,54,21,Yes.,a,THE WITNESS,start_question
265,1413,54,22,Did it?,q,MR. SHUEY,start_answer
266,1414,54,23,"Since she did not come back for the follow-up, I could not tell you how much it helped.  But what I remember specifically is she was incredibly fearful of the needles, incredibly needle phobic.",a,THE WITNESS,start_question
267,1420,55,3,"That brings me to a different issue, Doctor.  In your operative report, you actually write that a follow-up has actually been scheduled for patient in our office in ten days, correct?",q,MR. SHUEY,start_answer
268,1425,55,8,That's correct.,a,THE WITNESS,start_question
269,1426,55,9,And she never came back?,q,MR. SHUEY,start_answer
270,1427,55,10,Correct.,a,THE WITNESS,start_question
271,1428,55,11,"Doctor, earlier you described how a motor vehicle accident can cause injury. Do you remember testifying about that?",q,MR. SHUEY,start_answer
272,1431,55,14,"I don't think I went into great detail, typical motor vehicle accident.  Every accident is different depending on the type of collision, the angulation of the collision, whether the patient was restrained or not, degree of speed obviously.  But traditionally it's a hyperflexion, hyperextension type of injury with a sudden acceleration, a sudden deceleration.  Basic laws of physics. If you're traveling at a certain speed and you come to a sudden stop, bodies in motion tend to stay in motion.  Just because the car came to a stop, you continue to move, you get thrown against the seatbelt.  You stop, your organs continue to move and they get thrown inside and that's what causes disc herniations.  That's a general mechanism of a car accident.  I didn't -- I don't think I went in such great detail, but that's the gist.",a,THE WITNESS,start_question
273,1451,56,8,"When you say hyper -- I believe you said hyperflexion or hyperextension, what do you mean?",q,MR. SHUEY,start_answer
274,1454,56,11,"Neck is supposed to move at a certain pace, a certain motion.  Typically, when you get in a car accident you develop forceful, sudden extension beyond normal where your neck gets pushed down and then flipped back beyond a certain angle at a very fast pace, like a whiplash.  Which, I think, is typically described as a car accident.",a,THE WITNESS,start_question
275,1462,56,19,"Now, the reason that people get hurt in car accidents, if I'm understanding you correctly, is because there is force applied to the car and force applied to the body of the patient; is that right?",q,MR. SHUEY,start_answer
276,1467,56,24,"Traditionally, yes.",a,THE WITNESS,start_question
277,1468,56,25,And that moves them around?,q,MR. SHUEY,start_answer
278,1470,57,1,"Well, yes.  You might not move around if you're fully restrained in a five foot harness such as the race car drivers.  We don't have that in our everyday vehicles.",a,THE WITNESS,start_question
279,1474,57,5,"Well, let's talk about Ms. Gebeyaw specifically.  Your testimony to the jury is that she was injured in this accident and that in fact a herniation was caused by this accident.  Am I understanding that right?",q,MR. SHUEY,start_answer
280,1479,57,10,Correct.,a,THE WITNESS,start_question
281,1480,57,11,"Okay.  So that would require force to her neck specifically, correct?",q,MR. SHUEY,start_answer
282,1482,57,13,That is correct.,a,THE WITNESS,start_question
283,1483,57,14,"Okay.  Doctor, in this case she testified that she felt nothing at all during the accident.  Are you aware of that?",q,MR. SHUEY,start_answer
284,1486,57,17,"I'm not aware of her specific testimony that she felt nothing at all. Frankly, I wouldn't be surprised by it.  But depending on the type of collision the disc was already, as we read through the report, was desiccated.  Means it was weak.  So if the disc is already weak, you may not feel any immediate pain.  It's actually very common for motor vehicle accidents for patients to be in a state of shock or don't feel much.  Then as the time progresses they feel significant pain or pain increases.",a,THE WITNESS,start_question
285,1499,58,4,"Well, Doctor, certainly her body would have had to of moved for this accident to have caused a herniation, correct?",q,MR. SHUEY,start_answer
286,1502,58,7,"I cannot tell you how much her specific body has moved as a result of the accident, but it's apparent that she sustained some type of disc herniation and torsion type injury due to being sideswiped and her body did move a certain degree.  Because no matter how, if you collide at three miles per hour, you're still going to feel something.  You feel a jolt.  So frankly, I find it hard to believe that she didn't feel anything.",a,THE WITNESS,start_question
287,1512,58,17,"Doctor, you disagree with her testimony?",q,MR. SHUEY,start_answer
288,1514,58,19,Oh.  I'm nobody to disagree with the patient's own accord of what she's feeling. I'm just going by physics.,a,THE WITNESS,start_chat
289,1517,58,22,"Thank you, Doctor.",side_chat,MR. SHUEY,start_chat
290,1518,58,23,Thank you.,side_chat,THE WITNESS,start_chat
291,1519,58,24,I just have a few brief follow-up for you.,side_chat,MS. STURGES,symbols
292,1522,59,1,- - - REDIRECT EXAMINATION,symbols,,symbols
293,1524,59,3,- - -,symbols,,start_question
294,1526,59,5,"You were mentioning a few terms. Particularly disc degeneration, osteophytes, arthritis, spondylosis, and you were explaining those terms to the jury when talking with counsel.  Could it be possible that somebody has those specific things, arthritis, spondylosis, and then become symptomatic after a trauma such as motor vehicle accident?",q,MS. STURGES,start_answer
295,1534,59,13,"That's what's described as aggravation of degenerative changes and that's what I listed as number five on my list of diagnoses.  Means, something was there.  It was predating.  It was preexisting, but it was not hurting before and it started hurting after.",a,THE WITNESS,start_question
296,1540,59,19,"Okay.  And in terms of injections, as I know that you were speaking about the injection that you provided to Ms. Gebeyaw back in April of 2018, are injections a permanent fix?",q,MS. STURGES,start_answer
297,1545,59,24,"No.  Injections are not a permanent fix.  The medication that's injected is a combination of lidocaine and steroid. It's meant to take away inflammation, improve function, decrease pain.  Steroid is going to ware off.  The max shelf life of a steroid is about six months.",a,THE WITNESS,start_question
298,1553,60,6,"And just so that I'm clear, in terms of your testimony earlier when speaking with counsel, is that one could become symptomatic after a trauma but not experience any pain at the time of the trauma; is that right?",q,MS. STURGES,start_answer
299,1559,60,12,"Yes.  It is very common in motor vehicle accidents.  It has been very well reported in literature work that patients don't feel much pain or don't feel certain body parts hurt immediately after the accident.  And as the day or two days go by, they go to the ER because they feel severe pain.",a,THE WITNESS,start_question
300,1566,60,19,"And I know that you were speaking a number about the MRIs and the osteophytes and spondylosis, did you review any records or did Ms. Gebeyaw make any complaints about prior radicular symptoms?",q,MS. STURGES,start_answer
301,1571,60,24,"No, ma'am.",a,THE WITNESS,start_question
302,1572,60,25,"Okay.  And, lastly, have any of counsel's questions changed your opinions in this matter?",q,MS. STURGES,start_answer
303,1576,61,3,"No, ma'am.",a,THE WITNESS,start_question
304,1577,61,4,Okay.,q,MS. STURGES,start_chat
305,1578,61,5,Thank you.  That's all I have. VIDEOGRAPHER,side_chat,MS. STURGES,is brackets
306,1583,61,10,(Witness excused.),brackets,,is brackets
307,1584,61,11,"(Deposition ended at 5:30 p.m.) C E R T I F I C A T E I do hereby certify that I am a Notary Public in good standing, that the aforesaid testimony was taken before me, pursuant to notice, at the time and place indicated; that said deponent was by me duly sworn to tell the truth, the whole truth, and nothing but the truth; that the testimony of said deponent was correctly recorded in machine shorthand by me, to the best of my ability, and thereafter transcribed under my supervision with computer-aided transcription; that the deposition is a true and correct record of the testimony given by the witness; and that I am neither of counsel nor kin to any party in said action, nor interested in the outcome thereof. WITNESS my hand and official seal this 12th day of September, 2019. <%signature%>",brackets,,end
