,indice,page_number,line_number,text,text_type,speaker,time_added
0,0,0,0, examined and testified as follows:,,,symbols
1,145,6,2,- - - VOIR DIRE,symbols,,symbols
2,147,6,4,- - -,symbols,,start_question
3,149,6,6,"Good afternoon, Doctor.  How are you?",q,MS. STURGES,start_answer
4,151,6,8,Good.  Good afternoon.,a,THE WITNESS,start_question
5,152,6,9,Could you please introduce yourself to the jury.,q,MS. STURGES,start_answer
6,154,6,11,"Good afternoon, ladies and gentlemen.  My name is Dr. Gene Levinstein.",a,THE WITNESS,start_question
7,156,6,13,And what type of doctor are you?,q,MS. STURGES,start_answer
8,157,6,14,I'm a specialist.  My specialty is physical medicine and rehabilitation and pain management.,a,THE WITNESS,start_question
9,160,6,17,"Now, in case the jury is unaware, could you explain a little bit more about what physical medicine and rehabilitation are.",q,MS. STURGES,start_answer
10,164,6,21,"Physical medicine and rehabilitation is the names, kind of, that basically deal with the physical capabilities and providing rehabilitative care to patients. Physical medicine and rehabilitation doctors, also known as physiatrists, typically provide care to patients who either have undergone surgery or suffer from musculoskeletal neurologic conditions. This includes, traditionally, recovery after stroke, spinal cord injuries, cardiac rehabilitation after heart surgeries or transplants, and PT training for patients who were involved in neurologic conditions; the joint problems, total knee replacements, hip replacements.  Any other joint surgery such as arthroscopies, hips, knees, shoulders, or patients who suffer from neurologic conditions or spinal disorders; bulging, herniated discs, Parkinson's Disease, multiple sclerosis. Physiatrists also perform diagnostic studies, specifically EMG nerve conduction, and typically oversee physical therapy and occupational therapy departments.",a,THE WITNESS,start_question
11,189,7,20,"Now, Doctor, I know you just mentioned a large number of things that doctors such as yourself treat.  Do you treat people who have been involved in motor vehicle accidents?",q,MS. STURGES,start_answer
12,194,7,25,"Yes.  I treat patients who are involved in either motor vehicle accidents or any other type of injury be it a lifting injury, work injury, or athletic injury.",a,THE WITNESS,start_question
13,199,8,4,"Okay.  Do you happen to treat people with injuries to their neck, spine, and shoulders?",q,MS. STURGES,start_answer
14,202,8,7,"The nature of my practice, I treat approximately -- 70 percent of my practice involves treating patients who sustain spinal problems, be it either traumatic or chronic, be it degenerative with nature, just with age, or some type of trauma, fall, sports injury, just natural occurring discs, work related injuries, you name it.  Me being a subspecialist, such as pain management, that's what I primarily treat.",a,THE WITNESS,start_question
15,212,8,17,"And could you explain a little bit more about that specialty that you were just mentioning, pain management.",q,MS. STURGES,start_answer
16,215,8,20,"Pain management is a smaller subset where physicians only train in neurology, physiology, or physical medicine and rehab.  We are able to achieve this additional training.  It's typically an interventional specialty where you work with your hands and you preform primarily procedures such as injections.  But the nature of the disease or majority of the pain comes from the back, the spine, that's where the majority concentrates on. As I said, about 70 percent of my practice involves treating spinal disorders and remaining 30 percent I treat between other joints, small joints, hips, knees, shoulders. I'm sorry -- bigger joints; hips, knees, or shoulders.  Smaller joints; hands, elbows, wrists, and as well as nerve and muscle problems. I split my time between -- all pain management doctors typically perform a lot of procedures both using guidance such as x-ray, CAT Scan, ultrasound, but are also trained to perform injections just based on nerve stimulators or based on an anatomic location.",a,THE WITNESS,start_question
17,242,9,21,"And, Doctor, if you could look at what has been marked as Exhibit-1, could you please identify that.",q,MS. STURGES,start_answer
18,245,9,24,It is my curriculum vitae.  It is my CV.  It's my resume.  It is current and up-to-date.,a,THE WITNESS,start_question
19,249,10,2,Okay.  And could you tell the jury a little bit about how you became a doctor.,q,MS. STURGES,start_answer
20,252,10,5,"Following graduation from undergrad at Temple University, I completed medical school at Ross University.  Followed that with residency in the field of special -- internship the first year in the field of internal medicine at Graduate Hospital.  I followed that with additional training residency at Temple University Hospital where I served as a chief resident during my senior year, followed with additional fellowship training in my subspecialty of pain management.",a,THE WITNESS,start_question
21,263,10,16,And could you let the jury know about your current practice and what you do on a daily basis.,q,MS. STURGES,start_answer
22,266,10,19,"On a daily basis I split my time between seeing patients in the office, performing procedures, as well as working in the hospital doing hospital consults as well as performing procedures in the hospital.  The hospital work is reserved for patients who are really debilitated or have significant medical comorbidities or significant medical problems. They cannot be safe to do procedures in the office.  They have to be observed in the hospital for patients who require really complex procedures for which they have to be sedated, put to sleep.  Either myself providing sedation or working in conjunction with an anesthesiologist to put those patients to sleep. I work in the office long hours starting about 7:30, 8:00 in the morning and typically about 6:30, 7:00 at night.  I preform office consultations as well as in office injections.  And about a day and a half, two days a week I have dedicated time performing injections either under ultrasound or x-ray guidance primarily to the spine as the rest of the procedures I could do in the office. When I evaluate patients in the office, I perform what we call a full consultation where patients come to me, I review their diagnostic studies, I review their history, I discuss the condition that they are suffering from, what caused their condition, what can happen in the future.  It's really called a prognosis.  What's going to happen to them 5, 10, 20 years from now.  What's going to happen if they take option A, B, or C.  They can do nothing, they can do this, they can do that, and what's going to happen to them when they get older.  I give them their options and chances of one or another making them better or not and always you give the patient a chance of something making them worse or making them no different.",a,THE WITNESS,start_question
23,310,12,11,"And I believe you touched upon this earlier, but as part of your practice do you routinely review medical records and diagnostic studies and images?",q,MS. STURGES,start_answer
24,314,12,15,"Yes.  Well, it's a two-part question.  First, regarding medical records, as a specialist I have no personal knowledge of a patient until they walk through my door at a specific point in time.  I don't know their history.  So it is customary medicine to rely on their physicians' medical records to help us formulate an opinion.  Meaning, other doctors' notes, ER records, therapy notes, diagnotic studies, reports.  It helps come up with a causation and come up with at least a chain of events or sequence of events to help me formulate my opinion and my diagnosis.  But as everything in medicine, it's a puzzle.  I have to put all the pieces together.  So history is one.  Diagnostics is two.  My own exam is three.  I guess records from other doctors is four.  So you put everything together, you come up with a diagnosis and prognosis and treatment plans.  This is regarding the medical records. In regards to the diagnostic studies, I am not a radiologist, but the nature of my specialty, I read MRIs, CAT Scans, and x-rays.  I limit myself to reading only the body parts where I'm going to perform procedures.  So either the joints or spine. I'm not good at reading soft tissue ultrasounds aside from me just doing the injection, which we call function ultrasounds.  So I don't fancy myself a radiologist nor do I bill for those readings. But if I'm the one sticking a needle a long in somebody's back, I need to make sure I know what I'm talking about.  I don't want my patients to be backseat passengers basically where a doctor just says it's a one-way street where everybody explains it.  I love to get their brain -- to bring the images.  In the old days we used to put them up in the viewing box.  Now I put them on my computer and I flip my laptop and I show it to the patient and discuss everything with them to make sure they understand the condition they are suffering.",a,THE WITNESS,start_question
25,360,14,9,"And, Doctor, you're currently licensed to practice medicine here in the Commonwealth of Pennsylvania; is that right?",q,MS. STURGES,start_answer
26,363,14,12,Yes.,a,THE WITNESS,start_question
27,364,14,13,Okay.  And have you ever qualified to testify as an expert witness in the Philadelphia County Court of Common Pleas before?,q,MS. STURGES,start_answer
28,368,14,17,"Yes, ma'am.",a,THE WITNESS,start_question
29,369,14,18,Okay.  And you were paid -- you're being paid to testify here today; is that right?,q,MS. STURGES,start_answer
30,372,14,21,Correct.,a,THE WITNESS,start_question
31,373,14,22,Okay.  What is your fee for today?,q,MS. STURGES,start_answer
32,375,14,24,"$2,000.  And we agreed that this would be a mutual convenient time to testify and place rather than my office where we are not setup.  As I was working in Philadelphia today, but we don't have such a nice conference room.  It's a pure clinical space.",a,THE WITNESS,start_question
33,382,15,5,"If you weren't here testifying today, what would you be doing?",q,MS. STURGES,start_answer
34,384,15,7,"I would still be seeing patients for a little bit over two hours, probably.  I usually get out about 7:00ish.",a,THE WITNESS,start_question
35,387,15,10,"Okay.  So the fee that you charged, the $2,000 that you mentioned, compensates you for the money that you're missing by not treating patients?",q,MS. STURGES,start_answer
36,391,15,14,"It's for the time to be away from my practice, to prepare for today's testimony, and not being able to provide care for my patients.",a,THE WITNESS,start_chat
37,395,15,18,At this time I offer Dr. Gene Levinstein as an expert witness in the fields of physical medicine and rehabilitation and pain management.  Counsel?,side_chat,MS. STURGES,start_question
38,401,15,24,"Doctor, I just have a few questions for you.  First, I would like to go back and discuss a little bit about your education.  You went to Temple University for undergraduate education; is that --",q,MR. SHUEY,start_answer
39,407,16,4,Correct.,a,THE WITNESS,start_question
40,408,16,5,And then you went to Ross University School of Medicine in the West Indies?,q,MR. SHUEY,start_answer
41,411,16,8,Correct.,a,THE WITNESS,start_question
42,412,16,9,And then you came back to Philadelphia to do your internship and your residency?,q,MR. SHUEY,start_answer
43,415,16,12,Correct.,a,THE WITNESS,start_question
44,416,16,13,And then your fellowship out in Pottstown; is that right?,q,MR. SHUEY,start_answer
45,418,16,15,Correct.,a,THE WITNESS,start_question
46,419,16,16,And the fellowship was with a place called Interventional Spine and Pain Management; is that right?,q,MR. SHUEY,start_answer
47,422,16,19,Correct.,a,THE WITNESS,start_question
48,423,16,20,"Okay.  Currently, you work at several different offices; is that right?",q,MR. SHUEY,start_answer
49,425,16,22,"Well, I have my own practice, Pennsylvania Pain Specialists, which is primarily located in Lehigh Valley.  I live in Bucks County so I live sort of centrally.  I love Philly.  I came here when I was a teenager and I grew up in Philly.  That's why I practice in Philadelphia about once every other week. Sometimes more frequently, sometimes maybe a little less depending on the volume of the patients.  I rent space from a place called Spinal Care in Philadelphia.  Otherwise, I have my offices in Lehigh Valley.",a,THE WITNESS,start_question
50,438,17,9,"And is Spinal Care of Philadelphia, is that office location listed on your CV?",q,MR. SHUEY,start_answer
51,441,17,12,Yes.,a,THE WITNESS,start_question
52,442,17,13,Can you point it to me.  I'm sorry.,q,MR. SHUEY,start_answer
53,444,17,15,"Sure.  I guess -- I apologize. You're right.  It's not listed.  It's not my primary office, not the office that I own. It's one of the places where I rent space.  I apologize it is not listed as one of the primary locations.",a,THE WITNESS,start_question
54,450,17,21,"That's no problem.  So just to be clear, you have the office that you rent in Philadelphia and then another one in Allentown, another one in Bethlehem --",q,MR. SHUEY,start_answer
55,454,17,25,That's it.,a,THE WITNESS,start_question
56,456,18,1,Just those three?,q,MR. SHUEY,start_answer
57,457,18,2,Correct.,a,THE WITNESS,start_question
58,458,18,3,Okay.  You also list VitamedIV or is that Vitamed Four?,q,MR. SHUEY,start_answer
59,460,18,5,No.  VitamedIV.,a,THE WITNESS,start_question
60,461,18,6,Okay.  And what is that?,q,MR. SHUEY,start_answer
61,462,18,7,"I'm no longer working there. It's a facility, medical IV infusion, where I was a medical director until May of this year.",a,THE WITNESS,start_question
62,465,18,10,"Oh, I'm sorry.  I do see that it says until May of this year.  I misunderstood. Thank you.  Doctor, you've mentioned that you you've testified in the past in cases like this; is that right?",q,MR. SHUEY,start_answer
63,470,18,15,Correct.,a,THE WITNESS,start_question
64,471,18,16,Okay.  How many times have you testified in an injury case similar to what we're here for today?,q,MR. SHUEY,start_answer
65,474,18,19,"I can't say the total how many times I've testified or, I guess, whatever specific time period.  But I would say on the average for a personal injury case where I have to testify on video or live in court, probably about once a month or so.",a,THE WITNESS,start_question
66,480,18,25,How long have you been testifying about once a month or so?,q,MR. SHUEY,start_answer
67,483,19,2,"It really fluctuates.  I can go for some months where I don't testify.  Then the next month I'm testifying two times.  But at most, I would say it's probably about once a month for, maybe, five, six years.",a,THE WITNESS,start_question
68,488,19,7,"Now, could you give us a percentage breakdown.  How many times do you testify on behalf of plaintiffs or plaintiffs' offices and how many times you testify on behalf of defendants or defense offices?",q,MR. SHUEY,start_answer
69,493,19,12,"I would say 99 percent of the time, 99 percent plus, I am the treating doctor or I perform an Independent Medical Evaluation.",a,THE WITNESS,start_question
70,496,19,15,"And I understand -- so when you're the treating doctor, you've given some kind of treatment to the plaintiff in the case that you're talking about, right?",q,MR. SHUEY,start_answer
71,500,19,19,"I refer to them as patients, yes.  I testify on behalf of my patients.",a,THE WITNESS,start_question
72,502,19,21,"Okay.  However, when you give an Independent Medical Evaluation, that's when you're not testifying on behalf of a patient, but rather someone that's been referred to you and somebody has asked for your opinion; is that correct?",q,MR. SHUEY,start_answer
73,509,20,2,"Correct.  Independent Medical Evaluation is the name -- stands as independent.  You have no doctor-patient relationship.  So you see the patient once, you review medical records, a little or a lot, and you issue your opinion and you provide the report to the requesting party.  Usually an attorney or a case manager.",a,THE WITNESS,start_question
74,517,20,10,How often do you do Independent Medical Evaluations?,q,MR. SHUEY,start_answer
75,519,20,12,"Probably a few.  Two, three times a month.  It really depends.  Again, everything fluctuates.  I think this week I have two of them.  Last two weeks I had none.",a,THE WITNESS,start_question
76,523,20,16,"Okay.  When you do Independent Medical Evaluations, so you're not working with a patient of your's, do you ever do them for defense attorneys or defendants?",q,MR. SHUEY,start_answer
77,527,20,20,Yes.,a,THE WITNESS,start_question
78,528,20,21,"What percentage do you do for -- of Independent Medical Evaluations, what percentage do you do for defense attorneys or defendants and what percentage do you do for plaintiffs or plaintiff attorneys?",q,MR. SHUEY,start_answer
79,534,21,1,"Very small for defense. Primarily patients who either seek a second opinion or somebody who was injured in some type of an accident, whether it's work related or personal injury.",a,THE WITNESS,start_question
80,539,21,6,So would you agree the great majority are for the plaintiffs?,q,MR. SHUEY,start_answer
81,541,21,8,Yes.,a,THE WITNESS,start_question
82,542,21,9,"In this case, you provided a report to the plaintiff's attorney, correct?",q,MR. SHUEY,start_answer
83,544,21,11,That is correct.,a,THE WITNESS,start_question
84,545,21,12,"And that report is dated July 25, 2019, correct?",q,MR. SHUEY,start_answer
85,547,21,14,Correct.,a,THE WITNESS,start_question
86,548,21,15,Was there a fee related to that report?,q,MR. SHUEY,start_answer
87,550,21,17,Yes.  Certainly.,a,THE WITNESS,start_question
88,551,21,18,What was that?,q,MR. SHUEY,start_answer
89,552,21,19,$500.,a,THE WITNESS,start_question
90,553,21,20,"And that's in addition to the $2,000 that you spoke about earlier, correct?",q,MR. SHUEY,start_answer
91,555,21,22,Correct.  The fee for the report is for me to review medical records and to generate my report.  Patient was referred to me by the treating doctors and those bills have nothing to do with the report and the fee for today's testimony to be away from my practice and be here.,a,THE WITNESS,start_question
92,563,22,4,"Doctor, earlier you talked about the procedures that you do and you mentioned injections.",q,MR. SHUEY,start_answer
93,566,22,7,Correct.,a,THE WITNESS,start_question
94,567,22,8,What other procedures do you do?,q,MR. SHUEY,start_answer
95,568,22,9,"Primarily injections, whether it's some, I guess, more common such as epidural injections, facet blocks, medial branch blocks.  Two more involved procedures such as rhizotomies.  Two more involved procedures such as percutaneous disc-decompressions, implantation of spinal cord stimulators, even percutaneous laminotomies, stem cell injections.  You can go on.",a,THE WITNESS,start_question
96,578,22,19,"Okay.  Well, let me ask you this, do ever do arthroscopic surgery?",q,MR. SHUEY,start_answer
97,580,22,21,"No.  I'm not an orthopedic surgeon.  Although, a few of the procedures that I do perform carry orthopedic codes such as putting cement inside the vertebral bones for fractures, called vertebroplasty or kyphoplasty or percutaneous disc-decompression or even I can do the decompression of the carpel tunnel. I am not qualified to do an arthroscopic surgery, such as hips, knees, or shoulders.  If I felt one of those would be necessary, I would refer them to my orthopedic colleagues.  But that wouldn't be applicable to Ms. Gebeyaw in this case as she has no joint damage.",a,THE WITNESS,start_question
98,596,23,11,"Okay.  How about open surgery, something, like, as I understand, a cervical fusion for example?",q,MR. SHUEY,start_answer
99,599,23,14,"No.  I think the answer would be the same.  If the patient needs a fusion or even a more advanced laminectomy, whatever -- I'm going to go on surgeries -- or microdiscectomy, I would certainly refer to my orthopedic spine and neurosurgeon colleagues.",a,THE WITNESS,start_chat
100,605,23,20,"Those are all the questions I have.  Thank you, Doctor.",side_chat,MR. SHUEY,start_chat
101,607,23,22,Thank you.,side_chat,THE WITNESS,start_question
102,609,23,24,"Doctor, I just have one brief follow-up about that.  Counsel was asking you about the number of times you've testified or write reports on behalf of plaintiffs versus defendants.  In those situations, regardless of whether or not you're doing so for a plaintiff or a defendant in a legal matter, would that have any impact on the outcome of your report and testimony?",q,MS. STURGES,start_answer
103,619,24,8,"No.  You evaluate the patient. And frankly when I write the report, I don't really know who is requesting it.  If it's requested by an attorney, it's just a name with esquire after it.  When you issue a prognosis or a causation, it's based on the patient's evaluation, based on the review of records, based on the diagnosis.  Treatment recommendations would be essentially the same whether it's a plaintiff or a defendant because it's based on diagnosis sustained.",a,THE WITNESS,start_chat
104,630,24,19,"Thank you, Doctor. Again, at this time I offer Dr. Gene Levinstein as an expert witness in the fields of physical medicine and rehabilitation and pain management.",side_chat,MS. STURGES,symbols
105,635,24,24,- - - DIRECT EXAMINATION,symbols,,symbols
106,638,25,1,- - -,symbols,,start_question
107,640,25,3,"So, Doctor, we're here to take your testimony today on behalf of Mehret Gebeyaw related to her treatment following a motor vehicle accident that she was involved in on November 9, 2017.  During the course of your testimony here today, I'm going to ask you for some opinions, but I don't want you to give any unless you can do so to a reasonable degree of medical certainty; is that fair?",q,MS. STURGES,start_answer
108,649,25,12,"Yes, ma'am.",a,THE WITNESS,start_question
109,650,25,13,So you treated Ms. Gebeyaw; is that correct?,q,MS. STURGES,start_answer
110,652,25,15,That is correct.,a,THE WITNESS,start_question
111,653,25,16,Okay.  And you also did review some records at the request of my office; is that right?,q,MS. STURGES,start_answer
112,656,25,19,"In addition to the records available to me during her evaluation, yes. Your office provided some records when I was preparing the report.",a,THE WITNESS,start_question
113,660,25,23,Okay.  And you did prepare a comprehensive report that you have in front of you marked as Levinstein-2; is that right?,q,MS. STURGES,start_answer
114,664,26,1,Yes.,a,THE WITNESS,start_question
115,665,26,2,I'm going to ask that you refer to that as needed during the course of your testimony.  Could you explain a little bit about your treatment of Ms. Gebeyaw in regards to her injuries from this accident.,q,MS. STURGES,start_answer
116,670,26,7,"When I saw Ms. Gebeyaw on April 2nd of 2018, she presented to me with complaints of right neck pain going to the right shoulder and upper arm.  I reviewed the records from both Dr. Rosin with the EMG nerve conduction study, which showed radiculopathy or nerve damage on the right side.  I also reviewed and discussed the MRI results, which showed cervical disc herniations as well as some preexisting changes. I discussed with the patient how the accident happened and the prior treatment that she received.  I examined her and we agreed that the best course of care at this point, as she failed to progress beyond a certain point and certain time -- I think it was about six months at that point -- after accident she continued to be in pain.  So I felt it was reasonable, appropriate, and necessary to proceed to the next step in intervention such as injections, which I did on April 2nd of 2018.",a,THE WITNESS,start_question
117,693,27,4,And what type of injection was that?,q,MS. STURGES,start_answer
118,695,27,6,"I performed a cervical epidural steroid injection.  This is a procedure where a physician puts a needle in the back of the spine.  Would preform this -- usually go from the back.  There is two ways of doing this. You can go from the side next to the nerve or you can go from the back of the spine. Neck injections are traditionally considered the most dangerous types of procedures because of the amount of skill level needed as well as really no margin for error.  You are literally sitting within half a millimeter or a millimeter away from the spinal cord in the neck so you don't want to spear it going from the back.  If you go from the side, you're away from the spinal cord, but you have to follow certain protocol of injection because you don't want to cause a blood clot, which can make the patient paralyzed. So different types of -- I'm sorry.  Similar injection, different type of risks.  And the goal of the injection is to take away inflammation, take away pain, help the body's natural healing process.",a,THE WITNESS,start_question
119,721,28,6,"Now, one of the keywords that you mentioned as you were explaining was the term cervical.  What does that mean?",q,MS. STURGES,start_answer
120,724,28,9,Neck.,a,THE WITNESS,start_question
121,725,28,10,"Okay.  And I have a very important question for you.  After your treatment of her with that injection in April of 2018, as well as the records that you reviewed both at the time of the treatment as well as after, did you find that she suffered any injuries as a result of the motor vehicle accident?",q,MS. STURGES,start_answer
122,733,28,18,I did.,a,THE WITNESS,start_question
123,734,28,19,Okay.  Could you explain to the jury what injuries you found.,q,MS. STURGES,start_answer
