,indice,page_number,line_number,text,text_type,speaker,time_added
147,715,27,5,I don't believe any of our products allow for partial entry in the Social Security number field.  But I don't know.,a,THE WITNESS,start_question
148,718,27,8,"Okay.  So then let's -- let me move a little further into this exhibit.  And I'm just going to sort of fast forward you there.  I'm showing you the page marked TURSS 114.  And let's see.  And I think I may ask you about the following pages as well. So take a look at that, and let me know when you're ready to discuss. MR. O'NEIL:  Look at what page?  Page 114?",q,MR. HASHMALL,start_chat
149,726,27,16,"114 and 115, yes.",side_chat,MR. HASHMALL,start_answer
150,727,27,17,(Deponent perused document.) Okay.,a,THE WITNESS,start_question
151,729,27,19,"(BY MR. HASHMALL)  So can you tell me what this is? MR. O'NEIL:  Objection.  Lack of foundation. Go ahead and answer if you can, Mr. Landreth.",q,MR. HASHMALL,start_answer
152,733,27,23,Are you referring to both pages?,a,THE WITNESS,start_question
153,734,27,24,(BY MR. HASHMALL)  Yes.,q,MR. HASHMALL,start_answer
154,735,27,25,"So it looks like the first page is a criminal report from one of TURSS's products.  The second page is the continuance of that, as well as the eviction report.",a,THE WITNESS,start_question
155,740,28,4,Okay.  And is this the type of thing that you are familiar with in your -- your responsibilities in your job? MR. O'NEIL:  Objection.  Vague.,q,MR. HASHMALL,start_answer
156,744,28,8,I do see criminal reports and eviction reports quite frequently in -- in the scope of my work.,a,THE WITNESS,start_question
157,746,28,10,"(BY MR. HASHMALL)  Sure. And you're responsible for managing the criminal and eviction database, correct?",q,MR. HASHMALL,start_answer
158,749,28,13,Yes.,a,THE WITNESS,start_question
159,750,28,14,"Okay.  And the information on these pages would have come from the criminal and eviction database? MR. O'NEIL:  Objection.  Lack of foundation. Go ahead and answer if you can about this particular document, Mr. Landreth.",q,MR. HASHMALL,start_answer
160,756,28,20,"So, yeah.  I think that's right.  Again, I'm not responsible for how it gets mapped to this page.",a,THE WITNESS,start_question
161,758,28,22,(BY MR. HASHMALL)  Okay.,q,MR. HASHMALL,start_answer
162,759,28,23,And so there might be things that -- that the product includes that I'm not aware of or things that they omitted that were in the criminal database.,a,THE WITNESS,start_question
163,763,29,1,I see. Who is responsible for how the data in the criminal and eviction database gets mapped onto this page or onto reports? MR. O'NEIL:  Objection.  Vague as to types of reports. Go ahead and answer if you can.,q,MR. HASHMALL,start_answer
164,770,29,8,So I'm not sure the -- the -- I would start with the product manager of the product.,a,THE WITNESS,start_question
165,772,29,10,"(BY MR. HASHMALL)  Okay.  If this was a SmartMove report, who would be responsible for the mapping from the criminal and eviction database under this report?",q,MR. HASHMALL,start_answer
166,776,29,14,"From a product management perspective, that would be someone named Kayleen.  And I don't know how to pronounce her last name.",a,THE WITNESS,start_question
167,779,29,17,"Okay.  And so can you give me a sense of where your responsibilities end, in the kind of -- in the kind of work flow as -- you've talked to me about how records come in to the criminal and eviction database and that you have a responsibility for the match logic.  In terms of the actual matching and records coming out of the database, is that outside of your responsibility or outside of your purview?",q,MR. HASHMALL,start_answer
168,787,29,25,Can you repeat the last part of that.,a,THE WITNESS,start_question
169,789,30,1,"In terms of records actually being matched to the database and then information coming out of the database, is that part of your purview or not? MR. O'NEIL:  Objection.  Vague.",q,MR. HASHMALL,start_answer
170,793,30,5,"Yeah.  Yeah.  I guess I'm not sure of the question. I would treat -- I treat SmartMove as a customer of mine.  They use my products which are the criminal and eviction database.  They send requests.  I do all the work -- well, I don't, but the system does all the work to match records to their applicants, and I send those records back to SmartMove.",a,THE WITNESS,start_question
171,801,30,13,"(BY MR. HASHMALL)  Got it.  Okay. And when you send those records back, what format are they in?",q,MR. HASHMALL,start_answer
172,804,30,16,"They are in a format called -- I think we call it, internally, the criminal entity or the eviction entity.",a,THE WITNESS,start_question
173,807,30,19,The criminal entity. And is that -- do you know what type of file that is?,q,MR. HASHMALL,start_answer
174,810,30,22,I do not.  I believe it's XML.,a,THE WITNESS,start_question
175,811,30,23,Okay.  And does -- and is it fair to say it's been the product manager's responsibility for translating that XML into something like -- like you see in front of you here on page 114? MR. O'NEIL:  Objection.  Vague.,q,MR. HASHMALL,start_answer
176,817,31,3,"It would be the current product manager's responsibility to update or make any changes.  But the mapping was built a long time ago, so it's just -- I guess the responsibility is to -- to maintain it or update it or improve it.",a,THE WITNESS,start_question
177,822,31,8,(BY MR. HASHMALL)  And do you know if it's been updated or improved in the last five years?,q,MR. HASHMALL,start_answer
178,824,31,10,I don't know.,a,THE WITNESS,start_question
179,825,31,11,Are you aware of any times it has been changed?,q,MR. HASHMALL,start_answer
180,827,31,13,For SmartMove specifically?,a,THE WITNESS,start_question
181,828,31,14,Yes.,q,MR. HASHMALL,start_answer
182,829,31,15,No.,a,THE WITNESS,start_question
183,830,31,16,"Okay.  So is it fair to say, looking at page 114, that the -- on -- as to the information submitted by the applicant is on -- is in the top line, and then the results returned followed below? MR. O'NEIL:  Objection.  Vague.  Lack of foundation. Go ahead and answer if you can, sir.",q,MR. HASHMALL,start_answer
184,837,31,23,"Yeah.  I can't -- what do you mean by ""top line""?",a,THE WITNESS,start_question
185,839,31,25,"(BY MR. HASHMALL)  So where it says -- on the top of page 114, it says, ""Criminal records by state, William R. Hall, DOB 5-2-1968, SSN 186-58-2019."" Do you see that?",q,MR. HASHMALL,start_answer
186,844,32,4,Yes.,a,THE WITNESS,start_question
187,845,32,5,Okay.  That's what I mean by top line.,q,MR. HASHMALL,start_answer
188,846,32,6,Okay.  Yeah.  I don't -- I don't know.  It's a SmartMove report which I've never dealt with in my eight years at TransUnion.,a,THE WITNESS,start_question
189,849,32,9,You have no familiarity with a SmartMove report?,q,MR. HASHMALL,start_answer
190,851,32,11,"Not -- not their website, not their user interface.",a,THE WITNESS,start_question
191,853,32,13,"Okay.  And the -- the information below where it says ""Criminal Report,"" does that -- are you able to identify that as information coming from the criminal and eviction database?",q,MR. HASHMALL,start_answer
192,857,32,17,"So where it says ""Criminal Report,"" it has the date there.  Below that is the applicant information submitted, which is why I asked my question about the top line.",a,THE WITNESS,start_question
193,861,32,21,Got it.,q,MR. HASHMALL,start_answer
194,862,32,22,"So I believe that's the application information -- applicant information that was submitted.  And then below that, where it says ""William R. Hall,"" is the beginning of the credit report -- or I mean -- sorry -- the criminal report.",a,THE WITNESS,start_question
195,868,33,2,"Got it. And so the information below where it says ""William R. Hall"" is information that came from the criminal and eviction database that you manage?",q,MR. HASHMALL,start_answer
196,872,33,6,That information would have come from the criminal database.,a,THE WITNESS,start_question
197,874,33,8,"Okay.  And moving down to page 115, the sections labeled ""Summary,"" ""Comments,"" and ""Court Action,"" would those also have come from the same database?",q,MR. HASHMALL,start_answer
198,878,33,12,"The ""summary"" is not something that's in the criminal database.  The ""comments,"" which are blank, would have been if they were there, if there was anything there.  And then where the ""court action"" and ""court charge,"" those things would have come from the criminal database.",a,THE WITNESS,start_question
199,884,33,18,"Okay.  So looking -- and feel free to split between those two pages. Can you tell me ultimately where this -- this information came from, you know, both in terms of its original source?",q,MR. HASHMALL,start_answer
200,889,33,23,Just -- are you talking about the criminal report or --,a,THE WITNESS,start_question
201,891,33,25,Yeah.  Just focusing on the criminal report.,q,MR. HASHMALL,start_answer
202,893,34,1,So the dataset name indicates to me that it was a dataset that ultimately came from the South Carolina Department of Corrections.,a,THE WITNESS,start_question
203,896,34,4,Okay.  And TURSS received that information via a vendor; is that right?,q,MR. HASHMALL,start_answer
204,898,34,6,Correct.,a,THE WITNESS,start_question
205,899,34,7,And is that under Themis?,q,MR. HASHMALL,start_answer
206,900,34,8,Yes.,a,THE WITNESS,start_question
207,901,34,9,"And this -- the information -- the identifying information, the physical details, and then the things like date of birth, page, Social Security number -- which are blank -- would those also have come or -- from the South Carolina Department of Corrections via Themis.",q,MR. HASHMALL,start_answer
208,907,34,15,"So what we're looking at on the SmartMove criminal report, that stuff came from the criminal database.  I don't know that -- that SmartMove has mapped everything.  But the things on the page came from Themis to the criminal database.",a,THE WITNESS,start_question
209,912,34,20,"Okay.  So, for example, it says -- next to Age, it says, ""N/A."" Do you see that?",q,MR. HASHMALL,start_answer
210,915,34,23,Yes.,a,THE WITNESS,start_question
211,916,34,24,"Is it possible that in the criminal and eviction database, there was actually age data and it just didn't get mapped on this report?",q,MR. HASHMALL,start_answer
212,920,35,2,Yes.,a,THE WITNESS,start_question
213,921,35,3,Do you have any sense of why that might be?,q,MR. HASHMALL,start_answer
214,922,35,4,I don't.  That would be up to SmartMove.,a,THE WITNESS,start_question
215,923,35,5,Okay.,q,MR. HASHMALL,start_answer
216,924,35,6,But --,a,THE WITNESS,start_question
217,925,35,7,And that would be -- the Kaylene person you referenced earlier?,q,MR. HASHMALL,start_answer
218,927,35,9,Now.  Yeah.,a,THE WITNESS,start_question
219,928,35,10,How long has she been in charge of the product?,q,MR. HASHMALL,start_answer
220,930,35,12,"I am not sure.  I think -- yeah, I don't know.",a,THE WITNESS,start_question
221,932,35,14,Months?  Years?,q,MR. HASHMALL,start_answer
222,933,35,15,"More than a few months, less than a few years.",a,THE WITNESS,start_question
223,935,35,17,Okay.  Who was it previously?,q,MR. HASHMALL,start_answer
224,936,35,18,I believe it was Steve Hansen.,a,THE WITNESS,start_question
225,937,35,19,Is Mr. Hansen still with TURSS?,q,MR. HASHMALL,start_answer
226,938,35,20,Yes.,a,THE WITNESS,start_question
227,939,35,21,Okay.  I would like to show you another document.  It should pop up now.  It has previously been marked as Exhibit 30.  Feel free to take a look at it.  It's two pages -- or sorry -- three pages.  And let me know when you're ready to -- to address it.,q,MR. HASHMALL,start_answer
228,945,36,1,"Just to confirm, you're talking about 296, 297, and 298?",a,THE WITNESS,start_question
229,947,36,3,Yes.  Thank you for clarifying.,q,MR. HASHMALL,start_answer
230,948,36,4,Okay. (Deponent perused document.)  Okay.,a,THE WITNESS,start_question
231,950,36,6,So are you familiar with the documents of this type in your position?,q,MR. HASHMALL,start_answer
232,952,36,8,Somewhat.,a,THE WITNESS,start_question
233,953,36,9,Can you tell me what this is?,q,MR. HASHMALL,start_answer
234,954,36,10,"This looks like a printout of the record we were looking at earlier, but from the criminal database.",a,THE WITNESS,start_question
235,957,36,13,Okay.  So it's a printout of the -- from the -- from the database that -- that you manage?,q,MR. HASHMALL,start_answer
236,959,36,15,"It looks like that.  The reason I say it looks like that is it's -- it's a -- it's rows instead of columns.  I'm used to all of these things being columns.  And it's very horizontal, the way I normally look at it, and this is very vertical.  But it looks like it's all the same fields that would be in the criminal database.",a,THE WITNESS,start_question
237,966,36,22,"Got it. So I would just like to go through and discuss some of these fields and see if I can get a better understanding of them, and that would help me. And we can just start from the top. Do you know what -- what ""identity ID"" means?",q,MR. HASHMALL,start_answer
238,973,37,3,That is a unique number to this -- to the combination of identity information that's on this record.,a,THE WITNESS,start_question
239,976,37,6,"And when you say ""identity information,"" do you mean the -- the defendant's name, or do you mean something different?",q,MR. HASHMALL,start_answer
240,979,37,9,I mean -- hold on.  I'm just looking.,a,THE WITNESS,start_question
241,980,37,10,Yeah.  Take your time.,q,MR. HASHMALL,start_answer
242,981,37,11,"I think it goes all the way down to ""date time modified"" on 297.  That is the identity table, all of the columns that would be in the identity table. And so that identity ID is unique all the way across that row, if that makes sense.  It probably doesn't.",a,THE WITNESS,start_question
243,986,37,16,So this is -- is it fair to say this is a unique identifier for -- for this entire criminal record?,q,MR. HASHMALL,start_answer
244,989,37,19,"Not necessarily.  It is in this case, in this record.  But that's not necessarily true across the database.",a,THE WITNESS,start_question
245,992,37,22,Why not?,q,MR. HASHMALL,start_answer
246,993,37,23,There can be multiple defendants on criminal records.,a,THE WITNESS,start_question
247,995,37,25,"Oh, I see.  I see. So the identity ID is unique to the record; it's not to the defendant.  Is that right?",q,MR. HASHMALL,start_answer
248,999,38,3,Identity ID is unique to this defendant on this record.,a,THE WITNESS,start_question
249,1001,38,5,"Oh, okay.  So if there are multiple defendants, would there be multiple identity IDs?",q,MR. HASHMALL,start_answer
250,1003,38,7,Yes.,a,THE WITNESS,start_question
251,1004,38,8,Got it.  Got it.  Okay. So this identity ID is about William Hall in this particular court proceeding.  Is that fair?,q,MR. HASHMALL,start_answer
252,1007,38,11,"The identity ID only goes down to, like I said, date time modified.  And then the next set of rows there are in a different table.",a,THE WITNESS,start_question
253,1010,38,14,Yeah.,q,MR. HASHMALL,start_answer
254,1011,38,15,So that --,a,THE WITNESS,start_question
255,1012,38,16,"Okay.  Oh, sorry.  I didn't mean to interrupt you.  Please continue.",q,MR. HASHMALL,start_answer
256,1014,38,18,"Well, I think that's all I have to say about that.",a,THE WITNESS,start_question
257,1016,38,20,"Okay.  On -- the next one down is ""source ID.""  Can you tell me what that is?",q,MR. HASHMALL,start_answer
258,1018,38,22,"The best way to think of the source ID is actually just where the ""state key"" is.  It's -- it's a unique number to identify the source of the data.  The state key is the same thing; the five-digit state key, which is next.",a,THE WITNESS,start_question
259,1024,39,2,"And the state key here is listed as ""SCCO2."" And do you know, offhand, what that means?",q,MR. HASHMALL,start_answer
260,1026,39,4,No.,a,THE WITNESS,start_question
261,1027,39,5,"If you'd like, we can flip back to Exhibit 13, which says the source of this record was the South Carolina Department of Corrections.  If you -- feel free to look at that.  I'm not trying to pull a fast one here. My only question is going to be whether you think ""SCCO2"" refers to the South Carolina Department of Corrections.",q,MR. HASHMALL,start_answer
262,1035,39,13,"I think that's true.  Yeah.  I mean, I don't have all of our state keys memorized as far as what source they go to.  So I think it's true in this record that the ""SCCO2"" corresponds to a South Carolina Department of Corrections dataset.",a,THE WITNESS,start_question
263,1040,39,18,Got it. And is there a document at TURSS that kind of decodes that state key fields for following different sources?,q,MR. HASHMALL,start_answer
264,1044,39,22,Yes.,a,THE WITNESS,start_question
265,1045,39,23,"Okay.  And next, we have the ""product type"" which is -- is ""criminal."" Is that just, essentially, identifying that this is a criminal record?",q,MR. HASHMALL,start_answer
266,1050,40,2,Yes.,a,THE WITNESS,start_question
267,1051,40,3,"Okay.  I think I understand the next one, which is ""searchable source state."" Can you tell me what ""criminal ID number"" means?",q,MR. HASHMALL,start_answer
268,1055,40,7,That is a unique number to this criminal record.  That is -- it's something internal.  It's unique for TURSS.  So we can look -- like the way this document was produced was probably by using that number to identify everything to do with that criminal ID number.,a,THE WITNESS,start_question
269,1061,40,13,"I see.  On -- and at some point on -- so I think most -- the fields we've talked about so far, these first -- one, two, three, four, five -- six on this sheet, are all fields that -- if I'm understanding you right -- are created or populated by TURSS internally.  Is that right?",q,MR. HASHMALL,start_answer
270,1067,40,19,"I can't answer definitively for ""searchable source state.""  But the --",a,THE WITNESS,start_question
271,1069,40,21,Okay.,q,MR. HASHMALL,start_answer
272,1070,40,22,"But the others, I think that's accurate.",a,THE WITNESS,start_question
273,1071,40,23,"Sure. At some point we're going to get into data that came from the source.  Are you able to kind of identify the span of records that came from the -- the source -- the span of fields, I guess, not records.",q,MR. HASHMALL,start_answer
274,1077,41,3,"Yeah.  I mean, to exclude ones that didn't would take me some time to go through line by line, if you'd like me to do that.",a,THE WITNESS,start_question
275,1080,41,6,"Yeah.  It might actually be helpful if you can, yeah.  Yeah.",q,MR. HASHMALL,start_answer
276,1082,41,8,"So looking at page 296, skipping the fields we've already talked about, the ""parent ID"" is not something that would have come from the source.  But it came -- I believe it probably came from Themis.",a,THE WITNESS,start_question
277,1086,41,12,Okay.,q,MR. HASHMALL,start_answer
278,1087,41,13,I believe the rest on this page would have come from the source.,a,THE WITNESS,start_question
279,1089,41,15,Got it. On --,q,MR. HASHMALL,start_answer
280,1091,41,17,"Sorry.  Except -- sorry.  Except for ""photo identifier.""  That would have come from Themis.",a,THE WITNESS,start_question
281,1093,41,19,Okay.  Let's -- I think this is helpful.  So let's just press on and do the same things on page 297.,q,MR. HASHMALL,start_answer
282,1095,41,21,"So 297, you're seeing a lot of the same fields as the last page because of -- it's -- there's three different tables, and this is how they relate to each other.",a,THE WITNESS,start_question
283,1099,41,25,Okay.,q,MR. HASHMALL,start_answer
284,1101,42,1,"The ""source_file_record _date,"" ""is expunged,"" ""date time created,"" ""date time modified,"" ""HID_ID,"" ""case ID,"" ""state key,"" ""identity ID,"" none of those would have come from the source.",a,THE WITNESS,start_question
285,1105,42,5,I see.,q,MR. HASHMALL,start_answer
286,1106,42,6,They would have either been Themis or TURSS.,a,THE WITNESS,start_question
287,1107,42,7,Got it. Then going down with the rest of the ones on this page would come from the source?,q,MR. HASHMALL,start_answer
288,1110,42,10,I'm about halfway.  So...,a,THE WITNESS,start_question
289,1111,42,11,Yeah.  Take your time.,q,MR. HASHMALL,start_answer
290,1112,42,12,"All the way down to ""date time created"" would have come from the source.",a,THE WITNESS,start_question
291,1114,42,14,Okay.,q,MR. HASHMALL,start_answer
292,1115,42,15,"Then after ""date time created,"" ""date time modified,"" we're starting a new table here.  So again, you'll see all those fields that are not populated -- or not from the source.",a,THE WITNESS,start_question
293,1119,42,19,Okay.,q,MR. HASHMALL,start_answer
294,1120,42,20,"Starting at ""sequence,"" it would be coming from the source through the end of the page.",a,THE WITNESS,start_question
295,1122,42,22,Okay.  And then there's only a little bit left on 298.  So let's just keep pressing on.,q,MR. HASHMALL,start_answer
296,1124,42,24,"All the way down to ""is expunged"" would have come from the source.",a,THE WITNESS,start_question
297,1127,43,1,Got it.,q,MR. HASHMALL,start_answer
298,1128,43,2,The rest would not have.,a,THE WITNESS,start_question
299,1129,43,3,Sure.,q,MR. HASHMALL,start_answer
300,1130,43,4,Either Themis or TURSS.,a,THE WITNESS,start_question
301,1131,43,5,"Sure. So one question.  I know -- is it your understanding that every two weeks when Themis sends an updated record, that the -- the old records are taken out of the database and completely replaced by new Themis data? Is that a fair way to characterize that?",q,MR. HASHMALL,start_answer
302,1138,43,12,"I think that's fair.  Yeah, it's -- it's a replacement.",a,THE WITNESS,start_question
303,1140,43,14,"Okay.  And do these identifiers at the top of the -- at the top of the records -- specifically, like, ""identity ID"" and ""criminal ID number,"" do those stay consistent when the database is replaced in that way, or are they regenerated or changed in some way?",q,MR. HASHMALL,start_answer
304,1145,43,19,I think they generally stay consistent.  I don't think that there's a rule in place that they must stay consistent.  So I think there's a potential for changing.,a,THE WITNESS,start_question
305,1149,43,23,Why might they change?,q,MR. HASHMALL,start_answer
306,1150,43,24,"Depending on what changes within the identity data.  So, you know, a court could add another name here, a different name.  They could change ""hall"" to ""hallway"" or something like that, and that might affect those numbers.",a,THE WITNESS,start_question
307,1156,44,4,"I see.  That makes sense. But if the underlying data stays the same, would you expect those identifiers to stay the same as well?",q,MR. HASHMALL,start_answer
308,1160,44,8,"Generally, yes.",a,THE WITNESS,start_question
309,1161,44,9,"Okay.  And then just to -- a good -- about halfway down the page on 296, it does look like this record came with -- with an ""age."" Do you see that?",q,MR. HASHMALL,start_answer
310,1165,44,13,"I see the ""age,"" yeah.",a,THE WITNESS,start_question
311,1166,44,14,"And again, feel free to look back to Exhibit 13 if you'd like.  But would it be fair to say that ""age"" was present in the criminal and eviction database but was not mapped onto the ultimate report? MR. O'NEIL:  Objection to the extent that you're suggesting, Mr. Hashmall, that document -- Exhibit 30 is the same moment in time as the record that was included in Exhibit 13.  So I would object to the extent that you're mischaracterizing the record. But go ahead and answer if you can, Mr. Landreth.",q,MR. HASHMALL,start_answer
312,1177,44,25,"Yeah.  It's hard to answer without knowing when the Exhibit 30 was pulled out of the database.  So I can't say for certain looking at the two exhibits that ""age"" was present on this record the day that that report was run.",a,THE WITNESS,start_question
313,1183,45,5,(BY MR. HASHMALL)  I see. Okay.  But you can -- you can say for certain that age was present on the day that Exhibit 30 was pulled from the database?,q,MR. HASHMALL,start_answer
314,1187,45,9,Yes.,a,THE WITNESS,start_question
315,1188,45,10,"And it looks like birth date and birth year were not present, is that accurate, on the day that Exhibit 30 was pulled from the database?",q,MR. HASHMALL,start_answer
316,1191,45,13,Yeah.,a,THE WITNESS,start_question
317,1192,45,14,Okay.  And do you have records or tables indicating what data you generally received from various sources? MR. O'NEIL:  Objection.  Vague.,q,MR. HASHMALL,start_answer
318,1196,45,18,Yeah.  I don't know if you can clarify that at all or be more specific.,a,THE WITNESS,start_question
319,1198,45,20,"(BY MR. HASHMALL)  Sure. Again, to be more specific, is there a document somewhere at TURSS that says, you know, for this South Carolina Department of Corrections, we usually receive age but not date of birth or anything like that?",q,MR. HASHMALL,start_answer
320,1205,46,1,"There is a document that would indicate the number of records within this dataset that has age -- that have age on them.  That's all metadata, though. It doesn't tie back to specific records.",a,THE WITNESS,start_question
321,1209,46,5,Sure. And is that historical or does that reflect to the database today? MR. O'NEIL:  Objection.  Vague.  Form.,q,MR. HASHMALL,start_answer
322,1213,46,9,"We pull these from time to time, so it would reflect the database as it existed on the day we pulled them.",a,THE WITNESS,start_question
323,1216,46,12,(BY MR. HASHMALL)  Did you have a sense of how frequently that's pulled?,q,MR. HASHMALL,start_answer
324,1218,46,14,"We typically do that biweekly, every other week.",a,THE WITNESS,start_question
325,1220,46,16,So what do you call that document?,q,MR. HASHMALL,start_answer
326,1221,46,17,"I would call that -- I think it's called the ""fill rate report.""",a,THE WITNESS,start_question
