,indice,page_number,line_number,text,text_type,speaker,time_added
327,1223,46,19,And does the fill rate report include data for the rate at which various variables are filled in broken down by -- by source?  Is that fair?,q,MR. HASHMALL,start_answer
328,1226,46,22,It doesn't have the rate.  It has counts.,a,THE WITNESS,start_question
329,1227,46,23,"Okay.  That's confusing.  It's called the fill rate report, but it doesn't actually have rates?",q,MR. HASHMALL,start_answer
330,1229,46,25,Correct.,a,THE WITNESS,start_question
331,1231,47,1,"Okay.  Would you be able to calculate a rate by, you know -- does it have the total number of records that you divide and come up with a percentage?",q,MR. HASHMALL,start_answer
332,1234,47,4,"Yeah, that could be done.",a,THE WITNESS,start_question
333,1235,47,5,"Okay.  So by -- going back to my question, is it -- does it have those -- does it have specifics broken down by jurisdiction, or how is it broken down?",q,MR. HASHMALL,start_answer
334,1238,47,8,"It's broken down by distinct state keys, that five-digit key near the top of the page.",a,THE WITNESS,start_question
335,1240,47,10,Got it. And what use do you put those that you report to?,q,MR. HASHMALL,start_answer
336,1243,47,13,"I -- my team puts it to use to -- like I mentioned at the beginning -- to QA, the data, every other week.  So we look at variances between fill rate reports to see if there are any potential issues indicated by that.",a,THE WITNESS,start_question
337,1248,47,18,"So, for example, you might say, Oh, state tax used to report -- we used to get a hundred percent of dispositions and now we're only getting 50; what the heck is going on?  Is that sort of a basic example?",q,MR. HASHMALL,start_answer
338,1252,47,22,"Yeah.  Not at the state level, but at the dataset level, yeah.",a,THE WITNESS,start_question
339,1254,47,24,"Sure.  Yeah. And do you -- have you analyzed these fill rate reports -- or have you looked at the fill rate with respect to age and with respect to date of birth? Has that been something you've focused on in your time, in your position?",q,MR. HASHMALL,start_answer
340,1261,48,5,"The -- yeah.  The extent to which I look at those reports is the variances between them.  And so, you know, if date of birth changed drastically in a dataset or across the board from one update to the next, I would -- I would look at it in that respect. Mostly, it's my team that does this stuff now.  So...",a,THE WITNESS,start_question
341,1267,48,11,Sorry.  I didn't quite hear that.  Can you repeat your last sentence.,q,MR. HASHMALL,start_answer
342,1269,48,13,"Most of the time, it's my team that does the analysis.  And then, you know, escalates any issues to me or the vendor.",a,THE WITNESS,start_question
343,1272,48,16,"Sure. If they escalate an issue to you, do they, like, write a memo or do they send you an email or do they walk over to your desk?  Or how does that happen?",q,MR. HASHMALL,start_answer
344,1276,48,20,It would be all of the above except memos.,a,THE WITNESS,start_question
345,1277,48,21,Okay.  Okay.,q,MR. HASHMALL,start_answer
346,1278,48,22,So...,a,THE WITNESS,start_question
347,1279,48,23,"All right.  Let's talk a little bit about the match logic.  I think we've talked a lot about the -- about the criminal data.  I think that the match logic would be the next -- the next thing. MR. O'NEIL:  Mr. Hashmall, sorry to interrupt.  But I was going to ask to take a break.  Is this a good time to take a -- take a short break?",q,MR. HASHMALL,start_chat
348,1287,49,5,This is a great time to take a short break. Do you want five minutes?  Ten minutes? MR. O'NEIL,side_chat,MR. HASHMALL,start_chat
349,1292,49,10,Sounds great.  Let's go off the record and meet back in five minutes.,side_chat,MR. HASHMALL,is brackets
350,1294,49,12,(Recess taken from 10:50 a.m. to 10:58 a.m.),brackets,,start_chat
351,1295,49,13,Let's go back on the record.,side_chat,MR. HASHMALL,start_question
352,1296,49,14,"(BY MR. HASHMALL)  Before I go to the next exhibit, I just wanted to -- I have one quick follow-up on the fill rate reports.  I was just looking at testimony from a prior witness. Is it -- is there -- within TURSS, their fill rate reports also called variance reports?",q,MR. HASHMALL,start_answer
353,1302,49,20,The variance report is the other thing I was talking about where we compare the differences between one fill rate to another.  So there are two -- two separate documents.,a,THE WITNESS,start_question
354,1306,49,24,"So on -- am I correct in saying that if the -- if the fill rate has changed significantly, then a advance report might be filled out?  Is that -- is that accurate?",q,MR. HASHMALL,start_answer
355,1311,50,3,"The variance report is always filled out when -- before we do a change. So to answer your question, we wouldn't know something changed drastically between fill rates without making the variance report.",a,THE WITNESS,start_question
356,1316,50,8,"Got it. So -- is -- just to be clear, is the variance report one of these things that's drafted biweekly or it's only drafted when there's going to be a change of procedures?",q,MR. HASHMALL,start_answer
357,1321,50,13,It's done biweekly for the data updates.,a,THE WITNESS,start_question
358,1322,50,14,Got it.  Okay.  That is helpful. Okay.  I'm going to show you -- it should be showing up on your page now -- a document that's previously been marked as Exhibit 22.  It's a two-page document labeled page TURSS 247 and 248.  And take a look at that and tell me if you recognize it.,q,MR. HASHMALL,start_answer
359,1328,50,20,"I do recognize it.  The second page has it -- looks like a redaction, but...",a,THE WITNESS,start_question
360,1330,50,22,Can you tell me what it is?,q,MR. HASHMALL,start_answer
361,1331,50,23,"Looking at the first page, I refer to this document as the qualification table.",a,THE WITNESS,start_question
362,1333,50,25,And can you tell me how it is used?,q,MR. HASHMALL,start_answer
363,1335,51,1,This is -- this table represents one step in the match logic -- the qualifications step.  So --,a,THE WITNESS,start_question
364,1337,51,3,Okay.,q,MR. HASHMALL,start_answer
365,1338,51,4,Yep.,a,THE WITNESS,start_question
366,1339,51,5,"And then let's run through the steps of the match logic, then. Is the qualification step 1? MR. O'NEIL:  Objection.  Vague.",q,MR. HASHMALL,start_answer
367,1343,51,9,"I don't understand the qualification step as being step 1.  When I look at the match logic as the products manager, I would consider in the enrichment phase that we talked about earlier to be step 1.",a,THE WITNESS,start_question
368,1347,51,13,"(BY MR. HASHMALL)  Great. And then can you just walk me through the steps and then that will help clarify our future conversations. MR. O'NEIL:  Objection.  Vague.  Calls for a narrative.  Form. Are you asking for a high-level listing of what you call steps, Mr. Hashmall?",q,MR. HASHMALL,start_chat
369,1355,51,21,Yeah.  That's what I'm asking for. MR. O'NEIL,side_chat,MR. HASHMALL,start_answer
370,1359,51,25,"Yeah.  So very high level, we get the applicant's information, we do the enrichment phase, then we pull records out of the criminal database -- so we call that the scoop -- then we do the qualification, and then the disqualification, and then some additional filtering that we've made on top of that.",a,THE WITNESS,start_question
371,1366,52,6,(BY MR. HASHMALL)  Okay.  So we talked about enrichment.  Can you tell me how the scoop works?,q,MR. HASHMALL,start_answer
372,1368,52,8,"So after enrichment, when we have the names and addresses that we want to use -- dates of birth, SSN -- we look at the criminal database to determine which records we think might be a match.  And those records are then sent to the next step, the next phase in the matching logic.",a,THE WITNESS,start_question
373,1374,52,14,"How did you determine what might be a match in that scoop step?  Is it just -- how broad of -- or what needs to match in order for it to be pulled into that step? MR. O'NEIL:  Objection.  Vague.  Incomplete hypothetical.  Calls for a narrative. Go ahead and answer if you can, Mr. Landreth.",q,MR. HASHMALL,start_answer
374,1381,52,21,"Yeah.  There are clauses that were written that I don't have memorized.  But that piece of the process is generally to find records that might be a match, like I said.  It's not -- it's not as tight as we get later on in the matching process.",a,THE WITNESS,start_question
375,1387,53,1,"(BY MR. HASHMALL)  Okay.  Does it -- so you -- do you know -- for example, you know, does it need to match on name and one other matching characteristic, or is it just -- is just a name enough to match or -- in this -- in this broader step? Can you put any kind of parameters on it?",q,MR. HASHMALL,start_answer
376,1393,53,7,"Yeah.  Like I said, I don't have it memorized.  I could speculate.  I think most, if not all, of the clauses have more than one element required.",a,THE WITNESS,start_question
377,1397,53,11,"Are the clauses -- you know, obviously, I assume they are present in the code.  Are they -- is it true that they are in code somewhere through the system? And are they present or written down anywhere else?",q,MR. HASHMALL,start_answer
378,1403,53,17,"It is true that they are in the code.  I believe they are written down elsewhere as well.  But it's not something I work with a lot.  So I don't -- like I said, that's why I don't have them well memorized or anything.",a,THE WITNESS,start_question
379,1408,53,22,"Sure. If you wanted to find where else they were written down, what kind of document would you ask for or who would you talk to?",q,MR. HASHMALL,start_answer
380,1413,54,1,"Well, if -- so I could look in some places, some shared drives that, you know -- that my team has and uses.  Or if I couldn't find them, I would ask a developer to interpret the code and write it down.",a,THE WITNESS,start_question
381,1417,54,5,"Okay.  What -- if you were looking at a shared drive, what type of document would you be looking for?  What would it be called?",q,MR. HASHMALL,start_answer
382,1420,54,8,"I don't -- I don't know.  I'd search the word ""clause,"" probably, and see if I can find it that way.",a,THE WITNESS,start_question
383,1422,54,10,Clause?,q,MR. HASHMALL,start_answer
384,1423,54,11,Yeah.,a,THE WITNESS,start_question
385,1424,54,12,"Why ""clause""?",q,MR. HASHMALL,start_answer
386,1425,54,13,"That's how they are referred to, as the scoop clauses, I think.",a,THE WITNESS,start_question
387,1427,54,15,"Scoop clauses.  I see.  Okay. So in the broad overview of the process that -- the match logic -- you gave me, the step 3 is then the qualification step, which relates to this table, Exhibit 22, you have in front of you. Can you give me a broad overview of how this table works?",q,MR. HASHMALL,start_answer
388,1434,54,22,"Sure. So looking at the top row, there are columns for Name, Low and High; Address, Low and High; SSN, Low and High; and Date of Birth, Low and High. Prior to the qualification step, all of those fields are scored, and those scores feed into this table.  So if the scores for each of those fields matches the ranges in each of those rows -- or in one row all the way across, the record would go onto the next step.",a,THE WITNESS,start_question
389,1445,55,7,"Got it. And there are additional tables for name, address, Social Security number, and date of birth that define how these scores are assigned; is that right?",q,MR. HASHMALL,start_answer
390,1449,55,11,There are additional tables that -- that you can use to -- for those scoring.  But I'm not sure those tables really define what score is what.  But...,a,THE WITNESS,start_question
391,1452,55,14,"Okay.  And it's true that if any of the conditions on any of these 33 rows are matched, then that record has passed the qualification set.  Is that fair to say?",q,MR. HASHMALL,start_answer
392,1456,55,18,"Well, there's 35 rows.  Like I said, the two on the next page, I think they were highlighted in the Xcel document that this was probably translated from.",a,THE WITNESS,start_question
393,1459,55,21,I see.,q,MR. HASHMALL,start_answer
394,1460,55,22,"But as it goes down from 1 to 35, if a record meets the criteria within one of the rows, it moves onto the next step.",a,THE WITNESS,start_question
395,1463,55,25,"Got it. And generally speaking, is it fair to say a score of 1 is a really good match and a score of 99 is not a match?",q,MR. HASHMALL,start_answer
396,1468,56,4,Yes.,a,THE WITNESS,start_question
397,1469,56,5,"And the lower the number, the better the match?",q,MR. HASHMALL,start_answer
398,1471,56,7,That is generally true.,a,THE WITNESS,start_question
399,1472,56,8,"Okay.  Are the numbers 99 and 88, do they have special significance?",q,MR. HASHMALL,start_answer
400,1474,56,10,"Yeah.  Like you said earlier, 99 would indicate a nonmatch and 88 would be indeterminate.",a,THE WITNESS,start_question
401,1476,56,12,"What does ""indeterminate"" mean in this context?",q,MR. HASHMALL,start_answer
402,1478,56,14,"So when you're looking at the scoring, you're comparing one name to another -- the criminal record name versus, say, the applicant name.  ""Indeterminate"" means one or more is not present.",a,THE WITNESS,start_question
403,1482,56,18,"Got it.  Okay. So, for example, we're now looking at the underlying tables.  But if I were to put this into -- put in precise plain English, I might say, Well, row 1 means a pretty good match on the name and a pretty good match on the address, no match on Social Security number, date of birth not present.  That will allow you to match on row 1.",q,MR. HASHMALL,start_answer
404,1491,57,1,Is there a question?,a,THE WITNESS,start_question
405,1492,57,2,Yeah.  Is that fair?  Would you agree or disagree with that statement?,q,MR. HASHMALL,start_answer
406,1494,57,4,"I would agree that, yeah, name is strong, address is strong.  SSN doesn't really matter for this row.  And date of birth either has to be matching or indeterminate.",a,THE WITNESS,start_question
407,1498,57,8,"Got it. So for row 33, the bottom row on this table -- and we'll look at the -- some of the underlying tables -- it looks to me like for row 33, if there's a really good name match and an address match at level 9, there doesn't need to be any Social Security number or date of birth present for there to be a match. Is that fair?",q,MR. HASHMALL,start_answer
408,1507,57,17,"I -- I would characterize ""SSN"" and ""DOB"" as they must be indeterminate for this row.",a,THE WITNESS,start_question
409,1509,57,19,They must be indeterminate.  Got it. Do you do -- or have you -- you or your team -- ever conducted an analysis of what rows are the most likely to generate a match -- or most likely to qualify a record rather?,q,MR. HASHMALL,start_answer
410,1514,57,24,We do.  We look at counts of records by qualification row as part of the champion-challenger process.,a,THE WITNESS,start_question
411,1518,58,2,Okay.  Do you know offhand which -- which rows are most likely to -- to qualify a record?,q,MR. HASHMALL,start_answer
412,1520,58,4,"I don't, off the top of my head.",a,THE WITNESS,start_question
413,1521,58,5,"Okay.  I mean, is it fair to say that most criminal records don't include a Social Security number?",q,MR. HASHMALL,start_answer
414,1524,58,8,"That is fair to say, yes.",a,THE WITNESS,start_question
415,1525,58,9,So would it also be fair to say that rows -- say 17 through 29 -- which all seem to include -- to require pretty good Social Security match are not frequently used when criminal records are qualified?,q,MR. HASHMALL,start_answer
416,1529,58,13,"Yeah.  I mean, if I'm following your logic, I think that's probably fair to say, although I don't know that.",a,THE WITNESS,start_question
417,1532,58,16,"Okay.  Let's take a look on -- I'm going to show you, actually, two exhibits.  I think you should be able to toggle between them.  But if you're not, I'm happy to do it for you. Let me show you a document that's previously been labeled as Exhibit 27, and then a document that's previously been labeled as Exhibit 28.  And these are two versions of what appear to be the same thing as they are both labeled ""Criminal Record Address Ranks Table"" -- and -- or one is labeled ""Criminal Address Ranks Table"" and one is labeled ""Criminal Record Address Levels."" And my -- you can take a look at both of them.  And -- but you should know that my first question is going to be whether or not you know which one of these is presently in effect.",q,MR. HASHMALL,start_answer
418,1549,59,7,Yeah.  How do I -- can you go back to 27?  I don't know how to do it.,a,THE WITNESS,start_question
419,1551,59,9,Yes.  So here is 27.,q,MR. HASHMALL,start_answer
420,1552,59,10,"So between 27 and 28, they are different.  I believe both of them exist in the match logic.  28 -- 28 is going to be what feeds into what we were just looking at, the qualification table.",a,THE WITNESS,start_question
421,1556,59,14,Okay.  What is 27?,q,MR. HASHMALL,start_answer
422,1557,59,15,"That's just -- that's the ranks table, which is distinct from levels.",a,THE WITNESS,start_question
423,1559,59,17,What are ranks used for?,q,MR. HASHMALL,start_answer
424,1560,59,18,"So ranks, they are primarily used as part of TransUnion's credit matching.  To my knowledge, TURSS doesn't use this ranks table.  But I think it's in the environment that we use for matching logic.",a,THE WITNESS,start_question
425,1564,59,22,"I see.  So because -- so I'm going to show you -- go back to Exhibit 28, because it seems like that's the most relevant.  But that leads us to a larger question. You testified earlier that these tables -- and correct me if I'm wrong -- that these tables originated at TransUnion.  But is it fair to say now that TURSS has kind of custody over them and is modifying them as it sees fit? MR. O'NEIL:  Objection.  Vague as to the term ""them.""",q,MR. HASHMALL,start_question
426,1576,60,8,"(BY MR. HASHMALL)  By the -- by ""them"" I mean the tables we've looked at so far, Exhibits 22, 27, 28.",q,MR. HASHMALL,start_answer
427,1578,60,10,"So I don't know if this answers your question, but TURSS has its own instance of the matching service, and we can -- and have from time to time modified some of these tables.",a,THE WITNESS,start_question
428,1582,60,14,Okay.  Is it fair to say that the tables were originally created by TransUnion?,q,MR. HASHMALL,start_answer
429,1584,60,16,"If I were to speculate, I would say yes.",a,THE WITNESS,start_question
430,1585,60,17,"And if TransUnion changes their matching logic, do they communicate that to TURSS in some way?",q,MR. HASHMALL,start_answer
431,1587,60,19,Not -- not always.,a,THE WITNESS,start_question
432,1588,60,20,Do they sometimes?,q,MR. HASHMALL,start_answer
433,1589,60,21,Yeah.  We're aware of matching logic changes that TransUnion has made.  But --,a,THE WITNESS,start_question
434,1591,60,23,And then -- go ahead.  Sorry.  Please finish.,q,MR. HASHMALL,start_answer
435,1592,60,24,The TransUnion doesn't dictate match logic changes for TURSS on a regular basis or anything like that.,a,THE WITNESS,start_question
436,1596,61,2,"Okay.  So when you become aware of -- by a TransUnion match logic change, do you consider updating it at TURSS or have you sometimes adopted those changes?",q,MR. HASHMALL,start_answer
437,1600,61,6,"Like I said, I've only been a product manager for a month, so I haven't yet.  But I think, generally, we would look at what sort of impact TransUnion was trying to effectuate with those changes and see how they might apply to criminal and eviction records.  And then if we were to adopt them, we would do a champion-challenger analysis the same as we always would.",a,THE WITNESS,start_question
438,1608,61,14,"I see.  Okay. So let's go back to Exhibit 28.  It is two pages.  I think it's the -- the table has been broken up over two pages.  I think it would have continued across in the original exhibit at the Xcel document. But are you, you know, familiar with the contents of this table?",q,MR. HASHMALL,start_answer
439,1615,61,21,"Somewhat, yeah.",a,THE WITNESS,start_question
440,1616,61,22,"Okay.  So can you -- so I see in the -- just kind of the body of the table -- a couple different letters.  I assume that ""Y"" stands for ""yes,"" and ""N"" stands for ""no.""  Is that correct?",q,MR. HASHMALL,start_answer
441,1621,62,1,"Yes, that's correct.",a,THE WITNESS,start_question
442,1622,62,2,"Can you tell me what ""P"" and ""I"" and ""N"" stand for?",q,MR. HASHMALL,start_answer
443,1624,62,4,"So I would -- I would say -- I mean, here's how I would define each of the letters.  ""Yes"" being an exact match -- or ""Y"" being an exact match.  ""P"" being a partial match.  ""N"" being nonmatching, and ""I"" being indeterminate.",a,THE WITNESS,start_question
444,1629,62,9,Okay.  Do you -- what -- where did the -- are you familiar with the underlying logic behind -- behind those scores?,q,MR. HASHMALL,start_answer
445,1632,62,12,"Scores being the ""Ys"" and the ""Ps"" and things.",a,THE WITNESS,start_question
446,1634,62,14,"Yeah, exactly.",q,MR. HASHMALL,start_answer
447,1635,62,15,I'm generally familiar with that.,a,THE WITNESS,start_question
448,1636,62,16,"Do you -- for example, do you know how close something has to be to be judged partial versus indeterminate or not a match?",q,MR. HASHMALL,start_answer
449,1639,62,19,"I have a general familiarity with that regarding addresses.  Obviously, it would be different for the different columns.",a,THE WITNESS,start_question
450,1642,62,22,"Okay.  So let's take a look at -- for example, street name.  So obviously, ""Y"" -- would ""Y"" only apply if there's an exact character to prepare for match for the entire street names?",q,MR. HASHMALL,start_answer
451,1647,63,1,Yes.  I believe that's correct.,a,THE WITNESS,start_question
452,1648,63,2,"Okay.  In what instance would you get a ""P"" for a street name?",q,MR. HASHMALL,start_answer
453,1650,63,4,I believe a P is one-third of the street name elements matching.,a,THE WITNESS,start_question
454,1652,63,6,What is a street name element?,q,MR. HASHMALL,start_answer
455,1653,63,7,"So a descriptive example, 123 Main Street would have three elements.",a,THE WITNESS,start_question
456,1655,63,9,"Okay.  So 123 is an element -- the number -- Main is an element, and then street is an element?",q,MR. HASHMALL,start_answer
457,1657,63,11,Correct.,a,THE WITNESS,start_question
458,1658,63,12,Is that right?,q,MR. HASHMALL,start_answer
459,1659,63,13,Yep.,a,THE WITNESS,start_question
460,1660,63,14,Okay.  I see. And sorry.  You said that P is two out of three?  I can't -- I've already forgotten.,q,MR. HASHMALL,start_answer
461,1663,63,17,I believe it's one out of three.,a,THE WITNESS,start_question
462,1664,63,18,"One out of three.  Okay.  And then what result is an ""I""?",q,MR. HASHMALL,start_answer
463,1666,63,20,"""I"" is indeterminate, so one or more isn't present.",a,THE WITNESS,start_question
464,1668,63,22,"I see.  ""N"" would be zero out of three matching?",q,MR. HASHMALL,start_answer
465,1670,63,24,"For the street name match column, yeah.",a,THE WITNESS,start_question
466,1671,63,25,Got it.,q,MR. HASHMALL,start_answer
467,1673,64,1,"There's no Ns in the tables, so...",a,THE WITNESS,start_question
468,1674,64,2,"Oh, sure. So, I see.  So, for example, to get in 88, which we decided was in no -- you know, there's nothing to compare it to, you get your -- your street name matches is an ""I,"" because there's no data to compare it to.  Is that fair?",q,MR. HASHMALL,start_answer
469,1680,64,8,Correct.,a,THE WITNESS,start_question
470,1681,64,9,"Okay.  So -- and on the left, there are sequence numbers and levels.  Is it fair to say that if you match any of the -- the given levels -- or any of the given sequence numbers associated with the level, you get that level? Is that -- if that wasn't clear, I can clarify.",q,MR. HASHMALL,start_answer
471,1688,64,16,"Yes.  I mean, it's a sequence number, so you go into sequence, right?  And then if you satisfy sequence number 3, you get a level 4.",a,THE WITNESS,start_question
472,1691,64,19,"Got it. And also, if you satisfy sequence level 10 -- sequence number 10, you get a level 4 as well.",q,MR. HASHMALL,start_answer
473,1694,64,22,Correct.,a,THE WITNESS,start_question
474,1695,64,23,Got it. So the code works its way down this table. It starts with 1 and it goes all the way down to 30?,q,MR. HASHMALL,start_answer
475,1699,65,1,"That's a technical question.  But if you satisfy a row, it's -- like row 10, for example, it's not going to look at row 11.",a,THE WITNESS,start_question
476,1702,65,4,"Got it. So is it fair to characterize level 9 as -- actually I have a -- sorry. Just to look at the second page of this document, is this second page a kind of a computer translation of the -- of the -- of the first page? Is that a -- would you characterize it that way, or some other way?",q,MR. HASHMALL,start_answer
477,1710,65,12,I know this as the programmers' view.,a,THE WITNESS,start_question
478,1711,65,13,Okay.  Is it kind of a numerical version of what is shown on the previous page?,q,MR. HASHMALL,start_answer
479,1713,65,15,Yes.  It means the same thing to a programmer that the previous page means to the business.,a,THE WITNESS,start_question
480,1715,65,17,"Got it. So let's focus on the one that we can read, which is page 290.  On -- is it fair to say that for a level 9 match, any of sequences 21 through 29, that what you need is for the state code to match?",q,MR. HASHMALL,start_answer
481,1720,65,22,"Yeah.  The state code must be an exact match for any of the rows for level 9, yeah.",a,THE WITNESS,start_question
482,1722,65,24,"Okay.  And, in fact, for sequence 29, on -- if only this 8 is present, there's no street name, no city name, and no ZIP code.  But the state matches, then -- then it's a level 9 match?",q,MR. HASHMALL,start_answer
