,indice,page_number,line_number,text,text_type,speaker,time_added
619,2083,83,21,"Fair enough.  Let's look back at there's a Robert Vogelsberg and then it says J 1937, junior engineer, De Laval Steam Turbine Company.  Did I read that correctly?",q,,start_answer
620,2088,84,1,Yes.,a,THE WITNESS,start_question
621,2089,84,2,Did you know Mr. Robert Vogelsberg?,q,,start_answer
622,2091,84,4,No.,a,THE WITNESS,start_question
623,2092,84,5,"Let's look at the next one Richard Waller, 1913, VP chief engineer, De Laval Steam Turbine Company.  Did you know Mr. Richard or O. Richard Waller?",q,,start_answer
624,2096,84,9,Yes.,a,THE WITNESS,start_question
625,2097,84,10,Was he working there at the time that you were working there?,q,,start_answer
626,2099,84,12,Yes.,a,THE WITNESS,start_question
627,2100,84,13,What was his position at the company when you were there?,q,,start_answer
628,2102,84,15,"I believe it's the same, he was vice-president of engineering I believe.",a,THE WITNESS,start_question
629,2104,84,17,Was he one of your bosses?,q,,start_answer
630,2105,84,18,Yes.,a,THE WITNESS,start_question
631,2106,84,19,How long was he one of your bosses?,q,,start_answer
632,2108,84,21,I think he retired the year I joined the company or shortly thereafter.,a,THE WITNESS,start_question
633,2110,84,23,Were you aware that Mr. Waller was a member of The American Society of Mechanical Engineers?,q,,start_answer
634,2114,85,2,I don't believe that I was.,a,THE WITNESS,start_question
635,2115,85,3,Certainly doesn't surprise you?,q,,start_answer
636,2116,85,4,"Doesn't surprise me, no.",a,THE WITNESS,start_question
637,2117,85,5,Did you ever go to any conferences with Mr. Waller to your knowledge?,q,,start_answer
638,2120,85,8,They rarely let a young guy like me go into his office.,a,THE WITNESS,start_question
639,2122,85,10,"Understood.  Next one is at the very bottom there Herbert L. Watson and then it says in parenthesis 1907, 1921, general sales manager, De Laval Steam Turbine Company.  Did I read that correctly?",q,,start_answer
640,2127,85,15,Yes.,a,THE WITNESS,start_question
641,2128,85,16,Did you know Mr. Herbert Watson?,q,,start_answer
642,2130,85,18,No.,a,THE WITNESS,start_question
643,2131,85,19,"Sir, if I counted it up correctly, there were 13 employees of De Laval Steam Turbine Company out of the Trenton, New Jersey facility that are listed in this publication as members of The American Society of Mechanical Engineers. Does that sound unusual to you?",q,,start_answer
644,2139,86,2,"No, not particularly.",a,THE WITNESS,start_question
645,2140,86,3,"If we include the one from Lawrenceville in this publication at least as I found so far there are 14 members or employees of De Laval or IMO that were members of The American Society of Mechanical Engineers, true?",q,,start_answer
646,2146,86,9,"That's what this publication says, yes.",a,THE WITNESS,start_question
647,2148,86,11,"If we looked through these individuals and I read the dates as we were going, some of the dates were 1935, 1936, 1937, 1939, 1935, 1937.  If those are the dates when these individuals were members of The American Society of Mechanical Engineers, wouldn't you agree, sir, that it's likely that they would have received these publications in 1935 that indicated that asbestos was hazardous?",q,,start_chat
648,2158,86,21,Objection to form.,side_chat,MR. COLAO,start_answer
649,2159,86,22,"Again, if that's what ASME was doing in 1935 then yes, they would have received them as members.",a,THE WITNESS,start_question
650,2163,87,1,"Same thing as it relates to 1939, these individuals if this date here refers to the date when these people were members and there's people listed here in 1939, wouldn't you agree it's likely that they would have received the publications of The American Society of Mechanical Engineers including the one we marked as Exhibit 6 in 1939?",q,,start_chat
651,2172,87,10,Same objection.,side_chat,MR. COLAO,start_answer
652,2173,87,11,"Subject to your qualification there of the meaning of these numbers and the fact that ASME was distributing its publication routinely to its members, yes.",a,THE WITNESS,start_question
653,2177,87,15,"Sir, you don't find it at all surprising that there would have been 13 or 14 or even more De Laval employees that were members of The American Society of Mechanical Engineers in the 1930s, true?",q,,start_answer
654,2182,87,20,I don't -- what was the question again?,a,THE WITNESS,start_question
655,2184,87,22,"You don't find it surprising at all or even unusual that there would have been 13 or 14 or even more employees of De Laval who would have been members of The American Society of Mechanical Engineers in the 1930s, true?",q,,start_answer
656,2191,88,4,"I don't find it surprising, no.",a,THE WITNESS,start_question
657,2192,88,5,"In fact, based on what you said that's completely consistent with the practice of De Laval when you were there namely that a portion of the individuals who were involved in engineering design of pumps and turbines were members of The American Society of Mechanical Engineers, true?",q,,start_chat
658,2199,88,12,Objection to form.,side_chat,MR. COLAO,start_answer
659,2200,88,13,"Yes, if they were mechanical engineering graduates and had an interest in a professional association, then they would have most likely joined the ASME.",a,THE WITNESS,start_question
660,2204,88,17,"It's in fact likely that there were in fact a number of De Laval employees who were members of The American Society of Mechanical Engineers throughout the 1930s, true?",q,,start_chat
661,2209,88,22,Objection; asked and answered.,side_chat,MR. COLAO,start_answer
662,2211,88,24,"Yes, based on this list I agreed that there were.",a,THE WITNESS,start_question
663,2214,89,2,"So it's likely that at least some of them would have received the 1935 publication and the 1939 publication from The American Society of Mechanical Engineers, can we agree on that?",q,,start_chat
664,2219,89,7,Same objection.,side_chat,MR. COLAO,start_answer
665,2220,89,8,"Again, if the ASME was distributing the publication routinely to members, to all members, then yes.",a,THE WITNESS,start_question
666,2223,89,11,You have no reason to believe that they were not?,q,,start_chat
667,2225,89,13,Objection to form.,side_chat,MR. COLAO,start_answer
668,2226,89,14,"I don't know that they were or were not in 1935, I wasn't around.",a,THE WITNESS,start_question
669,2228,89,16,In 1960 you know that they did distribute their publications to all of their members?,q,,start_answer
670,2231,89,19,That's correct.,a,THE WITNESS,start_question
671,2232,89,20,Do you know if 1960 was the first year that they started doing that or was that practice when you started?,q,,start_answer
672,2235,89,23,I don't know when they started doing that.,a,THE WITNESS,start_question
673,2238,90,1,"They had started that before you were a member, true?",q,,start_answer
674,2240,90,3,I don't know the answer to that.  I just know that they were doing it when I became a member in 1962.,a,THE WITNESS,start_chat
675,2243,90,6,Fair enough. Let's go off the record.,side_chat,MR. GREENSTONE,start_chat
676,2245,90,8,The time is 11:39.  This ends tape one of the videotape deposition of Richard M. Salzmann.  We are off the record.,side_chat,THE VIDEOGRAPHER,is brackets
677,2249,90,12,(Recess taken.),brackets,,start_chat
678,2250,90,13,The time is 11:56.  This begins tape two of the videotaped deposition of Richard M. Salzmann.  We are on the record.,side_chat,THE VIDEOGRAPHER,start_question
679,2254,90,17,"Mr. Salzmann, are you ready to continue?",q,,start_answer
680,2256,90,19,Yes.,a,THE WITNESS,start_question
681,2257,90,20,We've just been talking about The American Society of Mechanical Engineers and documents that were published by it and individuals who were employees of De Laval who were members of The American Society of Mechanical Engineers.  Do you remember that line of questions?,q,,start_answer
682,2265,91,3,Yes.,a,THE WITNESS,start_question
683,2266,91,4,"Would you agree with me, sir, that certainly employees of De Laval would have had access to the publications of The American Society of Mechanical Engineers in the 1930s?",q,,start_chat
684,2271,91,9,Objection; asked and answered.,side_chat,MR. COLAO,start_answer
685,2273,91,11,"I've answered that a number of times and as I say depending on how the ASME distributed its documents in the 1930s, yes.",a,THE WITNESS,start_question
686,2276,91,14,"My question is a little bit different. I'm not asking if you in fact have knowledge that they got the documents, but if members of or employees of De Laval including the vice-president of the company were members of The American Society of Mechanical Engineers in the 1930s, would you agree that they at least had the ability to get publications of The American Society of Mechanical Engineers in the 1930s?",q,,start_chat
687,2286,91,24,Same objection.,side_chat,MR. COLAO,start_answer
688,2288,92,1,"Again, I don't know what access they may or may not have had in the 1930s.",a,THE WITNESS,start_question
689,2290,92,3,"Sir, based on what you know about The American Society of Mechanical Engineers, what is the basis for your testimony that you don't know whether they would have had access to publications of The American Society of Mechanical Engineers?",q,,start_chat
690,2296,92,9,Objection to form.,side_chat,MR. COLAO,start_answer
691,2297,92,10,I wasn't there in the 1930s.,a,THE WITNESS,start_question
692,2298,92,11,Even though you were a member of this organization for how many years?,q,,start_answer
693,2300,92,13,From 1962 until the present.,a,THE WITNESS,start_question
694,2301,92,14,You have been a member of this organization for over 40 years?,q,,start_answer
695,2303,92,16,Yes.,a,THE WITNESS,start_question
696,2304,92,17,Has there ever been a time in the 40 years that you have been a member of The American Society of Mechanical Engineers that they haven't made their publications available to their members?,q,,start_answer
697,2309,92,22,"Not while I have been a member, no.",a,THE WITNESS,start_question
698,2311,92,24,"Sir, isn't it logical and reasonable that in the 1930s these publications of The American Society of Mechanical Engineers would have been made available to the De Laval employees who were members at that time including the vice-president of the company?",q,,start_chat
699,2319,93,7,Objection to form; asked and answered and based on his prior answers you are asking him to speculate.,side_chat,MR. COLAO,start_answer
700,2323,93,11,What's logical and reasonable may or may not be fact.  I don't know I'm trying to tell you that what's happening in the 1930s. I was born in 1942.,a,THE WITNESS,start_question
701,2327,93,15,"You can't testify as you sit here today, sir, that De Laval employees did not receive these publications of The American Society of Mechanical Engineers in the 1930s, correct?",q,,start_chat
702,2332,93,20,Objection; asked and answered.  Said he didn't know one way or the other.,side_chat,MR. COLAO,start_answer
703,2335,93,23,"That's right, I don't know.",a,THE WITNESS,start_question
704,2336,93,24,You don't know?,q,,start_answer
705,2338,94,1,I don't know one way or the other.,a,THE WITNESS,start_question
706,2340,94,3,"As you sit here today, you can't swear under oath as the corporate representative of IMO and De Laval Steam Turbine Company that the first time that IMO or De Laval learned about the dangers of asbestos was 1972; isn't that true?",q,,start_chat
707,2346,94,9,Same objection.,side_chat,MR. COLAO,start_answer
708,2347,94,10,"To my knowledge based on documents that I have seen, the first time that we were aware of some specific problem was in 1972.",a,THE WITNESS,start_chat
709,2351,94,14,Objection; non-responsive.,side_chat,MR. GREENSTONE,start_question
710,2353,94,16,"As the corporate representative who's been designated as the person most knowledgeable on the issue of when De Laval knew about the dangers of asbestos, isn't it true that you cannot swear under oath to this jury that employees of De Laval were not aware about hazards of asbestos as early as the 1930s when these American Society of Mechanical Engineers publications came out?",q,,start_chat
711,2363,95,1,Objection to form and asked and answered.,side_chat,MR. COLAO,start_answer
712,2365,95,3,I don't know what the individuals who were members of ASME knew or did not know in the 1930s.,a,THE WITNESS,start_question
713,2368,95,6,"The answer to my question is you can't swear under oath that the first time IMO learned about the dangers of asbestos was 1972, true?",q,,start_chat
714,2372,95,10,Objection to form; that's not what he said.,side_chat,MR. COLAO,start_answer
715,2374,95,12,What I said was that in the 1930s I have no knowledge of what specific individuals who are members of ASME knew or did not know.,a,THE WITNESS,start_question
716,2378,95,16,That's exactly --,q,,start_answer
717,2379,95,17,Individuals as opposed to the company.,a,THE WITNESS,start_question
718,2381,95,19,"I didn't mean to interrupt you, sir. That's exactly the point that I'm trying to make, sir, which is why I've asked the question that I've asked and I would like an answer to the question that I've asked which is we know that The American Society of Mechanical Engineers was publishing information about the hazards of asbestos in the 1930s.  You cannot swear under oath on behalf of IMO or De Laval Steam Turbine Company that people at De Laval didn't know as early as the 1930s about the dangers of asbestos?",q,,start_chat
719,2395,96,8,"Objection to form; asked and answered.  In fact, he has sworn under oath that they didn't know.",side_chat,MR. COLAO,start_chat
720,2399,96,12,"Counsel, please stop coaching the witness.  You are allowed to say objection to form under Massachusetts law.  That's a point that's been made to me over and over again by defense counsel many of whom are probably on the phone.",side_chat,MR. GREENSTONE,start_chat
721,2406,96,19,The only reason that I'm making any comment is because the question is being asked over and over again.  At some point --,side_chat,MR. COLAO,start_chat
722,2410,96,23,I still have not gotten an answer to my question.,side_chat,MR. GREENSTONE,start_chat
723,2413,97,1,I don't think you got the answer you wanted.  You got an answer.,side_chat,MR. COLAO,start_chat
724,2416,97,4,I got a non-responsive answer that I objected to.,side_chat,MR. GREENSTONE,start_chat
725,2419,97,7,I'll let him answer it again.,side_chat,MR. COLAO,start_chat
726,2421,97,9,Thank you.,side_chat,MR. GREENSTONE,start_question
727,2422,97,10,"Sir, isn't it accurate that because you do not know whether IMO or De Laval employees received publications in the 1930s or 40s that indicated that asbestos could kill because you don't know that?",q,,start_chat
728,2427,97,15,Objection.,side_chat,MR. COLAO,start_question
729,2428,97,16,"You cannot swear under oath, sorry, I have to finish my question.  I'll re-ask it.",q,,start_chat
730,2431,97,19,I apologize.,side_chat,MR. COLAO,start_question
731,2432,97,20,"You've testified that you don't know what employees of De Laval received or didn't receive in the 1930s and forties, true?",q,,start_answer
732,2436,97,24,"I said that, yes.",a,THE WITNESS,start_question
733,2438,98,1,"That's because you were not there, correct?",q,,start_answer
734,2440,98,3,That's correct.,a,THE WITNESS,start_question
735,2441,98,4,"But you are right now being produced as the corporate representative of IMO on the issue of when De Laval first learned about the dangers of asbestos, correct?",q,,start_answer
736,2446,98,9,That's correct.,a,THE WITNESS,start_question
737,2447,98,10,Isn't it accurate that because you do not know what the De Laval employees received in the 1930s and forties you cannot swear under oath that they didn't know about the dangers of asbestos as early as the 1930s and forties?,q,,start_chat
738,2453,98,16,Same objection.,side_chat,MR. COLAO,start_answer
739,2454,98,17,"I can only tell you what I know and based on what I know and what I have seen documents in reference to, they learned and took action in 1972.",a,THE WITNESS,start_question
740,2458,98,21,"Those are two different things, right, when you learned and when you took action, would you agree with me?",q,,start_answer
741,2461,98,24,Pardon me.,a,THE WITNESS,start_question
742,2463,99,1,"Wouldn't you agree with me that the two different things are when you learned and when you took action, correct?",q,,start_answer
743,2466,99,4,Yes.,a,THE WITNESS,start_question
744,2467,99,5,"The fact that De Laval took action in 1972, that fact in and of itself doesn't prove that De Laval didn't know about any dangers until 1972, would you agree with that?",q,,start_chat
745,2472,99,10,Objection; mischaracterizes his testimony.,side_chat,MR. COLAO,start_answer
746,2474,99,12,I think I said what the documents that I have seen indicate is that they learned and took action in 1972 and thereafter.,a,THE WITNESS,start_question
747,2478,99,16,Let's make sure that that's clear for the ladies and gentlemen of the jury.  What research did you do of historical documents to determine what was being published to De Laval or De Laval employees prior to 1972?,q,,start_answer
748,2484,99,22,Personally I did none.,a,THE WITNESS,start_question
749,2485,99,23,Didn't do anything?,q,,start_answer
750,2486,99,24,No.,a,THE WITNESS,start_question
751,2488,100,1,Nothing at all?,q,,start_answer
752,2489,100,2,I reviewed documents that were provided to me.,a,THE WITNESS,start_question
753,2491,100,4,By attorneys for De Laval?,q,,start_answer
754,2492,100,5,That's correct.,a,THE WITNESS,start_question
755,2493,100,6,"You were not provided nor did you look at publications from the 1930s, forties, fifties or sixties, true?",q,,start_answer
756,2496,100,9,I did not.,a,THE WITNESS,start_question
757,2497,100,10,"You did not conduct any type of independent research through De Laval's library or their files if there is even one to determine what publications they had in their possession from earlier than 1972, true?",q,,start_answer
758,2503,100,16,"I didn't do any personal research, no.",a,THE WITNESS,start_question
759,2505,100,18,All you did was get documents from attorneys for De Laval who told you that De Laval didn't know until 1972?,q,,start_chat
760,2508,100,21,Objection to form; it's not what he said.,side_chat,MR. COLAO,start_question
761,2510,100,23,"That's the basis of your testimony, true?",q,,start_answer
762,2513,101,1,My testimony is based on the documents that I have seen from 1972.,a,THE WITNESS,start_question
763,2515,101,3,"Those were documents that were hand picked and chosen by lawyers for De Laval, true?",q,,start_chat
764,2518,101,6,Same objection.,side_chat,MR. COLAO,start_answer
765,2519,101,7,"To the best of my knowledge that's not true, they are whatever documents exist, all of whatever documents exist that are relevant to these questions.",a,THE WITNESS,start_question
766,2523,101,11,"They certainly didn't show you any publications of The American Society of Mechanical Engineers, did they?",q,,start_answer
767,2526,101,14,"Not that I recall, no.",a,THE WITNESS,start_question
768,2527,101,15,"They didn't show you any membership rosters that indicated that the vice-president of IMO was a member of The American Society of Mechanical Engineers as early as 1912, did they?",q,,start_chat
769,2532,101,20,Objection to form.,side_chat,MR. COLAO,start_answer
770,2533,101,21,Not that I recall.,a,THE WITNESS,start_question
771,2534,101,22,"They didn't show you any trade journals such as the Southern Power & Industry that De Laval was listed as an advertiser in, did they?",q,,start_answer
772,2539,102,2,No.,a,THE WITNESS,start_question
773,2540,102,3,"Even though you have not tried to find the documents from the 1930s, forties and fifties and sixties that may indicate that De Laval had earlier knowledge about the dangers of asbestos, you still feel comfortable testifying to this jury under oath that De Laval couldn't have known until 1972?",q,,start_chat
774,2548,102,11,Same objection.,side_chat,MR. COLAO,start_answer
775,2549,102,12,Would you repeat the question.,a,THE WITNESS,start_question
776,2550,102,13,"Even though you conducted no research to determine what documents were available to De Laval in the 1930s, forties, fifties or sixties, do you still feel comfortable testifying on behalf of De Laval that they couldn't have known that asbestos was hazardous until 1972?",q,,start_chat
777,2557,102,20,Same objection.,side_chat,MR. COLAO,start_answer
778,2558,102,21,"I feel comfortable, yes.  I have not done any personal research myself.",a,THE WITNESS,start_question
779,2560,102,23,"If you don't do any research, sir, how do you really know whether it's correct or not?",q,,start_answer
780,2564,103,2,Just because I didn't personally do any research doesn't suggest that it has not been done.,a,THE WITNESS,start_question
781,2567,103,5,Wasn't done by you?,q,,start_answer
782,2568,103,6,Wasn't done by me.,a,THE WITNESS,start_question
783,2569,103,7,Do you know who did the research?,q,,start_answer
784,2571,103,9,No.,a,THE WITNESS,start_question
785,2572,103,10,"Whoever did it didn't give you documents from the thirties, forties, fifties and sixties?",q,,start_chat
786,2575,103,13,"Objection, asked and answered.",side_chat,MR. COLAO,start_answer
787,2577,103,15,"They did not, no.",a,THE WITNESS,start_question
788,2578,103,16,"The first time you knew about these American Society of Mechanical Engineers publications from the thirties that indicated concerns with asbestos, that was when I showed them to you today, true?",q,,start_answer
789,2583,103,21,I believe that's correct.,a,THE WITNESS,start_question
790,2584,103,22,They don't cause you to change your testimony at all about when De Laval first could have potentially known about the dangers of asbestos?,q,,start_chat
791,2589,104,2,Objection; asked and answered.  I'll let him answer it one more time.,side_chat,MR. COLAO,start_answer
792,2592,104,5,I said it doesn't change my opinion about when I actually know that De Laval learned about the dangers.,a,THE WITNESS,start_question
793,2595,104,8,Does it change your testimony about when De Laval could have potentially learned about the dangers?,q,,start_chat
794,2598,104,11,Same objection.,side_chat,MR. COLAO,start_answer
795,2599,104,12,"That's pure speculation, no.",a,THE WITNESS,start_question
796,2600,104,13,"Let's talk about what you have testified about as it relates to De Laval's knowledge.  As you and I discussed before you said that it was the OSHA, the Occupational Safety and Health Administration asbestos regulations in 1972, that's the first thing that put De Laval on notice; is that fair?",q,,start_answer
797,2607,104,20,"I believe that's correct, yes.",a,THE WITNESS,start_question
798,2608,104,21,Why was it that a federal regulation relating to asbestos put De Laval on notice about the hazards of asbestos?,q,,start_answer
799,2611,104,24,I don't understand that question why was it.,a,THE WITNESS,start_question
800,2614,105,2,"Sure, why is it just because the federal government passes a regulation that says asbestos is dangerous, why would that affect De Laval?",q,,start_answer
801,2618,105,6,I'm searching for where you are trying to go here.,a,THE WITNESS,start_question
802,2620,105,8,"I would like you to answer the question, sir?",q,,start_answer
803,2622,105,10,Would you ask it again?,a,THE WITNESS,start_question
804,2623,105,11,Sure.  Why did the OSHA regulations provide notice to De Laval that there may be a concern with asbestos if you know?,q,,start_answer
805,2627,105,15,It really affected the customers who used our equipment in work places and so a customer raised a question about whether we would use a substitute for asbestos because of those regulations.,a,THE WITNESS,start_question
806,2632,105,20,You certainly agree that a federal regulation relating to asbestos that would affect your customers is the type of information that would put De Laval on notice that there may be a concern here?,q,,start_answer
807,2638,106,1,Yes.,a,THE WITNESS,start_question
808,2639,106,2,That's in fact what you testified did put De Laval on notice in 1972?,q,,start_chat
809,2641,106,4,Objection to form. Go ahead.,side_chat,MR. COLAO,start_question
810,2643,106,6,Correct?,q,,start_answer
811,2644,106,7,"Yeah, yes, that's what raised the issue in 1972, yes.",a,THE WITNESS,start_question
812,2646,106,9,"Sir, if there had been a similar government regulation, federal government regulation that was passed say 20 years before 1972 that also affected your customers in the same way, would you agree that that would also be something that would have put De Laval on notice about the dangers of asbestos?",q,,start_chat
813,2654,106,17,Objection to form.,side_chat,MR. COLAO,start_answer
814,2655,106,18,"Yes, if it was something that affected the use or sale of our equipment by a customer, yes.",a,THE WITNESS,start_question
815,2658,106,21,"Sir, have you ever heard of the Walsh Healey Act?",q,,start_answer
816,2660,106,23,I've heard the name.,a,THE WITNESS,start_question
817,2661,106,24,What is the Walsh Healey Act if you know?,q,,start_answer
818,2664,107,2,I don't know.,a,THE WITNESS,start_question
819,2665,107,3,Do you know that the Walsh Healey Act was passed in the 1950s?,q,,start_chat
820,2667,107,5,Objection; asked and answered.,side_chat,MR. COLAO,start_question
821,2669,107,7,"If you know, sir?",q,,start_answer
822,2670,107,8,"Yes, I don't know.",a,THE WITNESS,start_question
823,2671,107,9,"Where have you seen that referenced, sir?",q,,start_answer
824,2673,107,11,On order cards for De Laval equipment.,a,THE WITNESS,start_question
825,2675,107,13,De Laval documents?,q,,start_answer
826,2676,107,14,"They are -- well, they are partially De Laval documents, yes.",a,THE WITNESS,start_question
