,indice,page_number,line_number,text,text_type,speaker,time_added
1201,3875,155,13,It's the same question and I'm going to direct him not to answer where it's the same exact question now twice.  I think I have been overly liberal.,side_chat,MR. COLAO,start_chat
1202,3880,155,18,He didn't answer it the first time.  He asked me to clarify it which is why I asked it again.,side_chat,MR. GREENSTONE,start_chat
1203,3884,155,22,He did.,side_chat,MR. COLAO,start_chat
1204,3885,155,23,You know why I have to ask the question.  I've worded the question in a way that's not been asked before specifically talking about officers of the federal government.  You know exactly why I'm asking it.  He's entitled to answer it and I'm entitled to get an answer to the question.,side_chat,MR. GREENSTONE,start_chat
1205,3895,156,8,"I'm not so sure that you are right, but I'll let him do it.",side_chat,MR. COLAO,start_question
1206,3898,156,11,"You are aware of nothing that would -- no information at all that would indicate to you that De Laval didn't warn regarding the dangers of asbestos because they were directed not to warn by any officer of the federal government, true?",q,,start_answer
1207,3904,156,17,"Again, I can't know that with any degree of accuracy, but I know of no specific instance where that occurred.",a,THE WITNESS,start_question
1208,3907,156,20,Do you believe it was responsible for De Laval to never warn regarding the dangers of asbestos for the more than 50 years that they sold products that had asbestos components?,q,,start_answer
1209,3913,157,1,"To the best of my knowledge, De Laval acted responsibly as long as I was with the company and if they felt that there was a need to warn or take action of any kind, their response was generally that they did so.",a,THE WITNESS,start_question
1210,3919,157,7,"Isn't it accurate, sir, that you have seen nothing that indicates that De Laval was concerned at all about the safety of individuals who were using asbestos components of De Laval products?",q,,start_chat
1211,3924,157,12,Objection to form.,side_chat,MR. COLAO,start_answer
1212,3925,157,13,Would you repeat that question?,a,THE WITNESS,start_question
1213,3926,157,14,Sure.  You have seen nothing that would indicate to you that De Laval was concerned at all about the safety of people who were using asbestos components of De Laval products?,q,,start_chat
1214,3931,157,19,Same objection.,side_chat,MR. COLAO,start_answer
1215,3932,157,20,What I have seen is all kinds of indications that De Laval didn't believe there was any danger associated with those asbestos products that it used when they used them.,a,THE WITNESS,start_chat
1216,3938,158,1,Objection; non-responsive.,side_chat,MR. GREENSTONE,start_question
1217,3940,158,3,"Would you agree with me, sir, that you have seen no documents or any other evidence that would indicate to you that De Laval was concerned about the safety of individuals who would be using asbestos gaskets and packing or any other asbestos component that might have been used with a De Laval product?",q,,start_answer
1218,3948,158,11,I think I'll leave my answer stand in terms of the asbestos and packing -- gaskets and packing.,a,THE WITNESS,start_question
1219,3951,158,14,"What's your answer, sir?",q,,start_answer
1220,3952,158,15,The same as I gave there.,a,THE WITNESS,start_question
1221,3953,158,16,I'm asking you the question.  I haven't showed you the testimony yet.  I'm asking you a question.,q,,start_chat
1222,3956,158,19,"Maybe you should. If you will read, you probably should show it to him.",side_chat,MR. COLAO,start_answer
1223,3959,158,22,I would like to see it.,a,THE WITNESS,start_chat
1224,3960,158,23,It's not a game.,side_chat,MR. COLAO,start_chat
1225,3961,158,24,"It's only impeachment if he disagrees with it. I only need to impeach him if he disagrees with it.  That's law school 101.  I don't mean to lecture, but I'm asking the question to see if he gives the same answer.",side_chat,MR. GREENSTONE,start_chat
1226,3969,159,7,"I don't think it was a lecture, there's no need to apologize.  I think though he did answer the question and you were impeaching him and if you are, show him the question and answer, this way he does not have to guess.",side_chat,MR. COLAO,start_chat
1227,3976,159,14,I know that until he disagreed with it it's not improper impeachment and you will object to it later when I try to designate the page and lines.  There's a proper way to do it which is what I'm trying to do.,side_chat,MR. GREENSTONE,start_chat
1228,3983,159,21,I thought you did it properly.,side_chat,MR. COLAO,start_question
1229,3985,159,23,Have you seen any documents or any other evidence that would indicate to you that De Laval was concerned about the safety of individuals who would be using asbestos gaskets and packing that played some role in stopping their use of asbestos gaskets and packing?,q,,start_answer
1230,3993,160,6,"No, I have not.",a,THE WITNESS,start_question
1231,3994,160,7,"Sir, if De Laval had received the Southern Power & Industry documents that talked about asbestos being toxic or The American Society of Mechanical Engineers documents that talked about asbestos being potentially hazardous or the Walsh Healey Act that indicated precautions that needed to be taken around asbestos and other dust, if they had gotten those documents in those time periods, the thirties, forties and fifties, do you still believe it was reasonable for De Laval to never warn about the dangers of asbestos?",q,,start_chat
1232,4007,160,20,"Objection; calls for speculation, asked and answered. You can answer it again.",side_chat,MR. COLAO,start_answer
1233,4010,160,23,The fact that they did not suggests quite clearly that they did not see a danger or a need to warn and therefore did not.,a,THE WITNESS,start_chat
1234,4015,161,3,Objection; non-responsive.,side_chat,MR. GREENSTONE,start_chat
1235,4017,161,5,I don't know about that.,side_chat,MR. COLAO,start_question
1236,4019,161,7,"My question was if De Laval had received documents in the thirties, forties and fifties indicating that asbestos was hazardous, do you still believe as the corporate representative of De Laval that it was reasonable for them to never warn regarding the dangers of asbestos?",q,,start_chat
1237,4026,161,14,Same objection. You are asking him to speculate.,side_chat,MR. COLAO,start_answer
1238,4028,161,16,I believe that as a result of the evidence that they did not warn that there was no perceived need to based on whatever knowledge they had at that time which I'm not aware of.,a,THE WITNESS,start_chat
1239,4033,161,21,"Objection, non-responsive.  This is as good a place as any to take a break.",side_chat,MR. GREENSTONE,start_chat
1240,4036,161,24,The time is 1:00.  This ends tape two of the videotaped deposition of Richard M. Salzmann.  We are off the record.,side_chat,THE VIDEOGRAPHER,is brackets
1241,4041,162,4,(Luncheon recess taken at 1:00 p.m.) A F T E R N O O N  S E S S I O N,brackets,,is brackets
1242,4064,163,2,"(Time Noted: 2:01 p.m.) R I C H A R D   S A L Z M A N N, resumed and testified as follows: CONTINUED EXAMINATION",brackets,,start_chat
1243,4071,163,9,The time is 2:01.  This begins tape three of the videotaped deposition of Richard M. Salzmann.  We are on the record.,side_chat,THE VIDEOGRAPHER,start_question
1244,4075,163,13,"Mr. Salzmann, we're back after a lunch break.  Are you ready to continue?",q,MR. GREENSTONE,start_answer
1245,4077,163,15,Yes.,a,THE WITNESS,start_question
1246,4078,163,16,"Okay, great.  It was a good breaking point.  I'm now up to my third area of inquiry that I wanted to talk to you about which is dealing with De Laval pumps and turbines and their asbestos components and asbestos insulation, okay?",q,MR. GREENSTONE,start_answer
1247,4084,163,22,Okay.,a,THE WITNESS,start_question
1248,4085,163,23,"As a general principal it's correct, is it not, that De Laval pumps and turbines contained asbestos components at the time they left the De Laval manufacturing facility, true?",q,MR. GREENSTONE,start_answer
1249,4091,164,4,"Those that contained those components, it was the general practice to send or to ship a complete product.",a,THE WITNESS,start_question
1250,4094,164,7,"The complete product would include whatever asbestos components were included if any, true?",q,MR. GREENSTONE,start_answer
1251,4097,164,10,That's correct.,a,THE WITNESS,start_question
1252,4098,164,11,"That has been the case namely that De Laval would ship their pump or turbine with asbestos components if any during the entire time that De Laval had sold pumps and turbines with asbestos components, true?",q,MR. GREENSTONE,start_answer
1253,4104,164,17,"Well, now you are getting into infinite time periods again.  To the best of my knowledge that's correct.  There were occasions I'm sure where machines or parts of machines were shipped individually.",a,THE WITNESS,start_question
1254,4109,164,22,Is it accurate that De Laval pumps and turbines contained asbestos packing?,q,MR. GREENSTONE,start_answer
1255,4113,165,1,Some pumps did and some turbines did.,a,THE WITNESS,start_question
1256,4115,165,3,"As it relates to De Laval fuel oil service pumps, is it accurate that they always would have contained asbestos packing?",q,MR. GREENSTONE,start_answer
1257,4118,165,6,In general the pumps did not contain asbestos packing.,a,THE WITNESS,start_question
1258,4120,165,8,"As it relates to fuel oil service pumps, is it accurate that the turbine drivers of the pumps contained asbestos packing?",q,MR. GREENSTONE,start_answer
1259,4124,165,12,With respect to what kind of machines?,a,THE WITNESS,start_question
1260,4126,165,14,Fuel oil service pumps?,q,MR. GREENSTONE,start_answer
1261,4127,165,15,Fuel oil service pumps in general there were pieces of packing which may have contained asbestos around the valve stems.,a,THE WITNESS,start_question
1262,4131,165,19,I think I didn't ask a complete question and I wanted to come back and do it. Is it accurate that the De Laval turbines that drove the De Laval fuel oil service pumps generally contained asbestos packing?,q,MR. GREENSTONE,start_chat
1263,4136,165,24,Objection to form. Go ahead.,side_chat,MR. COLAO,start_answer
1264,4139,166,2,Many of them did again in the valve stems as I mentioned.,a,THE WITNESS,start_question
1265,4141,166,4,Have you ever seen specifications for De Laval fuel oil service pumps or the De Laval turbines that drove fuel oil service pumps that specified non asbestos packing for the turbine?,q,MR. GREENSTONE,start_chat
1266,4146,166,9,Objection to form. Go ahead.,side_chat,MR. COLAO,start_answer
1267,4148,166,11,I can't recall that I have in that particular circumstance.,a,THE WITNESS,start_question
1268,4150,166,13,"You have not seen any instance that you could recall where a De Laval turbine driver of a fuel oil service pump had anything other than asbestos packing, fair?",q,MR. GREENSTONE,start_answer
1269,4154,166,17,That's correct.,a,THE WITNESS,start_question
1270,4155,166,18,Would there be any asbestos gaskets associated with De Laval fuel oil service pumps or their turbine drivers to your knowledge?,q,MR. GREENSTONE,start_answer
1271,4159,166,22,"No, not with respect to either the pump or the turbine to my knowledge.",a,THE WITNESS,start_question
1272,4161,166,24,"You believe that -- thanks.  As it relates to the De Laval lube oil service pumps, is it accurate that the turbine drivers of De Laval lube oil service pumps came with asbestos packing?",q,MR. GREENSTONE,start_answer
1273,4167,167,5,"Again, in the valve stems to the best of my knowledge that's generally true.",a,THE WITNESS,start_question
1274,4170,167,8,"As you sit here today, are you aware of any instances in which the turbine drivers of the De Laval lube oil service pumps did not contain asbestos packing?",q,MR. GREENSTONE,start_answer
1275,4174,167,12,I can't recall a specific instance where they did not again in that location.,a,THE WITNESS,start_question
1276,4177,167,15,"So at least to your knowledge and recollection and your experience with De Laval, the turbines that drove the De Laval fuel oil service pumps and lube oil service pumps came with asbestos packing at least as far as you know?",q,MR. GREENSTONE,start_answer
1277,4183,167,21,We're talking generally now?,a,THE WITNESS,start_question
1278,4184,167,22,"Yes, sir.",q,MR. GREENSTONE,start_answer
1279,4185,167,23,Generally that's true.,a,THE WITNESS,start_question
1280,4186,167,24,"Again, just to make sure it's clear for the record, that packing was a component of those turbines at the time they left the De Laval manufacturing facility, true?",q,MR. GREENSTONE,start_answer
1281,4192,168,5,They would have been assembled into the turbine buried in around the valve stem to seal it.,a,THE WITNESS,start_question
1282,4195,168,8,"Just to make sure, I apologize, I don't mean to be repetitive here, I really don't.  Sometimes I do, but now I don't.  As it relates to the asbestos packing in De Laval turbines in the valve stems as you've indicated, that asbestos packing was contained within the De Laval turbine at the time that it left the De Laval manufacturing facility, true?",q,MR. GREENSTONE,start_answer
1283,4204,168,17,"That's generally true, yes.",a,THE WITNESS,start_question
1284,4205,168,18,Did De Laval main condensate pumps have any asbestos components to your knowledge?,q,MR. GREENSTONE,start_answer
1285,4208,168,21,I recall from the specific machines that were aboard the WILLIS LEE that there is a gasket which is asbestos containing.,a,THE WITNESS,start_question
1286,4213,169,1,Do you know how many asbestos gaskets were in the De Laval main condensate pumps?,q,MR. GREENSTONE,start_answer
1287,4216,169,4,One I believe.,a,THE WITNESS,start_question
1288,4217,169,5,De Laval also sold main reduction gears; is that accurate?,q,MR. GREENSTONE,start_answer
1289,4219,169,7,Yes.,a,THE WITNESS,start_question
1290,4220,169,8,Do you know if there were any asbestos components in main reduction gears?,q,MR. GREENSTONE,start_answer
1291,4222,169,10,At times.,a,THE WITNESS,start_question
1292,4223,169,11,What asbestos components would be in main reduction gears?,q,MR. GREENSTONE,start_answer
1293,4225,169,13,There may have been on those gears which had a small instrument in the casing or the bracket to measure shaft position; that instrument was generally sealed with packing.,a,THE WITNESS,start_question
1294,4230,169,18,That generally would have been asbestos packing?,q,MR. GREENSTONE,start_answer
1295,4232,169,20,"More often than not, yes.",a,THE WITNESS,start_question
1296,4233,169,21,There were times when De Laval sold turbine drivers for other companies pumps; is that fair?,q,MR. GREENSTONE,start_answer
1297,4236,169,24,For ship board service for the Navy?,a,THE WITNESS,start_question
1298,4239,170,2,Sure.,q,MR. GREENSTONE,start_answer
1299,4240,170,3,They may have.  I can't remember a specific instance of that.,a,THE WITNESS,start_question
1300,4242,170,5,"For example, De Laval sold turbines that drove fire pumps for the United States Navy, true?",q,MR. GREENSTONE,start_answer
1301,4245,170,8,I don't know.,a,THE WITNESS,start_question
1302,4246,170,9,Are you familiar with De Laval turbines that drive fire pumps?,q,MR. GREENSTONE,start_answer
1303,4248,170,11,"Not specifically, no.  I would need to look at -- that's a -- that's not one I run into very often.",a,THE WITNESS,start_question
1304,4251,170,14,Do you know if they would have had -- those particular turbines would have had any asbestos components?,q,MR. GREENSTONE,start_answer
1305,4254,170,17,"No, I don't.",a,THE WITNESS,start_question
1306,4255,170,18,You don't know one way or the other?,q,MR. GREENSTONE,start_answer
1307,4257,170,20,No.,a,THE WITNESS,start_question
1308,4258,170,21,"Would you agree with me, sir, that De Laval knew at the time they sold pumps that had asbestos components that on occasion those asbestos components may have to be changed out and replaced?",q,MR. GREENSTONE,start_chat
1309,4264,171,2,Objection to form.,side_chat,MR. COLAO,start_answer
1310,4265,171,3,It was a part that was spared so on occasion that's possible.,a,THE WITNESS,start_question
1311,4267,171,5,"I want to make sure that I understand your testimony.  It is true, is it not, that De Laval knew that the asbestos packing in their turbines would on some occasions have to be changed out and replaced, true?",q,MR. GREENSTONE,start_answer
1312,4273,171,11,"They certainly knew that it was possible that it would have to be changed out and replaced, yes.",a,THE WITNESS,start_question
1313,4276,171,14,"The only problem I'm having with your answer is the qualification that it was possible.  I want to show you your testimony again from the Merrill case, page 405, line 17.  You were asked De Laval would have known that the asbestos packing on their turbines would on some occasions have to be changed out and replaced, true, and your answer at line 21 was what?",q,MR. GREENSTONE,start_answer
1314,4285,171,23,My answer was yes and that was probably a case where you elicited a simple answer that was less than the proper characterization.,a,THE WITNESS,start_question
1315,4290,172,3,"In any event, De Laval -- I'll object to the non-responsive portions.  Is it accurate that in this testimony you gave just a few months ago you answered yes to the question would De Laval know that the packing in their turbines would have to be changed out and replaced?",q,MR. GREENSTONE,start_answer
1316,4297,172,10,"Yes, and I think the correct answer is yes and it varied widely in terms of when and how and why the packing would have to be changed out.",a,THE WITNESS,start_question
1317,4301,172,14,"No question, but it is likely and De Laval knew that it was likely that at some point during the life of the turbine packing is going to have to be replaced?",q,MR. GREENSTONE,start_answer
1318,4305,172,18,That's correct.,a,THE WITNESS,start_question
1319,4306,172,19,"De Laval knew that it's possible that some of that packing might be wet and some of it might be dried out, true?",q,MR. GREENSTONE,start_chat
1320,4309,172,22,Objection to form.,side_chat,MR. COLAO,start_answer
1321,4310,172,23,I don't know what in that period of time people anticipated.  Packing is generally wet because its sealing either liquids or condensables so I'm not sure what those who were around in the forties or whenever anticipated.,a,THE WITNESS,start_question
1322,4317,173,5,"Certainly it's logical, isn't it, that they would know that if a turbine or pump had been out of service for a period of time and the packing had been sitting for a while it could dry out and have to be replaced, true?",q,MR. GREENSTONE,start_chat
1323,4323,173,11,Objection to form.,side_chat,MR. COLAO,start_answer
1324,4324,173,12,The packing would certainly be dry if it was sitting for a long period of time with no fluid in it.,a,THE WITNESS,start_question
1325,4327,173,15,De Laval would have known at the time they sold their pumps and turbines that the asbestos packing would likely have to be replaced using a packing tool; is that fair?,q,MR. GREENSTONE,start_chat
1326,4332,173,20,"Objection to form. I think as you get more specific with these questions they are becoming more speculative, but go ahead.",side_chat,MR. COLAO,start_answer
1327,4336,173,24,I don't really know what kind of tool they used back in those days.  I'm sure they didn't pick it out with their fingers.,a,THE WITNESS,start_question
1328,4341,174,4,"Fair enough.  I think as you articulated, but I wanted to make sure it's clear, one of the reasons that De Laval sold spares or made spares available of asbestos packing was because of their realization that at some point during the life of the pump and turbine the packing would have to be replaced, true?",q,MR. GREENSTONE,start_answer
1329,4349,174,12,"Yes, it was the customer's realization or the customer's order that included the spares, but that was typical of the Navy's approach to things.",a,THE WITNESS,start_question
1330,4353,174,16,"It was the customer that wanted the spares and De Laval that made those spares available to them and sold them, correct?",q,MR. GREENSTONE,start_answer
1331,4357,174,20,That's correct.,a,THE WITNESS,start_question
1332,4358,174,21,"Sometimes De Laval would actually sell replacement gaskets and packing with the actual pump and turbine, true?",q,MR. GREENSTONE,start_answer
1333,4361,174,24,That's correct.,a,THE WITNESS,start_question
1334,4363,175,1,Would you also agree that it was foreseeable to De Laval that at some point during the life of a pump a gasket may have to be changed out if there is a gasket?,q,MR. GREENSTONE,start_chat
1335,4367,175,5,Objection to form.,side_chat,MR. COLAO,start_answer
1336,4368,175,6,"Yes, less frequently, but yes.",a,THE WITNESS,start_question
1337,4369,175,7,"Let's talk for a few minutes about asbestos insulation.  Would you agree with me, sir, that on some of their pumps De Laval knew that the turbine drivers of those pumps would need to be insulated with asbestos?",q,MR. GREENSTONE,start_chat
1338,4375,175,13,Objection to form.,side_chat,MR. COLAO,start_answer
1339,4376,175,14,"The word need is a mischaracterization.  The turbines didn't need to be insulated in order to run properly, but there were times depending on the service, depending on the ship for that matter that I'm aware of where they would be insulated I'm sure.",a,THE WITNESS,start_question
1340,4383,175,21,"Let me ask a little bit of a different question because of your qualification.  It was foreseeable to De Laval at the time they sold their pumps and turbines to a customer including the United States Navy, it was foreseeable to them that some of those turbines would be insulated with asbestos insulation?",q,MR. GREENSTONE,start_chat
1341,4392,176,5,"Objection to form. At any time, no time period?  I guess no time period.",side_chat,MR. COLAO,start_answer
1342,4395,176,8,I don't know the answer to that question.,a,THE WITNESS,start_question
1343,4397,176,10,"Have you ever testified differently, sir?",q,MR. GREENSTONE,start_answer
1344,4399,176,12,I don't recall.,a,THE WITNESS,start_question
1345,4400,176,13,"Let's take a look at your testimony in the Merrill case again, January 18, 2007.  Page 429 you were asked the same question, it was certainly foreseeable to De Laval at the time they sold their pumps and turbines to the United States Navy, it was foreseeable to them that those turbines would be insulated with asbestos insulation and your answer at line 23 was that the turbine could have been insulated, yes; is that correct?",q,MR. GREENSTONE,start_answer
1346,4411,176,24,Yes and that was after a series of questions where we talked about who would actually do the insulation and whether it was actually to be done or not so it was the end of a series of questions that's --,a,THE WITNESS,start_question
1347,4417,177,5,"There's no question that I asked you a series of questions in that deposition as well, but the bottom line was when I asked you the one question was it foreseeable to De Laval at the time they sold their pumps and turbines to the Navy that some of those turbines would be insulated with asbestos, your answer is yes, it was foreseeable, true?",q,MR. GREENSTONE,start_chat
1348,4426,177,14,"Objection to form, but go ahead.",side_chat,MR. COLAO,start_answer
1349,4428,177,16,"In certain applications, certain types of turbines, yes, that's correct, again, subject to the qualifications that occurred in all of the previous questions to that.",a,THE WITNESS,start_question
1350,4433,177,21,Was there any qualification given to your answer in that question?,q,MR. GREENSTONE,start_chat
1351,4435,177,23,Objection.,side_chat,MR. COLAO,start_answer
1352,4436,177,24,"In that specific question, no, but you have to look at that question in the context with the previous X number of pages.",a,THE WITNESS,start_question
1353,4440,178,3,"I don't want there to be any misleading elements at all.  I want your testimony to be what your testimony is and as you sit here today, you would agree with me that it was foreseeable to De Laval at the time they sold certain pumps and turbines to the United States Navy that some of those turbines may be insulated with asbestos insulation, true?",q,MR. GREENSTONE,start_chat
1354,4449,178,12,Objection to form. Go ahead.,side_chat,MR. COLAO,start_answer
1355,4451,178,14,"As you stated it there with those possibilities, yes.",a,THE WITNESS,start_question
1356,4453,178,16,"In fact, would you agree with me that at the time that De Laval sold a pump and turbine to the United States Navy or to any customer, they would had to have known the operating temperature of that turbine and that pump?",q,MR. GREENSTONE,start_answer
1357,4459,178,22,"We certainly knew the operating temperature, yes.",a,THE WITNESS,start_question
1358,4461,178,24,It's accurate that De Laval would know at least at some level the conditions in which their turbines and pumps would be used; is that fair?,q,MR. GREENSTONE,start_chat
1359,4466,179,4,Objection to form.,side_chat,MR. COLAO,start_answer
1360,4467,179,5,"That varied widely I think.  It depends on -- when you say the condition in which the turbines were to be used, that's a function of where the customer puts the turbine, under what -- where he locates it and what he intends to do with it when he gets it in his plant.",a,THE WITNESS,start_question
1361,4474,179,12,"De Laval has to know those things or else they cannot make a turbine or a pump that would work for that customer, true?",q,MR. GREENSTONE,start_answer
1362,4478,179,16,No.,a,THE WITNESS,start_question
1363,4479,179,17,"De Laval would know that -- first of all, would you agree De Laval was an expert relating to the pumps and turbines that they were selling to customers?",q,MR. GREENSTONE,start_answer
1364,4483,179,21,Yes.,a,THE WITNESS,start_question
