,indice,page_number,line_number,text,text_type,speaker,time_added
0,0,0,0," IMO Industries, Inc. to Plaintiffs' Third Amended Notice of Taking Deposition, marked for Identification.)",,,start_question
1,265,11,3,"Good morning, sir.",q,,start_answer
2,266,11,4,Good morning.,a,THE WITNESS,start_question
3,267,11,5,"You and I have met once before, but my name is David Greenstone.  Would you please state your full name for the record?",q,,start_answer
4,270,11,8,Richard Salzmann.,a,THE WITNESS,start_question
5,271,11,9,"You understand that you are here giving your testimony today in two cases, the Kenneth Balthazar case and the Charles McDaniel case?",q,,start_answer
6,275,11,13,Yes.,a,THE WITNESS,start_question
7,276,11,14,"Is it accurate that you are here as the corporate representative of IMO Industries, Inc.?",q,,start_answer
8,279,11,17,Yes.,a,THE WITNESS,start_question
9,280,11,18,"Can we agree for purposes of this deposition that when we're talking about IMO Industries, Inc. we are also talking about De Laval Steam Turbine Company?",q,,start_answer
10,284,11,22,Yes.,a,THE WITNESS,start_question
11,285,11,23,"And probably for most of the deposition I will actually refer to De Laval or De Laval Steam Turbine Company.  Is that appropriate and will you understand that I'm referring to IMO Industries, Inc., the company that you are the corporate representative for?",q,,start_answer
12,293,12,6,Yes.,a,THE WITNESS,start_question
13,294,12,7,"You understand here that you are speaking on behalf of IMO Industries, Inc. and De Laval Steam Turbine Company, true?",q,,start_answer
14,298,12,11,Yes.,a,THE WITNESS,start_question
15,299,12,12,"And it's your understanding that you have authority to speak on behalf of IMO Industries, Inc. and De Laval Steam Turbine Company, true?",q,,start_answer
16,303,12,16,"Yes, I believe that's correct.",a,THE WITNESS,start_question
17,304,12,17,"Just so it's clear for the ladies and gentlemen of the jury, when you are talking today, you are talking as the corporation, you are talking as IMO Industries, Inc. and De Laval Steam Turbine Company, fair?",q,,start_answer
18,310,12,23,"If that's the definition of the corporate rep, then yes.",a,THE WITNESS,start_question
19,313,13,1,"It's your understanding that you are in fact the corporate representative, true?",q,,start_answer
20,316,13,4,That's correct.,a,THE WITNESS,start_question
21,317,13,5,"I'm going to talk to you about three basic topics for purposes of this deposition.  The first topic is going to De Laval's historical knowledge about the dangers of asbestos.  The second topic is going to be De Laval's conduct or how they responded relating to asbestos and the third topic is going to be related to De Laval pumps and turbines that had asbestos components or utilized asbestos insulation, okay?",q,,start_answer
22,328,13,16,Okay.,a,THE WITNESS,start_question
23,329,13,17,"I want to start out before I get there with some preliminary matters. First of all, is it accurate, sir, that De Laval Steam Turbine Company was a seller and manufacturer of products that had asbestos components for more than 50 years?",q,,start_chat
24,335,13,23,Objection to form.,side_chat,MR. COLAO,start_answer
25,336,13,24,"I'm not sure of the exact time, but we built precision mechanical equipment some of which contains small and/or medium size components that contained asbestos.",a,THE WITNESS,start_question
26,341,14,4,"We'll get to the years -- well, De Laval as far as you know started selling equipment with asbestos components at least as early as the 1930s, true?",q,,start_answer
27,345,14,8,That's correct.,a,THE WITNESS,start_question
28,346,14,9,"They continued to sell these products with asbestos components without interruption until the 1980s, true?",q,,start_answer
29,349,14,12,"It depends on the component, but some yes.",a,THE WITNESS,start_question
30,351,14,14,"If we start in the thirties and end in the eighties, it's accurate that for over 50 years De Laval Steam Turbine Company manufactured and sold equipment that had asbestos components, true?",q,,start_answer
31,356,14,19,"Some, yes.",a,THE WITNESS,start_question
32,357,14,20,"In fact, De Laval also sold asbestos products themselves, true?",q,,start_answer
33,359,14,22,"In some cases where spare parts were included as part of customer's orders, that may be true.",a,THE WITNESS,start_question
34,363,15,1,"For example, I guess we need a little bit of background.  When you were talking about the asbestos components that were utilized in some De Laval pumps and turbines, you are referring to in some occasions asbestos gaskets and asbestos packing material, true?",q,,start_answer
35,370,15,8,That's correct.,a,THE WITNESS,start_question
36,371,15,9,"In addition to actually selling the pump or the turbine with that piece of asbestos component inside it, De Laval on occasion also sold spare parts which would have been just the asbestos gasket or the asbestos packing as requested by a customer?",q,,start_chat
37,377,15,15,Objection to form.,side_chat,MR. COLAO,start_question
38,378,15,16,True?,q,,start_answer
39,379,15,17,"That's possible on some occasions, yes.",a,THE WITNESS,start_question
40,381,15,19,"In fact, you know that De Laval Steam Turbine Company made available asbestos gaskets and asbestos packing for sale, true?",q,,start_chat
41,384,15,22,Objection to form.,side_chat,MR. COLAO,start_answer
42,385,15,23,"I believe that's the case.  I can't remember specific records to that affect, but that probably is the case.",a,THE WITNESS,start_question
43,389,16,2,"Sure.  You have seen bills of materials, for example, that indicate that De Laval Steam Turbine Company will be providing spare asbestos gaskets and spare asbestos packing, true?",q,,start_answer
44,394,16,7,"On occasion, yes.",a,THE WITNESS,start_question
45,395,16,8,"And you were aware that De Laval made available and sold asbestos gasket and asbestos packing material from the 1930s until the 1980s, true?",q,,start_answer
46,399,16,12,"That is generally true, yes.",a,THE WITNESS,start_question
47,400,16,13,"It is also accurate that at least on occasion De Laval has sold asbestos thermal insulation products, true?",q,,start_chat
48,403,16,16,Objection to form.,side_chat,MR. COLAO,start_answer
49,404,16,17,"On relatively infrequent occasions, yes.",a,THE WITNESS,start_question
50,406,16,19,"I think you and I have discussed that issue before.  As you sit here today, can you quantify for the jury how many times De Laval sold asbestos thermal insulation from the 1930s until say the 1970s?",q,,start_answer
51,413,17,1,"No, I can't.",a,THE WITNESS,start_question
52,414,17,2,"De Laval on occasion did sell thermal insulation products that contained asbestos from the 1930s up until the 1970s, true?",q,,start_chat
53,418,17,6,Objection to form.,side_chat,MR. COLAO,start_answer
54,419,17,7,Until 1972 that's true.,a,THE WITNESS,start_question
55,420,17,8,Sorry?,q,,start_answer
56,421,17,9,Until 1972 that's true on relatively infrequent occasions.,a,THE WITNESS,start_question
57,423,17,11,"If we take it from the 1930s until the 1970s, De Laval would have been a seller of asbestos thermal insulation products for a period of about 40 years, true?",q,,start_chat
58,428,17,16,"Same objection, mainly to the term seller, but you can answer the question.",side_chat,MR. COLAO,start_answer
59,431,17,19,"Yes, when a customer ordered asbestos or any insulation and the material that was being used at that time happened to contain asbestos, then De Laval would provide it as part of a contractual obligation to a customer.",a,THE WITNESS,start_question
60,438,18,1,"It would generally be asbestos thermal insulation products that would be used as insulation for a De Laval turbine, true?",q,,start_chat
61,442,18,5,"Subject to the prior objection, go ahead.",side_chat,MR. COLAO,start_answer
62,444,18,7,"Again, generally is a very broad term.  It often was, but there are other materials that were used on occasion.",a,THE WITNESS,start_question
63,447,18,10,"Fair enough.  I think I understand what the nature of your qualification was and my point simply was when De Laval did on occasion sell asbestos thermal insulation products between the time period of the 1930s until the 1970s, it was insulation that was going to be used on De Laval turbines, true?",q,,start_answer
64,455,18,18,"Yes, normally, yes.",a,THE WITNESS,start_question
65,456,18,19,I want to shift gears now and talk to you about the first item that I mentioned at the very beginning which was De Laval's knowledge about the dangers of asbestos.  Now we've discussed as we just pointed out that De Laval sold and manufactured equipment that had asbestos components and also sold asbestos replacement components for a period of about 50 years. Would you agree that when De Laval knew about the dangers of asbestos is an important inquiry?,q,,start_chat
66,469,19,7,Objection to form. I don't know why he would have that basis of knowledge.,side_chat,MR. COLAO,start_answer
67,472,19,10,That's your call.,a,THE WITNESS,start_question
68,473,19,11,"Fair enough.  As the corporate representative of a company that sold products with asbestos components for more than 50 years, do you think that it's important to find out when your company may have first learned that asbestos was dangerous to human beings?",q,,start_chat
69,480,19,18,"Objection to form. It may be beyond the scope of the deposition notice whether he believed it was important, but I'll let him answer the question.",side_chat,MR. COLAO,start_answer
70,485,19,23,"After the fact in today's environment, yes, that seems important.",a,THE WITNESS,start_question
71,488,20,1,Would you also agree that it is important for a company to tell the truth about its products?,q,,start_answer
72,491,20,4,Yes.,a,THE WITNESS,start_question
73,492,20,5,"It's important for a company to not misrepresent the safety or the hazards associated with their products, true?",q,,start_answer
74,495,20,8,That's generally true.,a,THE WITNESS,start_question
75,496,20,9,Would you agree that it is in fact irresponsible corporate conduct in your opinion as the corporate representative of IMO to give inaccurate information about products that you are selling?,q,,start_chat
76,501,20,14,"Objection to form. Again, I don't know if it's part of the scope of his deposition notice, but I'll let him answer the question.",side_chat,MR. COLAO,start_answer
77,505,20,18,"Would you repeat the question, please?",a,THE WITNESS,start_question
78,507,20,20,"Sure.  Would you agree as the corporate representative for IMO, someone who's been involved with this company for a number of years, would you agree that it's irresponsible for a company to give inaccurate information about its products particularly as it relates to hazards?",q,,start_chat
79,515,21,3,Same objection.,side_chat,MR. COLAO,start_answer
80,516,21,4,"That's generally true, yes.",a,THE WITNESS,start_question
81,517,21,5,How many years have you been with De Laval Steam Turbine Company or IMO?,q,,start_answer
82,519,21,7,"I spent 32 years with IMO while they owned the company, yes.",a,THE WITNESS,start_question
83,521,21,9,When did you start with the company?,q,,start_answer
84,523,21,11,1962.,a,THE WITNESS,start_question
85,524,21,12,Are you currently still employed by the company?,q,,start_answer
86,526,21,14,No.,a,THE WITNESS,start_question
87,527,21,15,When did you cease being employed directly by IMO?,q,,start_answer
88,529,21,17,In 1994.,a,THE WITNESS,start_question
89,530,21,18,What was your position at the time that you retired from IMO?,q,,start_answer
90,532,21,20,Manager of compressor engineering.,a,THE WITNESS,start_question
91,534,21,22,"Over the time period that you have been with this company more than 30 years starting in the sixties going up until at least the nineties, is it your testimony that De Laval and IMO have been truthful and accurate about potential hazards associated with their products?",q,,start_answer
92,542,22,5,Yes.,a,THE WITNESS,start_question
93,543,22,6,Do you believe that De Laval has been truthful and accurate about when they first knew that asbestos was hazardous?,q,,start_answer
94,546,22,9,Yes.,a,THE WITNESS,start_question
95,547,22,10,"It's your testimony, is it not, on behalf of De Laval that De Laval did not know about any potential hazards of asbestos to human beings until approximately 1972, true?",q,,start_answer
96,552,22,15,"To the best of my knowledge, yes.",a,THE WITNESS,start_question
97,554,22,17,"In 1972 something happened that in your testimony put De Laval on notice and that would have been the passing of the Occupational Safety and Health Administration, the OSHA asbestos standard, is that true?",q,,start_chat
98,560,22,23,Objection.  Are you characterizing prior testimony or are you just asking him a question?,side_chat,MR. COLAO,start_chat
99,564,23,2,I'm asking him the question.,side_chat,MR. GREENSTONE,start_chat
100,566,23,4,Same objection.  Go ahead.,side_chat,MR. COLAO,start_answer
101,568,23,6,"Yes, I'm not sure exactly what the --",a,THE WITNESS,start_question
102,570,23,8,What happened in 1972 that in your opinion was the first thing that put De Laval on notice that asbestos could be hazardous to human beings potentially?,q,,start_answer
103,574,23,12,The OSHA regulations were recognized by De Laval and its customers to some extent.,a,THE WITNESS,start_question
104,577,23,15,"You believe as you sit here today as the corporate representative of De Laval, you believe that it is accurate that 1972 was the first time that De Laval knew anything about the potential hazards of asbestos?",q,,start_chat
105,583,23,21,"Objection; asked and answered, but go ahead.",side_chat,MR. COLAO,start_answer
106,585,23,23,"Yes, that's what the records suggests.",a,THE WITNESS,start_question
107,588,24,1,You are comfortable testifying to that to this jury in this case?,q,,start_answer
108,590,24,3,Yes.,a,THE WITNESS,start_question
109,591,24,4,"Have you seen any documents or any publications or anything that's made you question that testimony, sir?",q,,start_answer
110,594,24,7,No.,a,THE WITNESS,start_question
111,595,24,8,"You and I have talked before in deposition, me asking you questions and you answering questions such as today and it was a few months ago I think and in the intervening months since the last time that you and I have spoken, have you seen any documents that would make you believe that perhaps De Laval knew prior to 1972 or may have known that asbestos was hazardous to human beings?",q,,start_answer
112,605,24,18,"I have seen no authoritative documents to that affect, no.",a,THE WITNESS,start_question
113,607,24,20,Have you been given any documents from IMO from the folks at De Laval Steam Turbine Company that have made you think perhaps they knew prior to 1972 that asbestos was hazardous to human beings or could potentially be hazardous?,q,,start_chat
114,614,25,2,Objection to form.,side_chat,MR. COLAO,start_answer
115,615,25,3,No.,a,THE WITNESS,start_question
116,616,25,4,Haven't seen anything?,q,,start_answer
117,617,25,5,No.,a,THE WITNESS,start_chat
118,618,25,6,Asked and answered.,side_chat,MR. COLAO,start_question
119,619,25,7,"Would you agree, sir, that in fact and I think you have agreed in the past that one of the things that De Laval did to stay abreast of knowledge regarding their products was to monitor trade publications; is that accurate?",q,,start_answer
120,625,25,13,"Yes, with respect to the design of its products, yes.",a,THE WITNESS,start_question
121,627,25,15,Have you ever heard of a trade publication called the Southern Power & Industry journal?,q,,start_answer
122,630,25,18,"I've heard the name recently, yes.",a,THE WITNESS,start_question
123,632,25,20,Do you know whether or not De Laval Steam Turbine Company had a close cooperation relationship with that trade journal starting back as early as the 1940s?,q,,start_chat
124,636,25,24,Objection to form.,side_chat,MR. COLAO,start_answer
125,638,26,1,"Again, I'm aware that only from previous depositions that there were some advertisements that De Laval had in that publication.",a,THE WITNESS,start_chat
126,642,26,5,I want to show you what I'll mark as Exhibit 3 to the deposition.,side_chat,MR. GREENSTONE,is brackets
127,645,26,8,"(Plaintiff's Exhibit 3, Affidavit and January 1946 Southern Power & Industry Journal, marked for Identification.)",brackets,,start_question
128,649,26,12,"It is the January 1946 Southern Power & Industry journal and you can actually see on the front page under the affidavit that that's in fact what it is. Have you seen that document before, sir?",q,,start_answer
129,655,26,18,I can't recall if I have seen this exact one.  I just don't remember the dates.,a,THE WITNESS,start_question
130,658,26,21,"Let's turn if we could -- that's fair enough.  Let's turn if we could to page 8.  It's one of the pages that I have tabbed.  It's a page that starts at the top Where To Get It And How to Do It, Index of Helpful Booklets, Bulletins, Reference Literature.  Do you see where I am, sir?",q,,start_answer
131,666,27,4,Yes.,a,THE WITNESS,start_question
132,667,27,5,"Then it says at the very top cooperating with leading manufacturers of equipment and supplies, SPI makes available for the asking without cost or obligation the following valuable bulletins, booklets, handbooks and catalogs.  Do you see where I read that, sir?",q,,start_answer
133,674,27,12,Yes.,a,THE WITNESS,start_question
134,675,27,13,Did I read that correctly?,q,,start_answer
135,676,27,14,Yes.,a,THE WITNESS,start_question
136,677,27,15,"If we look at the other section that I've highlighted, first of all, there are a number of different catalogs that are listed and little blurbs and then if you look at one that's under the tab 172, do you see where I'm reading?",q,,start_answer
137,683,27,21,Yes.,a,THE WITNESS,start_question
138,684,27,22,"It says pumps, compressors, turbines, catalog 1181.  Complete presentation of De Laval line of pumps, centrifugal compressors, worm gear, speed reducers and IMO oil pumps engineering details and company background, De Laval Steam Turbine Company, Trenton, New Jersey. Did I read that correctly?",q,,start_answer
139,693,28,6,Yes.,a,THE WITNESS,start_question
140,694,28,7,"Before I showed that to you, sir, were you aware that the relationship that De Laval Steam Turbine Company had with Southern Power & Industry magazine was that Southern Power & Industry would actually distribute De Laval engineering details and company background in their manuals?",q,,start_chat
141,701,28,14,"Objection to form. I don't know if that's what it states, but go ahead.",side_chat,MR. COLAO,start_answer
142,704,28,17,It distributed a catalog which advertised our products to potential users I believe is what the correct context is here.,a,THE WITNESS,start_question
143,707,28,20,"When it says at the top it says that SPI Southern Power & Industry was cooperating with leading manufacturers of equipment and supply, in that context they are supplying De Laval catalogs to customers?",q,,start_chat
144,713,29,1,Objection to form.,side_chat,MR. COLAO,start_question
145,714,29,2,Is that accurate?,q,,start_chat
146,715,29,3,"I don't know what context you are referring to, but go ahead.",side_chat,MR. COLAO,start_answer
147,718,29,6,"Yeah, again, I'm not sure exactly what's going on, but I would suspect that De Laval has provided some of its catalogs that could be requested through this magazine.",a,THE WITNESS,start_chat
148,723,29,11,Sounds like speculation in the testimony. I'll just caution the witness to give testimony about what he knows and to not assume or speculate.,side_chat,MR. COLAO,start_chat
149,728,29,16,That's fine.,side_chat,THE WITNESS,start_question
150,729,29,17,"In any event, there's certainly nothing improper or wrong or even unusual about De Laval working with Southern Power & Industry giving them their catalogs so that SPI, the magazine, could distribute them to the public?",q,,start_chat
151,735,29,23,Objection to form.,side_chat,MR. COLAO,start_answer
152,736,29,24,"In my experience that's a relatively unusual thing, but obviously that's what's stated here.",a,THE WITNESS,start_question
153,740,30,3,"Before I showed that to you, you didn't know that that was occurring?",q,,start_chat
154,742,30,5,Objection to form. Was occurring.,side_chat,MR. COLAO,start_question
155,744,30,7,"I'll re-ask.  Before I showed you this document, you didn't realize that De Laval had been cooperating with Southern Power & Industry to make their manuals available to the public as indicated here?",q,,start_chat
156,749,30,12,"Same objection. Specifically to the understanding of cooperating, but go ahead.",side_chat,MR. COLAO,start_answer
157,752,30,15,"The cooperating is a problem here, but as I said before, I think I have been shown this magazine or at least some issue of it in a previous deposition so this is not the first time I have seen at least a similar advertisement.",a,THE WITNESS,start_chat
158,758,30,21,"Let me just add this for the record, it's an extension of my prior objection.  We are asking the witness about a publication that was issued in 1946.  He was not at De Laval during that time so I just want to make the record clear that he obviously can't be testifying from personal knowledge about what was happening during that time.  He's only testifying based upon what he's being shown and read from this Exhibit.",side_chat,MR. COLAO,start_chat
159,771,31,9,"Well, I actually would like to respond to that. The deposition notice, the 30(b)(6) witness, he's testifying as the corporate representative of De Laval on the subject of when De Laval knew that asbestos was hazardous if ever so that's in the context I'm asking him this question.",side_chat,MR. GREENSTONE,start_chat
160,780,31,18,"I understand that, but the only point I'm making is that in testifying as the corporate representative and based upon his knowledge as corporate representative, he obviously could not have personal knowledge of what was going on in 1946.",side_chat,MR. COLAO,start_chat
161,789,32,2,That's fair. I'll try to clear it up.,side_chat,MR. GREENSTONE,start_question
162,791,32,4,"Sir, you understand here that you are the corporate representative speaking on behalf of De Laval Steam Turbine Company and IMO Industries on the subject of when De Laval Steam Turbine Company first knew that asbestos was hazardous if ever; is that your understanding?",q,,start_answer
163,798,32,11,"To the extent of my knowledge, yes.",a,THE WITNESS,start_question
164,800,32,13,It's your testimony that you are the person most knowledgeable on that subject that's currently with the company?,q,,start_answer
165,803,32,16,I'm not currently with the company.,a,THE WITNESS,start_chat
166,805,32,18,Objection to form.,side_chat,MR. COLAO,start_chat
167,806,32,19,Let me strike that and re-ask it.,side_chat,MR. GREENSTONE,start_question
168,808,32,21,It's your testimony that as far as you know you are the person most knowledgeable on that subject for IMO?,q,,start_answer
169,811,32,24,I don't know of anybody who's more knowledgeable at this point.,a,THE WITNESS,start_question
170,814,33,2,"Fair enough and before you had seen this particular document in the course of litigation, did you know that it existed?",q,,start_answer
171,817,33,5,No.,a,THE WITNESS,start_question
172,818,33,6,"Let's turn to the last tab that I have, it's page 158, that's the advertiser's index; is that correct?",q,,start_answer
173,821,33,9,That's correct.,a,THE WITNESS,start_question
174,822,33,10,And under the Ds is De Laval Steam Turbine Company listed as an advertiser in this particular publication?,q,,start_answer
175,825,33,13,Yes.,a,THE WITNESS,start_question
176,826,33,14,Were you aware before you saw this document for the first time in litigation that De Laval was an advertiser in Southern Power & Industry?,q,,start_chat
177,830,33,18,In 1946?,side_chat,MR. COLAO,start_answer
178,831,33,19,No.,a,THE WITNESS,start_chat
179,832,33,20,Let me strike it.  Let me re-ask it so there's actually a clear question.,side_chat,MR. GREENSTONE,start_question
180,835,33,23,Were you aware before you saw this document in litigation that De Laval advertised in Southern Power & Industry magazine in the 1940s?,q,,start_answer
181,840,34,3,No.,a,THE WITNESS,start_question
182,841,34,4,Did De Laval Steam Turbine Company have an advertising department in the 1940s if you know?,q,,start_answer
183,844,34,7,I don't know.,a,THE WITNESS,start_question
184,845,34,8,Do you know anything at all about advertising and how it works as it relates to the company that you worked for?,q,,start_chat
185,848,34,11,In general?,side_chat,MR. COLAO,start_chat
186,849,34,12,As it relates to IMO.,side_chat,MR. GREENSTONE,start_answer
187,851,34,14,No.,a,THE WITNESS,start_question
188,852,34,15,Fair enough.  Do you know if the advertising department had to approve advertisements after they paid for them?,q,,start_chat
189,855,34,18,"Objection; asked and answered.  He said he didn't know anything about it, but go ahead.",side_chat,MR. COLAO,start_answer
190,858,34,21,I don't know.,a,THE WITNESS,start_question
191,859,34,22,"Fair enough.  Let's turn, sir, to page 68 of this same document that De Laval is listed in the advertiser's index in. Are you on page 68?",q,,start_answer
192,864,35,2,Yes.,a,THE WITNESS,start_question
193,865,35,3,"There is an article there by an N.V. Hendricks entitled Industrial Hygiene Control of Working Environment is Important and you can see down there at the bottom again this is from January 1946, is that what the document says, sir?",q,,start_answer
194,871,35,9,Yes.,a,THE WITNESS,start_question
195,872,35,10,"If we turn to page 74 of this same article in this publication there is a section that's called Silica and Dust, correct?",q,,start_answer
196,876,35,14,Yes.,a,THE WITNESS,start_question
