,indice,page_number,line_number,text,text_type,speaker,time_added
1734,5600,224,13,Let me show you what I'll mark as the next exhibits to the deposition which are -- I'll mark them separately as Exhibits 11 and 12.  Exhibit 11 is a machinery synopsis reproduced at the national archives for USS 4 and 5 talking about a number of different things including the main fuel oil service pump and Exhibit 12 is again a machinery synopsis from the national archives for DL 4 and 5 relating to some pumps including a fire pump for the WILLIS A LEE.,side_chat,MR. GREENSTONE,is brackets
1735,5615,225,3,"(Plaintiff's Exhibit 11, Machinery Synopsis, marked for Identification.)",brackets,,is brackets
1736,5618,225,6,"(Plaintiff's Exhibit 12, Machinery Synopsis, marked for Identification.)",brackets,,start_question
1737,5621,225,9,"Have you seen these documents before, sir?",q,MR. GREENSTONE,start_answer
1738,5623,225,11,No.,a,THE WITNESS,start_question
1739,5624,225,12,Do you know that DL 4 is in fact the WILLIS A LEE?,q,MR. GREENSTONE,start_answer
1740,5626,225,14,"I believe that's the correct number, yes.",a,THE WITNESS,start_question
1741,5628,225,16,You see on that machinery synopsis it indicates that two De Laval fuel oil service pumps and turbines that drove them would be in each fire room on those ships?,q,MR. GREENSTONE,start_answer
1742,5633,225,21,You have to point out to me where you are getting the information.,a,THE WITNESS,start_question
1743,5635,225,23,The part that's highlighted?,q,MR. GREENSTONE,start_answer
1744,5636,225,24,You have a main fuel oil service pump and a port fuel oil service pump.,a,THE WITNESS,start_question
1745,5640,226,3,"I'll show you, sir, if you hand me the document back.  At the top you see it says main fuel oil service pump and then it says two in each fire room and it says De Laval and then De Laval turbine, do you see where it says that?",q,MR. GREENSTONE,start_answer
1746,5646,226,9,Yes.,a,THE WITNESS,start_question
1747,5647,226,10,Is that consistent with what you found in this case namely that there would have been four De Laval fuel oil service pumps and four De Laval turbines that were on the WILLIS A LEE?,q,MR. GREENSTONE,start_answer
1748,5652,226,15,"I believe that number is correct, yes.",a,THE WITNESS,start_question
1749,5654,226,17,"If you break that down, two of them go in each fire room so two of them would have been in the fore fire room and two of them would have been in the aft fire room?",q,MR. GREENSTONE,start_chat
1750,5658,226,21,Objection to form.,side_chat,MR. COLAO,start_answer
1751,5659,226,22,"Probably port and starboard, but that's close enough.",a,THE WITNESS,start_question
1752,5661,226,24,"Then if we look, it also appears that there would have been a De Laval port fuel oil service pump that was motor driven, one in each fire room; is that accurate?",q,MR. GREENSTONE,start_answer
1753,5667,227,5,"Yes, that appears to be correct.",a,THE WITNESS,start_question
1754,5669,227,7,"If you look at the -- so so far we're up to basically three De Laval pumps in each fire room on the WILLIS A LEE, correct?",q,MR. GREENSTONE,start_answer
1755,5672,227,10,"That's what's suggested by this, yes.",a,THE WITNESS,start_question
1756,5674,227,12,On the next document that's Exhibit 12 it indicates a fire pump that was made by Worthington; is that accurate?,q,MR. GREENSTONE,start_answer
1757,5677,227,15,"Yes, appears to be.",a,THE WITNESS,start_question
1758,5678,227,16,It says one in each fire room; is that correct?,q,MR. GREENSTONE,start_answer
1759,5680,227,18,"Yes, it does.",a,THE WITNESS,start_question
1760,5681,227,19,Who does it indicate made the turbine that drove the Worthington fire pump?,q,MR. GREENSTONE,start_answer
1761,5683,227,21,It indicates De Laval.,a,THE WITNESS,start_question
1762,5684,227,22,"Let me ask you these questions, sir.  Did you find the documents that relate to all of these different pieces of equipment on the WILLIS A LEE?",q,MR. GREENSTONE,start_answer
1763,5689,228,2,We did not find anything related to the fire pumps for Worthington.,a,THE WITNESS,start_question
1764,5691,228,4,Did you look for any?,q,MR. GREENSTONE,start_answer
1765,5692,228,5,We looked for everything that was aboard the WILLIS A LEE.,a,THE WITNESS,start_question
1766,5694,228,7,"That doesn't mean that you didn't actually have the De Laval turbine that was driving the Worthington pump, it just means that you don't have the records for it, true?",q,MR. GREENSTONE,start_answer
1767,5699,228,12,"Yes, we didn't find any records for it.",a,THE WITNESS,start_question
1768,5701,228,14,"My point is this is in the synopsis that the Navy prepares relating to the equipment that's on the WILLIS A LEE. You're not saying that De Laval did not supply the turbine for the Worthington fire pump, you're just saying you did not find any records?",q,MR. GREENSTONE,start_chat
1769,5708,228,21,Objection to form.,side_chat,MR. COLAO,start_answer
1770,5709,228,22,That's correct.,a,THE WITNESS,start_question
1771,5710,228,23,Do you know how long De Laval keeps records?,q,MR. GREENSTONE,start_answer
1772,5713,229,1,"Depends on the records, but order cards and bills of material at least while De Laval owned the facility were kept indefinitely.",a,THE WITNESS,start_question
1773,5717,229,5,Did you find indication or did your records confirm that De Laval had sold four fuel oil service -- main fuel oil service pumps for use on the WILLIS A LEE?,q,MR. GREENSTONE,start_answer
1774,5721,229,9,I believe so.,a,THE WITNESS,start_question
1775,5722,229,10,And two port fuel oil service pumps for use on the WILLIS A LEE?,q,MR. GREENSTONE,start_answer
1776,5724,229,12,I'm not sure about that.,a,THE WITNESS,start_question
1777,5725,229,13,Did you find those records?,q,MR. GREENSTONE,start_answer
1778,5726,229,14,Those records they were not turbine driven pumps so they would be in North Carolina.,a,THE WITNESS,start_question
1779,5729,229,17,You didn't look in North Carolina?,q,MR. GREENSTONE,start_answer
1780,5731,229,19,No.,a,THE WITNESS,start_question
1781,5732,229,20,"Fair enough.  As it relates to the turbine that drove the Worthington fire pump that's referenced in Exhibit 12, would those documents have been kept somewhere else because you were just selling the turbine and not the whole pump?",q,MR. GREENSTONE,start_answer
1782,5739,230,2,"No, if we provided those turbines they would have most likely been in Trenton.",a,THE WITNESS,start_question
1783,5742,230,5,You didn't find them?,q,MR. GREENSTONE,start_answer
1784,5743,230,6,No.,a,THE WITNESS,start_question
1785,5744,230,7,"If the Navy synopsis is correct that was at the national archives, would it be accurate that there were in fact three De Laval turbines in each fire room of the WILLIS A LEE?",q,MR. GREENSTONE,start_chat
1786,5749,230,12,Objection to form.,side_chat,MR. COLAO,start_answer
1787,5750,230,13,"Yes, if that's correct, there were.",a,THE WITNESS,start_question
1788,5752,230,15,"You're not saying that that's not correct, true?",q,MR. GREENSTONE,start_answer
1789,5754,230,17,No.,a,THE WITNESS,start_question
1790,5755,230,18,"No, you're not saying that that's not correct?",q,MR. GREENSTONE,start_answer
1791,5757,230,20,I think you better ask the question the way you want it.,a,THE WITNESS,start_question
1792,5759,230,22,"Fair enough.  You are not -- as the representative of IMO, you are not testifying that there were not three De Laval turbines in each fire room on the WILLIS A LEE, true?",q,MR. GREENSTONE,start_chat
1793,5765,231,3,Objection to form.,side_chat,MR. COLAO,start_question
1794,5766,231,4,"As far as you know, there were in fact three De Laval turbines?",q,MR. GREENSTONE,start_answer
1795,5768,231,6,According to that document there were three turbines.,a,THE WITNESS,start_question
1796,5770,231,8,"You are not disputing that there were in fact three De Laval turbines in each fire room on the WILLIS A LEE, true?",q,MR. GREENSTONE,start_answer
1797,5773,231,11,You foul it up with that word true at the end of each one.,a,THE WITNESS,start_question
1798,5775,231,13,"All you have to do is say yes, it's true?",q,MR. GREENSTONE,start_answer
1799,5777,231,15,"Before you got to there, the answer was no, I'm not denying that there were -- that the Navy archives say that there were three turbines aboard the WILLIS A LEE in each fire room.",a,THE WITNESS,start_question
1800,5782,231,20,"I think we are there.  I have to re-ask the question.  If the Navy documents are correct, then there were three De Laval turbines in each fire room on the WILLIS A LEE?",q,MR. GREENSTONE,start_answer
1801,5788,232,1,Yes.,a,THE WITNESS,start_question
1802,5789,232,2,You are not disputing that?,q,MR. GREENSTONE,start_answer
1803,5790,232,3,"I didn't, did I, I said yes.",a,THE WITNESS,start_chat
1804,5791,232,4,Do you want to take a break?,side_chat,MR. COLAO,start_chat
1805,5793,232,6,"No, I'm okay. You guys need a break?",side_chat,MR. GREENSTONE,start_chat
1806,5795,232,8,"Yes, I would like to take one.",side_chat,THE WITNESS,start_chat
1807,5797,232,10,The time is 3:13.  This ends tape three of the videotaped deposition of Richard M. Salzmann.  We are off the record.,side_chat,THE VIDEOGRAPHER,is brackets
1808,5801,232,14,(Recess taken.),brackets,,start_chat
1809,5802,232,15,The time is 3:27.  This begins tape four of the videotaped deposition of Richard M. Salzmann.  We are on the record.,side_chat,THE VIDEOGRAPHER,start_question
1810,5806,232,19,"Mr. Salzmann, are you ready to continue?",q,MR. GREENSTONE,start_answer
1811,5808,232,21,Yes.,a,THE WITNESS,start_question
1812,5809,232,22,"We were talking about the De Laval pumps and turbines that were in the fire rooms on the WILLIS A LEE, do you remember that line of questions?",q,MR. GREENSTONE,start_answer
1813,5814,233,2,Yes.,a,THE WITNESS,start_question
1814,5815,233,3,"Would you agree with me, sir, that De Laval shipped the pump and the turbine together to the ship builder or to the Navy for use on the WILLIS A LEE?",q,MR. GREENSTONE,start_chat
1815,5819,233,7,Objection to form.,side_chat,MR. COLAO,start_chat
1816,5820,233,8,Why?,side_chat,MR. GREENSTONE,start_chat
1817,5821,233,9,Not every pump had a turbine.,side_chat,MR. COLAO,start_chat
1818,5823,233,11,Let me clarify that.,side_chat,MR. GREENSTONE,start_question
1819,5825,233,13,"With respect to the De Laval fuel oil service pumps that were turbine driven that we've referenced in the synopsis here, is it accurate that De Laval would have shipped the pump and the turbine together as one unit?",q,MR. GREENSTONE,start_answer
1820,5831,233,19,"I don't know, but that would be the normal thing I believe.",a,THE WITNESS,start_question
1821,5833,233,21,Normally the turbine came with the pump?,q,MR. GREENSTONE,start_answer
1822,5835,233,23,Yes.,a,THE WITNESS,start_question
1823,5836,233,24,Is it accurate that the turbines that were driving these fuel oil service pumps in the fire rooms on the WILLIS A LEE would have contained asbestos packing?,q,MR. GREENSTONE,start_answer
1824,5841,234,4,"That is quite possible, yes.",a,THE WITNESS,start_question
1825,5842,234,5,In fact isn't it likely?,q,MR. GREENSTONE,start_answer
1826,5843,234,6,It's likely.,a,THE WITNESS,start_question
1827,5844,234,7,"They would have been shipped with the asbestos packing as an internal component, true?",q,MR. GREENSTONE,start_answer
1828,5847,234,10,"That would be the norm, yes.",a,THE WITNESS,start_question
1829,5848,234,11,"Sir, can you tell us any differences between the De Laval fuel oil service pumps and turbines that were in the fire rooms on the WILLIS A LEE and those that are referenced in the drawings in Exhibit 9 or the tech manual in Exhibit 10?",q,MR. GREENSTONE,start_answer
1830,5854,234,17,"I can't tell you the specific differences without looking at the documents, but they were similar, but I would say they were not identical.",a,THE WITNESS,start_question
1831,5858,234,21,Can you site for me as you sit here today on behalf of IMO any differences between the fuel oil service pumps and turbines on the WILLIS A LEE and those referenced in Exhibits 9 and 10?,q,MR. GREENSTONE,start_answer
1832,5864,235,2,"No, I said I would have to look at them in detail to try and figure out what the differences are.",a,THE WITNESS,start_question
1833,5867,235,5,You have not tried to do that?,q,MR. GREENSTONE,start_answer
1834,5868,235,6,No.,a,THE WITNESS,start_question
1835,5869,235,7,"As you sit here today, you are not aware of any major differences between them?",q,MR. GREENSTONE,start_chat
1836,5872,235,10,Objection to form.,side_chat,MR. COLAO,start_answer
1837,5873,235,11,I'm not aware of what the differences would be whether they would be major or minor or what.,a,THE WITNESS,start_question
1838,5876,235,14,"You haven't looked to see if there were any differences at all, true?",q,MR. GREENSTONE,start_chat
1839,5878,235,16,Objection; asked and answered.,side_chat,MR. COLAO,start_answer
1840,5880,235,18,"No, these ships are not at issue in this case so I haven't looked at any details of them.",a,THE WITNESS,start_question
1841,5883,235,21,"As you sit here today, you cannot testify that there were any differences between the De Laval fuel oil service pumps and turbines on the WILLIS A LEE and those referenced in 9 and 10, true?",q,MR. GREENSTONE,start_chat
1842,5889,236,2,Objection; mischaracterizes his testimony.,side_chat,MR. COLAO,start_answer
1843,5891,236,4,"I would say there likely are differences, I just don't know what they are.",a,THE WITNESS,start_question
1844,5893,236,6,"You know that they are similar pumps and turbines, correct?",q,MR. GREENSTONE,start_chat
1845,5895,236,8,Objection; asked and answered.,side_chat,MR. COLAO,start_answer
1846,5897,236,10,"They are most likely similar, yes.",a,THE WITNESS,start_question
1847,5899,236,12,Would the turbines have been roughly the same size on the WILLIS A LEE as those that are being referenced in Exhibits 9 and 10 or do you know?,q,MR. GREENSTONE,start_chat
1848,5903,236,16,Objection to form.,side_chat,MR. COLAO,start_answer
1849,5904,236,17,I don't know.  There were different horse powers for these services on different ships.,a,THE WITNESS,start_question
1850,5907,236,20,Do you know what the horse powers were for the turbines that were on the WILLIS A LEE verses those that were referenced in Exhibits 9 and 10?,q,MR. GREENSTONE,start_answer
1851,5911,236,24,Not verses those in 9 and 10. I could tell you from those documents what the horse powers were for those turbines aboard the WILLIS A LEE.,a,THE WITNESS,start_question
1852,5916,237,4,Do you know if the turbines on the fuel oil service pumps on the WILLIS A LEE would have been similar in appearance to the turbines that were referenced in Exhibits 9 and 10 or do you know?,q,MR. GREENSTONE,start_answer
1853,5921,237,9,I'm not sure.,a,THE WITNESS,start_question
1854,5922,237,10,Are there turbines that are vastly different in appearance?,q,MR. GREENSTONE,start_answer
1855,5924,237,12,Yes.,a,THE WITNESS,start_question
1856,5925,237,13,That drive fuel oil service pumps for use in Navy fire rooms?,q,MR. GREENSTONE,start_answer
1857,5927,237,15,"I'm trying to recall whether all of them are even oriented the same way. I'm not sure that they are.  For example, some are vertical units.  I know a lot of them are vertical units, but I believe there are also some horizontal units which would look completely different.",a,THE WITNESS,start_question
1858,5934,237,22,Why don't you take some time to look at Exhibits 9 and 10 and see if you could point out any differences between those fuel oil service pumps and turbines and the ones on the WILLIS A LEE?,q,MR. GREENSTONE,start_answer
1859,5940,238,3,I don't know that I can tell that by looking at these documents because I don't have comparable documents for the WILLIS A LEE.  I have the detailed information on the WILLIS A LEE that tells you the performance characteristics of the turbine and the bill of materials tell you the details of what's in them.,a,THE WITNESS,start_chat
1860,5948,238,11,Let's go off the record for just a second.  This is why we will need his depo in every case.,side_chat,MR. GREENSTONE,start_chat
1861,5952,238,15,Let's go off.,side_chat,MR. COLAO,start_chat
1862,5953,238,16,The time is 3:33.  We're going off the record.,side_chat,THE VIDEOGRAPHER,is brackets
1863,5955,238,18,(Recess taken.),brackets,,start_chat
1864,5956,238,19,The time is 3:34.  We are on the record.,side_chat,THE VIDEOGRAPHER,start_question
1865,5958,238,21,"Sir, would you agree with me that all of the De Laval fuel oil service pumps that were turbine driven that were sold to the United States Navy for use in fire rooms on Navy ships were similar in nature?",q,MR. GREENSTONE,start_chat
1866,5964,239,2,Objection to form.,side_chat,MR. COLAO,start_answer
1867,5965,239,3,That's far too broad a statement.  I don't know the answer to that.,a,THE WITNESS,start_question
1868,5967,239,5,"All of the De Laval fuel oil service pumps and turbines that were sold to the United States Navy for use in fire rooms on Naval vessels were designed to do basically the same things, true?",q,MR. GREENSTONE,start_chat
1869,5972,239,10,Same objection.,side_chat,MR. COLAO,start_answer
1870,5973,239,11,"The functions would be similar, yes.",a,THE WITNESS,start_question
1871,5975,239,13,"The various parts of the turbine would be similar too, fair?",q,MR. GREENSTONE,start_answer
1872,5977,239,15,"There would be, yes, there would be similar parts in terms of the function of the part. There would be blades on all the turbines or they all have casings so yes, in that sense they have similar parts.",a,THE WITNESS,start_question
1873,5983,239,21,Are there different model numbers for different De Laval fuel oil service pumps?,q,MR. GREENSTONE,start_answer
1874,5986,239,24,Yes.,a,THE WITNESS,start_question
1875,5988,240,1,What are the model numbers that are relating to the De Laval fuel oil service pumps referenced in 9 and 10?,q,MR. GREENSTONE,start_answer
1876,5991,240,4,I don't know.,a,THE WITNESS,start_question
1877,5992,240,5,Do you know what the model number is for those that are related to the WILLIS A LEE?,q,MR. GREENSTONE,start_answer
1878,5995,240,8,"Yes, from those documents if you show me those documents.",a,THE WITNESS,start_question
1879,5997,240,10,"I'll do that in just a second. Before we get there, I want to lay a little bit more background.  What do the different models represents if you know?",q,MR. GREENSTONE,start_answer
1880,6001,240,14,"Different power, different styles of casings possibly, different orientation of inlet and exhaust nozzles.",a,THE WITNESS,start_question
1881,6004,240,17,How many different models of De Laval fuel oil service pumps are there?,q,MR. GREENSTONE,start_answer
1882,6006,240,19,I don't know.,a,THE WITNESS,start_question
1883,6007,240,20,Do you know if there's more than two?,q,MR. GREENSTONE,start_answer
1884,6009,240,22,I suspect there are many more than two.,a,THE WITNESS,start_question
1885,6011,240,24,Do you know if there's more than 10?,q,MR. GREENSTONE,start_answer
1886,6014,241,2,There may very well be.,a,THE WITNESS,start_question
1887,6015,241,3,Do you actually know or you are just guessing?,q,MR. GREENSTONE,start_answer
1888,6017,241,5,"No, I'm sure there are many. These turbines were not standard items that were produced for stock and then somebody sold them off a shelf.  They were produced specifically for a function in terms of horsepower, speed, the functions that a turbine must do, power, and they were specific to a given type of ship.",a,THE WITNESS,start_question
1889,6025,241,13,Are there some De Laval turbines that were used as drivers for fuel oil services pumps that run cold?,q,MR. GREENSTONE,start_answer
1890,6028,241,16,No.,a,THE WITNESS,start_question
1891,6029,241,17,They all run hot?,q,MR. GREENSTONE,start_answer
1892,6030,241,18,"To varying degrees, yes.",a,THE WITNESS,start_question
1893,6031,241,19,Do you know what the temperature ranges would be for how hot the turbines run as an average?,q,MR. GREENSTONE,start_answer
1894,6034,241,22,"I could look, again, I could look at the documents and tell you what the temperatures were for that particular group of turbines.",a,THE WITNESS,start_question
1895,6039,242,2,"I do want to get to that, but my question is more general than that.  Is there a range of temperatures that the De Laval turbines that drove fuel oil service pumps would work?",q,MR. GREENSTONE,start_answer
1896,6044,242,7,"If they all used steam from the same pressure level, then those would be consistent.  If different -- if on different ships the steam came from a different point in the production or use of that steam.  For example, if it came directly from the boiler, it would be higher in pressure and therefore temperature than if it came from the cross over between the low and high pressure turbine.",a,THE WITNESS,start_question
1897,6054,242,17,Fair enough.,q,MR. GREENSTONE,start_answer
1898,6055,242,18,So there is a range and it's probably relatively consistent for a given type of ship.,a,THE WITNESS,start_question
1899,6058,242,21,Are you aware of any turbines that drove any type of De Laval pumps that were not hot?,q,MR. GREENSTONE,start_answer
1900,6061,242,24,"Again, hot is a generality. They were all above 212 degrees obviously because it takes that temperature to produce steam.",a,THE WITNESS,start_question
1901,6066,243,4,"So all turbines that drove De Laval pumps to the extent that there were turbines driving the pump, it's going to at least be above 212 degrees?",q,MR. GREENSTONE,start_answer
1902,6070,243,8,That's correct.,a,THE WITNESS,start_question
1903,6071,243,9,That's too hot to touch without getting burned; is that fair?,q,MR. GREENSTONE,start_answer
1904,6073,243,11,"If that temperature were transferred through to the surface of a case, yes.",a,THE WITNESS,start_question
1905,6076,243,14,"That would apply whether the turbine was on the fuel oil service pump in the WILLIS A LEE or on the U.S.S Springfield or those battle ships that are referenced in 9 or 10, true?",q,MR. GREENSTONE,start_answer
1906,6081,243,19,"That's generally true, yes.",a,THE WITNESS,start_question
1907,6082,243,20,"Certainly at a temperature above 212 degrees, it would be reasonable to think that the turbines that drive pumps are going to be insulated on Navy ships?",q,MR. GREENSTONE,start_answer
1908,6086,243,24,Depends on where they are.,a,THE WITNESS,start_question
1909,6088,244,1,"If they are in an area where somebody could touch them, they would need to be insulated, true?",q,MR. GREENSTONE,start_chat
1910,6091,244,4,Objection to form.,side_chat,MR. COLAO,start_answer
1911,6092,244,5,"That's a function of the Navy's decision as to where and when they insulate, but they certainly could be.",a,THE WITNESS,start_question
1912,6095,244,8,"I think that I understood your answer and correct me if I'm wrong, but what I believe you are trying to say is if the turbine was in a place in which nobody could possibly get to it, then it would not necessarily need to be insulated, but if it was in a place where people would be around, then it would be insulated most likely?",q,MR. GREENSTONE,start_chat
1913,6103,244,16,Objection to form.,side_chat,MR. COLAO,start_answer
1914,6104,244,17,"Then the Navy would be more likely to do that, yes, I would say that.",a,THE WITNESS,start_question
1915,6106,244,19,"That's accurate whether we are talking about the WILLIS A LEE or the carriers in Exhibit 9 or the battle ships in 10 or any De Laval fuel oil service pumps that are turbine driven, true?",q,MR. GREENSTONE,start_chat
1916,6111,244,24,Same objection.,side_chat,MR. COLAO,start_answer
1917,6113,245,1,"I would say that's generally true, yes.",a,THE WITNESS,start_question
1918,6115,245,3,"As it relates to turbines that drive all De Laval pumps regardless of the type of pump, if it's turbine driven and it's going to be placed in a place where people could be around it, most likely it will be insulated, true?",q,MR. GREENSTONE,start_answer
1919,6121,245,9,"Again, it's a function of what the Navy sees as access and where it's located and who's working on it and when, but it's possible, yes.",a,THE WITNESS,start_question
1920,6125,245,13,"Certainly if people are going to be working in close proximity to any De Laval turbine regardless of the ship, most likely that turbine will be insulated, true?",q,MR. GREENSTONE,start_answer
1921,6129,245,17,"You're working your way towards absolutes and again, I don't know.",a,THE WITNESS,start_question
1922,6131,245,19,"I don't think I was trying to get an absolute, I think I asked you what was most likely.",q,MR. GREENSTONE,start_answer
1923,6134,245,22,I'm saying it's possible.,a,THE WITNESS,start_question
1924,6135,245,23,"My question was based on nothing else other than the temperature range, 212 degrees of these turbines that you said was at the minimum what they had to be, if a De Laval turbine regardless of the ship or regardless of the location was in an area where people had direct access and contact with it, then it would most likely be insulated; is that fair?",q,MR. GREENSTONE,start_answer
1925,6145,246,8,"While it was operating then that's a possibility, yes.",a,THE WITNESS,start_question
1926,6147,246,10,"It most likely would be insulated while it was operating, true?",q,MR. GREENSTONE,start_chat
1927,6149,246,12,Objection to form.,side_chat,MR. COLAO,start_answer
1928,6150,246,13,"What I was getting at if it was in an area where people had to work around it while it was operating as opposed to being shut down for maintenance, for example, then the Navy could have made a decision to insulate it, yes.",a,THE WITNESS,start_question
1929,6156,246,19,"That would certainly be something that was foreseeable to De Laval at the time that they sold turbines to any customer, true?",q,MR. GREENSTONE,start_chat
1930,6160,246,23,Objection to form.,side_chat,MR. COLAO,start_answer
