,indice,page_number,line_number,text,text_type,speaker,time_added
0,0,0,0,,,,start_chat
1,137,4,12,"I would join in that objection.  And for the record, I'm Kyle Silvers representing Mr. Porterfield. EXAMINATION",side_chat,MS. SILVERS,start_question
2,142,4,17,"Mr. Porterfield, could you state your full name for the record, please?",q,MR. ARCHINACO,start_answer
3,144,4,19,John Scott Porterfield.,a,THE WITNESS,start_question
4,145,4,20,"And are you currently employed, or have you retired?",q,MR. ARCHINACO,start_answer
5,147,4,22,"I'm semi-retired.  I have a company that does practice management, and occasionally I get a call to do something, but it hasn't happened in a while.",a,THE WITNESS,start_question
6,152,5,1,So you're moving into retirement?,q,MR. ARCHINACO,start_answer
7,153,5,2,Pretty much.,a,THE WITNESS,start_question
8,154,5,3,"Fair enough. The events that we'll be talking about today occurred during time periods when I believe you were employed by the Toledo Clinic, Inc.",q,MR. ARCHINACO,start_answer
9,159,5,8,Yes.,a,THE WITNESS,start_question
10,160,5,9,"And how long were you employed at Toledo Clinic, Inc.?",q,MR. ARCHINACO,start_answer
11,162,5,11,"I -- I was employed from October 28, 2010 until December 15th, 2015.",a,THE WITNESS,start_question
12,164,5,13,"And when you left Toledo Clinic, that was when you went to basically transitioning to semi-retirement?",q,MR. ARCHINACO,start_answer
13,167,5,16,"I did some consulting for a couple of years, and then I didn't, so ....",a,THE WITNESS,start_question
14,169,5,18,Was your departure amicable?,q,MR. ARCHINACO,start_answer
15,170,5,19,I wouldn't say that.,a,THE WITNESS,start_question
16,171,5,20,"Okay.  Well, we'll get to that later then.  I'm going to try to go through --",q,MR. ARCHINACO,start_answer
17,173,5,22,Okay.,a,THE WITNESS,start_question
18,174,5,23,-- things in chronological order for you.,q,MR. ARCHINACO,start_answer
19,176,5,25,Sure.,a,THE WITNESS,start_question
20,178,6,1,"Can you just give me a little, some background in terms of your educational background and training?",q,MR. ARCHINACO,start_answer
21,181,6,4,"I have a graduate degree in public administration.  I trained to be a city manager, but I spent 45 years in healthcare, and that's how that goes.  I have worked overseas in healthcare, I worked for University Hospitals of Cleveland, in the early '80s.  I was kind of their ambulatory services guy, outpatient guy.  And I moved, relocated to Sylvania in 1988, and got a position as a VP at Flower in physician services. I've spent all my adult life working on the physician side of the equation, usually with the hospitals.  And then, you know, I -- we merged, that's the wrong word, but we merged with The Toledo Hospital in January of '96.  And then three years later, they -- I moved to work for a company owned by St. Luke's called Providers Solutions.  I worked there for about three years.  They decided to close the company, and I bought it. And that was a really good -- that was a -- it still is a good company, it's just not the size it -- 2008 kind of wiped everybody out. And my clients were all physicians, and they started baling to hospital systems, because there is just -- it's safer there, so they thought. And then I was approached by the president of the clinic around 2010 to apply for the administrator job at the clinic, and I did, and I got it.  And so that's what I did for that stretch of five years.",a,THE WITNESS,start_question
22,215,7,12,Okay.  Let me go through some general back -- have you ever given a deposition before?,q,MR. ARCHINACO,start_answer
23,218,7,15,Yes.,a,THE WITNESS,start_question
24,219,7,16,Okay.  What type of case?,q,MR. ARCHINACO,start_answer
25,220,7,17,Medical.,a,THE WITNESS,start_question
26,221,7,18,Malpractice type matters or -- or business?,q,MR. ARCHINACO,start_answer
27,223,7,20,"One was -- I can't really recall. One was angry physicians, and you know, suing his former employer.",a,THE WITNESS,start_question
28,226,7,23,"Got it.  I'm going to go through basic ground rules.  There is a videographer, but the court reporter is the official transcript, so the formatting is question, then potential objection from your counsel, or Mr. Wiencek.  Give them a chance to make an objection.  If they're making an objection, let them finish it.  Normally, you can answer the question after objections are made, unless your counsel directs you not to answer a question.",q,MR. ARCHINACO,start_answer
29,238,8,9,Okay.,a,THE WITNESS,start_question
30,239,8,10,"So normally you'll answer, even if there is an objection, relevance, whatever. But try to keep it in that format. You and I will probably get a little colloquial.  My client says you're an easy guy to speak to, so we might get a little colloquial.  And when that happens, we start talking over one another, even if we're not trying to insult each other.  It becomes more conversational.  The court reporter has a difficult time.  She'll throw her hands in the air and tell us not to, so we'll try to keep that idea in mind of question, give the opportunity for the objection, then answer. If you answer a question, I'll assume you both heard and understood it.  And if for some reason so you don't hear or understand a question, please let me know. And then the last thing is to keep your answers audible.  Some people get into nods and shakes of the head, and have to be reminded, but as long as you keep your answers audible, we're fine.  So those are the basic rules. You also have attorney-client privilege.  Even though you're a former employee, during periods in time that you were employed there, and there is other parameters, you have an attorney representing you today, so I'm not trying to inquire about privilege matters, or your actual conversations with counsel today.  I'm just trying to seek your independent information.  Fair?",q,MR. ARCHINACO,start_answer
31,273,9,18,Okay.,a,THE WITNESS,start_question
32,274,9,19,Okay.  In terms of -- where did you graduate from college?,q,MR. ARCHINACO,start_answer
33,276,9,21,Western Michigan University.,a,THE WITNESS,start_question
34,277,9,22,"And so going back a second, just to go back, when you said 2008 wiped everyone out, what were you speaking about?",q,MR. ARCHINACO,start_answer
35,280,9,25,"Well, you know, the stock market, the banks, it was a big push, and it just, you know, in small business, there is the quick and the dead.  That's about it.  So I survived it, but I lost about probably 60 percent of my clients right away.  And so I had to downsize and keep moving, and I mean, a little bit of downsizing, a smaller space, and it got harder to make a living.",a,THE WITNESS,start_question
36,290,10,9,"And when you said you worked on -- and I just want to hit on one other point, in terms of a trend, I think you were pointing out, which was that physicians at one time were more independent groups, and then there was a flight or movement towards hospitals. Is that right?",q,MR. ARCHINACO,start_answer
37,297,10,16,That's my opinion.,a,THE WITNESS,start_question
38,298,10,17,When -- when did you start noticing that?,q,MR. ARCHINACO,start_answer
39,300,10,19,"About two -- well, in Toledo, it's been cyclical over the years.  It literally has.  Because in the early '90s, ProMedica and Mercy started employing physicians.  And then they -- they went back and forth.  I worked for Flower Hospital.  We employed them, but we didn't have as many as those two groups, and we didn't build medical office buildings like they did.  We rented space.  And my physicians were happier than the ones working for the other system. We didn't have a noncompete, because I didn't believe in them, so my guys could go anywhere they wanted.  And the model worked really well.",a,THE WITNESS,start_question
40,316,11,9,"And you saw -- did you also see sort of a movement towards the large medical institutions acquiring or becoming -- strike that. Did you also see the fact that a ProMedica and Mercy, for example, each have their own insurance programs, or programs that would direct clients to them?",q,MR. ARCHINACO,start_answer
41,324,11,17,I believe ProMedica had Paramount.  I'm not sure whether Mercy had their own insurance plan or not.,a,THE WITNESS,start_question
42,327,11,20,"ProMedica basically created like a captive insurance, so to say?",q,MR. ARCHINACO,start_answer
43,329,11,22,They did.,a,THE WITNESS,start_question
44,330,11,23,"And then so when they did that, when patients would be ProMedica-insured patients, typically, those patients, just to your knowledge, would be referred to ProMedica institutions?",q,MR. ARCHINACO,start_answer
45,336,12,3,"The thing -- and not in all cases, because not everybody has all the specialists.  And they have to cut pieces out, so that if the doctor, or the patient really needed to go someplace, it would happen.  But that was the goal, was to capture market share, in my opinion.",a,THE WITNESS,start_question
46,343,12,10,"Okay.  So basically what you have seen -- well, you saw, although it was cyclical with doctors, you have seen, or saw in the industry, where the large medical institutions started to employ physicians, as opposed to where they used to be --",q,MR. ARCHINACO,start_answer
47,349,12,16,Yes.,a,THE WITNESS,start_question
48,350,12,17,-- more independent groups?,q,MR. ARCHINACO,start_answer
49,351,12,18,Yes.,a,THE WITNESS,start_chat
50,352,12,19,Let him finish.  Let him finish.,side_chat,MS. SILVERS,start_question
51,354,12,21,"(By Mr.  Archinaco) And then insurance, also, is sometimes is part of that, like with ProMedica.  Not necessarily always, but sometimes you see an instance where a hospital also will have their own captive insurance to help refer?",q,MR. ARCHINACO,start_answer
52,361,13,2,"In the Toledo market, I would say yes.",a,THE WITNESS,start_question
53,363,13,4,"Okay.  And I'm not asking you for anything else.  I mean, I -- I do work in Pittsburgh.  I could tell you all about UPMC and all kinds of stuff there, but that's not for you to worry about today.",q,MR. ARCHINACO,start_answer
54,368,13,9,Okay.,a,THE WITNESS,start_question
55,369,13,10,"The next -- the next exhibit we have, I'm going to mark your affidavit.  I'm not going to ask a lot of questions about it right now.  We'll come back to it, but you signed an affidavit in this case.  We'll mark this as Exhibit 115, and I have copies for counsel.",q,MR. ARCHINACO,start_chat
56,376,13,17,Thank you.,side_chat,MS. SILVERS,start_chat
57,377,13,18,You're welcome.,side_chat,MR. ARCHINACO,is brackets
58,378,13,19,"(Whereupon, Plaintiff's Exhibit 115 was marked for identification.)",brackets,,start_question
59,380,13,21,(By Mr. Archinaco) Does this appear to be an affidavit that you signed?,q,MR. ARCHINACO,start_answer
60,382,13,23,It does.,a,THE WITNESS,start_question
61,383,13,24,"Okay.  Now, a couple of questions.  Are you -- are you -- you're not an attorney, are you?",q,MR. ARCHINACO,start_answer
62,387,14,2,No.,a,THE WITNESS,start_question
63,388,14,3,Okay.  People laugh.  Sometimes people are happy they're not attorneys. What -- what do you recall about the circumstances surrounding how this affidavit came to be?,q,MR. ARCHINACO,start_chat
64,393,14,8,"Objection.  May be protected by privilege, but you can answer.",side_chat,MS. SILVERS,start_answer
65,395,14,10,"I thought it was just part of this process that has gotten me to this table today.  I was supposed to sign a document, and which I did, to the best of my knowledge, that these are the things that happened, so that's what I did.",a,THE WITNESS,start_question
66,401,14,16,"Well, do you know who prepared this document?",q,MR. ARCHINACO,start_chat
67,403,14,18,"Objection, privilege. You may answer.",side_chat,MS. SILVERS,start_answer
68,405,14,20,I'm -- I guess I don't know who prepared it.,a,THE WITNESS,start_question
69,407,14,22,"Okay.  What involvement did you have, if any, in the language that was selected or put --",q,MR. ARCHINACO,start_answer
70,410,14,25,None.,a,THE WITNESS,start_question
71,412,15,1,"-- into the affidavit? So you were just simply asked to sign it, essentially?",q,MR. ARCHINACO,start_answer
72,415,15,4,"Well, I was asked to read it, and you know, if I thought the -- I objected to anything, I could state so at that time, and then I signed it.",a,THE WITNESS,start_question
73,419,15,8,"Did you have any emails with people?  I'm not asking you to disclose content right now with anyone.  Did you have any emails forwarded back and forth, whether between your attorneys, or with Mr. Wiencek from Mercy, about this affidavit?",q,MR. ARCHINACO,start_chat
74,425,15,14,"Objection, privilege. For the record, I would state that any emails pertaining to this affidavit were solely between my client and myself.  You may answer.",side_chat,MS. SILVERS,start_chat
75,429,15,18,I may answer?,side_chat,THE WITNESS,start_chat
76,430,15,19,You may.,side_chat,MS. SILVERS,start_answer
77,431,15,20,I corresponded with my attorney.,a,THE WITNESS,start_question
78,432,15,21,Only your attorney?,q,MR. ARCHINACO,start_answer
79,433,15,22,Only my attorney.,a,THE WITNESS,start_question
80,434,15,23,Okay.  And so you don't know where your attorney got the affidavit?,q,MR. ARCHINACO,start_chat
81,436,15,25,Objection.,side_chat,MS. SILVERS,start_question
82,438,16,1,(By Mr. Archinaco) Or whether she prepared it?,q,MR. ARCHINACO,start_answer
83,440,16,3,I do -- I don't know.,a,THE WITNESS,start_question
84,441,16,4,Okay.  Were you shown any documents before you signed it?,q,MR. ARCHINACO,start_answer
85,443,16,6,On this?,a,THE WITNESS,start_question
86,444,16,7,Before you signed the affidavit?,q,MR. ARCHINACO,start_answer
87,445,16,8,"No, I don't believe I -- I don't believe so.",a,THE WITNESS,start_question
88,447,16,10,Like any of your old emails or anything like that?,q,MR. ARCHINACO,start_answer
89,449,16,12,"I didn't get copies of the old emails until, like, I think last week.  I don't have access to the Toledo Clinic emails. That's where all that stuff is.",a,THE WITNESS,start_question
90,453,16,16,"No.  And I, and Mr. Porterfield, there is no -- there is no accusation being directed at you in any way.  Just asking for informational --",q,MR. ARCHINACO,start_answer
91,457,16,20,Okay.,a,THE WITNESS,start_question
92,458,16,21,"-- purposes about what you saw, what you didn't see, when you had it, because it puts it in perspective --",q,MR. ARCHINACO,start_answer
93,461,16,24,Okay.,a,THE WITNESS,start_question
94,462,16,25,"-- when you signed things. So very recently you saw -- you didn't have access -- strike that. You did not have access to Toledo Clinic's emails, because you don't work there anymore, correct?",q,MR. ARCHINACO,start_answer
95,469,17,6,Correct.,a,THE WITNESS,start_question
96,470,17,7,"Okay.  And that's, you know, there is an attorney involved in this process and has been involved for Toledo Clinic, correct?",q,MR. ARCHINACO,start_answer
97,474,17,11,For the Toledo Clinic?,a,THE WITNESS,start_question
98,475,17,12,Yes.,q,MR. ARCHINACO,start_answer
99,476,17,13,I'm not aware of what the Toledo Clinic is doing in this matter.,a,THE WITNESS,start_question
100,478,17,15,Okay.  So you have personal counsel here today?,q,MR. ARCHINACO,start_answer
101,480,17,17,I do.,a,THE WITNESS,start_question
102,481,17,18,All right.  And where did you obtain these doc -- you just obtained emails or documents recently in the last week or so?,q,MR. ARCHINACO,start_answer
103,484,17,21,Yes.,a,THE WITNESS,start_question
104,485,17,22,Okay.  Where did you obtain those from?,q,MR. ARCHINACO,start_answer
105,487,17,24,My attorney.,a,THE WITNESS,start_question
106,488,17,25,"And what were those documents?  I don't want to know about conversations with your attorney.  I'm not entitled to know them, what you talked about.",q,MR. ARCHINACO,start_answer
107,493,18,4,They were copies --,a,THE WITNESS,start_chat
108,494,18,5,"Limited objection as to privilege, but you may answer the question as presented.",side_chat,MS. SILVERS,start_answer
109,497,18,8,"They were copies, not all mine, but they were copies of emails that went back and forth from the time Dr. Holland arrived, and it was like 59 pages worth of stuff.",a,THE WITNESS,start_question
110,501,18,12,Okay.  Did you retain a copy of that that we could have a copy of?,q,MR. ARCHINACO,start_answer
111,503,18,14,With me here?,a,THE WITNESS,start_question
112,504,18,15,No.  Did you retain a copy of those 59 pages?,q,MR. ARCHINACO,start_answer
113,506,18,17,I don't have it with me.,a,THE WITNESS,start_question
114,507,18,18,Okay.  It's fair enough that you don't have it.  The question is just whether you have it.,q,MR. ARCHINACO,start_answer
115,510,18,21,I received it from my attorney.,a,THE WITNESS,start_question
116,511,18,22,"Okay.  So we will make a request for those, those documents to review.",q,MR. ARCHINACO,start_chat
117,513,18,24,"And I will object on the basis of privilege, but we'll provide.",side_chat,MS. SILVERS,start_chat
118,516,19,1,Okay.  Thank you. And I don't know if it's easier to do it today.  We can talk during a break about how to handle it.,side_chat,MR. ARCHINACO,start_question
119,520,19,5,"(By Mr. Archinaco) Mr. Porterfield, I'm going to show you some documents we've already marked in this case, and some emails and things, and some that we haven't marked yet.  Some of them may be ones that you have seen or not, so I'll just ask that as we go along, and if it is one that was one of your 59, you know, please let me know, as we go through it. The first one I'd like to direct you to is Exhibit 24, which is -- should be in the binder in front of you.",q,MR. ARCHINACO,start_answer
120,532,19,17,Binder one or two?,a,THE WITNESS,start_question
121,533,19,18,"Should be in binder one, I believe.",q,MR. ARCHINACO,start_answer
122,535,19,20,And it's numbered by the column?,a,THE WITNESS,start_chat
123,536,19,21,Yes.,side_chat,MS. SILVERS,start_chat
124,537,19,22,Yes.,side_chat,MR. ARCHINACO,start_chat
125,538,19,23,"And you said 24, correct?",side_chat,MS. SILVERS,start_chat
126,540,19,25,"Yes, 24.",side_chat,MR. ARCHINACO,start_question
127,542,20,1,"(By Mr. Archinaco) And also, when I ask you to look at a document, you're welcome to take -- you know, you're welcome to take time to look at it and review it.  This isn't, you know?",q,MR. ARCHINACO,start_answer
128,547,20,6,Okay.  Okay.,a,THE WITNESS,start_question
129,548,20,7,All right.  Have you had a chance to review Exhibit 24?,q,MR. ARCHINACO,start_answer
130,550,20,9,"Yes.  It's -- to be honest, it's a pretty standard email that most every employed physician at the clinic would have gotten from me, or Dr. Elliott, because it just covers how -- how it works.",a,THE WITNESS,start_question
131,555,20,14,"All right.  So this is December 19th, 2012, is an email from you to Dr. Holland, with a cc to Thomas Arquilla and also Tom Leeds, correct?",q,MR. ARCHINACO,start_answer
132,559,20,18,"Correct, right.",a,THE WITNESS,start_question
133,560,20,19,"Now, just to go back a second. One of the reasons I gave this up front, I'm going to try to use exhibits to kind of anchor thought processes in your head about time periods. Were you involved in recruiting Dr. Holland?",q,MR. ARCHINACO,start_answer
134,568,21,1,The way the recruitment -- I can only speak to the clinic side of this equation.,a,THE WITNESS,start_question
135,571,21,4,Okay.  Please.,q,MR. ARCHINACO,start_answer
136,572,21,5,"It was driven by the, in this case, by the cardiology -- cardiology division of the Toledo Clinic.  They had -- well, in the '90s, they had pretty strong cardiothoracic coverage, and then they didn't. And they just -- and, you know, the clinic tries very hard to straddle the fence between the health systems in town.",a,THE WITNESS,start_question
137,580,21,13,Uh-huh.,q,MR. ARCHINACO,start_answer
138,581,21,14,"And they're pretty good at it, but the cardiology -- cardiology department decided they wanted to recruit a cardiothoracic surgeon.  And Tom Leeds is their recruiter.  And you know, that's -- we went fishing for cardiothoracic surgeons, but Mercy was the lead on that, and -- and I believe we -- we got two.  We got Dr. Holland, and a guy, I think his name is Mundinger, but he -- he didn't -- he didn't stay long.  He was -- he was -- anyway, he did not -- he was not a serious competitor.  He wasn't interested really.",a,THE WITNESS,start_question
139,595,22,2,"Okay.  All right.  So first of all, just to cover one thing you said, you indicated Mercy was the lead in terms of the advertising; is that right?",q,MR. ARCHINACO,start_answer
140,599,22,6,Yes.,a,THE WITNESS,start_question
141,600,22,7,"Why -- why was Mercy the lead, as opposed to Toledo Clinic, to your knowledge?",q,MR. ARCHINACO,start_answer
142,602,22,9,To my knowledge?,a,THE WITNESS,start_question
143,603,22,10,Yes.,q,MR. ARCHINACO,start_answer
144,604,22,11,"Well, we were trying to, as I said before, partner with everybody successfully.  You know, we -- we tried to do it with ProMedica.  Had a huge agreement with them.  It never worked out.  And ProMedica was shutting the physicians out of their hospitals, slowly, but surely, okay?  And Mercy was interested, and we -- I'm speaking with my clinic -- that was interested in seeing what we could do together, okay?  So they -- excuse me.  They have a budget for physician recruitment.  I don't have one at the clinic.  I mean, we did it on occasion, but normally it was just doctors showing up, who wanted to join the clinic, so there were no recruitment fees involved.",a,THE WITNESS,start_question
145,621,23,2,"Okay.  So Mercy, was it your understanding, Mercy needed a cardiothoracic surgeon?",q,MR. ARCHINACO,start_chat
146,624,23,5,Objection.  Misstates the record.,side_chat,MR. WIENCEK,start_chat
147,626,23,7,Join.,side_chat,MS. SILVERS,start_answer
148,627,23,8,"I can't answer that as because I'm looking at it through the lens of the clinic.  They're the ones that came to the board meeting and said we'd like to, our board meeting, we'd like to recruit a cardiothoracic surgeon, and let's see who we can get help us.",a,THE WITNESS,start_question
149,633,23,14,Who came to the board meeting and --,q,MR. ARCHINACO,start_answer
150,635,23,16,Would be Dr. Nahhas.,a,THE WITNESS,start_question
151,636,23,17,Okay.,q,MR. ARCHINACO,start_answer
152,637,23,18,Who is kind of the head of the cardiology department.,a,THE WITNESS,start_question
153,639,23,20,"Did you have -- well, as of today, do you still have -- strike that. Did you have a good relationship with Dr. Nahhas --",q,MR. ARCHINACO,start_answer
154,643,23,24,Yeah.,a,THE WITNESS,start_question
155,644,23,25,-- overall?,q,MR. ARCHINACO,start_answer
156,646,24,1,Yes.,a,THE WITNESS,start_question
157,647,24,2,"Do you think you still do, as you sit here today?",q,MR. ARCHINACO,start_answer
158,649,24,4,He friended me on Facebook.,a,THE WITNESS,start_question
159,650,24,5,"Okay.  Did you have an opportunity, though, that because of what ProMedica was doing in terms of shutting people out, that there was a problem or an issue that was developing at Mercy with regard to cardiothoracic surgery coverage?",q,MR. ARCHINACO,start_answer
160,656,24,11,"I actually just -- I was not well versed with what was going on at Mercy per se. Okay?  This was a new, you know, we had been a Flower Hospital clinic for years.  That's where, you know, 30 years ago, it was run by Toledo Clinic physicians.  And then they acquired the hospital in '96, and just started -- they wanted to own the Toledo Clinic, and they're independent.  They're all independent doctors, if you will.  They're entrepreneurial, that's where they want to be. They don't want to be owned by a hospital system.  So that's the model.  It's a -- they're cash basis, they're for profit, they're good doctors, but they're very independent.  And I believe we were just getting our toe in the water to see what, if anything, we could do with Mercy.  But driving it was this trouble with ProMedica, because they were causing a lot of trouble for us.",a,THE WITNESS,start_question
161,677,25,6,"Okay.  So -- well, just to -- to put it in perspective, the Toledo Clinic was independent and had a group of cardiologists employed there, correct?",q,MR. ARCHINACO,start_answer
162,681,25,10,Yes.,a,THE WITNESS,start_question
163,682,25,11,"And then there is also an entity called TCI, which was a competitor of Toledo Clinic, that was run by Dr. Kabour.  Do you know that group?  I'm sorry, TCC.  TCC, do you know who Dr. Kabour is?",q,MR. ARCHINACO,start_answer
164,687,25,16,Of course I do.,a,THE WITNESS,start_question
165,688,25,17,Okay.  Do you know Dr. Kabour had his own group of independent physicians?,q,MR. ARCHINACO,start_answer
166,690,25,19,I see him on TV every Sunday.,a,THE WITNESS,start_question
167,691,25,20,"Okay.  He has a television show, correct?",q,MR. ARCHINACO,start_answer
168,693,25,22,Yeah.  I was his patient.  Point of disclosure.,a,THE WITNESS,start_question
169,695,25,24,"The -- fair enough.  Fair enough. And Dr. Kabour said -- well, anyway. We deposed Dr. Kabour.  We had him in here.  And well, tell me about that.  As you sit here today, do you have any ill will or animosity toward my client?",q,MR. ARCHINACO,start_answer
170,702,26,5,None whatsoever.,a,THE WITNESS,start_question
171,703,26,6,"Dr. Kabour had indicated a willingness to actually sit down and have dinner with my client.  And if such a dinner would occur, and you were invited, would you attend as well?",q,MR. ARCHINACO,start_chat
172,708,26,11,"Objection to the form of the question, but you may answer.",side_chat,MS. SILVERS,start_answer
