,indice,page_number,line_number,text,text_type,speaker,time_added
1924,3759,155,22,"Okay.  And, Mr. Goradia, do you recognize this page of Exhibit 20 that we're looking at as the August and November capital call valuations?",q,MR. PRICE,start_answer
1925,3762,155,25,"By this page, I cannot tell.",a,THE WITNESS,start_question
1926,3763,156,1,Have you ever seen this page before?,q,MR. PRICE,start_answer
1927,3764,156,2,I may have.,a,THE WITNESS,start_question
1928,3765,156,3,Earlier today I believe you testified that you looked at and approved the August and November capital call valuations; is that correct?,q,MR. PRICE,start_answer
1929,3768,156,6,"As a board member, I would have.",a,THE WITNESS,start_question
1930,3769,156,7,"Okay.  And what we are looking at is, in fact, the August and November capital call valuations. And do you recognize them as such?",q,MR. PRICE,start_chat
1931,3772,156,10,Object to form.,side_chat,MR. RUOCCO,start_answer
1932,3773,156,11,I don't understand your question.,a,THE WITNESS,start_question
1933,3774,156,12,(By Mr. Price)  Do you recognize this page of Exhibit 20 as the August and November capital call valuations that you reviewed and approved?,q,MR. PRICE,start_answer
1934,3777,156,15,"Again, I'm confused with your question.  You know, to me recognized, do I recognize you.  I recognize -- I have never met you.  So do I recognize you from the past, no, I don't.  Tomorrow will I recognize you, probably, yes, because I met you.  So what do you mean by do I recognize this?",a,THE WITNESS,start_question
1935,3783,156,21,"Well, so we'll break it down.",q,MR. PRICE,start_answer
1936,3784,156,22,"Yeah, please.",a,THE WITNESS,start_question
1937,3785,156,23,"Have you ever seen Exhibit 20, the whole thing, before?",q,MR. PRICE,start_answer
1938,3787,156,25,I don't recall.,a,THE WITNESS,start_question
1939,3788,157,1,Okay.  Have you ever seen this particular page before?,q,MR. PRICE,start_answer
1940,3790,157,3,I don't recall.,a,THE WITNESS,start_question
1941,3791,157,4,"Your side of the case, your lawyers, Vijay in sworn testimony have said this is the November and August '14 capital call valuations.",q,MR. PRICE,start_answer
1942,3794,157,7,"I was not at Vijay's deposition, and I have not read his deposition.  So I don't know what he said and what he meant.",a,THE WITNESS,start_question
1943,3797,157,10,And so my question to you is:  Do you recognize these as the August and November capital call valuations seeing as you claim to have reviewed and approved them back in 2014?,q,MR. PRICE,start_answer
1944,3801,157,14,"So I don't know if she can pull out my answer but I think what I said was, I do not recall the specifics but I do recall that I would have approved it.",a,THE WITNESS,start_question
1945,3805,157,18,Okay.  So you've never seen this before?,q,MR. PRICE,start_answer
1946,3806,157,19,I did not say that.  I say I do not recall.,a,THE WITNESS,start_question
1947,3807,157,20,"Okay.  When you -- so let's -- let's do it this way.  When you approved the August 2014 capital call back in 2014, did you know that the current EBITDA used by the company was $54,942,592?",q,MR. PRICE,start_answer
1948,3811,157,24,"Sitting here today, I do not recall what that number was in August or November of 2014.",a,THE WITNESS,start_question
1949,3813,158,1,Okay.  And so do you know what current EBITDA even means?,q,MR. PRICE,start_answer
1950,3815,158,3,Generically?,a,THE WITNESS,start_question
1951,3816,158,4,"Do you know what -- when the company says current EBITDA 54,942,592, the number they used in the capital call valuation, what does current EBITDA mean? Where did they get that number?",q,MR. PRICE,start_answer
1952,3820,158,8,I don't know.,a,THE WITNESS,start_question
1953,3821,158,9,Is that last 12 months of EBITDA?,q,MR. PRICE,start_answer
1954,3822,158,10,It could be last 12 months.  It could be the real EBITDA of the current year actual versus projected for the rest of the months.  I don't know.,a,THE WITNESS,start_question
1955,3825,158,13,Could it be a normalized EBITDA?,q,MR. PRICE,start_answer
1956,3826,158,14,I don't know.,a,THE WITNESS,start_question
1957,3827,158,15,"I mean, you're aware of the Williams interruption that was going on in 2014, correct?",q,MR. PRICE,start_answer
1958,3829,158,17,Yes.,a,THE WITNESS,start_question
1959,3830,158,18,And so do you know if this is a normalized EBITDA to adjust for Williams?,q,MR. PRICE,start_answer
1960,3832,158,20,It was ongoing.  So I don't know how you normalize it.,a,THE WITNESS,start_question
1961,3834,158,22,Okay.  You're saying you can only normalize it after the fact?,q,MR. PRICE,start_answer
1962,3836,158,24,It would be very difficult not knowing when Williams was supposed to be back on stream.,a,THE WITNESS,start_question
1963,3838,159,1,"Well, but to the extent -- to the extent that the Williams interruption had impacted months that had already occurred, you could normalize those prior months, right?",q,MR. PRICE,start_answer
1964,3842,159,5,"No.  I didn't normalize.  You would normalize when you know for a specific time frame that this is what occurred and it is contained within this time frame. With Williams, there was -- at that time nobody knew when they would be up and running again --",a,THE WITNESS,start_question
1965,3848,159,11,Okay.,q,MR. PRICE,start_answer
1966,3849,159,12,-- and so how long that situation would continue.,a,THE WITNESS,start_question
1967,3851,159,14,Okay.  So current EBITDA could be last 12 months?,q,MR. PRICE,start_answer
1968,3853,159,16,"In this context, I don't know.",a,THE WITNESS,start_question
1969,3854,159,17,I'm just -- I'm just trying to understand what it could be.,q,MR. PRICE,start_answer
1970,3856,159,19,"Well, you're asking me to speculate.",a,THE WITNESS,start_question
1971,3857,159,20,"Well, do you think it would be unreasonable to use last 12 months?",q,MR. PRICE,start_answer
1972,3859,159,22,I don't want to speculate.,a,THE WITNESS,start_question
1973,3860,159,23,Would it be unreasonable to use projections?,q,MR. PRICE,start_answer
1974,3861,159,24,I -- I cannot speculate.  Sorry.,a,THE WITNESS,start_question
1975,3862,159,25,So you don't know where this number came from?,q,MR. PRICE,start_answer
1976,3863,160,1,"Not specifically, no, sir.",a,THE WITNESS,start_question
1977,3864,160,2,Did you -- did you know where this number came from back in 2014 when you approved it?,q,MR. PRICE,start_answer
1978,3866,160,4,"As I said, I cannot recall, no.",a,THE WITNESS,start_question
1979,3867,160,5,Did you ask any questions about where the number came from at the time you approved it?,q,MR. PRICE,start_answer
1980,3869,160,7,I cannot recall right now.,a,THE WITNESS,start_question
1981,3870,160,8,There's a six EBITDA multiple.  What does that mean?,q,MR. PRICE,start_answer
1982,3872,160,10,"That's what it says, six, six months probably.",a,THE WITNESS,start_question
1983,3873,160,11,Okay.  Where did that come from?,q,MR. PRICE,start_answer
1984,3874,160,12,"I believe that -- I don't know, but I believe it must have come from using a reasonable analysis of that multiple to utilize for these purposes.",a,THE WITNESS,start_question
1985,3877,160,15,All right.  And were you involved in that analysis at all?,q,MR. PRICE,start_answer
1986,3879,160,17,I was not.,a,THE WITNESS,start_question
1987,3880,160,18,Okay.  Do you know who was?,q,MR. PRICE,start_answer
1988,3881,160,19,"I don't know specifically, but I believe it would have to be with Vijay doing it, you know, based on his experience over all of the industry and the Lion's performance over the years.",a,THE WITNESS,start_question
1989,3885,160,23,And did you have any discussions with Vijay about his decision to use a six multiple?,q,MR. PRICE,start_answer
1990,3887,160,25,"We had a lot of discussions as it related to Williams and its impact on Lion, and I did not -- do not recall specifically of using six multiple, but I do remember at that time that I felt that given that Lion was solely dependent on Williams for its feedstock supply, that Lion was a distressed asset.",a,THE WITNESS,start_question
1991,3893,161,6,"Mr. Goradia, my question is:  Did you have discussions with Vijay about his decision to use a six multiple?",q,MR. PRICE,start_answer
1992,3896,161,9,"And I said, I do not recall.",a,THE WITNESS,start_question
1993,3897,161,10,Do you know what the source was for Vijay picking a six multiple?,q,MR. PRICE,start_answer
1994,3899,161,12,No.,a,THE WITNESS,start_question
1995,3900,161,13,Did he provide you any calculations on how he got to a six multiple?,q,MR. PRICE,start_answer
1996,3902,161,15,I don't recall.,a,THE WITNESS,start_question
1997,3903,161,16,Did you ask anyone to benchmark Vijay's six multiple?,q,MR. PRICE,start_chat
1998,3905,161,18,Object to form.,side_chat,MR. RUOCCO,start_answer
1999,3906,161,19,"As I said, I do not recall the six multiple. So how could I have asked someone to benchmark a six multiple.",a,THE WITNESS,start_question
2000,3909,161,22,(By Mr. Price)  So now you're saying you don't remember it even being a six multiple at the time?,q,MR. PRICE,start_answer
2001,3911,161,24,"You asked me that what was the basis of the six multiple, and I said I don't recall.",a,THE WITNESS,start_question
2002,3913,162,1,And then I said did you ask anyone to benchmark the six multiple.,q,MR. PRICE,start_answer
2003,3915,162,3,"No, I did not.",a,THE WITNESS,start_question
2004,3916,162,4,Was Vijay's six multiple based upon public companies?,q,MR. PRICE,start_answer
2005,3918,162,6,Publicly traded companies?,a,THE WITNESS,start_question
2006,3919,162,7,Yes.,q,MR. PRICE,start_answer
2007,3920,162,8,I don't know what it was based on.,a,THE WITNESS,start_question
2008,3921,162,9,Did you ask him what it was based on?,q,MR. PRICE,start_answer
2009,3922,162,10,I don't recall.,a,THE WITNESS,start_question
2010,3923,162,11,Did you ask him if it was based on public companies?,q,MR. PRICE,start_answer
2011,3925,162,13,I do not recall.,a,THE WITNESS,start_question
2012,3926,162,14,Did you ask him if it was based on transactions or acquisitions that had actually occurred?,q,MR. PRICE,start_answer
2013,3928,162,16,"I'm sure with all his experience that he would have taken into account various transactions and also Lion's situation at the time which was -- which was in distress, serious distress.",a,THE WITNESS,start_question
2014,3932,162,20,But you don't know whether he did or not?,q,MR. PRICE,start_answer
2015,3933,162,21,I don't know.,a,THE WITNESS,start_question
2016,3934,162,22,"Multiples like this change over time, correct?",q,MR. PRICE,start_answer
2017,3935,162,23,Yes.,a,THE WITNESS,start_question
2018,3936,162,24,"So then it comes -- so then the next line is ""329,655,551."" Do you see that?",q,MR. PRICE,start_answer
2019,3939,163,2,Sorry.  Which one?,a,THE WITNESS,start_question
2020,3940,163,3,"The next line on this chart, ""329,655,551."" Do you see that?",q,MR. PRICE,start_answer
2021,3942,163,5,"Yes, yes.",a,THE WITNESS,start_question
2022,3943,163,6,What is your understanding of what that is?,q,MR. PRICE,start_answer
2023,3944,163,7,I believe that would be the current EBITDA times six.,a,THE WITNESS,start_question
2024,3946,163,9,Okay.  Is that the enterprise value?,q,MR. PRICE,start_answer
2025,3947,163,10,It doesn't show here.,a,THE WITNESS,start_question
2026,3948,163,11,Okay.  What is your understanding of what the enterprise value is as of August of '14?,q,MR. PRICE,start_answer
2027,3950,163,13,I don't know.,a,THE WITNESS,start_question
2028,3951,163,14,Did you think you needed to know that in order to approve the capital call?,q,MR. PRICE,start_answer
2029,3953,163,16,At the time I'm sure.,a,THE WITNESS,start_question
2030,3954,163,17,At the time you're sure you did know what the enterprise value was?,q,MR. PRICE,start_answer
2031,3956,163,19,I'm sure I would have been told.,a,THE WITNESS,start_question
2032,3957,163,20,And what -- what were you told?,q,MR. PRICE,start_answer
2033,3958,163,21,I don't know.  I don't remember.,a,THE WITNESS,start_question
2034,3959,163,22,Were you told that it was $330 million?,q,MR. PRICE,start_answer
2035,3960,163,23,I don't remember.,a,THE WITNESS,start_question
2036,3961,163,24,"If you had been told that it was $330 million back in 2014, would that have shocked you?",q,MR. PRICE,start_answer
2037,3963,164,1,"Again, you are going -- you're asking me to go back in time, and I don't know at the time.",a,THE WITNESS,start_question
2038,3965,164,3,"You had been told by your advisor Stout for estate planning purposes that 16 months before, the company was worth $650 million. Is your testimony that had you been told it was only worth 330, that you wouldn't have been shocked?",q,MR. PRICE,start_chat
2039,3971,164,9,Object to form.,side_chat,MR. RUOCCO,start_answer
2040,3972,164,10,I don't know what I would have thought.  You're asking me to speculate.,a,THE WITNESS,start_question
2041,3974,164,12,"(By Mr. Price)  What is -- do you see on here ""35 million pre-equity""? Do you see that?",q,MR. PRICE,start_answer
2042,3977,164,15,Yes.,a,THE WITNESS,start_question
2043,3978,164,16,What is pre-equity?,q,MR. PRICE,start_answer
2044,3979,164,17,That is prior to injection on the equity.,a,THE WITNESS,start_question
2045,3980,164,18,But what is pre-equity?  Do you know what it is?,q,MR. PRICE,start_answer
2046,3982,164,20,I don't -- I don't know what you're asking.,a,THE WITNESS,start_question
2047,3983,164,21,Have you ever heard of an account or an accounting entry or a financial statement entry called pre-equity?,q,MR. PRICE,start_answer
2048,3986,164,24,Yes.,a,THE WITNESS,start_question
2049,3987,164,25,When have you heard of that?,q,MR. PRICE,start_answer
2050,3988,165,1,When we are looking at investments.,a,THE WITNESS,start_question
2051,3989,165,2,"Okay.  Who's ""we""?",q,MR. PRICE,start_answer
2052,3990,165,3,Me.,a,THE WITNESS,start_question
2053,3991,165,4,"Okay.  When you look at investments, you look at something called pre-equity?",q,MR. PRICE,start_answer
2054,3993,165,6,Sometimes.,a,THE WITNESS,start_question
2055,3994,165,7,And what is it?,q,MR. PRICE,start_answer
2056,3995,165,8,"A company that is trying to induce us to provide equity, then they show pre-equity valuation and post-equity valuation.",a,THE WITNESS,start_question
2057,3998,165,11,No.  I understand a pre-equity valuation and a post-equity valuation.  I'm talking about something that appears on the debt side of the balance sheet called pre-equity. Do you know what that is?,q,MR. PRICE,start_answer
2058,4003,165,16,"As I said, I do not recall this document.  So I don't know what it is, but I would assume this was an advance that AFWest had made.",a,THE WITNESS,start_question
2059,4006,165,19,"The advance that is showing up as a debt on the balance sheet, correct?",q,MR. PRICE,start_chat
2060,4008,165,21,Object to form.,side_chat,MR. RUOCCO,start_answer
2061,4009,165,22,I don't think it's showing up as debt.,a,THE WITNESS,start_question
2062,4010,165,23,(By Mr. Price)  It's not?,q,MR. PRICE,start_answer
2063,4011,165,24,I don't believe so.,a,THE WITNESS,start_question
2064,4012,165,25,"You don't think that 240 plus 7 plus 35, 282 of debt?",q,MR. PRICE,start_chat
2065,4014,166,2,Object to form.,side_chat,MR. RUOCCO,start_answer
2066,4015,166,3,"That is not debt.  There was an advance made; and so when you are calculating, you have to account for it.  It doesn't just disappear.",a,THE WITNESS,start_question
2067,4018,166,6,"(By Mr. Price)  So, but why is it appearing on the debt side of the ledger?",q,MR. PRICE,start_answer
2068,4020,166,8,"I am not an accountant, as I've already stated; and I don't know who prepared this document, so...",a,THE WITNESS,start_question
2069,4022,166,10,"Then do you see where it says, ""Less legal and bankers' fees 12 million""?",q,MR. PRICE,start_answer
2070,4024,166,12,Yes.,a,THE WITNESS,start_question
2071,4025,166,13,Do you see that?,q,MR. PRICE,start_answer
2072,4026,166,14,Yes.,a,THE WITNESS,start_question
2073,4027,166,15,Where did that come from?,q,MR. PRICE,start_answer
2074,4028,166,16,I don't know.,a,THE WITNESS,start_question
2075,4029,166,17,Did you review and approve that deduction for the August capital call?,q,MR. PRICE,start_answer
2076,4031,166,19,"As I said, as a board member, I would have looked at it and approved it.",a,THE WITNESS,start_question
2077,4033,166,21,Are transaction costs typically subtracted from fair market value calculations?,q,MR. PRICE,start_answer
2078,4035,166,23,It depends.,a,THE WITNESS,start_question
2079,4036,166,24,"Stout didn't deduct transaction costs from your valuation for estate planning purposes, did they?",q,MR. PRICE,start_answer
2080,4038,167,1,Stout was not anticipating any transaction.,a,THE WITNESS,start_question
2081,4039,167,2,Was a transaction being anticipated here?,q,MR. PRICE,start_answer
2082,4040,167,3,I don't know.,a,THE WITNESS,start_question
2083,4041,167,4,"Well, you approved the valuation.  Was a transaction being anticipated or not?",q,MR. PRICE,start_answer
2084,4043,167,6,"Well, there was -- you showed me some document that there was refinancing to be done with Bank of America.  So that would have been a transaction.",a,THE WITNESS,start_question
2085,4046,167,9,And so this legal and bankers' fees of 12 million relates to a refinancing transaction with Bank of America?,q,MR. PRICE,start_answer
2086,4049,167,12,"I've already told you, I don't know what this refers to.",a,THE WITNESS,start_question
2087,4051,167,14,"So let's talk about the questions for the November capital call, ""Current EBITDA 53 million."" Do you see that?",q,MR. PRICE,start_answer
2088,4054,167,17,Yes.,a,THE WITNESS,start_question
2089,4055,167,18,Same set of questions.  Do you know where that number came from?,q,MR. PRICE,start_answer
2090,4057,167,20,No.,a,THE WITNESS,start_question
2091,4058,167,21,Could it be last -- could it be last 12 months?,q,MR. PRICE,start_answer
2092,4059,167,22,I don't know.,a,THE WITNESS,start_question
2093,4060,167,23,Could it be some amount of actuals plus projections?,q,MR. PRICE,start_answer
2094,4062,167,25,I do not know.,a,THE WITNESS,start_question
2095,4063,168,1,Did you know at the time that you approved the capital call in November of 2014?,q,MR. PRICE,start_answer
2096,4065,168,3,I don't remember.,a,THE WITNESS,start_question
2097,4066,168,4,"Okay.  And the six EBITDA multiple, same set of questions, would your answers all be the same as to -- as to the November capital call in that multiple and why you chose -- or why it was chosen and why you approved it?",q,MR. PRICE,start_answer
2098,4071,168,9,Yes.,a,THE WITNESS,start_question
2099,4072,168,10,All the answers would be the same?,q,MR. PRICE,start_answer
2100,4073,168,11,The same. You find that humorous?,a,THE WITNESS,start_question
2101,4075,168,13,"No, I'm just trying -- no, I'm actually hoping we can expedite this a little bit.",q,MR. PRICE,start_answer
2102,4077,168,15,Okay.,a,THE WITNESS,start_question
2103,4078,168,16,"It's actually -- none of this is really funny. But I'd like to go a little faster if we can, but I also don't want to miss something if you have a specific recollection of why you approved the November capital call.",q,MR. PRICE,start_answer
2104,4083,168,21,Thank you.,a,THE WITNESS,start_question
2105,4084,168,22,"So the $318 million number, again, you don't know what that is other than it's 53 times six?",q,MR. PRICE,start_answer
2106,4086,168,24,Correct.,a,THE WITNESS,start_question
2107,4087,168,25,But you don't know what that's representing?,q,MR. PRICE,start_answer
2108,4088,169,1,The document doesn't state what it is.,a,THE WITNESS,start_question
2109,4089,169,2,"Right.  And you don't remember that, that that was the enterprise value presented to you as a board member in 2014?",q,MR. PRICE,start_answer
2110,4092,169,5,I do not.,a,THE WITNESS,start_question
2111,4093,169,6,"Let's go down to ""legal and bankers' fees."" Again, the same series of questions for November of '14. Do you know why that was taken out?",q,MR. PRICE,start_answer
2112,4096,169,9,Taken out?  It's here for November.,a,THE WITNESS,start_question
2113,4097,169,10,Right.  But that's -- but that's being deducted --,q,MR. PRICE,start_answer
2114,4099,169,12,Right.,a,THE WITNESS,start_question
2115,4100,169,13,"-- as part of the November capital call valuation. You understand that, right?",q,MR. PRICE,start_answer
2116,4103,169,16,"I -- I don't know specifically.  You know, it could be for all legal and bankers' fees anticipated for various things that were going on with Lion.",a,THE WITNESS,start_question
2117,4106,169,19,"You understand, do you not, that in both the August and November capital calls that these $12 million figures were taken out to reduce the value to increase the amount that the plaintiffs were diluted?",q,MR. PRICE,start_chat
2118,4110,169,23,Object to form.,side_chat,MR. RUOCCO,start_question
2119,4111,169,24,"(By Mr. Price)  You understand that, right?",q,MR. PRICE,start_answer
2120,4112,169,25,That's -- I don't understand the question.,a,THE WITNESS,start_question
2121,4113,170,1,You don't understand that that's how it works?,q,MR. PRICE,start_chat
2122,4114,170,2,Object to form.,side_chat,MR. RUOCCO,start_answer
2123,4115,170,3,"That's a very complex question; and if you could break it down, perhaps I can respond to you.",a,THE WITNESS,start_question
2124,4117,170,5,(By Mr. Price)  Okay.  Do you understand that the -- that the $12 million deduction for both the August and November capital calls resulted in a lower fair market value of the company?,q,MR. PRICE,start_answer
2125,4121,170,9,I think --,a,THE WITNESS,start_chat
2126,4122,170,10,Object to form.,side_chat,MR. RUOCCO,start_answer
2127,4123,170,11,I think the $12 million as the document shows was attributed to legal and bankers' fees.,a,THE WITNESS,start_question
2128,4125,170,13,"(By Mr. Price)  And that it reduced the amount of distributable value, correct?",q,MR. PRICE,start_answer
2129,4127,170,15,"It would have to, yes.",a,THE WITNESS,start_question
2130,4128,170,16,And that that reduced -- and that that increased the amount that the nonparticipating unit holders were diluted?,q,MR. PRICE,start_answer
2131,4131,170,19,"No.  It would result in, I believe, dilution of all the original shareholders.",a,THE WITNESS,start_question
2132,4133,170,21,And how do you think that works?,q,MR. PRICE,start_answer
2133,4134,170,22,Based on the original equity of everybody.,a,THE WITNESS,start_question
2134,4135,170,23,"Well, the amount of units that, say, AFWest got was based upon the amount put in compared to the existing equity value, right?",q,MR. PRICE,start_answer
2135,4138,171,1,Say that again.,a,THE WITNESS,start_question
2136,4139,171,2,"You understand that, that the -- that the amount that AFWest and all the other participating members got was based on comparing the amount put in with the existing equity value?",q,MR. PRICE,start_answer
2137,4143,171,6,So are you talking about new equity or old equity?,a,THE WITNESS,start_question
2138,4145,171,8,I'm talking about how much the new equity got in the company.,q,MR. PRICE,start_answer
2139,4147,171,10,So what -- how much -- whoever got the new equity are the people who contributed in the capital call.,a,THE WITNESS,start_question
2140,4150,171,13,Correct.,q,MR. PRICE,start_answer
2141,4151,171,14,Right.  And?,a,THE WITNESS,start_question
2142,4152,171,15,"But to determine how much they get, you have to know how much the company was worth at the time they were putting it in, right?",q,MR. PRICE,start_answer
2143,4155,171,18,Right.,a,THE WITNESS,start_question
2144,4156,171,19,"And if you knock off $12 million of legal and bankers' fees, you decrease the value of the company that they're buying into and increase the amount that they're getting, right?",q,MR. PRICE,start_chat
2145,4160,171,23,Object to form.,side_chat,MR. RUOCCO,start_answer
2146,4161,171,24,I'm trying to make sense of your question.,a,THE WITNESS,start_question
2147,4162,171,25,(By Mr. Price)  You don't understand that that's how it works?,q,MR. PRICE,start_answer
2148,4164,172,2,I want to be careful because I know that you are an expert at tricking somebody like me.  So let me have a moment to think it through. Okay.,a,THE WITNESS,start_question
2149,4168,172,6,You tell me when you're ready.,q,MR. PRICE,start_answer
2150,4169,172,7,I'm ready.,a,THE WITNESS,start_question
2151,4170,172,8,Okay.  So do you understand that that's how it works?,q,MR. PRICE,start_answer
2152,4172,172,10,What I understand is there were equity holders and then there was a capital call and then whoever contributed got equity based on their contributions and based on the formula that was developed.,a,THE WITNESS,start_question
2153,4176,172,14,"And do you understand how the minority who didn't contribute got diluted, what the calculation for that was?",q,MR. PRICE,start_answer
2154,4179,172,17,"As I said, it would be based on the formula that was developed.",a,THE WITNESS,start_question
2155,4181,172,19,Developed by who?,q,MR. PRICE,start_answer
2156,4182,172,20,By Lion's management.,a,THE WITNESS,start_question
2157,4183,172,21,The board of directors?,q,MR. PRICE,start_answer
2158,4184,172,22,And -- and the management of Lion.,a,THE WITNESS,start_question
2159,4185,172,23,Who's the management of Lion?,q,MR. PRICE,start_answer
2160,4186,172,24,I think we went through that.  Could you repeat who we --,a,THE WITNESS,start_question
2161,4188,173,1,"Well, no, no.  I'm sorry.  You think the -- you think the dilution -- the amount of dilution or the fair market value that somehow Neil Jurkovic or Jesse Zeringue and those people were involved?",q,MR. PRICE,start_answer
2162,4192,173,5,No.,a,THE WITNESS,start_question
2163,4193,173,6,So who is the management of Lion then?,q,MR. PRICE,start_answer
